PostLink;PostTürü;BeğeniSayısı;YorumSayısı;Görüntülenme Sayısı;Tarih;DisplayPhoto;Caption;Takipçi;TahminMi
https://www.instagram.com/p/DRW0AyIjIVu/;Carousel;482;4;0;2025-11-22 14:06:11;https://scontent-lhr8-2.cdninstagram.com/v/t51.82787-15/584367993_18412411699136668_3228022835181682628_n.jpg?stp=dst-jpg_e35_tt6&_nc_cat=101&ig_cache_key=Mzc3MTQzMDQ3ODQyNDA5ODQyOQ%3D%3D.3-ccb7-5&ccb=7-5&_nc_sid=58cdad&efg=eyJ2ZW5jb2RlX3RhZyI6InhwaWRzLjIxNjB4MTQ0MC5zZHIuQzMifQ%3D%3D&_nc_ohc=8BslVpo_OjIQ7kNvwH1Y0US&_nc_oc=Adm5HXV9qs-0f2V_3dxnBq-lWlZSt0Xys__wJW4F_5nGkZrqMppt8FtXKsRZBIFnSAc&_nc_ad=z-m&_nc_cid=0&_nc_zt=23&_nc_ht=scontent-lhr8-2.cdninstagram.com&_nc_gid=5RKakcgePryJs4Y_myCJ9g&oh=00_AfjM3k3Q0t4wVzSOY7jLwP3c2dAJmEErc21pzN2Fxm00fg&oe=693122B0;"🦋 Büyükşehir Belediyemiz Türkiye’de Bir İlke İmza Attı: Nöro-Çeşitlilik Çalıştayı Düzenlendi  📌 “Barış ve Demokratik Toplum Sürecinde Nöro-Çeşitliler ve Eşit Yurttaşlık Çalıştayı” düzenlendi. Türkiye’de bu konuda ilk kez düzenlenen çalıştaya Eşbaşkanımız Serra Bucak, DEM Parti Eş Genel Başkanı Tülay Hatimoğulları, DEM Parti İl Eşbaşkanı Gülşen Özer, sivil toplum örgütü temsilcileri ile çok sayıda engelli yurttaş katıldı. Çalıştayda konuşan Bucak, ön yargıları, kalıp yargıları ve dışlayıcı dili ortadan kaldırmak için politika ürettiklerine dikkat çekerek, “Bunun bir kamu sorumluluğu olduğunu bilen bir yerden yaklaşmaktayız” dedi. Açılış konuşmalarının ardından farklı başlıklarda sunumlar gerçekleştirildi.  🦋 Şaredariya me ya Bajarê Mezin li Tirkiyeyê Karekî Pêşeng Kir: Komxebata Cûrbecûrîya Nwêro hate Lidarxistin  📌 Komxebata ""Cûrbecûrîya Nwêro û Hemwelatîbûna Wekhev di Pêvajoya Aştî û Civaka Demokratîk de"" hate lidarxistin. Komxebat, ku cara yekem li Tirkiyeyê li ser vê mijarê hate lidarxistin, Hevseroka me Serra Bucak, Hevseroka Partiya DEM Tulay Hatımogullari, Hevseroka Parêzgehê ya Partiya DEM Gulşen Ozer, nûnerên rêxistinên civaka sivîl û gelek welatiyên astengdar beşdar bûn. Bucak di komxebatê de axivî û tekez kir ku ew polîtîkayên jiholêrakirina pêşdarazî, stereotîp û zimanê îstîsnayî pêş dixin û got, ""Em ji têgihîştina ku ev berpirsiyariyek giştî ye nêzî vê dibin."" Piştî axaftinên vekirinê, li ser mijarên cûrbecûr pêşkêşkirin hatin kirin.  #Diyarbakır #Amed #NöroÇeşitlilikÇalıştayı";;0
https://www.instagram.com/p/DRWv1OQDLTF/;Photo;197;2;0;2025-11-22 13:29:39;https://scontent-lhr8-1.cdninstagram.com/v/t51.82787-15/587317408_18412408843136668_6914126961739972466_n.jpg?stp=dst-jpg_e35_tt6&_nc_cat=111&ig_cache_key=Mzc3MTQxMjEwMzU4OTMxMTY4NQ%3D%3D.3-ccb7-5&ccb=7-5&_nc_sid=58cdad&efg=eyJ2ZW5jb2RlX3RhZyI6InhwaWRzLjE0NDB4MTgwMC5zZHIuQzMifQ%3D%3D&_nc_ohc=zQGeurR94PIQ7kNvwFqG8s5&_nc_oc=AdlpSi6oGcaanWBwDp_gepxRLsPr394XetRY9OjSpXqmqwBXU2uiHNLciN1U0QrIIxs&_nc_ad=z-m&_nc_cid=0&_nc_zt=23&_nc_ht=scontent-lhr8-1.cdninstagram.com&_nc_gid=5RKakcgePryJs4Y_myCJ9g&oh=00_AfgE8_gm0I9ugQjtDaEeCwVSZ5GaLURU94o5DR8CVm75QA&oe=693117E0;"💬 “Barış ve Demokratik Toplum Sürecinde Nöro-Çeşitliler ve Eşit Yurttaşlık Çalıştayı”nda konuşan Eşbaşkanımız Serra Bucak;  📌 Belediye bünyesinde engellilerin ve ailelerin yararlandığı Danışmanlık Merkezlerimiz bulunuyor. DEM Partinin bu konudaki paradigması ve Belediyemizin kararlılığı ile eşitlikçi, özgürlükçü yaklaşımları anlamak, kabul etmek ve buna dair uyumlayıcı politikaları hayata geçirmeye çalışıyoruz. Engellilerin kamusal politikaları ve eğitim faaliyetlerini güçlendirmek için buradayız. Mekânsal uyumlamaları sağlamak ve bunun bir kamu sorumluluğu olduğunu bilen bir yerden yaklaşıyoruz.  #Diyarbakır #Amed";;0
https://www.instagram.com/p/DRWoNHADMU2/;Carousel;269;2;0;2025-11-22 12:23:00;https://scontent-lhr6-1.cdninstagram.com/v/t51.82787-15/584396322_18412404304136668_8200099616856117591_n.jpg?stp=cp6_dst-jpg_e35_tt6&_nc_cat=102&ig_cache_key=Mzc3MTM3ODU1MDg4NTMyMDc3NQ%3D%3D.3-ccb7-5&ccb=7-5&_nc_sid=58cdad&efg=eyJ2ZW5jb2RlX3RhZyI6InhwaWRzLjIxNjB4MTQ0MC5zZHIuQzMifQ%3D%3D&_nc_ohc=dNkMJ0-rmhUQ7kNvwH2tQ6g&_nc_oc=Adn-Ir5xQUMinEcMpli7ED9JWzofGZTFAyWyY0WvLL1aN1F01ia2fHh1IHejizp_3ts&_nc_ad=z-m&_nc_cid=0&_nc_zt=23&_nc_ht=scontent-lhr6-1.cdninstagram.com&_nc_gid=5RKakcgePryJs4Y_myCJ9g&oh=00_AfhVIktki0YZh1D3r9jmbEnbG1v-iHPi32PSxWue5IuRpA&oe=69310105;🔸 “Barış ve Demokratik Toplum Sürecinde Nöro-Çeşitliler ve Eşit Yurttaşlık Çalıştayı”  📌Engelli ve Yaşlı Hizmetleri Dairesi Başkanlığımız, nöro-çeşitlilik perspektifini güçlendirmek ve eşit yurttaşlık hakkına dikkat çekmek amacıyla “Barış ve Demokratik Toplum Sürecinde Nöro-Çeşitliler ve Eşit Yurttaşlık Çalıştayı” düzenliyor. Türkiye’de bu kapsamda ilk defa yapılan etkinliğe Eşbaşkanımız Serra Bucak, DEM Parti Eş Genel Başkanı Tülay Hatimoğulları, ilçe belediye eşbaşkanları ve bu alanda çalışma yürüten sivil toplum örgütü temsilcileri ve çok sayıda engelli yurttaş katıldı. Açılış konuşmasını yapan Bucak, “Engelli politikasını hayata geçirmek ve yalnızca politika ile sınırlandırmayıp politik faaliyetlerde kent hizmetlerinde kapsayıcı olmak suretiyle çalışmalarımızı devam ettiriyoruz.” dedi.   🔸 “Di Pêvajoya Aştî û Civaka Demokratîk de Komxebata Nwêro-Cihêrengan û Welatîbûna Wekhev”  📌 Serokatiya Daîreya Xizmetên ji bo Kesên Astengdar û Temenmezin, bi armanca xurtkirina perspektîfa nwêro-cihêrengîtiyê û balkişandina ser mafê welatîbûna wekhev, “Komxebata Nwêro-Cihêrengan û Welatîbûna Wekhev a di Pêvajoya Aştî û Civaka Demokratîk de” li dar dixe. Hevşaredara me Serra Bucak, Hevseroka Giştî ya DEM Partiyê Tulay Hatîmogullari, hevserokên şaredariyên navçeyan, nûnerên rêxistinên civaka sivîl ên ku di vê qadê de xebatan dimeşînin û gelek welatiyên astengdar beşdarî vê çalakiyê bûn ku li Tirkiyeyê di vê çarçoveyê de cara yekem tê lidarxistin. Bucak a ku axaftina vekirinê kir wiha got: “Em xebatên xwe, ji bo pêkanîna polîtîkaya astengdaran û ne tenê sînordarkirina bi polîtîkayê, bi awayekî ku di çalakiyên polîtîk û xizmetên bajêr de tevîker bin, didomînin.”  #Diyarbakır #Amed;;0
https://www.instagram.com/p/DRVXVDpDbO1/;Carousel;112;3;0;2025-11-22 00:36:18;https://scontent-lhr8-2.cdninstagram.com/v/t51.82787-15/587530150_17873185788452016_5944678666773701761_n.jpg?stp=dst-jpegr_e35_tt6&_nc_cat=101&ig_cache_key=Mzc3MTAyMjg0NzY2NjY0MDUxMw%3D%3D.3-ccb7-5&ccb=7-5&_nc_sid=58cdad&efg=eyJ2ZW5jb2RlX3RhZyI6InhwaWRzLjE0Mzh4ODA5Lmhkci5DMyJ9&_nc_ohc=UaCAJAGL2YwQ7kNvwFpaTB3&_nc_oc=AdmI7FXgsLAPQJNDMUxJq-RmPpFKLAga_POlMb2rknWLbVmsPfkGZKUU3rxbegiacd8&_nc_ad=z-m&_nc_cid=0&_nc_zt=23&_nc_ht=scontent-lhr8-2.cdninstagram.com&_nc_gid=5RKakcgePryJs4Y_myCJ9g&oh=00_Afgg3kKI37dAXqJ-P2pMBUbtx6HDCoaVSKP6bQwzhv0DnA&oe=69312E5D;"⏩️ Diyarbakır İklim Uyum Çalıştayı Düzenlendi  ➡️ Diyarbakır Büyükşehir Belediyesi, Heinrich Böll Stiftung Derneği İşbirliğiyle “Diyarbakır İklim Uyum Çalıştayı”nı Çand Amed Kültür Ve Kongre Merkezi’nde Geniş Bir Katılımla Gerçekleştirdi.  ➡️ Çalıştaya Büyükşehir Belediyesinin ilgili daire başkanlıklarının yanı sıra ilçe belediyeleri, Kent Konseyi, Dicle Üniversitesi, Boğaziçi Üniversitesi, Çevre Şehircilik ve İklim Değişikliği İl Müdürlüğü, Tarım İl Müdürlüğü, DİSKİ Genel Müdürlüğü, sanatçı Bestamin ve Ekoloji Derneği temsilcileri katılım sağladı. Kamu kurumları, akademi ve sivil toplumun bir araya geldiği etkinlikte, iklim krizinin bölgesel etkileri ve çözüm için ortak politika geliştirme yolları ele alındı.  ➡️ İklim Değişikliği ve Sıfır Atık Dairesi Başkanı Evin DİNAR, açılış konuşmasında yerel yönetimlerde iklim birimlerinin henüz yeni güçlendiği bir dönemde Diyarbakır’ın öncü adımlar attığını vurguladı. DİNAR, iklim krizinin su kaynaklarından tarımsal üretime, kent ısı adası etkisinden kırılgan grupların yaşam koşullarına kadar birçok alanda etkilerinin derinleştirdiğini belirterek şunları ifade etti: İklim çalışmalarını yalnızca teknik bir mesele olarak değil; sosyal, ekonomik ve çevresel boyutlarıyla birlikte ele almak zorundayız. Amacımız, dayanıklı ve iklim uyumlu bir Diyarbakır oluşturmak için ortak dilimizi güçlendirmek, rollerimizi netleştirmek ve tüm paydaşlarla koordinasyonu artırmaktır.  ➡️ DİNAR, (SECAP) Sürdürülebilir Enerji ve İklim Eylem Planı’nın uygulanabilirliğini artırmak üzere kurumlar arası işbirliğinin önemine işaret ederek, çalıştayın Diyarbakır’ın iklim hedeflerine katkı sunacağına inandıklarını belirtti.   ➡️ Gün boyunca devam eden tartışmalar ve sunumlarda akademisyenler, ekolojistler ve yerel uzmanlar tarafından değerlendirmeler yapıldı:";;0
https://www.instagram.com/p/DRUgmTljKUJ/;Carousel;502;3;0;2025-11-21 16:38:03;https://scontent-lhr8-2.cdninstagram.com/v/t51.82787-15/583908091_18412316920136668_5542531752272976096_n.jpg?stp=dst-jpg_e35_tt6&_nc_cat=101&ig_cache_key=Mzc3MDc4MjE0NzQ5MDQxMDgzMA%3D%3D.3-ccb7-5&ccb=7-5&_nc_sid=58cdad&efg=eyJ2ZW5jb2RlX3RhZyI6InhwaWRzLjIxNjB4MTQ0MC5zZHIuQzMifQ%3D%3D&_nc_ohc=DXeY1q_wYYsQ7kNvwGHHmQg&_nc_oc=Adn3Qg4_WwX-6WeJFY4OtF3djKr0m1mNW74i9lAylbZpV3eLYxSsuJn__a4HZRBepBo&_nc_ad=z-m&_nc_cid=0&_nc_zt=23&_nc_ht=scontent-lhr8-2.cdninstagram.com&_nc_gid=5RKakcgePryJs4Y_myCJ9g&oh=00_Afje9kvQ3spML8QdDJCl9NEhZq7Tvqc_ER40GaXvNYxEXQ&oe=693127B1;🔸 Türkiye Sağırlar Konfederasyonundan Belediyemize Ziyaret  📌 Türkiye Sağırlar Konfederasyonu Başkanı Orkun Utsukarcı ve Diyarbakır Sağırlar Spor Kulübü Başkanı Sait Elinç, Belediyemize gerçekleştirdikleri ziyarette Eşbaşkanımız Doğan Hatun ile bir araya geldi. Görüşmede, engellilere yönelik yürütülen çalışmalar ve belediyenin sunduğu hizmetler üzerine kapsamlı bir fikir alışverişi yapıldı. Hatun, engellilere yönelik hizmetlerin kararlılıkla sürdüğünü belirterek, dayanışma mesajı verdi. Utsukarcı ve Elinç, Eşbaşkanlarımıza Büyükşehir Belediyesinin desteklerinden dolayı teşekkür plaketi takdim etti.  🔸 Ji Konfederasyona Guhgiranan a Tirkiyeyê Serdana Şaredariya Me  📌 Serokê Konfederasyona Guhgiranan a Tirkiyeyê Orkun Utsukarci û Serokê Klûba Sporê ya Guhgiranan a Amedê Saît Elînç, di serdana xwe ya Şaredariya me de bi Hevşaredarê me Dogan Hatun re hatin cem hev. Di hevdîtinê de, li ser xebatên ji bo astengdaran ên ku tên meşandin û xizmetên şaredariyê yên ku tên pêşkêşkirin, danûstandineke berfireh a fikran hat kirin. Hatun diyar kir ku xizmetên ji bo astengdaran bi biryardarî didomin û peyama piştevaniyê da. Utsukarci û Elînç, ji ber piştgiriya Şaredariya Bajarê Mezin, plaketa spasdariyê pêşkêşî Hevşaredarên me kirin.  #Diyarbakır #Amed;;0
https://www.instagram.com/p/DRRRe1lglQR/;Reels;197;6;37547;2025-11-20 10:29:23;https://scontent-lhr6-1.cdninstagram.com/v/t51.82787-15/583243319_18412186195136668_4081482785882051154_n.jpg?stp=dst-jpg_e15_tt6&_nc_cat=109&ig_cache_key=Mzc2OTg3MTI0ODk5ODQyMTUyMTE4NDEyMTg2MTkyMTM2NjY4.3-ccb7-5&ccb=7-5&_nc_sid=58cdad&efg=eyJ2ZW5jb2RlX3RhZyI6InhwaWRzLjEwODB4MTkyMC5zZHIuQzMifQ%3D%3D&_nc_ohc=dy67zTieGpcQ7kNvwH04nUG&_nc_oc=AdlcssKt9PJyLScq2hjqAmqXrGS78yZ4Rc_GhNR4nkgy8sd5mSBh58hij-eIhD_FLQc&_nc_ad=z-m&_nc_cid=0&_nc_zt=23&_nc_ht=scontent-lhr6-1.cdninstagram.com&_nc_gid=5RKakcgePryJs4Y_myCJ9g&oh=00_Afil-zkH7c8k9UnRPHoj3nCzygKLIBTXVVBd7c2N_IVXkA&oe=69311A47;"🤝 Demokratik Yaşamı Birlikte İnşa Edeceğiz ✨  📌 Eşbaşkanlarımız Serra Bucak ve Doğan Hatun, Kent Konseyi Gençlik Meclisi ile düzenlenen Gençlik Buluşması'nın ikincisinde Dicle Üniversitesi öğrencileriyle bir araya geldi. Eşbaşkanlarımız, gençlerin moderatörlüğünde yerel yönetim, ulaşım, ekoloji, dil çalışmaları ve demokratik katılım üzerine gelen soruları yanıtladı. Eşbaşkanımız Hatun, kalabalığın kendilerine güç verdiğini belirterek, ""Seçim zamanında söylemiştik, bu şehri birlikte kuracağız, sorunlarımızı birlikte çözeceğiz,"" diyerek eleştiri ve öneri çağrısında bulundu. Eşbaşkanımız Bucak ise zorlu süreçlerden geçen bölgede, gençlerin demokratik toplum ve barış inşasına dair fikirlerinin politika oluşturmaya katkı sunduğunu vurguladı.  🤝 Em ê Jiyaneke Demokratîk Bi Hev Re Ava Bikin ✨  📌 Hevserokên me Serra Bucak û Dogan Hatun, di duyemîn Civîna Ciwanan de ku ji hêla Meclîsa Ciwanan a Meclîsa Bajar ve hatî organîzekirin, bi xwendekarên Zanîngeha Dîcleyê re civiyan. Bi moderatoriya ciwanan, hevserokan pirsên li ser rêveberiya herêmî, veguhastin, ekolojî, xebatên ziman û beşdariya demokratîk bersivandin. Hevserok Hatun diyar kir ku girseyê hêz da wan û got, ""Me di dema hilbijartinê de got: em ê vî bajarî bi hev re ava bikin û pirsgirêkên xwe bi hev re çareser bikin,"" û rexne û pêşniyar girtin. Hevserok Bucak tekez kir ku ramanên ciwanan li ser avakirina civakeke demokratîk û aştiyê di herêmek ku di demên dijwar re derbas dibe de beşdarî çêkirina polîtîkayê dibin.  #Diyarbakır #Amed #GençlikBuluşması";;0
https://www.instagram.com/p/DRRRIrEjKxA/;Carousel;508;4;0;2025-11-20 10:25:13;https://scontent-lhr8-1.cdninstagram.com/v/t51.82787-15/584388630_18412185892136668_5780544915764101122_n.jpg?stp=dst-jpg_e35_tt6&_nc_cat=107&ig_cache_key=Mzc2OTg2OTcxODA4NjQ5NjExNQ%3D%3D.3-ccb7-5&ccb=7-5&_nc_sid=58cdad&efg=eyJ2ZW5jb2RlX3RhZyI6InhwaWRzLjIxNjB4MTQ0MC5zZHIuQzMifQ%3D%3D&_nc_ohc=bZWKXbBCwHUQ7kNvwGuBu06&_nc_oc=Adkofk5vKRQ3_4cYXSygwzFZDczJT3mPdffxMnuNQgZCIlGJiG0EuwgCQy2cZLqoRgY&_nc_ad=z-m&_nc_cid=0&_nc_zt=23&_nc_ht=scontent-lhr8-1.cdninstagram.com&_nc_gid=5RKakcgePryJs4Y_myCJ9g&oh=00_AfjKiDWy9I2_rDMuZ5tD1sRv4IK13sea4PYhlSh9aR5fhA&oe=6931004C;🏢 Eşbaşkanlarımız, EMEP Genel Başkanı Seyit Aslan ve Heyetini Ağırladı 🤝  📌 Eşbaşkanlarımız Serra Bucak ve Doğan Hatun, Emek Partisi (EMEP) Genel Başkanı Seyit Aslan ve beraberindeki heyeti Büyükşehir Belediyesinde ağırladı. Eşbaşkanlarımız, karşılamanın ardından EMEP heyeti ile bir görüşme gerçekleştirerek güncel gelişmelere ilişkin görüş alışverişinde bulundu. Ziyaretten duydukları memnuniyeti dile getiren Eşbaşkanlarımız, Aslan ve heyetine teşekkürlerini iletti. Ziyarette Eşbaşkanlarımıza, DBB Meclisi Eşsözcülerimiz Demet Ceylan ve Ayhan Karatekin eşlik etti.  🏢 Hevşaredarên Me, Serokê Giştî yê EMEPê Seyît Aslan û Şandeya Wî Pêşwazî Kirin 🤝  📌 Hevşaredarên me Serra Bucak û Dogan Hatun, Serokê Giştî yê Partiya Kedê (EMEP) Seyît Aslan û şandeya ligel wî li Şaredariya Bajarê Mezin mêvan kirin. Hevşaredarên me, piştî pêşwazîkirinê bi şandeya EMEPê re hevdîtinek pêk anî û li ser pêşhatên rojane danûstandina fikran kirin. Hevşaredarên me kêfxweşiya xwe ya ji ber serdanê anîn ziman û spasiya Aslan û şandeya wî kirin. Di serdanê de Hevberdevkên Meclîsa Şaredariya Bajarê Mezin Demet Ceylan û Ayhan Karatekîn jî bi Hevşaredarên me re bûn.  #Diyarbakır #Amed;;0
https://www.instagram.com/p/DRRNgHzgjI3/;Carousel;1012;31;0;2025-11-20 09:53:28;https://scontent-lhr8-1.cdninstagram.com/v/t51.82787-15/584622325_17859350088546025_2881354622283660455_n.jpg?stp=dst-jpg_e35_tt6&_nc_cat=111&ig_cache_key=Mzc2OTg1MzcxNzgzOTUzMzMxNQ%3D%3D.3-ccb7-5&ccb=7-5&_nc_sid=58cdad&efg=eyJ2ZW5jb2RlX3RhZyI6InhwaWRzLjE2MzZ4OTIwLnNkci5DMyJ9&_nc_ohc=sNeQNj81kPsQ7kNvwGYPE0k&_nc_oc=Adnc21qT0KP_3E3KcO0hm6kamOS96eStDH7RJOI09SdUz_4qS8MfNn7L4eYT5iEsiYk&_nc_ad=z-m&_nc_cid=0&_nc_zt=23&_nc_ht=scontent-lhr8-1.cdninstagram.com&_nc_gid=5RKakcgePryJs4Y_myCJ9g&oh=00_AfhKHaZUwys0zCD6k5EMZbX1nztR58ernJ8n3Fj1zEa0hg&oe=693123B2;"🔴“Amed’de Temizlikte El Ele”  Kadın temizlik çalışanlarımızın emeği ve yurttaşlarımızın temizlik bilinciyle; tarihi Sur bölgesinden tüm Amed’e uzanan daha temiz bir gelecek için el ele. Amed'i Seviyorum Kirletmiyorum #Amed #Diyarbakır #Sur #Temizlik";;0
https://www.instagram.com/p/DRPTERIjJzj/;Photo;461;7;0;2025-11-19 16:03:37;https://scontent-lhr8-2.cdninstagram.com/v/t51.82787-15/582819622_18412107805136668_2655411165532270297_n.jpg?stp=dst-jpg_e35_tt6&_nc_cat=101&ig_cache_key=Mzc2OTMxNTI2OTI5MTA1NjM1NQ%3D%3D.3-ccb7-5&ccb=7-5&_nc_sid=58cdad&efg=eyJ2ZW5jb2RlX3RhZyI6InhwaWRzLjEwMjR4NjgzLnNkci5DMyJ9&_nc_ohc=05S1eztSTyEQ7kNvwEc3M8T&_nc_oc=Admv-gTtlYHY4UmWL42Acooxy5zE3UDJHeV1KzBwYUjEP-XFJJfC7DA6FRHd-28y2bs&_nc_ad=z-m&_nc_cid=0&_nc_zt=23&_nc_ht=scontent-lhr8-2.cdninstagram.com&_nc_gid=5RKakcgePryJs4Y_myCJ9g&oh=00_Afjs3znrQSSfong-O5N8c6Td7KRBmZZbiIj951JY32j6VQ&oe=69310465;"✔️ Eş Başkanımız Doğan Hatun, “Gençlik Buluşması”nda Konuşuyor  ❓ Dicle Üniversitesi’nde Kürt dili ve tarihi üzerine çalışmalar yürütüyoruz. Belediyenin bu alandaki çalışmalarımıza destek olmasını istiyoruz. Bizlere nasıl yardımcı olabilirsiniz?  💬 Doğan Hatun: “Dil çalışmalarınızı kutluyoruz; Büyükşehir Belediyesi olarak bizim de teknik ve idari alanlarda Kürtçe hizmet verilmesine dair çalışmalarımız var. Kürtçe’nin tüm lehçelerinde hizmet sunmaya çalışıyoruz ve bu çalışmaları birlikte yürütebiliriz. Bu, çok önemli ve kıymetli bir çalışmadır. Yurtta kalan arkadaşlara bir önerim var: Bizim dönemimizde yurt temsilcileri vardı ve üniversite yönetimine sorunlar daha düzenli bir şekilde iletiliyor, çözümler daha hızlı bulunuyordu. Yaşadığınız sorunların koordineli yürütülmesi hem çözümü kolaylaştırır hem de kendi örgütlülüğünüzü güçlendirir, ön açıcı olur.”  ✔️ Hevşaredarê Me Dogan Hatun, di “Hevdîtina Ciwanan” de Diaxive  ❓ Li Zanîngeha Dîcleyê em li ser ziman û dîroka Kurdî xebatan dimeşînin. Em dixwazin şaredarî di vê qadê de piştgiriyê bide xebatên me. Hûn dikarin çawa alîkariya me bikin?  💬 Doğan Hatun: “Em xebatên we yên ziman pîroz dikin; weke Şaredariya Bajarê Mezin xebatên me jî hene ku di qadên teknîkî û îdarî de bi Kurdî xizmet were dayîn. Em hewl didin bi hemû zaravayên Kurdî xizmetê pêşkêş bikin û em dikarin van xebatan bi hev re bimeşînin. Ev, xebateke pir girîng û biqîmet e. Pêşniyareke min ji bo hevalên li wargehan dimînin heye: Di serdema me de nûnerên wargehan hebûn û pirsgirêk bi awayekî birêkûpêktir ji rêveberiya zanîngehê re dihatin ragihandin, çareserî zûtir dihatin dîtin. Birêvebirina koordîneyî ya pirsgirêkên hûn dijîn hem çareseriyê hêsan dike, hem jî rêxistinbûna we xurt dike û rê vedike.”  #Diyarbakır #Amed #GençlikBuluşması";;0
https://www.instagram.com/p/DRPQMndDE0a/;Photo;402;15;0;2025-11-19 15:38:32;https://scontent-lhr8-1.cdninstagram.com/v/t51.82787-15/582215962_18412106242136668_3422146148745610823_n.jpg?stp=dst-jpg_e35_tt6&_nc_cat=111&ig_cache_key=Mzc2OTMwMjY0ODg3MzU2OTU2Mg%3D%3D.3-ccb7-5&ccb=7-5&_nc_sid=58cdad&efg=eyJ2ZW5jb2RlX3RhZyI6InhwaWRzLjEwMjR4NjgzLnNkci5DMyJ9&_nc_ohc=j9wHugku7v0Q7kNvwFmkBZo&_nc_oc=AdnZG51eAkTcUQ7_P3_uHV1Gh0aOdXAJuT5mcvA7Qq_ENVHp6uT-NV8_b-YJ6UEKF8c&_nc_ad=z-m&_nc_cid=0&_nc_zt=23&_nc_ht=scontent-lhr8-1.cdninstagram.com&_nc_gid=5RKakcgePryJs4Y_myCJ9g&oh=00_AfjAEoNHxEJCDHNlzN8FGStroa45U7SkFKust3Ezwp8kWg&oe=693105AC;"✔️ Eş Başkanımız Serra Bucak, “Gençlik Buluşması”nda Konuşuyor  ❓ Çevre ve ekoloji alanında belediyenin yürüttüğü çalışmalar gençlerin katılımını nasıl kapsıyor?  💬 Serra Bucak: “İklim Dairemizin kapasitesini güçlendirdik; küresel ısınma ve kuraklık konusunda kapsamlı çalışmalar yürütüyoruz. Agrokekoloji İklim Okulu’nu kurduk. Kadınlar için kent bostanları, meyve bahçeleri ve tıbbi–aromatik bahçeler inşa ediyoruz. Tüm bu projelerin kent merkezinde görünür, tartışılabilir ve erişilebilir olmasını önemsiyoruz.  20 aydır şunu düşünüyoruz: Liseli ve üniversiteli genç arkadaşlarımızı nasıl gönüllümüz haline getirebiliriz? Birbirimize fikir sunduğumuzda gerçek halk ve gençlik katılımı ortaya çıkar. Takas kültürü ve dayanışma kültürü bizi biz yapan değerlerdir. Burada ekoloji, kadın politikaları ve diğer alanlar için bir gönüllülük komitesi kurmayı çok isterim. Çalışmalarımıza yön vermenizi isteriz.”  ✔️ Hevşaredara Me Serra Bucak, di “Hevdîtina Ciwanan” de Diaxive  ❓ Xebatên ku şaredarî di qada hawîrdor û ekolojiyê de dimeşîne, beşdariya ciwanan çawa digire nav xwe?  💬 Serra Bucak: “Me kapasîteya Daîreya xwe ya Avhewayê xurt kir; em li ser germbûna gerdûnî û hişkesaliyê xebatên berfireh dimeşînin. Me Dibistana Avhewayê ya Agroekolojiyê ava kir. Em ji bo jinan bîstanên bajêr, baxçeyên fêkiyan û baxçeyên tibî-aromatîk ava dikin. Em giringiyê didin wê yekê ku hemû ev proje li navenda bajêr xuya bin, bên nîqaşkirin û gihîştina wan hebe.  20 meh e em vê difikirin: Em ê çawa hevalên xwe yên ciwan ên lîse û zanîngehê bikin dilxwazên xwe? Dema em fikrên xwe pêşkêşî hev dikin, beşdariya rasteqîn a gel û ciwanan derdikeve holê.  Çanda teqasê û çanda hevgirtinê, nirxên ku me dikin em in. Ez pir dixwazim ku li vir ji bo ekolojî, polîtîkayên jinan û qadên din komîteyeke dilxwaziyê ava bikim. Em dixwazin ku hûn reng û rû bidin xebatên me.”  #Diyarbakır #Amed #GençlikBuluşması";;0
https://www.instagram.com/p/DRPPMVeDK2E/;Carousel;272;7;0;2025-11-19 15:29:46;https://scontent-lhr8-2.cdninstagram.com/v/t51.82787-15/583740253_18412105735136668_7065354417938262948_n.jpg?stp=dst-jpg_e35_tt6&_nc_cat=101&ig_cache_key=Mzc2OTI5ODIyMDAwNzM0NjU0MQ%3D%3D.3-ccb7-5&ccb=7-5&_nc_sid=58cdad&efg=eyJ2ZW5jb2RlX3RhZyI6InhwaWRzLjEwMjR4NjgzLnNkci5DMyJ9&_nc_ohc=RwMQRh9h52YQ7kNvwF1HSTg&_nc_oc=Adnw_qxp3fJvtrdmoozAY0wiRmdiRSaCBkE7xsoYxvfgSvm0LXQKY7ogCCk-gok6wqI&_nc_ad=z-m&_nc_cid=0&_nc_zt=23&_nc_ht=scontent-lhr8-2.cdninstagram.com&_nc_gid=5RKakcgePryJs4Y_myCJ9g&oh=00_AfjE6JkzSY-NcQXr82tNZ_aQP1WzmipCSFrBNbWH_cL-Kw&oe=69310116;🗣️ Gençler Soruyor, Eşbaşkanlarımız Yanıtlıyor  📌 Eşbaşkanlarımız Serra Bucak ve Doğan Hatun, üniversiteli gençlerin moderatörlüğünde düzenlenen Gençlik Buluşmasında gençlerin sorularını yanıtlıyor. Gençlerin yönelttiği sorular, talepler ve öneriler üzerine söyleşi devam ediyor.  🗣️ Ciwan Dipirsin, Hevşaredarên Me Bersiv Didin  📌 Hevşaredarên me Serra Bucak û Doxan Hatun, di 'Hevdîtina Ciwanan' a ku bi moderatoriya ciwanên zanîngehê tê lidarxistin de, bersiva pirsên ciwanan didin. Gotûbêj li ser pirs, daxwaz û pêşniyarên ku ciwanan araste kirine, didome.  #Diyarbakır #Amed #GençlikBuluşması;;0
https://www.instagram.com/p/DRPK5SSCKgp/;Carousel;85;4;0;2025-11-19 14:52:12;https://scontent.cdninstagram.com/v/t51.82787-15/586847454_18183084556354013_1592086677011390418_n.webp?_nc_cat=108&ig_cache_key=Mzc2OTI3OTMxMTE3ODY3MTczMQ%3D%3D.3-ccb7-5&ccb=7-5&_nc_sid=58cdad&efg=eyJ2ZW5jb2RlX3RhZyI6InhwaWRzLjEwODB4MTA4MC5zZHIuQzMifQ%3D%3D&_nc_ohc=STtZMNYHZmgQ7kNvwHMiVjO&_nc_oc=AdnIh2qas-u_wqnKijQNM33Dc_B44IdGlZ-ZFESAEElNnPP12KGh7QYZiX5ledEHj9k&_nc_ad=z-m&_nc_cid=0&_nc_zt=23&_nc_ht=scontent.cdninstagram.com&_nc_gid=XWOt9drD1LkhKPwvBHE1ug&oh=00_AfgdKGiIRh9STOVoLdHpKjhuiS38WN6til00TZCv5a71JA&oe=69310B73;⚒️ DİSKİ, Kocaköy’de Yeni Kanalizasyon Hattı Döşedi  🔗 Link Hikaye’de!  💧 Diyarbakır Büyükşehir Belediyesi DİSKİ Genel Müdürlüğü, hazırlanan proje kapsamında Kocaköy ilçesi Şeyh Şerafettin Mahallesindeki yeni yerleşim alanlarında kanalizasyon hattı imalatını tamamladı.  #Amed #Diyarbakır #Diski #Av #Awk #Su #Water #Wasser;;0
https://www.instagram.com/p/DRPKO4cjE7k/;Carousel;390;7;0;2025-11-19 14:46:25;https://scontent.cdninstagram.com/v/t51.82787-15/584288595_18412101406136668_7121380495282595556_n.jpg?stp=cp6_dst-jpg_e35_tt6&_nc_cat=108&ig_cache_key=Mzc2OTI3NjQwOTY3Njg1OTIwNw%3D%3D.3-ccb7-5&ccb=7-5&_nc_sid=58cdad&efg=eyJ2ZW5jb2RlX3RhZyI6InhwaWRzLjIxNjB4MTQ0MC5zZHIuQzMifQ%3D%3D&_nc_ohc=1bEI_JHYbpkQ7kNvwGVSNkP&_nc_oc=AdnGxuAWk8jJpsqNYtp4catubl7o8dQ7bc3sPDh5m7cSsOQuFJlTBhd8LA-rrtr0qlY&_nc_ad=z-m&_nc_cid=0&_nc_zt=23&_nc_ht=scontent.cdninstagram.com&_nc_gid=XWOt9drD1LkhKPwvBHE1ug&oh=00_AfiXXDHhvVGqRH5UefbmVO5_98UYqJk2YIHFnGlO05CQQQ&oe=69311FFC;📢 Eşbaşkanlarımız, Gençlerle Bir Arada  📌 Eşbaşkanlarımız Serra Bucak ve Doğan Hatun, Dicle Üniversitesi Kültür ve Kongre Merkezi Ziya Gökalp Konferans Salonu'nda düzenlenen 'Gençlik Buluşması'nda gençlerin sorularını yanıtlıyor.  📢 Hevşaredarên Me bi Ciwanan re Dicivin  📌 Hevşaredarên me Serra Bucak û Dogan Hatun, di 'Hevdîtina Ciwanan' a ku li Zanîngeha Dîcleyê, Navenda Çand û Kongreyê, Salona Konferansê ya Ziya Gokalp tê lidarxistin de, bersiva pirsên ciwanan didin.  #Diyarbakır #Amed #GençlikBuluşması;;0
