PostLink;PostTürü;BeğeniSayısı;YorumSayısı;Görüntülenme Sayısı;Tarih;DisplayPhoto;Caption;Takipçi;TahminMi
https://www.instagram.com/p/DRHpA9yjNXc/;Carousel;298;0;0;2025-11-16 16:41:28;https://scontent.cdninstagram.com/v/t51.82787-15/583315610_18083236919084055_3142341319485392563_n.jpg?stp=dst-jpg_e35_tt6&_nc_cat=103&ig_cache_key=Mzc2NzE1OTk5MjYwMTA4MTE2OQ%3D%3D.3-ccb7-5&ccb=7-5&_nc_sid=58cdad&efg=eyJ2ZW5jb2RlX3RhZyI6InhwaWRzLjE0NDB4OTYxLnNkci5DMyJ9&_nc_ohc=a_mGVUNsO7QQ7kNvwEvS2li&_nc_oc=Admp_cCtpVRZUY7QW68STD34PcnPOki4ejlWrk4--uIXGZygKfSx-2ToJh0nJuQwYjU&_nc_ad=z-m&_nc_cid=1501&_nc_zt=23&_nc_ht=scontent.cdninstagram.com&_nc_gid=abwC_hHYe0yJSydUyGYhXw&oh=00_AfjeaO-X-RYcTd2AfkCZxWj_58QHZ-gpjJIvqnhffAx2jA&oe=6931181D;📌🏟️Çocuklara Özel Tiyatro Gösterimi Gerçekleşti  Belediyemiz tarafından düzenlenen ve Diyarbakır Büyükşehir Belediyesi’nin katkılarıyla sahnelenen “Ka Clovn” adlı çocuk tiyatrosu, bugün belediyemiz konferans salonunda çocuk izleyicilerle buluştu.  Gösterime, Belediye Eşbaşkanımız Birsen Azak Bayar, belediye meclis üyelerimiz, çok sayıda çocuk ve ebeveyn katıldı. Renkli görüntülere sahne olan etkinlikte çocuklar doyasıya eğlenerek keyifli vakit geçirdi.  Oyun sonunda Eşbaşkanımız Birsen Azak Bayar, Akademi Tiyatro Grubu’na teşekkür ederek çiçek takdim etti. Etkinliğe katılan çocuklara ise boyama kitabı hediye edildi.  📌🏟️Ji Bo Zarokan Pêşandana Şanoyê Hat Lidarxistin  Şanoya zarokan a “Ka Clovn” ku ji aliyê şaredariya me ve hat organîzekirin û bi piştgiriya Şaredariya Bajarê Mezin a Amedê hat pêşkêşkirin, îro li eywana konferansê ya şaredariyê hat pêşkêşkirin.  Hevşaredara me Bîrsen Azak Bayar, endamên meclîsa şaredariyê , gelek zarok , dê û bav jî beşdarî pêşandanê bûn. Zarokan bi vê çalakiya rengîn pir kêf kirin.  Di dawiya pêşandanê de, Hevşaredar Bîrsen Azak Bayar spasiya Koma Şanoya Akademiyê kir û kulîlk pêşkêşî wan kir. Ji zarokên ku beşdarî çalakiyê bûn re jî , pirtûkên boyaxkirinê diyarî  kirin.  @birsen_azak_bayar @guldikensiyar @diyarbakirbld @serra_bucak @doganhatundbb @diwanacademy;;0
https://www.instagram.com/p/DRHeY2FFpto/;Carousel;590;17;0;2025-11-16 15:08:37;https://scontent.cdninstagram.com/v/t39.30808-6/581474808_1148940254054447_7570596398502181725_n.jpg?stp=dst-jpg_e35_tt6&_nc_cat=111&ig_cache_key=Mzc2NzExMzI0OTMxNTAxNDcxMQ%3D%3D.3-ccb7-5&ccb=7-5&_nc_sid=58cdad&efg=eyJ2ZW5jb2RlX3RhZyI6InhwaWRzLjEwODB4MTM1MC5zZHIuQzMifQ%3D%3D&_nc_ohc=POpsl_H8GswQ7kNvwEojwSe&_nc_oc=AdngjYdXrzPFszaKRS-fQDzk4srtacJ670tKnLifymOWZB2_i1LE3uq8Y1wXzJk2DWo&_nc_ad=z-m&_nc_cid=1501&_nc_zt=23&_nc_ht=scontent.cdninstagram.com&_nc_gid=abwC_hHYe0yJSydUyGYhXw&oh=00_AfgvZXRkLxjnZniBF7cwnOwOKrA8Ig0BxjFgehuJI-LWMQ&oe=6930F84E;"📢 Zerzevan Kalesi’ne Toplu Taşıma Başlıyor 🚌  📌 Büyükşehir Belediyemiz, tarihi Zerzevan Kalesi’ne ulaşımı kolaylaştırmak amacıyla ÇM kodlu hattın güzergâhına Zerzevan Kalesi durağını ekledi. 17 Kasım Pazartesi gününden itibaren ÇM hattı; Doğu İlçe Otogarı’ndan başlayarak Zerzevan Kalesi üzerinden Meydanköy’e ulaşım sağlayacak. Seferler pazar günü hariç haftanın 6 günü gerçekleştirilecek.  🕒 Sefer Saatleri • Doğu İlçe Otogarı: 07.00 – 14.00 • Meydanköy: 08.15 – 15.15  📢 Veguhastina Komî Ber Bi Kela Zerzevanê Dest Pê Dike 🚌  📌 Şaredariya me ya Bajarê Mezin, ji bo ku gihîştina Kela Zerzevanê ya dîrokî hêsan bike, rawestgeha Kela Zerzevanê li ser rêya xeta bi koda ÇM zêde kir. Ji roja Duşemê, 17ê Mijdarê pê ve, xeta ÇM; dê ji Otogara Navçeyan a Rojhilat dest pê bike û bi ser Kela Zerzevanê re bigihîje Gundê Şorşîpê. Sefer dê ji bilî roja Yekşemê, 6 rojên hefteyê bên kirin.  🕒 Demên Seferan  • Otogara Navçeyan a Rojhilat:  07.00 – 14.00 • Gundê Şorşîpê: 08.15 – 15.15  #Diyarbakır #Amed";;0
https://www.instagram.com/p/DRHQQ-0lhui/;Carousel;336;3;0;2025-11-16 13:05:12;https://scontent.cdninstagram.com/v/t39.30808-6/583293910_1148871517394654_7422573062521803989_n.jpg?stp=dst-jpg_e35_tt6&_nc_cat=105&ig_cache_key=Mzc2NzA1MTEyOTUyNTI3NTY4Mg%3D%3D.3-ccb7-5&ccb=7-5&_nc_sid=58cdad&efg=eyJ2ZW5jb2RlX3RhZyI6InhwaWRzLjEwODB4MTM1MC5zZHIuQzMifQ%3D%3D&_nc_ohc=beQz4YLbI_4Q7kNvwHATg4g&_nc_oc=AdnZjibBL6dzpsmcAMN1sZNYz151nJkJ9ZleUqL3DKj2UguMh94QUMgGSDCkkTeIKe0&_nc_ad=z-m&_nc_cid=1501&_nc_zt=23&_nc_ht=scontent.cdninstagram.com&_nc_gid=abwC_hHYe0yJSydUyGYhXw&oh=00_AfhwHUUzYs7u66ogoA1uC71CD6FlSrWXBgCFnEd-Jf5ATA&oe=6931155E;📢 2. Gençlik Buluşması Başlıyor 🎓✨  📌 Büyükşehir Belediyemizin düzenlediği Gençlik Buluşmasının ikincisi gerçekleşiyor. Eş Başkanlarımız Serra Bucak ve Doğan Hatun, üniversite gençleriyle bir araya geliyor. Gençlerin fikirleri, soruları ve beklentileri bu buluşmada konuşulacak.  🎶 Etkinlikte Roni Artin & DJ Xodi konseriyle gençlik enerjisi sahnede olacak!  🗓️ 19 Kasım, Çarşamba🕓 14.00 📍 Dicle Üniversitesi, Kültür ve Kongre Merkezi – Ziya Gökalp Konferans Salonu  📢 2emîn Hevdîtina Ciwanan Dest Pê Dike 🎓✨  📌 Ya duyemîn a Hevdîtina Ciwanan a ku ji aliyê Şaredariya Bajarê Mezin a me ve tê lidarxistin, pêk tê. Hevşaredarên me Serra Bucak û Dogan Hatun, bi ciwanên zanîngehê re tên gel hev. Fikr, pirs û bendewariyên ciwanan wê di vê hevdîtinê de bên axaftin.  🎶 Di çalakiyê de, enerjiya ciwanan wê bi konsera Ronî Artîn û DJ Xodî re li ser sehneyê be!  🗓️ 19’ê Mijdarê, Çarşem🕓 14.00 📍 Navenda Çand û Kongreyê ya Zanîngeha Dîcleyê – Salona Konferansê ya Ziya Gokalp  📢 Pêdîyayîşê Ciwanîye yo 2. Dest Pêkeno 🎓✨  📌 Pêdîyayîşê Ciwanîye yo dîyin ke Şaredarîya ma ya Şaristanê Girdî organîze kena, dest pêkeno. Hemşaredarê ma Serra Bucak û Dogan Hatun ciwananê unîversîte reyde yenê têhet. Pêdîyayîşî de fikrê ciwanan, persê înan û waştişê înan do bêrê qiseykerdene.  🎶 Çalakîye de bi konserê Ronî Artîn û DJ Xodîyî hêzê ciwanîye do sahne de bibo!  🗓️ 19ê Teşrîna Peyêne, Çarşeme 🕓 14:00 📍 Unîversîteya Dîcle, Merkezê Kultur û Kongre – Salona Konferansî ya Zîya Gokalpî  #Diyarbakır #Amed #GençlikBuluşması;;0
https://www.instagram.com/p/DRFQNWjicly/;Reels;262;6;35750;2025-11-15 18:29:08;https://scontent.cdninstagram.com/v/t51.82787-15/581300484_18411707833136668_2337558935446122621_n.jpg?stp=dst-jpg_e15_tt6&_nc_cat=106&ig_cache_key=Mzc2NjQ4Nzk0OTY4MTIxNTg1ODE4NDExNzA3ODMwMTM2NjY4.3-ccb7-5&ccb=7-5&_nc_sid=58cdad&efg=eyJ2ZW5jb2RlX3RhZyI6InhwaWRzLjkwMHgxNjAwLnNkci5DMyJ9&_nc_ohc=m8yAO_PNN8kQ7kNvwF3daF6&_nc_oc=Adl-hEkvvuy2o66ZMjzuSyXDt9EhG2F4LnRuAEdtdrpiqkbqBFI-ouNQ3jCzT1jK_uI&_nc_ad=z-m&_nc_cid=1501&_nc_zt=23&_nc_ht=scontent.cdninstagram.com&_nc_gid=abwC_hHYe0yJSydUyGYhXw&oh=00_AfgC1tpgCTu1mB39Npx99uxLcZZM-RkaGApaqO6Ot5Gk2A&oe=69311A33;"🧥 Çalakiya 'Bazara Pevguhertinê' Hat Lidarxistin 📕  📌 Beşa me ya Guherîna Avhewayê û Sifir Bermayî û Komeleya Ekolojiyê ya Amedê bi hev re çalakiya ""Bazara Lêkguhertinê"" li dar xistin, bi şîara ""Em dema ku em serf dikin dixwin, werin em bi parvekirinê zêde bikin"" da ku parvekirinê li dijî çanda mezaxtinê pêşve bibin. Bazara ku cûrbecûr tişt pêşkêş dikir, di nav de cil, hilberên teknolojiyê, pirtûk, kovar, pêlîstok û zêr, rê da niştecihan ku tiştên ku bi xwe re anîne bi tiştên bijartina xwe biguherînin. Hevşaredarên me Serra Bucak û Dogan Hatun, bi endamên meclîsa me re li Bazara Berdêlkirinê geriyan û bi niştecihan re sohbet kirin.  🧥 ‘Takas Pazarı’ Etkinliği Düzenlendi 📕  📌 İklim Değişikliği ve Sıfır Atık Dairesi Başkanlığımız ile Amed Ekoloji Derneği iş birliğiyle, tüketim kültürüne karşı paylaşımı yaygınlaştırmak amacıyla “Tükettikçe tükeniyoruz, paylaşarak çoğaltalım” mottosuyla “Takas Pazarı” etkinliği gerçekleştirdi. Giyim, teknoloji ürünleri ile kitap, dergi, oyuncak ve takılar gibi birçok ürünün yer aldığı pazarda yurttaşlar, yanlarında getirdikleri ürünleri istediği ürünlerle değiştirebilme imkânı elde etti. Eşbaşkanlarımız Serra Bucak ve Doğan Hatun da meclis üyelerimizle birlikte Takas Pazarı’nı gezerek yurttaşlarla sohbet etti.  #Diyarbakır #Amed #TakasPazarı";;0
https://www.instagram.com/p/DRFKlopjFLo/;Carousel;764;1;0;2025-11-15 17:37:07;https://scontent.cdninstagram.com/v/t51.82787-15/582281804_18411701179136668_7402383725757178974_n.jpg?stp=cp6_dst-jpg_e35_tt6&_nc_cat=106&ig_cache_key=Mzc2NjQ2MzIyNDIyNTc0MzYxMw%3D%3D.3-ccb7-5&ccb=7-5&_nc_sid=58cdad&efg=eyJ2ZW5jb2RlX3RhZyI6InhwaWRzLjIxNjB4MTQ0MC5zZHIuQzMifQ%3D%3D&_nc_ohc=8KvBIQOB3bQQ7kNvwHrUNk2&_nc_oc=AdmhoaeOIGy9l1APfxNL_pRwnzCUNyDYxD9RMzJHTAOPX0_olYYMCtdbdYrIytqTRkY&_nc_ad=z-m&_nc_cid=1501&_nc_zt=23&_nc_ht=scontent.cdninstagram.com&_nc_gid=abwC_hHYe0yJSydUyGYhXw&oh=00_AfjZsgn13RoVO7lZaYH16bM6SrJzZC02xtYZlVWxT8orJA&oe=693125A8;◼️ Eşbaşkanlarımız Seyit Rıza Anmasına Katıldı  📌 Eşbaşkanlarımız Serra Bucak ve Doğan Hatun, Seyit Rıza'nın katledilişinin yıl dönümünde Pir Sultan Abdal Kültür Derneği ve Demokratik Kurumlar Platformu tarafından Şeyh Said Meydanı'nda düzenlenen anmaya katıldı. Anmaya eşbaşkanlarımızın yanı sıra ilçe belediye eşbaşkanları, demokratik ve kitle örgütü temsilcileri, DEM Parti Diyarbakır Milletvekili Serhat Eren, DEM Parti Diyarbakır İl Eşbaşkanları Gülşen Özer ve Abbas Şahin ile çok sayıda yurttaş katıldı. Açıklamada, hakikatlerin açığa çıkarılması ve geçmişle yüzleşilmesi talep edildi.  ◼️ Hevşaredarên me Beşdarî Bîranîna Seyît Riza Bûn  📌 Hevşaredarên me Serra Bucak û Dogan Hatun beşdarî bîranîna ku ji hêla Komeleya Çandî ya Pîr Sultan Abdal û Platforma Saziyên Demokratîk ve li Meydana Şêx Seîd di salvegera kuştina Seyît Riza de hate lidarxistin bûn. Ji bilî hevserokên me, hevserokên şaredariyên navçeyan, nûnerên rêxistinên demokratîk û girseyî, Cîgirê Amedê yê Partiya DEMê Serhat Eren, Hevserokên Parêzgeha Amedê ya Partiya DEMê Gulşen Ozer û Abbas Şahin, û gelek welatî beşdarî vê bîranînê bûn. Di daxuyaniyê de hat xwestin ku rastî were aşkerekirin û bi raboriyê re rûbirû bibin.  #Diyarbakır #Amed;;0
https://www.instagram.com/p/DRFBvbDDI2x/;Carousel;726;20;0;2025-11-15 16:19:49;https://scontent.cdninstagram.com/v/t51.82787-15/583429342_18411693289136668_9133547374419016845_n.jpg?stp=dst-jpg_e35_tt6&_nc_cat=104&ig_cache_key=Mzc2NjQyNDMwNjIxODQ1ODIyNw%3D%3D.3-ccb7-5&ccb=7-5&_nc_sid=58cdad&efg=eyJ2ZW5jb2RlX3RhZyI6InhwaWRzLjIxNTh4MTQ0MC5zZHIuQzMifQ%3D%3D&_nc_ohc=2_RzaseRd90Q7kNvwEyjH4X&_nc_oc=AdlRRPzgFHJ0bGzBIXAwWgzBMrd98R2ERY2moGOwnKr_Cs1QY2mFadZAX_ROG-6K28g&_nc_ad=z-m&_nc_cid=1501&_nc_zt=23&_nc_ht=scontent.cdninstagram.com&_nc_gid=abwC_hHYe0yJSydUyGYhXw&oh=00_AfgDNeWdXmI_eyxcNIjPxKE7gwP5PJbNj9jhzak3LjJ-MQ&oe=6930FD32;"🧥 ‘Takas Pazarı’ Etkinliği Düzenlendi 📕  📌 İklim Değişikliği ve Sıfır Atık Dairesi Başkanlığımız ile Amed Ekoloji Derneği iş birliğiyle, tüketim kültürüne karşı paylaşımı yaygınlaştırmak amacıyla “Tükettikçe tükeniyoruz, paylaşarak çoğaltalım” mottosuyla “Takas Pazarı” etkinliği gerçekleştirdi. Giyim, teknoloji ürünleri ile kitap, dergi, oyuncak ve takılar gibi birçok ürünün yer aldığı pazarda yurttaşlar, yanlarında getirdikleri ürünleri istediği ürünlerle değiştirebilme imkânı elde etti. Eşbaşkanlarımız Serra Bucak ve Doğan Hatun da meclis üyelerimizle birlikte Takas Pazarı’nı gezerek yurttaşlarla sohbet etti.   🧥 Çalakiya 'Bazara Pevguhertinê' Hat Lidarxistin 📕  📌 Beşa me ya Guherîna Avhewayê û Sifir Bermayî û Komeleya Ekolojiyê ya Amedê bi hev re çalakiya ""Bazara Lêkguhertinê"" li dar xistin, bi şîara ""Em dema ku em serf dikin dixwin, werin em bi parvekirinê zêde bikin"" da ku parvekirinê li dijî çanda mezaxtinê pêşve bibin. Bazara ku cûrbecûr tişt pêşkêş dikir, di nav de cil, hilberên teknolojiyê, pirtûk, kovar, pêlîstok û zêr, rê da niştecihan ku tiştên ku bi xwe re anîne bi tiştên bijartina xwe biguherînin. Hevşaredarên me Serra Bucak û Dogan Hatun, bi endamên meclîsa me re li Bazara Berdêlkirinê geriyan û bi niştecihan re sohbet kirin.  #Diyarbakır #Amed #TakasPazarı";;0
https://www.instagram.com/p/DRC_MfUFhLQ/;Carousel;440;6;0;2025-11-14 21:19:05;https://scontent.cdninstagram.com/v/t39.30808-6/582849741_1147644724184000_8324552336385336223_n.jpg?stp=dst-jpg_e35_tt6&_nc_cat=105&ig_cache_key=Mzc2NTg1MDE1NDE2MDUwMjc4NQ%3D%3D.3-ccb7-5&ccb=7-5&_nc_sid=58cdad&efg=eyJ2ZW5jb2RlX3RhZyI6InhwaWRzLjEwODB4MTM1MC5zZHIuQzMifQ%3D%3D&_nc_ohc=yOds8KvBkJAQ7kNvwG1lz25&_nc_oc=AdmsvK3QF37lpO9y02X-a3gDNdT7WUngoF4kMa2MnwXBdy0cGPviBI-iTc9vbhpEP2g&_nc_ad=z-m&_nc_cid=1501&_nc_zt=23&_nc_ht=scontent.cdninstagram.com&_nc_gid=abwC_hHYe0yJSydUyGYhXw&oh=00_AfiVkteqQWIKh1r5HRAbUp3oeNXBwCZrYed525Q7Qqb0Iw&oe=6931202F;📢 HALK BULUŞMAMIZA DAVETLİSİNİZ ✨  📌 Eşbaşkanlarımız Serra Bucak ve Doğan Hatun sizlerle bir araya geliyor. İstek, öneri ve taleplerinizi paylaşmak için siz değerli halkımızı bekliyoruz.  📍Yer: Ali Emiri Konferans Salonu (Büyükşehir Belediyesi Arkası) 🗓️ Tarih: 17 Kasım, Pazartesi 🕒 Saat: 14.00  📢 HÛN JI BO CIVÎNA ME YA BI GEL RE  VEXWENDÎ NE ✨  📌 Hevserokên me, Serra Bucak û Dogan Hatun, bi we re dicivin. Em li bendê ne ku daxwaz, pêşniyar û xwestekên we bi we, welatiyên me yên hêja re parve bikin.  📍Cih: Salona Konferansê ya Elî Emîrî (Li pişt Avahiya Şaredariya Bajarê Mezin) 🗓️ Dîrok: Duşem, 17ê Mijdarê 🕒 Dem: 2:00 PM  📢 VENGDAYÎŞ SEBA TÊHETAMEYÎŞÊ ŞARÎ ✨  📌 Hemşaredarê ma Serra Bucak û Doğan Hatun do şima reyde bêrê têhet. Seba ke waştiş, pêşnîyaz û talêbanê şima goşdarî bikê, ma paweyê şima şarê xo yê erjîyayeyî yê.  📍Salona Konferansî Ya Alî Emîrî (Peyê Şaredarîya Şarıstanê Gırdî) 🗓️ 17ê Teşrîna Peyêne, Dışeme 🕒14.00  #Diyarbakır #Amed #HalkBuluşması;;0
https://www.instagram.com/p/DRC8rkFjNID/;Carousel;548;5;0;2025-11-14 20:57:07;https://scontent.cdninstagram.com/v/t51.82787-15/581012516_18411612715136668_7917865813028199920_n.jpg?stp=dst-jpg_e35_tt6&_nc_cat=110&ig_cache_key=Mzc2NTgzOTEwNDI3NDM5MjgzNg%3D%3D.3-ccb7-5&ccb=7-5&_nc_sid=58cdad&efg=eyJ2ZW5jb2RlX3RhZyI6InhwaWRzLjIxNTV4MTQ0MC5zZHIuQzMifQ%3D%3D&_nc_ohc=cfrLhWbLmUQQ7kNvwGz6MX4&_nc_oc=AdkYEDIb2mqcW13_FWp1HN6GU9Nc_lmLXaAE7gfPK-YAXpt4kRmXHQw1wwBOYmommb4&_nc_ad=z-m&_nc_cid=1501&_nc_zt=23&_nc_ht=scontent.cdninstagram.com&_nc_gid=abwC_hHYe0yJSydUyGYhXw&oh=00_Afga8vp12RQuwTIvCugIfugcrN-S3OjWoYp5SQpmBGa-NQ&oe=693124C4;🇪🇺 Eşbaşkanlar, AB Türkiye Delegasyonu Heyeti ile Bir Araya Geldi  📌 Eşbaşkanlarımız Serra Bucak ve Doğan Hatun, Diyarbakır’da temaslarını sürdüren Avrupa Birliği (AB) Türkiye Delegasyonu Maslahatgüzarı Jurgis Vilcinskas ile AB üyesi Fransa, Avusturya, Portekiz, Belçika, İrlanda, Bulgaristan, Estonya, Yunanistan, Letonya, Litvanya, Lüksemburg, Malta, Romanya, Slovakya, Slovenya ve İsveç büyükelçilerinden oluşan heyetle bir araya geldi. Güncel gelişmeler üzerine görüş alışverişinde bulunulan görüşmeye, Meclis Eşsözcüsümüz Demet Ceylan ile Kayapınar, Sur, Yenişehir ve Bağlar Belediyeleri Eşbaşkanları da katıldı.  🇪🇺 Hevşaredar Bi Heyeta Delegeya Yekîtiya Ewropayê Re Hatin Gel Hev  📌 Hevşaredarên me Serra Bucak û Dogan Hatun, bi Alîkarê Balyozê Delegeya Yekîtiya Ewropayê (YE) ya Tirkiyeyê Jurgis Vilcinskas û balyozên welatên endamên YE yên wekî Fransa, Awistriya, Portekîz, Belçîka, Îrlanda, Bulgaristan, Estonya, Yewnanîstan, Letonya, Lîtvanya, Luksembûrg, Malta, Romanya, Slovakya, Slovenya û Swêdê yên ku li Amedê temasên xwe didomînin, re civiyan. Di hevdîtinê de li ser geşedanên rojane nêrîn hatin parvekirin. Hevberdevkê Meclisa me Demet Ceylan û Hevşaredarên Şaredariyên navçeyên Kayapinar, Sûr, Yenîşehir û Rezanê jî beşdarî hevdîtinê bûn.  #Diyarbakır #Amed #AB;;0
https://www.instagram.com/p/DRC1yNviNLh/;Reels;198;0;27468;2025-11-14 20:01:48;https://scontent.cdninstagram.com/v/t51.71878-15/582780673_2010830743083862_8912390083360751817_n.jpg?stp=dst-jpg_e15_tt6&_nc_cat=103&ig_cache_key=Mzc2NTgwODc4NTYzMDIyMTAyNTIxMjM1MDQ3MzQ4NDY5Mjk%3D.3-ccb7-5&ccb=7-5&_nc_sid=58cdad&efg=eyJ2ZW5jb2RlX3RhZyI6InhwaWRzLjY0MHgzNjIuc2RyLkMzIn0%3D&_nc_ohc=0CDAQnboH7IQ7kNvwESLU3l&_nc_oc=AdkyDdhr2z_sHMI0EKwn1dcNhOehzw262ZaNkzo8fGVsOm93IsaFOUzCl0IQfgzw-0o&_nc_ad=z-m&_nc_cid=1501&_nc_zt=23&_nc_ht=scontent.cdninstagram.com&_nc_gid=abwC_hHYe0yJSydUyGYhXw&oh=00_AfgbYI5IPkzxbr_M1Bcevi8dmHcdL-LIZxHN2FoRl8jpJA&oe=6931135B;"Halkımızın Sağlığı İçin Sahadayız!  Diyarbakır Büyükşehir Belediyesi Sağlık İşleri Dairesi Başkanlığına bağlı Sağlık Merkezi ekiplerimiz, Bismil ilçesi Güzelköy Mahallesi Tepekonak mezrasında vatandaşlara sağlık taraması hizmeti verdi.  Bismil Belediyesi Eş Başkanları Mizgin EKİN ve Güven TANRIKULU ile Diyarbakır Büyükşehir Belediyesi Sağlık İdari İşler Şube Müdürü Ümit ŞAHİN’in katılımıyla gerçekleştirilen çalışmada;  🩺 Hepatit testleri 🫀 Tansiyon ve şeker ölçümleri 🩸 Kan grubu tespitleri  yapılarak vatandaşlara gerekli bilgilendirme ve yönlendirmelerde bulunuldu.  Ayrıca çocuklara ağız ve diş sağlığı eğitimi verilerek, Bismil Belediyesi eş başkanlarımız ve sağlık ekiplerimiz tarafından hediyeler dağıtıldı.  💚 Halkımızın sağlığı için mahalle mahalle, mezra mezra hizmet etmeye devam ediyoruz.";;0
https://www.instagram.com/p/DRCxBBnlndM/;Carousel;552;19;0;2025-11-14 19:15:11;https://scontent-lhr6-2.cdninstagram.com/v/t39.30808-6/582685196_1147573834191089_2312438924051118899_n.jpg?stp=dst-jpg_e35_tt6&_nc_cat=104&ig_cache_key=Mzc2NTc4NzgwMTExNzE3MjU5NQ%3D%3D.3-ccb7-5&ccb=7-5&_nc_sid=58cdad&efg=eyJ2ZW5jb2RlX3RhZyI6InhwaWRzLjEwODB4MTM1MC5zZHIuQzMifQ%3D%3D&_nc_ohc=1jFn7-8l_fYQ7kNvwEkfc6l&_nc_oc=AdmqWskImYRE6i5KQzDSHhwdBPsKxLA0gwh5zqltru6yz-DTgMmHRDTR3TgrJDgHDB4&_nc_ad=z-m&_nc_cid=0&_nc_zt=23&_nc_ht=scontent-lhr6-2.cdninstagram.com&_nc_gid=s7CR1mOl8s4fPvir6zbWng&oh=00_Afh_S3qIVF9qKtjycelVTbB0A540767rh_8zrUhInwOr5Q&oe=69310CD0;📢 Diyarbakır Büyükşehir, Sosyal Medyada Türkiye 4.’sü! 📊✨  📌 Sosyal medya etkileşimlerinde Türkiye’deki 30 Büyükşehir Belediyesi arasında 4. sıraya yükselerek önemli bir başarıya imza attık. İnstagram platformundaki etkileşim performansı ile de ilk 3’e girerek birçok büyükşehir belediyesi geride bırakıldı. Göreve geldiğimiz günden bu yana halkımızın hizmetlerimize hızlı, doğru ve güvenilir biçimde ulaşması için çalışıyoruz. İçeriklerimizi Türkçe, Kürtçe (Kurmancî ve Zazakî) ve İngilizce hazırlayarak şeffaf, erişilebilir ve kapsayıcı bir iletişim anlayışını sürdürüyoruz.  Bu başarıyı hiçbir reklam kullanmadan, halkımızın güçlü ilgisiyle elde ettik. Teşekkürler AMED ❤️💚  Kaynak: Ajans Press 🔗 Detaylar: http://diyarbakir.bel.tr/haberler/16195  📢 Şaredariya Bajarê Mezin a Amedê, Di Medyaya Civakî De Li Tirkiyeyê Bû 4emîn! 📊✨  📌 Me di têkiliyên (etkileşim) medyaya civakî de, di nav 30 Şaredariyên Bajarên Mezin ên li Tirkiyeyê de, derketin rêza 4emîn û serkeftineke girîng bi dest xist. Ji roja ku em hatin ser kar ve, em dixebitin da ku gelê me bi lez, rast û pêbawer bigihêje xizmetên me. Em naverokên xwe bi zimanê Tirkî, Kurdî (Kurmancî û Zazakî) û Îngilîzî amade dikin û têgihîştineke ragihandinê ya şefaf, gihîner û hevgir didomînin.  Me ev serkeftin, bêyî ku em ti reklamê bi kar bînin, bi eleqeya xurt a gelê xwe bi dest xist. Spas AMED ❤️💚  Çavkanî: Ajans Press 🔗 Detay: http://diyarbakir.bel.tr/haberler/16195  #Diyarbakır #Amed #SosyalMedya;;0
https://www.instagram.com/p/DRCldZwCKHO/;Carousel;129;0;0;2025-11-14 17:34:12;https://scontent-lhr6-1.cdninstagram.com/v/t51.82787-15/580130806_18182676391354013_482895401703414921_n.webp?_nc_cat=110&ig_cache_key=Mzc2NTczNjk1OTY0MjE5NTcwMQ%3D%3D.3-ccb7-5&ccb=7-5&_nc_sid=58cdad&efg=eyJ2ZW5jb2RlX3RhZyI6InhwaWRzLjEwODB4MTA4MC5zZHIuQzMifQ%3D%3D&_nc_ohc=R3VT4RG885cQ7kNvwHC7bE7&_nc_oc=Adlsv-s1oiLFQDIaPeoNaBPyLuKkeWIuX_mMtCY8nsNtJytQaZu2Jqfenf523u3z3fI&_nc_ad=z-m&_nc_cid=0&_nc_zt=23&_nc_ht=scontent-lhr6-1.cdninstagram.com&_nc_gid=s7CR1mOl8s4fPvir6zbWng&oh=00_AfjxH3iVMPQxBhk13lmDiuIIpNejkmyc9BJgWziTaJQf0w&oe=6931048E;🌧️ DİSKİ, Kuvvetli Yağış Uyarısı Öncesi Kent Genelinde Yağmur Suyu Izgaralarını Temizledi  🔗 Link Hikaye’de!  💧 Diyarbakır Büyükşehir Belediyesi DİSKİ Genel Müdürlüğü, Meteoroloji Genel Müdürlüğünün kuvvetli yağış uyarısı öncesinde Urfa Bulvarı, Mahabad Bulvarı, Ofis, Suriçi ve 14 terfi merkezinin çevresi başta olmak üzere birçok noktada yağmur suyu ızgaralarını temizledi.  #Amed #Diyarbakır #Diski #Av #Awk #Su #Water #Wasser;;0
https://www.instagram.com/p/DRCaPPtDCXB/;Carousel;1564;16;0;2025-11-14 15:56:09;https://scontent-lhr6-1.cdninstagram.com/v/t51.82787-15/582756871_18411583930136668_4709986291485850127_n.jpg?stp=dst-jpg_e35_tt6&_nc_cat=110&ig_cache_key=Mzc2NTY4NzYyMTI5NzkwNzk5Mg%3D%3D.3-ccb7-5&ccb=7-5&_nc_sid=58cdad&efg=eyJ2ZW5jb2RlX3RhZyI6InhwaWRzLjIxNTV4MTQ0MC5zZHIuQzMifQ%3D%3D&_nc_ohc=-iepo9E7MgsQ7kNvwF9gg2l&_nc_oc=AdlA5Rbol7nQhxC2x3y4ub18tpQu0GpObp0xFJx66WI8LDSrw1kI1bJIgLGzY6mfUZA&_nc_ad=z-m&_nc_cid=0&_nc_zt=23&_nc_ht=scontent-lhr6-1.cdninstagram.com&_nc_gid=s7CR1mOl8s4fPvir6zbWng&oh=00_Afj59J6BFsgeqgCQNOL7YtLexEcFEZiUnixBciEMz7FdVg&oe=6930FC3C;"🔸 Eşbaşkanlar, Öğle Yemeğini Halk Lokantası’nda Yedi  📌 DEM Parti’nin, Çand Amed Kültür ve Kongre Merkezi’nde düzenlediği “Belediye Eşbaşkanları Buluşması”na katılan Eşbaşkanlarımız Serra Bucak ve Doğan Hatun ile DEM Parti Eş Genel Başkanları Tülay Hatimoğlulları ve Tuncer Bakırhan, DBP Eş Genel Başkanı Keskin Bayındır, DEM Parti İl Eşbaşkanları Gülşen Özer ve Abbas Şahin, Sur Belediyesi Eşbaşkanları Fatma Gulan Önkol ve Adnan Örhan, buluşma arasında Sur ilçesindeki Halk Lokantası’na geçti. Eşbaşkanlarımız ve Eş Genel Başkanlar, yurttaşlarla birlikte yemek yedi. Eşbaşkanlar, yurttaşlarla sohbet ederek sorun ve taleplerini dinledi.   🔸 Hevşaredaran Firavîna Xwe Li Xwaringeha Gel Xwar  📌 Hevşaredarên me Serra Bucak û Dogan Hatun, yên ku beşdarî ""Civîna Hevşaredaran"" a ji aliyê Partiya DEMê ve li Navenda Çand û Kongreyê ya Çand Amedê hatibû lidarxistin bûn, ligel Hevserokên Giştî yên Partiya DEMê Tulay Hatimoglullari û Tuncer Bakirhan, Hevserokê Giştî yê DBPê Keskîn Bayindir, Hevserokên Bajêr ên Partiya DEMê Gulşen Ozer û Abbas Şahîn, û Hevşaredarên Şaredariya Sûrê Fatma Gulan Onkol û Adnan Orhan, di navbera hevdîtinê de derbasî Xwaringeha Gel a li navçeya Sûrê bûn. Hevşaredar û Hevserokên Giştî, bi welatiyan re navroja xwe xwarin. Hevşaredaran bi welatiyan re sohbet kirin û guh dan pirsgirêk û daxwazên wan.  #Diyarbakır #Amed";;0
https://www.instagram.com/p/DRB8l7YiEka/;Carousel;66;3;0;2025-11-14 11:37:06;https://scontent-lhr6-1.cdninstagram.com/v/t51.82787-15/583960357_18182652658354013_7059848605392546341_n.webp?_nc_cat=110&ig_cache_key=Mzc2NTU1NzIyOTIxOTUxMjAxNA%3D%3D.3-ccb7-5&ccb=7-5&_nc_sid=58cdad&efg=eyJ2ZW5jb2RlX3RhZyI6InhwaWRzLjEwODB4MTA4MC5zZHIuQzMifQ%3D%3D&_nc_ohc=NXfUR2jnqj8Q7kNvwEQP7sn&_nc_oc=Adlutq2magqv97Jhi4-jeeeZO7NWfRz2NGWzTiaOmDGH7ABUjaSkMXS0jhObPfEP-a8&_nc_ad=z-m&_nc_cid=0&_nc_zt=23&_nc_ht=scontent-lhr6-1.cdninstagram.com&_nc_gid=s7CR1mOl8s4fPvir6zbWng&oh=00_AfjTmFt06OORD4wjQMBTJcMF-t9jK_sQS6XyVOv3ubCZ6g&oe=69310361;⚒️🔧 DİSKİ, Su Arz Güvenliği İçin Bakım-Onarım Faaliyetlerini Sürdürüyor  🔗 Link Hikaye’de!  💧 Diyarbakır Büyükşehir Belediyesi DİSKİ Genel Müdürlüğü, kent genelinde içme suyu kuyularının kesintisiz hizmet sunabilmesi için 2025’in ilk on ayında 6 bin 742 mekanik ve elektriksel bakım-onarım faaliyeti gerçekleştirdi.  #Amed #Diyarbakır #Diski #Av #Awk #Su #Water #Wasser;;0
https://www.instagram.com/p/DRB8iL2FmbV/;Carousel;306;2;0;2025-11-14 11:36:35;https://scontent-lhr6-1.cdninstagram.com/v/t39.30808-6/581550887_1147302170884922_2032338716531621065_n.jpg?stp=c14.0.2019.1366a_dst-jpg_e35_tt6&_nc_cat=109&ig_cache_key=Mzc2NTU1Njk3MzAwNzIwMzIwNQ%3D%3D.3-ccb7-5&ccb=7-5&_nc_sid=58cdad&efg=eyJ2ZW5jb2RlX3RhZyI6InhwaWRzLjIwNDh4MTM2Ni5zZHIuQzMifQ%3D%3D&_nc_ohc=4ktX6TBgKiMQ7kNvwE3-zNg&_nc_oc=AdkBDzFBuBOHt2qjAVHQC0K5TPAP-qiWlWJiGj2a41mrpRmlSDGaUXEQVg4jn5snWP8&_nc_ad=z-m&_nc_cid=0&_nc_zt=23&_nc_ht=scontent-lhr6-1.cdninstagram.com&_nc_gid=s7CR1mOl8s4fPvir6zbWng&oh=00_AfiI4ukqLg8icGAaDGyxP9c1M4OaJCPSBLZNiMI4ez-Aew&oe=69310FBB;🇪🇺 Our Co-Mayors Welcomed the Delegation of EU Member State Ambassadors 🤝  📌Chargé d’Affaires a.i. of the Delegation of the European Union to Türkiye, Jurgis Vilcinskas, together with the ambassadors of EU member states - France, Austria, Portugal, Belgium, Ireland, Bulgaria, Estonia, Greece, Latvia, Lithuania, Luxembourg, Malta, Romania, Slovakia, Slovenia, and Sweden - paid a courtesy visit to our Metropolitan Municipality. The EU delegation, visiting Diyarbakır for a series of meetings and engagements, was welcomed at the municipality’s protocol entrance by our Co-Mayors Serra Bucak and Doğan Hatun. During the meeting with the delegation, views were exchanged on political, social, cultural, and economic matters.  #Diyarbakır #Amed #EuropeanUnion #EU;;0
