PostLink;PostTürü;BeğeniSayısı;YorumSayısı;Görüntülenme Sayısı;Tarih;DisplayPhoto;Caption;Takipçi;TahminMi
https://www.instagram.com/p/DQ18nLIjOya/;Reels;3142;64;112557;2025-11-09 19:48:23;https://scontent-lhr6-2.cdninstagram.com/v/t51.71878-15/579837580_25121767290824777_7390069148684971731_n.jpg?stp=dst-jpg_e15_tt6&_nc_cat=104&ig_cache_key=Mzc2MjE3OTYzODU0Mjc4OTc4Ng%3D%3D.3-ccb7-5&ccb=7-5&_nc_sid=58cdad&efg=eyJ2ZW5jb2RlX3RhZyI6InhwaWRzLjY0MHgzNjAuc2RyLkMzIn0%3D&_nc_ohc=AsW_4uMsTzcQ7kNvwHwU_Uf&_nc_oc=Adl5bQc0O4VfKiRrIzrXmTn9l07lTfdoeYJGH6P4DmEBgUPC73wVF0F9jvLKXYrolGE&_nc_ad=z-m&_nc_cid=0&_nc_zt=23&_nc_ht=scontent-lhr6-2.cdninstagram.com&_nc_gid=ctWQcuQCoChm2iwl7kBhcw&oh=00_AfggR0ERWJG0vfpBQqOrZJCfMymgQELOFcUBKIVC209Cpw&oe=69310C26;Ulu Önder Gazi Mustafa Kemal Atatürk’ü sonsuzluğa uğurlayışımızın yıl dönümünde saygı, minnet ve tükenmeyen hasretle anıyoruz.   O’nun fikirleri bugün, yarın ve sonsuza dek yolumuzu aydınlatmaya devam edecek.  Daima izinde yürüyeceğimize, emanet ettiği Cumhuriyet meşalesini ilelebet taşıyacağımıza söz veriyoruz.  1881 - ♾️;;0
https://www.instagram.com/p/DQ1z2yXDE19/;Reels;1108;12;57954;2025-11-09 18:30:44;https://scontent-lhr6-2.cdninstagram.com/v/t51.71878-15/580574513_1387997959644380_7325916726881841458_n.jpg?stp=dst-jpg_e15_tt6&_nc_cat=105&ig_cache_key=Mzc2MjE0MTEyOTAzNTUwMDkyNQ%3D%3D.3-ccb7-5&ccb=7-5&_nc_sid=58cdad&efg=eyJ2ZW5jb2RlX3RhZyI6InhwaWRzLjY0MHg4MDAuc2RyLkMzIn0%3D&_nc_ohc=ce756iFaMcQQ7kNvwHbke7q&_nc_oc=AdksMbvfJx8Gpf_WC52p-deoO-JS19kIfPUKyKduMJGKWb-HG7X0UPKXBlZMt5Y47As&_nc_ad=z-m&_nc_cid=0&_nc_zt=23&_nc_ht=scontent-lhr6-2.cdninstagram.com&_nc_gid=ctWQcuQCoChm2iwl7kBhcw&oh=00_AfjR5X8YMTM2lKZTBCbC3-ej55MI8so4FLzo-iv8KCIsGA&oe=69310C9E;Şehrimizi geleceğe taşımak, iklim krizine ve olası afetlere karşı dayanıklı kılmak için 20 Milyon Euro’luk dev bir altyapı yatırımına hazırlanıyoruz.  Dünya Bankası finansmanıyla hayata geçireceğimiz ve şehrimizin 2050-2060 yıllarını esas aldığımız Manisa Merkez İçme Suyu Projemizi, Halk Katılım Toplantısı’nda hemşehrilerimize anlattık.  Manisa’nın geleceğini düşünen, halkla birlikte katılımcı çözümler üreten bir anlayışla çalışmaya devam edeceğiz.;;0
https://www.instagram.com/p/DQ1om1fjMgs/;Reels;673;13;43574;2025-11-09 16:52:35;https://scontent-mia3-3.cdninstagram.com/v/t51.71878-15/580121366_833415912759545_2422547259274197825_n.jpg?stp=dst-jpg_e15_tt6&_nc_cat=110&ig_cache_key=Mzc2MjA5MTY1NDM3NjExNDIyMA%3D%3D.3-ccb7-5&ccb=7-5&_nc_sid=58cdad&efg=eyJ2ZW5jb2RlX3RhZyI6InhwaWRzLjY0MHgxMTM2LnNkci5DMyJ9&_nc_ohc=nvBiKaLcobYQ7kNvwF8cO-n&_nc_oc=Adn73w8X4AL8jsvq-VuTpHIZ-LjUn8VaUGkahKn4_t7UTJnMhVxPWIKlQuEajDmPaPQ&_nc_ad=z-m&_nc_cid=0&_nc_zt=23&_nc_ht=scontent-mia3-3.cdninstagram.com&_nc_gid=sFuYZi79agk7qCDJXvJyuA&oh=00_Afgzgh5ldqtKkVnoIDmoeZeeGIH1aqH4tyN68v-a5SFvdQ&oe=6931117E;Kuraklıkla mücadelede en güçlü adımlardan birini atıyoruz.  Yağmur suyu hasadı çalışmalarımızla, 17 ilçemizin kırsal mahallelerinde suyun her damlasını değerlendireceğimiz yakalama alanları oluşturuyoruz.  #Manisa’mız için, doğamız ve geleceğimiz için tek bir damlayı bile israf etmeden çalışmaya devam edeceğiz.;;0
https://www.instagram.com/p/DQ1j5YbjI8G/;Carousel;655;5;0;2025-11-09 16:10:25;https://scontent-mia5-1.cdninstagram.com/v/t51.82787-15/575981243_18538081435040314_2684623029814994572_n.jpg?stp=dst-jpg_e35_tt6&_nc_cat=101&ig_cache_key=Mzc2MjA3MDkyNTM0NTYwOTU4Mg%3D%3D.3-ccb7-5&ccb=7-5&_nc_sid=58cdad&efg=eyJ2ZW5jb2RlX3RhZyI6InhwaWRzLjg1MHg1NjQuc2RyLkMzIn0%3D&_nc_ohc=KRGthNV48moQ7kNvwHrSPGS&_nc_oc=AdnuMkK2pAgTi3s0FRQ7Aj5XQ-44gfTk1GMZn3mEVqbHMH1beliO8K3U8ZnXbQbrCTg&_nc_ad=z-m&_nc_cid=0&_nc_zt=23&_nc_ht=scontent-mia5-1.cdninstagram.com&_nc_gid=sFuYZi79agk7qCDJXvJyuA&oh=00_AfiNTPEtq8Cu1NY_N3J5Kv7fnVfT1bNOIzCrdeZnPduMtQ&oe=69310A45;Türkiye Basketbol Süper Ligi’nin 7. hafta mücadelesinde, temsilcimiz Glint Manisa Basket, Trabzonspor ile karşılaşıyor.  Şehrimizi başarıyla temsil eden Glint Manisa Basket’i desteklemek için tribündeyiz. Temsilcimize başarılar diliyorum.;;0
https://www.instagram.com/p/DQ1QmwpDC32/;Reels;755;14;48681;2025-11-09 13:22:11;https://scontent-mia5-2.cdninstagram.com/v/t51.71878-15/575722082_32333831542927760_1928588222100047123_n.jpg?stp=dst-jpg_e15_tt6&_nc_cat=100&ig_cache_key=Mzc2MTk4NjA5NjA1MDQ4MjY3OA%3D%3D.3-ccb7-5&ccb=7-5&_nc_sid=58cdad&efg=eyJ2ZW5jb2RlX3RhZyI6InhwaWRzLjY0MHgxMTM2LnNkci5DMyJ9&_nc_ohc=lvk_9m4EsX8Q7kNvwE1GAG4&_nc_oc=AdmzbOXUImkKJ8NH0zXTRtWQXGBSxTN2qyFwfBOZ7J9ed1l5FTUc-VlUBxpDUMARG0g&_nc_ad=z-m&_nc_cid=0&_nc_zt=23&_nc_ht=scontent-mia5-2.cdninstagram.com&_nc_gid=sFuYZi79agk7qCDJXvJyuA&oh=00_AficasJDQoNjvg63oVBWZ9K0_ITVHLUfWO3ahMoSF3rlrg&oe=69310A14;"Kullanılmış pillerin doğaya verdiği zararı önlemek ve Manisa’mızı yeşillendirmek için el ele veriyor; 1 kilo atık pil getirene, 1 adet zeytin fidanı hediye ediyoruz!  Unutmayın: 1 küçük pil bile 8 ton toprağı kirletebiliyor. Bu pilleri doğadan uzak tutmak, geleceğimiz için en büyük yatırımımızdır.  Manisa’mızın bereketli topraklarını koruyalım ve yeni zeytin fidanlarıyla şehrimizi canlandıralım.  👉 Atık Pil Toplama Noktaları 26 Kasım Çarşamba Fatih Sergi Salonu Önü 27 Kasım Perşembe Salihli Belediye Binası Önü 28 Kasım Cuma Akhisar Belediye Binası Önü 1 Aralık Pazartesi Turgutlu Belediye Binası Önü";;0
https://www.instagram.com/p/DQzWXazjII0/;Reels;1029;9;39269;2025-11-08 19:34:12;https://scontent-mia5-1.cdninstagram.com/v/t51.71878-15/579688351_1947787285772161_6001269187169487461_n.jpg?stp=dst-jpg_e15_tt6&_nc_cat=101&ig_cache_key=Mzc2MTQ0ODQ4MDEzNzgzOTE1Ng%3D%3D.3-ccb7-5&ccb=7-5&_nc_sid=58cdad&efg=eyJ2ZW5jb2RlX3RhZyI6InhwaWRzLjY0MHgxMTM2LnNkci5DMyJ9&_nc_ohc=Cpd9xJ94-DAQ7kNvwEkrzOM&_nc_oc=AdlVP99j-9QPrTssbmu_zwJOnqDLw79NYGH9gnZhTXUqvisCH3Q1ZtpcvdkVYHSVbKY&_nc_ad=z-m&_nc_cid=0&_nc_zt=23&_nc_ht=scontent-mia5-1.cdninstagram.com&_nc_gid=sFuYZi79agk7qCDJXvJyuA&oh=00_Afhgw6uQWdRSOHTfvD3pYWp3pyMxcKJoBBE2-A6b_amWqQ&oe=6930FF67;Siz varsanız, biz varız❤️  Halkımızla bir arada olmak ve onlara hizmet etmek bize her zaman güç veriyor.  Güzel Manisa’mızı daha da güzelleştirmek için hiç durmadan çalışmaya devam edeceğiz.;;0
https://www.instagram.com/p/DQzIPaZDFVe/;Carousel;1939;5;0;2025-11-08 17:30:17;https://scontent-mia3-3.cdninstagram.com/v/t51.82787-15/573918280_18537820609040314_7479405804032405130_n.jpg?stp=dst-jpg_e35_tt6&_nc_cat=109&ig_cache_key=Mzc2MTM4NjMzOTk5NzMyNjc0Mg%3D%3D.3-ccb7-5&ccb=7-5&_nc_sid=58cdad&efg=eyJ2ZW5jb2RlX3RhZyI6InhwaWRzLjE0NDB4OTcwLnNkci5DMyJ9&_nc_ohc=khK3m6hHErQQ7kNvwEZye5H&_nc_oc=AdmT1FfUOF3-oLJZDgvlDWOqswcY806P9R-hO6ALPstn8K_A_YHM0FM0l8I5xEZNIUA&_nc_ad=z-m&_nc_cid=0&_nc_zt=23&_nc_ht=scontent-mia3-3.cdninstagram.com&_nc_gid=sFuYZi79agk7qCDJXvJyuA&oh=00_Afj2rqz_Yehh7uL1FenhqeOKRZMYCON7SXTTGWPN4RNWSA&oe=69310FEA;"Türkiye’nin en uzun soluklu şiir buluşması olan #SalihliŞiirİkindileri’nin 52’ncisinde, sözcüklerin büyüsüne bir kez daha tanıklık ettik.  Türk Edebiyatının büyük ustalarından Cemal Süreya’nın “Salihli, şiirin başkentidir” sözüyle anlam bulan bu kıymetli etkinliği şehrimizde yaşatmaktan büyük mutluluk duyuyoruz.  Bu güzel mirasa emek veren ve şiirin ışığını hiç söndürmeyen herkese gönülden teşekkür ediyorum.  Manisa’mız; kültürün, sanatın ve edebiyatın güzelliğiyle aydınlanmaya devam edecek.";;0
https://www.instagram.com/p/DQy4CKXDDJo/;Reels;1192;21;40598;2025-11-08 15:08:57;https://scontent-mia3-3.cdninstagram.com/v/t51.71878-15/575960366_761757366913739_2608970507863362201_n.jpg?stp=dst-jpg_e15_tt6&_nc_cat=110&ig_cache_key=Mzc2MTMxNTA3Nzk3NTQ1NDMxMg%3D%3D.3-ccb7-5&ccb=7-5&_nc_sid=58cdad&efg=eyJ2ZW5jb2RlX3RhZyI6InhwaWRzLjY0MHgxMTM2LnNkci5DMyJ9&_nc_ohc=pCyXlnjILaMQ7kNvwE-LlSh&_nc_oc=Adnx5Ga-MvKAUFzS6VbSWdiwgACzFodM7cFthy_4UqSaZAKcb-o4L7zHuLk5DeNu9uw&_nc_ad=z-m&_nc_cid=0&_nc_zt=23&_nc_ht=scontent-mia3-3.cdninstagram.com&_nc_gid=sFuYZi79agk7qCDJXvJyuA&oh=00_Afh0MmiHhH7h9i-6eFKr8traFpHwx9n3AJWYGGTJRQQ14g&oe=693123C1;"Halkımızın sofrasında bereket, yüzlerinde huzur ve mutluluk olsun diye çalışıyoruz.  Zorlu ekonomik koşullarda halkımızın sofrasındaki bereketi ve huzuru korumak için ilçelerimizdeki kent lokantası ve halk mandıralarımızın sayılarını her geçen gün arttırıyoruz.  Sosyal belediyecilik anlayışımızla; Gençlerimizin sağlıklı yemeğe, emeklimizin ucuz gıdaya, üreticimizin hakkı olan değere ulaşması için çalışmaya devam edeceğiz.";;0
https://www.instagram.com/p/DQyu6ZXjF3h/;Photo;379;2;0;2025-11-08 13:48:57;https://scontent-mia3-2.cdninstagram.com/v/t51.82787-15/573832078_18537755317040314_287660550805859655_n.jpg?stp=dst-jpg_e35_tt6&_nc_cat=103&ig_cache_key=Mzc2MTI3NDk2MTkxNTU2NzU4NQ%3D%3D.3-ccb7-5&ccb=7-5&_nc_sid=58cdad&efg=eyJ2ZW5jb2RlX3RhZyI6InhwaWRzLjE0NDB4MTgwMi5zZHIuQzMifQ%3D%3D&_nc_ohc=XuaFEjte4dQQ7kNvwEoQHpJ&_nc_oc=AdmsX50Cw1FKyBH6CjP0bhW6tSaPe5GGWjAaV9dIyfy4CnmBTcfB4EgNxOoV5A7uAIU&_nc_ad=z-m&_nc_cid=0&_nc_zt=23&_nc_ht=scontent-mia3-2.cdninstagram.com&_nc_gid=sFuYZi79agk7qCDJXvJyuA&oh=00_AfgI20vVosGsgxFd--OFWtGqP8JbTlhWjcc4X_L99HgPvQ&oe=69312429;Kardeş ülkemiz Can Azerbaycan’ın Zafer Günü kutlu olsun 🇦🇿🇹🇷  Karabağ için canını feda eden şehitleri rahmetle anıyor, gazilere minnetlerimizi sunuyoruz.;;0
https://www.instagram.com/p/DQwvER_DJff/;Carousel;1673;2;0;2025-11-07 19:11:49;https://scontent-mia3-2.cdninstagram.com/v/t51.82787-15/575338154_18537563896040314_1848954014369483163_n.jpg?stp=dst-jpg_e35_tt6&_nc_cat=107&ig_cache_key=Mzc2MDcxMjY3NzEyODQzMjMwMg%3D%3D.3-ccb7-5&ccb=7-5&_nc_sid=58cdad&efg=eyJ2ZW5jb2RlX3RhZyI6InhwaWRzLjEwNjV4NzEwLnNkci5DMyJ9&_nc_ohc=muhkNNNqWU8Q7kNvwEse0-R&_nc_oc=AdmAzWhhSrG5PL4WYV5tf36CbOCVEoNH8p_52YXHH5mNCn1oKt5wL5Cp5fX6bnbHMlI&_nc_ad=z-m&_nc_cid=0&_nc_zt=23&_nc_ht=scontent-mia3-2.cdninstagram.com&_nc_gid=sFuYZi79agk7qCDJXvJyuA&oh=00_AfjoxhajgrdnregqvCJ0nejE_4B7blb1Oq2gQyiRZopOyw&oe=6930FE71;"Sarıgöl’de renkli, hareketli ve güzel bir gün geçirdik!  Belediye Başkanımız Tahsin Akdeniz ile birlikte, esnafımıza hayırlı ve bereketli kazançlar diledik; pazar yerinde ve ilçemizin sokaklarında hemşehrilerimizle kucaklaştık.  Ardından Sarıgöl Atatürk Gençlik Merkezi’mizi de ziyaret ederek, MABEM eğitmenlerimiz ve gençlerimizle bir araya geldik.  Her hafta bir ilçemizi ziyaret ederek talepleri yerinde dinlemeye devam edeceğiz. Manisa’mızı hep beraber, el birliğiyle güzelleştireceğiz.";;0
https://www.instagram.com/p/DQwoixlDFNq/;Carousel;677;0;0;2025-11-07 18:14:49;https://scontent-mia5-1.cdninstagram.com/v/t51.82787-15/574508334_18537555751040314_7160281832279871389_n.jpg?stp=dst-jpg_e35_tt6&_nc_cat=104&ig_cache_key=Mzc2MDY4Mzk4Njc3MjA3MzI4OA%3D%3D.3-ccb7-5&ccb=7-5&_nc_sid=58cdad&efg=eyJ2ZW5jb2RlX3RhZyI6InhwaWRzLjEwNjV4NzEwLnNkci5DMyJ9&_nc_ohc=MW505v5J5lYQ7kNvwFh-Ot0&_nc_oc=AdlQnNq2oX3mjroMwo07S-KWgS0rHizh3cx7fFrecgpYreYB-hqbypR55CXabMsdHCM&_nc_ad=z-m&_nc_cid=0&_nc_zt=23&_nc_ht=scontent-mia5-1.cdninstagram.com&_nc_gid=sFuYZi79agk7qCDJXvJyuA&oh=00_Afi7VAKz6cAlgqXvJ-tFtf2VGe7EI9gIrME8LeCjLWJL4g&oe=6930FCA6;Sarıgöl’ümüze Kent Lokantası ve Halk Mandıra hayırlı olsun.  Öğrenciler, emekliler ve ihtiyaç sahipleri başta olmak üzere tüm hemşehrilerimiz için sağlıklı ve erişilebilir sofra sunmaya Sarıgöl ilçemiz ile devam ettik.  Kent Lokantamızla vatandaşlarımız uygun fiyatla sağlıklı yemeğe ulaşacak. Halk Mandıramızla ise hem üreticimiz kazanacak hem de tüketicimiz kaliteli ve uygun fiyatlı ürünlere rahatlıkla ulaşacak.  Halkımızın ihtiyaç duyduğu her alanda çalışmaya devam edeceğiz.;;0
https://www.instagram.com/p/DQwaUSijPsC/;Carousel;781;0;0;2025-11-07 16:10:30;https://scontent-mia5-1.cdninstagram.com/v/t51.82787-15/574604178_18537500224040314_1896402374299736121_n.jpg?stp=dst-jpg_e35_tt6&_nc_cat=104&ig_cache_key=Mzc2MDYyMTQxNzUzNzUxNDU1MA%3D%3D.3-ccb7-5&ccb=7-5&_nc_sid=58cdad&efg=eyJ2ZW5jb2RlX3RhZyI6InhwaWRzLjEwNjV4NzEwLnNkci5DMyJ9&_nc_ohc=2od3YLfuRwIQ7kNvwELqXWo&_nc_oc=Adl8laU44WPa3Phg1fwfsr92TJQBijjd4Ddt0FbX7MC61Wj0zpz0ByxzNU91XP2LXj4&_nc_ad=z-m&_nc_cid=0&_nc_zt=23&_nc_ht=scontent-mia5-1.cdninstagram.com&_nc_gid=sFuYZi79agk7qCDJXvJyuA&oh=00_AfhTljgaiIkFC5hz_uLypv1i1Auu8utgj-fejxi2BnUSSw&oe=69310B4D;Cuma namazımızı Sarıgöl’de kıldıktan sonra, Belediye Başkanımız Tahsin Akdeniz’i makamında ziyaret ederek ilçemizde hayata geçireceğimiz hizmet ve projeler üzerine verimli bir görüşme gerçekleştirdik.  Ardından baba ocağımız Cumhuriyet Halk Partisi’nde, İlçe Başkanımız Nuri Sarı ve yol arkadaşlarımızla bir araya geldik.  Sarıgöl’ümüz ve Manisa’mız için omuz omuza, tüm gücümüzle çalışmaya devam edeceğiz.;;0
https://www.instagram.com/p/DQwMcNmDALX/;Carousel;1110;1;0;2025-11-07 14:09:15;https://scontent-mia3-2.cdninstagram.com/v/t51.82787-15/575122161_18537486289040314_2791608088387943399_n.jpg?stp=dst-jpg_e35_tt6&_nc_cat=105&ig_cache_key=Mzc2MDU2MDM5MDcwNzkyNzQwMQ%3D%3D.3-ccb7-5&ccb=7-5&_nc_sid=58cdad&efg=eyJ2ZW5jb2RlX3RhZyI6InhwaWRzLjEwNjV4NzEwLnNkci5DMyJ9&_nc_ohc=HVxouI0qRy0Q7kNvwEDvsQ_&_nc_oc=Adkgfys1k0IASkCUG7UdKJeGDcHM9KhphQY16NMo_4dVEq1tHsSzAdGba2XfILqqeP0&_nc_ad=z-m&_nc_cid=0&_nc_zt=23&_nc_ht=scontent-mia3-2.cdninstagram.com&_nc_gid=sFuYZi79agk7qCDJXvJyuA&oh=00_Afj5qjk-4swu1IBifhqc7XEZlVrmU8uwZe4TzU5JGK7Mzw&oe=69310EAB;#Sarıgöl’deyiz!  Sarıgöl Belediye Başkanımız Tahsin Akdeniz ile birlikte ilçemizin muhtarlarıyla buluştuk. Mahallelerimizin acil ihtiyaçlarını ve taleplerini birinci ağızdan dinleyerek, notlarımızı aldık.  Ardından  Sarıgöl’ümüzdeki, sivil toplum kuruluşlarının temsilcileri ile bir araya gelerek yaptığımız ve yapacağımız projeleri konuştuk.  Bizleri içtenlikle karşılayan Tahsin Başkanımıza ve tüm hemşehrilerimize, katkı ve misafirperverlikleri için değerli muhtarlarımıza ve sivil toplum örgütü temsilcilerimize teşekkür ediyorum.  Sarıgöl’ümüzün tüm ihtiyaçlarını karşılamak için durmadan çalışmaya devam edeceğiz.;;0
https://www.instagram.com/p/DQvwXO-jDyU/;Reels;2567;33;78925;2025-11-07 10:07:09;https://scontent-mia5-1.cdninstagram.com/v/t51.71878-15/572899360_870790468842865_8411720873673331742_n.jpg?stp=dst-jpg_e15_tt6&_nc_cat=101&ig_cache_key=Mzc2MDQzNjkxNjczOTkxNDkwMA%3D%3D.3-ccb7-5&ccb=7-5&_nc_sid=58cdad&efg=eyJ2ZW5jb2RlX3RhZyI6InhwaWRzLjY0MHgxMTM2LnNkci5DMyJ9&_nc_ohc=pNM4-C2Wd9AQ7kNvwHZjDoh&_nc_oc=AdkdrYHormehgDt546bq1kDBVEkkTc_sb3FguHnB4m3Z7jzLrdoGaW01eBvufbmVmvs&_nc_ad=z-m&_nc_cid=0&_nc_zt=23&_nc_ht=scontent-mia5-1.cdninstagram.com&_nc_gid=sFuYZi79agk7qCDJXvJyuA&oh=00_AfjuIbyzbnCf7hU10OWoAUMQ_jFJvSJkyhPJTgUEC5R5_A&oe=6930FE5F;"Siz, bu hayatın en cesur kahramanlarısınız. 🧡  Gözlerinizdeki umut, gülüşünüzdeki güç bize her zaman ilham veriyor. Unutmayın; yalnız değilsiniz… Yanınızda kocaman bir aile, koskoca bir şehir var.   Hilal’imize ve tüm çocuklarımıza kalpten sevgilerimle…";;0
https://www.instagram.com/p/DQvtcVYDFwt/;Photo;693;4;0;2025-11-07 09:38:23;https://scontent.cdninstagram.com/v/t51.82787-15/573828295_18537421882040314_6655968668056191686_n.jpg?stp=dst-jpg_e35_tt6&_nc_cat=104&ig_cache_key=Mzc2MDQyNDA3MzA2ODA0MzMwOQ%3D%3D.3-ccb7-5&ccb=7-5&_nc_sid=58cdad&efg=eyJ2ZW5jb2RlX3RhZyI6InhwaWRzLjE0NDB4MTkyMC5zZHIuQzMifQ%3D%3D&_nc_ohc=3PzQv8RJawAQ7kNvwHRArcQ&_nc_oc=AdkogI-hzfxIQfVFBTaggImCfegyR9QG2gKR1vLOKEkGLTkW3wCqC6UUUql-TfvuekU&_nc_ad=z-m&_nc_cid=1522&_nc_zt=23&_nc_ht=scontent.cdninstagram.com&_nc_gid=ktQ6_6xIJQW4dNhxA9vvmA&oh=00_AfiThmlbW0F3-P47YUMa5e5XIJO0UlGNlyXAqkwsvjsSxQ&oe=693122B2;Gönlünüzden geçen tüm güzelliklerin gerçekleştiği, dualarınızın kabul olduğu bir gün olması dileğiyle…  Hayırlı Cumalar.;;0
https://www.instagram.com/p/DQuZ0IMjPGC/;Reels;1212;11;67419;2025-11-06 21:31:02;https://scontent.cdninstagram.com/v/t51.71878-15/573063332_761438510246005_3464870289380088186_n.jpg?stp=dst-jpg_e15_tt6&_nc_cat=105&ig_cache_key=Mzc2MDA1NjI3MjI3NzAwODc3MA%3D%3D.3-ccb7-5&ccb=7-5&_nc_sid=58cdad&efg=eyJ2ZW5jb2RlX3RhZyI6InhwaWRzLjY0MHgxMTM2LnNkci5DMyJ9&_nc_ohc=51H3c_PDNacQ7kNvwGeS26X&_nc_oc=AdniWh-VLdlNofHdUJkOf_rjen5LhPCHhGiiW5n9pdGpqt0mkvpyD1eULAD1-_OBTeo&_nc_ad=z-m&_nc_cid=1522&_nc_zt=23&_nc_ht=scontent.cdninstagram.com&_nc_gid=ktQ6_6xIJQW4dNhxA9vvmA&oh=00_AfjGzZAtYDUSaJ5v9PysBfHXsM7O8Sj2Aex26wVg6BsP0A&oe=6931081B;🚛 Aylık 45 bin kilometre daha az yol, daha az yakıt, daha az karbon salınımı… 🌿 Yani daha temiz sokaklar, daha yaşanabilir bir Manisa! ♻️ Yeni Katı Atık Transfer İstasyonumuz Manisa’mıza hayırlı olsun.;;0
https://www.instagram.com/p/DQuSCX8DI9t/;Carousel;9733;46;0;2025-11-06 20:19:41;https://scontent.cdninstagram.com/v/t51.82787-15/575624363_18537296698040314_6021213074738603931_n.jpg?stp=dst-jpg_e35_tt6&_nc_cat=102&ig_cache_key=Mzc2MDAyMjA1OTQxNDcxNzM5OQ%3D%3D.3-ccb7-5&ccb=7-5&_nc_sid=58cdad&efg=eyJ2ZW5jb2RlX3RhZyI6InhwaWRzLjEwNjd4NzEyLnNkci5DMyJ9&_nc_ohc=E0jjcNXAHFwQ7kNvwFo4pXE&_nc_oc=AdkDfVv8fu8hbOZObeuhEB3h27kztRoN_V5v_cN0LX0X_wl8x2XPyFv6sNTqXHR6wDw&_nc_ad=z-m&_nc_cid=1522&_nc_zt=23&_nc_ht=scontent.cdninstagram.com&_nc_gid=ktQ6_6xIJQW4dNhxA9vvmA&oh=00_AfjoIhMz-yDRyxZ2K_llfc5V8zsewbVBU2kFbE3WUyhVlg&oe=69312A31;Merhum Başkanımız Ferdi Zeyrek’in kıymetli kızı Nehir Zeyrek ile birlikte, Cumhuriyet Halk Partisi İl Gençlik Kolları Başkanımız Onur Çabuk’u, Başkan Yardımcısı Hüseyin Can Akyay’ı ve Şehzadeler Gençlik Kolları Başkanımız Mehmet Suyabatmaz’ı belediyemizde misafir ettik.  Nehir kızımızın, Ferdi Zeyrek Vakfı adına geliştirdiği gençlik projeleri üzerine güzel bir fikir alışverişinde bulunduk.  Gençlerimizin umut dolu fikirleri, geleceğe dair inançları ve enerjileri bizlere her zaman güç veriyor. Ferdi Başkanımızın adını yaşatacak, gençlerimize ilham olacak projelere her zaman destek olmaya devam edeceğiz.;;0
https://www.instagram.com/p/DQuNFcPDMVY/;Carousel;515;1;0;2025-11-06 19:36:24;https://scontent.cdninstagram.com/v/t51.82787-15/575197170_18537290635040314_8608036431812183314_n.jpg?stp=dst-jpg_e35_tt6&_nc_cat=109&ig_cache_key=Mzc2MDAwMDI3NjYzMjQ0MTczNQ%3D%3D.3-ccb7-5&ccb=7-5&_nc_sid=58cdad&efg=eyJ2ZW5jb2RlX3RhZyI6InhwaWRzLjEwNjR4NzA3LnNkci5DMyJ9&_nc_ohc=UhNo39RhbigQ7kNvwHXA0ha&_nc_oc=Adm_jsKdpVk6lhlVMfQvRGkzTYnfaeXp5B3cyo8mGNsx79q-KhvBW-j45gVVnkbWAHs&_nc_ad=z-m&_nc_cid=1522&_nc_zt=23&_nc_ht=scontent.cdninstagram.com&_nc_gid=ktQ6_6xIJQW4dNhxA9vvmA&oh=00_AfidVtjD3_XzauEyKlhI5Jmn0raBsYi4Lvzjw7fOwvBaJA&oe=69311C45;Bugün belediyemizde birbirinden değerli misafirlerimizi ağırladık.  ♦️ CHP Saruhanlı İlçe Başkanımız Selahattin Şahin ve yönetim kurulu üyelerine, ♦️ Türkiye Güçsüzler ve Kimsesizlere Yardım Vakfı Manisa Şube Başkanı Sıdıka Doğdu ve yönetim kurulu üyelerine, ♦️ Yunus Emre Derneği Başkanı ve yönetim kurulu üyelerine, ♦️ Manisa Amatör Spor Kulüpleri Birliği Başkanı Mehmet Salih Pektaş ve yönetim kurulu üyelerine nazik ziyaretleri için teşekkür ediyorum. ‎;;0
https://www.instagram.com/p/DQuItPpjGQt/;Carousel;1324;0;0;2025-11-06 18:58:09;https://scontent.cdninstagram.com/v/t51.82787-15/574264581_18537285199040314_8984271926642947766_n.jpg?stp=dst-jpg_e35_tt6&_nc_cat=102&ig_cache_key=Mzc1OTk4MTAyMjk4MTk0NjUxOQ%3D%3D.3-ccb7-5&ccb=7-5&_nc_sid=58cdad&efg=eyJ2ZW5jb2RlX3RhZyI6InhwaWRzLjEwNjV4NzEwLnNkci5DMyJ9&_nc_ohc=X8k4DwhdcCQQ7kNvwEZ1O01&_nc_oc=AdnXp8Tq-d0owM5xGRE7Tl1s-UE96CAdEFXfGm3FQKpVc5zn_dxD0ATjejyEcgOjfn4&_nc_ad=z-m&_nc_cid=1522&_nc_zt=23&_nc_ht=scontent.cdninstagram.com&_nc_gid=ktQ6_6xIJQW4dNhxA9vvmA&oh=00_AfjICsHKCjlETT14QkLSle59W2BE2_B5hkieH7EDdrMPMA&oe=693130AC;Manisa’mız için çevreyi ve ekonomiyi koruyan dev bir adım daha attık!  Yeni Katı Atık Transfer İstasyonu’muzu hizmete açarak atık yönetiminde yeni bir dönemi başlattık. Bu yatırımımızla:  ✅ Ayda 45 bin kilometre daha az yol yaparak büyük yakıt tasarrufu sağlıyoruz.  ✅ Karbon salınımını ciddi ölçüde azaltıyor, Manisa’ya daha temiz hava bırakıyoruz.  ✅ Çevre kirliliğinin önüne geçiyoruz.  ✅ Hizmet kalitesini artırıp, çöp toplama sürelerini kısaltıyoruz.  Tek hedefimiz var: Manisa’mız için daha temiz, daha yaşanabilir bir gelecek inşa etmek! Yeni tesisimiz şehrimize hayırlı uğurlu olsun.;;0
https://www.instagram.com/p/DQuAcpADPVE/;Carousel;780;2;0;2025-11-06 17:45:59;https://scontent.cdninstagram.com/v/t51.82787-15/573343738_18537274825040314_8366630580641297594_n.jpg?stp=dst-jpg_e35_tt6&_nc_cat=111&ig_cache_key=Mzc1OTk0NDY5Mzc0OTQyMDMyMg%3D%3D.3-ccb7-5&ccb=7-5&_nc_sid=58cdad&efg=eyJ2ZW5jb2RlX3RhZyI6InhwaWRzLjE0NDB4OTYwLnNkci5DMyJ9&_nc_ohc=m3uiJbWRjF8Q7kNvwFSF6-i&_nc_oc=Adnn8OfEHps9wRuYWbvfsR7gVM24n7bn8z3sLCP6z_zyJapuoqPhBc2qGW5Jbe0Pf8o&_nc_ad=z-m&_nc_cid=1522&_nc_zt=23&_nc_ht=scontent.cdninstagram.com&_nc_gid=ktQ6_6xIJQW4dNhxA9vvmA&oh=00_Afg3O5MYkbZDvsvI3RO8SL7kijjz5xiFkqMEgP75XcBMYg&oe=69312C3F;19’uncu Uluslararası Tarım ve Hayvancılık Fuarı’nın açılışını gerçekleştirdik.  Üreticilerimizin emeğini, alın terini ve yenilikçi tarım teknolojilerini buluşturan bu önemli fuar hem Manisa’mız hem de ülkemiz tarımı için büyük bir buluşma noktası.  Çiftçilerimizin, kooperatiflerimizin ve sektör temsilcilerimizin yanında olmaya, tarımın geleceğini birlikte şekillendirmeye devam edeceğiz.;;0
https://www.instagram.com/p/DQt8yGyDAMJ/;Photo;498;2;0;2025-11-06 17:13:57;https://scontent.cdninstagram.com/v/t51.82787-15/574186866_18537259996040314_1518555230803700963_n.jpg?stp=dst-jpg_e35_tt6&_nc_cat=110&ig_cache_key=Mzc1OTkyODU4OTk3MDgzNDE4NQ%3D%3D.3-ccb7-5&ccb=7-5&_nc_sid=58cdad&efg=eyJ2ZW5jb2RlX3RhZyI6InhwaWRzLjE0NDB4MTkyMC5zZHIuQzMifQ%3D%3D&_nc_ohc=LRDxd4LxFBwQ7kNvwHFV1Mv&_nc_oc=AdmVr3fhthBQIVuV1-oSM0lqBFaSeL39vzeFH5UEu3-jnVJxRn-19DEQwzU8SkwTiMM&_nc_ad=z-m&_nc_cid=1522&_nc_zt=23&_nc_ht=scontent.cdninstagram.com&_nc_gid=ktQ6_6xIJQW4dNhxA9vvmA&oh=00_AfjDv3J62xbWtOG-JYFbMj-MOKtSEqdAoQQGXe0R-TGE2A&oe=693115B7;Yarın Sarıgöl’deyiz!  Sarıgöl Belediye Başkanımız Tahsin Akdeniz ile birlikte hemşehrilerimizle bir araya gelecek, hizmetlerimizi paylaşacak ve Kent Lokantası ile Halk Mandıra açılışlarını gerçekleştireceğiz.  Programımız: 12.00 – Sarıgöl Belediyesi Ziyareti (Cumhuriyet Mah. İstiklal Cad. No:1/1) 15.00 – Esnaf Ziyareti ve Kent Lokantası Halk Mandıra Açılışı (Kapalı Pazar Yeri)  Tüm halkımızı buluşmamıza davet ediyoruz.;;0
https://www.instagram.com/p/DQtgDC8jIK2/;Carousel;918;4;0;2025-11-06 13:02:52;https://scontent.cdninstagram.com/v/t51.82787-15/573117852_18537206452040314_6457493820722063428_n.jpg?stp=dst-jpg_e35_tt6&_nc_cat=111&ig_cache_key=Mzc1OTgwMjIwMzI3Njg0NTIwMQ%3D%3D.3-ccb7-5&ccb=7-5&_nc_sid=58cdad&efg=eyJ2ZW5jb2RlX3RhZyI6InhwaWRzLjEwNjV4NzEwLnNkci5DMyJ9&_nc_ohc=VMcP_G_QvwAQ7kNvwEi5bFH&_nc_oc=Adnvm1tsYMZ6OGRS7Jb3_cn_Vi3fFsV8tqxEEMOUpZe0o7nGJqzIXtIZiQENPGhVL3c&_nc_ad=z-m&_nc_cid=1522&_nc_zt=23&_nc_ht=scontent.cdninstagram.com&_nc_gid=ktQ6_6xIJQW4dNhxA9vvmA&oh=00_AfhrKIacjgUU43TOvBnIMfYaVCZgWc-vRzA3TycDmKKjMw&oe=6931156E;2026 yılı Manisa’mızın proje ve yatırım yılı olacak.  Şehrimize kazandıracağımız hizmet ve projeler ile ilgili atacağımız adımları değerlendirmek üzere #Yunusemre Belediye Başkanımız Semih Balaban ve #Şehzadeler Belediye Başkanımız Gülşah Durbay ile bir araya gelerek fikir alışverişinde bulunduk.   Manisa’mızın hak ettiği hizmetleri hayata geçirmek için iş birliği içinde ve tüm gücümüzle çalışmaya devam edeceğiz.;;0
https://www.instagram.com/p/DQtTEkKDDTq/;Carousel;856;0;0;2025-11-06 11:09:28;https://scontent.cdninstagram.com/v/t51.82787-15/573819151_18537197338040314_9161926683084204346_n.jpg?stp=dst-jpg_e35_tt6&_nc_cat=105&ig_cache_key=Mzc1OTc0NTEzMjU5ODcwMjk3MQ%3D%3D.3-ccb7-5&ccb=7-5&_nc_sid=58cdad&efg=eyJ2ZW5jb2RlX3RhZyI6InhwaWRzLjE0NDB4OTYwLnNkci5DMyJ9&_nc_ohc=Q6CYAvsiCxkQ7kNvwHVKDvw&_nc_oc=Adl9996gQJqamSIxVCiKAKhP5NGgdJyic3VYdY-vMpUjaocW7rqf1fVVq5yObqzkXMI&_nc_ad=z-m&_nc_cid=1522&_nc_zt=23&_nc_ht=scontent.cdninstagram.com&_nc_gid=ktQ6_6xIJQW4dNhxA9vvmA&oh=00_Afj3RsRR2k35-4OK183E5218lPmZT3YFbS6Uw-Agc_uGaQ&oe=69311A42;Manisa Baro Başkanımız Av. Sevgi Başak Yeşil ve yönetim kurulu üyelerini belediyemizde misafir ettik.  Nazik ziyaretleri için kendilerine teşekkür ediyor, hukukun üstünlüğü ve adaletin tesisi için verdikleri özverili çalışmalarda başarılar diliyorum.;;0
https://www.instagram.com/p/DQtNoYMDKKO/;Photo;344;9;0;2025-11-06 10:21:56;https://scontent.cdninstagram.com/v/t51.82787-15/575673106_18537176983040314_8410284529054331062_n.jpg?stp=dst-jpg_e35_tt6&_nc_cat=106&ig_cache_key=Mzc1OTcyMTIxMzI3OTkwNDM5OA%3D%3D.3-ccb7-5&ccb=7-5&_nc_sid=58cdad&efg=eyJ2ZW5jb2RlX3RhZyI6InhwaWRzLjE0NDB4MTkyMC5zZHIuQzMifQ%3D%3D&_nc_ohc=0K1M37PUlewQ7kNvwFtOyOT&_nc_oc=Adk71SQ_Wm3VgFQdFMCb5rYSRjzVVKISpS7Q_boooHjmgnNDGeHIj7niYI3owOc461I&_nc_ad=z-m&_nc_cid=1522&_nc_zt=23&_nc_ht=scontent.cdninstagram.com&_nc_gid=ktQ6_6xIJQW4dNhxA9vvmA&oh=00_AfiItNEqGj98RJ4pYzteW75aMGL3yRq8TCK2uQ8yYEDUXg&oe=693129DD;"Türk dili ve kültürüne ömrünü adayan, Akhisar’ımızın yetiştirdiği büyük değer; dil bilimi, edebiyat ve tarih alanında öncü isimlerden İlhan Ayverdi’yi vefatının yıl dönümünde saygı ve rahmetle anıyorum.";;0
