PostLink;PostTürü;BeğeniSayısı;YorumSayısı;Görüntülenme Sayısı;Tarih;DisplayPhoto;Caption;Takipçi;TahminMi
https://www.instagram.com/p/DREfW8IDAjQ/;Photo;2901;89;0;2025-11-15 11:19:22;https://scontent-iad3-2.cdninstagram.com/v/t51.82787-15/582065691_18539684605040314_5196975981136845128_n.jpg?stp=dst-jpg_e35_tt6&_nc_cat=111&ig_cache_key=Mzc2NjI3MzEwNDIxODQyNTU1Mg%3D%3D.3-ccb7-5&ccb=7-5&_nc_sid=58cdad&efg=eyJ2ZW5jb2RlX3RhZyI6InhwaWRzLjkwMHg5MDAuc2RyLkMzIn0%3D&_nc_ohc=qFaROnWHRtIQ7kNvwEomC3z&_nc_oc=Adm-Qb5aUBiImmhrnUzheGIcCWTahfGZztegdUSx4aChB03nQF--_HirS4zUxDsokIc&_nc_ad=z-m&_nc_cid=0&_nc_zt=23&_nc_ht=scontent-iad3-2.cdninstagram.com&_nc_gid=NfdB6NFNVP0yQXC7U5zCig&oh=00_AfhxDV2hEvG0sgXHzL5BPcoZAxkMGvQnjJMkcoHcQ95TWQ&oe=69313043;Acı haberle yüreğimiz yandı.   Alaşehir-Sarıgöl yolunda meydana gelen trafik kazasında bir polis memurumuzun şehit olduğunu, bir polis memurumuzun da ağır yaralandığını derin bir üzüntüyle öğrendim.  Şehit polis memurumuza Allah’tan rahmet, yaralı polisimize acil şifalar diliyorum. Şehidimizin ailesine, emniyet teşkilatımıza ve milletimize başsağlığı diliyorum.  Milletimizin başı sağolsun 🇹🇷;;0
https://www.instagram.com/p/DRCbDXLDPPy/;Reels;532;8;43364;2025-11-14 16:03:51;https://scontent-iad3-2.cdninstagram.com/v/t51.71878-15/582966846_832223449594643_6519801044087627834_n.jpg?stp=dst-jpg_e15_tt6&_nc_cat=111&ig_cache_key=Mzc2NTY5MTIxNjczMDg0NjE5NA%3D%3D.3-ccb7-5&ccb=7-5&_nc_sid=58cdad&efg=eyJ2ZW5jb2RlX3RhZyI6InhwaWRzLjY0MHgzNjAuc2RyLkMzIn0%3D&_nc_ohc=ARvMYiPWKA4Q7kNvwGVKNq-&_nc_oc=Adm8e1x49ojzSpXdIzTG_QCb1lc_ablPJfRPY8XdK_4sQ83DsqAwxnCx8x75yccOUo4&_nc_ad=z-m&_nc_cid=0&_nc_zt=23&_nc_ht=scontent-iad3-2.cdninstagram.com&_nc_gid=NfdB6NFNVP0yQXC7U5zCig&oh=00_Afhl8jXfoAOmq0OY2bu_ESYtLglRe_oYKLEAQxNp7mHnGQ&oe=69310CE5;Gölmarmara ilçemizde uzun süredir atıl durumda bulunan metruk yapıya, vatandaşlarımıza daha hızlı ve etkili hizmet sunmak için yeniden hayat veriyoruz.  MASKİ Ek Hizmet Binası olarak düzenleyeceğimiz bu yapıyla:  * Altyapı arızalarına daha hızlı müdahale edeceğiz, * Yakıt ve zaman kaybını azaltacağız, * Hizmet verimliliğimizi artıracağız.  Gölmarmara’nın altyapı hizmetlerinde yeni bir dönemi başlatırken, şehrimizin her noktasında vatandaş odaklı belediyecilik için var gücümüzle çalışmayı sürdüreceğiz.;;0
https://www.instagram.com/p/DRCOOc2jHme/;Reels;981;37;61107;2025-11-14 14:11:42;https://scontent-iad3-1.cdninstagram.com/v/t51.82787-15/581627412_18539553478040314_2903928596594942971_n.jpg?stp=dst-jpg_e15_tt6&_nc_cat=104&ig_cache_key=Mzc2NTYzNDgwNDEzODkzMjYzODE4NTM5NTUzNDc1MDQwMzE0.3-ccb7-5&ccb=7-5&_nc_sid=58cdad&efg=eyJ2ZW5jb2RlX3RhZyI6InhwaWRzLjcyMHgxMjgwLnNkci5DMyJ9&_nc_ohc=XhC0U5VYHfsQ7kNvwGwVJnG&_nc_oc=Adkz6GmWPvUwSuUBdRlnNkOJpixv2nXyYnRJeekcNZB6PpM5vi470qlD90xrG009FE8&_nc_ad=z-m&_nc_cid=0&_nc_zt=23&_nc_ht=scontent-iad3-1.cdninstagram.com&_nc_gid=NfdB6NFNVP0yQXC7U5zCig&oh=00_AfixM9kdJNhZU7P6UMFHBl_ufcfFzbDlRhCJZAQanRRN1A&oe=69312E78;"2026 yılı yatırım programımız kapsamında hayata geçireceğimiz Çevre Yolu Orta Refüj Peyzaj Düzenleme Projemiz ile 40.000 metrekarelik alanı sürdürülebilir peyzaj anlayışıyla yeniden tasarlıyoruz.  💧Su tüketimini %70 azaltarak yılda 110.000 ton su tasarrufu sağlayacağız ve yıllık 12 milyon TL bakım maliyeti tasarrufu elde edeceğiz.  Doğaya dost, ekonomiye katkı sunan bu projemizde; Manisa’mızın girişini süsleyen kavşakta Ulu Önderimiz Gazi Mustafa Kemal Atatürk’ün silueti de yer alacak.   Daha yeşil ve kaynaklarını koruyan bir Manisa için çalışıyoruz.";;0
https://www.instagram.com/p/DRCA9GkjFjW/;Reels;848;8;41183;2025-11-14 12:16:09;https://scontent.cdninstagram.com/v/t51.71878-15/581464938_1762955917689878_3757266477334975772_n.jpg?stp=dst-jpg_e15_tt6&_nc_cat=111&ig_cache_key=Mzc2NTU3NjQzNzM3ODg2NTM2Ng%3D%3D.3-ccb7-5&ccb=7-5&_nc_sid=58cdad&efg=eyJ2ZW5jb2RlX3RhZyI6InhwaWRzLjY0MHgxMTM2LnNkci5DMyJ9&_nc_ohc=XPkhZ5tP4UkQ7kNvwFM1Pcn&_nc_oc=AdkeLwut5HIU6T5bEAKQd8fQZsaIy0CBI49dsClJXhXYj2Jh2Psk-JyeFOB0bTu5z3U&_nc_ad=z-m&_nc_cid=0&_nc_zt=23&_nc_ht=scontent.cdninstagram.com&_nc_gid=0RW1GDyVrebbswzt3R6SrQ&oh=00_AfgG1jljtKKY03-bUtU7LJzKvsNLC86GeMhbhYCQMhBPrg&oe=69310436;Ailelerin ve evlatların gözü arkada kalmasın diye “Ben Buradayım”  Hayata geçirdiğimiz “Ben Buradayım” uygulaması ve alzheimer, demans hastaları ile kaybolma riski taşıyan down sendromlu, otizmli ve zihinsel engelli bireylerin ailelerine ücretsiz teslim ettiğimiz akıllı bileklikler sayesinde, Manisa’da binlerce aile, artık güvenle nefes alıyor.  Teknolojiyi insanımızın hizmetine sunmaya ve hemşehrilerimizin yüzünü güldürmeye devam edeceğiz.;;0
https://www.instagram.com/p/DRB2RosDJq4/;Reels;593;3;23901;2025-11-14 10:42:43;https://scontent.cdninstagram.com/v/t51.71878-15/581836438_1002362888771027_8237038598194887851_n.jpg?stp=dst-jpg_e15_tt6&_nc_cat=105&ig_cache_key=Mzc2NTUyOTQ2OTg4OTg0NTk0NA%3D%3D.3-ccb7-5&ccb=7-5&_nc_sid=58cdad&efg=eyJ2ZW5jb2RlX3RhZyI6InhwaWRzLjY0MHgxMTM2LnNkci5DMyJ9&_nc_ohc=tVEbKrQPx20Q7kNvwHpraKM&_nc_oc=AdmGLl1r3h7ZTQjynxHdImO6_78INsiCcy10RYjtkEz_lC2tFJPT0io3HiaX1fMd0pg&_nc_ad=z-m&_nc_cid=0&_nc_zt=23&_nc_ht=scontent.cdninstagram.com&_nc_gid=0RW1GDyVrebbswzt3R6SrQ&oh=00_AfhI8ddr57tJWMabU3jsKiMzNMiqcPo8MnfqNhdjeAE8Gw&oe=69310145;Manisa’mız, ailemiz ve sevdiklerimiz için dilediğimiz tüm güzelliklerin kabul olması dileğiyle...  Hayırlı Cumalar!;;0
https://www.instagram.com/p/DRAmpbCjneE/;Photo;1785;16;0;2025-11-13 23:06:06;https://scontent.cdninstagram.com/v/t51.82787-15/582833330_18539469157040314_8135718742752396378_n.jpg?stp=dst-jpg_e35_tt6&_nc_cat=106&ig_cache_key=Mzc2NTE3OTI2MDc4MTYyMzE3Mg%3D%3D.3-ccb7-5&ccb=7-5&_nc_sid=58cdad&efg=eyJ2ZW5jb2RlX3RhZyI6InhwaWRzLjg4MXg2NjAuc2RyLkMzIn0%3D&_nc_ohc=ySm2qfwTrbUQ7kNvwFSSuJH&_nc_oc=Adn5CnCeMfvt_jrE9IbxCv-d5FqezSRWQoBptMcGJDVpuBByAzQ9deqGCbnVZTBMYkk&_nc_ad=z-m&_nc_cid=0&_nc_zt=23&_nc_ht=scontent.cdninstagram.com&_nc_gid=0RW1GDyVrebbswzt3R6SrQ&oh=00_AfjHN3-PiqMB8JgQSa8jD85izTLrbufzal4qACQ35VfdPg&oe=69311CBC;Orman Genel Müdürlüğü’müze ait yangın söndürme uçağımızın Hırvatistan’da düşmesi sonucu şehit olan pilotumuza Allah’tan rahmet, ailesine ve sevenlerine sabır diliyorum.  Milletimizin başı sağ olsun. 🇹🇷;;0
https://www.instagram.com/p/DRAIVrvjOOX/;Reels;3834;124;288470;2025-11-13 18:45:50;https://scontent.cdninstagram.com/v/t51.71878-15/580775989_1513550309956903_1081573011719596087_n.jpg?stp=dst-jpg_e15_tt6&_nc_cat=110&ig_cache_key=Mzc2NTA0NTk2MjkzMTQ5NTgzMQ%3D%3D.3-ccb7-5&ccb=7-5&_nc_sid=58cdad&efg=eyJ2ZW5jb2RlX3RhZyI6InhwaWRzLjY0MHgxMTM2LnNkci5DMyJ9&_nc_ohc=IyxAKUp_irUQ7kNvwEB3DD7&_nc_oc=AdmcEPGZKd8BCJGg9N7PAq7kJsVLSReBNnVAaZkCtnWXoH6OAUa6cLjYZn91ZxDjjSw&_nc_ad=z-m&_nc_cid=0&_nc_zt=23&_nc_ht=scontent.cdninstagram.com&_nc_gid=0RW1GDyVrebbswzt3R6SrQ&oh=00_AfjCxKNag8TJIwI1UX6cLnHH-lQD5OsuuVobJl_Dc3bVAg&oe=69312143;Çocuklarımızın eğitimi, Manisa’nın geleceğidir.  Eğitim-öğretim yılının başlamasından itibaren 15 bin öğrencimize çanta ve kırtasiye seti desteğinde bulunduk.  Hiçbir evladımızın temel eğitim ihtiyacından mahrum kalmaması için çalışmaya devam edeceğiz.;;0
https://www.instagram.com/p/DQ_dkVlDGIn/;Carousel;676;0;0;2025-11-13 12:27:31;https://scontent.cdninstagram.com/v/t51.82787-15/581776756_18539397244040314_7913334226975594727_n.jpg?stp=dst-jpg_e35_tt6&_nc_cat=111&ig_cache_key=Mzc2NDg1Nzg0MDI2ODUzODM5Ng%3D%3D.3-ccb7-5&ccb=7-5&_nc_sid=58cdad&efg=eyJ2ZW5jb2RlX3RhZyI6InhwaWRzLjE0NDB4OTU5LnNkci5DMyJ9&_nc_ohc=6qAhkFB9qnAQ7kNvwG5yVVc&_nc_oc=AdlXypJKKlFz261-jwok7bbVzhZrqldaYPjoHMxlE5JQTaYjnwP8MzROaPG9Hr7JsHA&_nc_ad=z-m&_nc_cid=0&_nc_zt=23&_nc_ht=scontent.cdninstagram.com&_nc_gid=0RW1GDyVrebbswzt3R6SrQ&oh=00_AfimEGG9iwGQ7-L4tCXHkoVr-d4QdSGhYy175Mj2dnczrg&oe=69312DEB;Manisa’da özel halk otobüsleri de dahil olmak üzere toplu ulaşım hizmetlerinde görev yapan sürücülerimize yönelik, 3 gün sürecek “Sürücü Davranışları ve İletişim Eğitimi” programını başlattık.  Program kapsamında şoförler, ayrıcalıklı ve dezavantajlı yolculara davranış, stres yönetimi ve öfke kontrolü, müşteri odaklı hizmet, trafik güvenliği gibi konularda bilgilendirildi.   Halkımızın daha konforlu ve daha saygılı bir ulaşım hizmeti alması için var gücümüzle çalışmaya devam edeceğiz.;;0
https://www.instagram.com/p/DQ9dpbXjCwY/;Reels;816;23;49740;2025-11-12 17:50:19;https://scontent.cdninstagram.com/v/t51.71878-15/581040092_1557857108918641_5547380897559187724_n.jpg?stp=dst-jpg_e15_tt6&_nc_cat=106&ig_cache_key=Mzc2NDI5NTI1Mzc4NTA2MjQyNA%3D%3D.3-ccb7-5&ccb=7-5&_nc_sid=58cdad&efg=eyJ2ZW5jb2RlX3RhZyI6InhwaWRzLjY0MHgxMTM2LnNkci5DMyJ9&_nc_ohc=gYNKggNKYNAQ7kNvwE1m2Eo&_nc_oc=Adneo9kFmC8vs59W-39dVgCUQnH8aCjTUdracFqDf0YeW0RK5tmrEtQEAArTyKESy9k&_nc_ad=z-m&_nc_cid=0&_nc_zt=23&_nc_ht=scontent.cdninstagram.com&_nc_gid=0RW1GDyVrebbswzt3R6SrQ&oh=00_AfiLS-eh1Sxq842mIt-mOSDlxZVh2WpFN0QrQqgsw4WNwQ&oe=693128E6;Konut ihtiyacına çözüm, vatandaşlarımızın yaşam kalitesine değer katacak Spilkent Toplu Konut Projemiz hızla yükseliyor.  İnşaat süreci planlanan programın önünde ilerliyor. En kısa sürede hak sahiplerimize evlerini teslim etmeyi hedefliyoruz.  Şehrimize modern ve güvenli yaşam alanları kazandırmak için çalışmaya devam ediyoruz.;;0
https://www.instagram.com/p/DQ9I8PhjBgA/;Carousel;1742;10;0;2025-11-12 14:48:48;https://scontent.cdninstagram.com/v/t51.82787-15/582701147_18539267557040314_2200086878423029049_n.jpg?stp=dst-jpg_e35_tt6&_nc_cat=110&ig_cache_key=Mzc2NDIwNDE3NzgyOTE2NTIyNg%3D%3D.3-ccb7-5&ccb=7-5&_nc_sid=58cdad&efg=eyJ2ZW5jb2RlX3RhZyI6InhwaWRzLjEwNjV4NzEwLnNkci5DMyJ9&_nc_ohc=5djsT3I5lPQQ7kNvwFdlwhL&_nc_oc=Adnvnky3ujtv689gf_ytD5DfE3xnO1Veth5XdWIdEbvICir5oRMHxg-9Ugd954S8VTg&_nc_ad=z-m&_nc_cid=0&_nc_zt=23&_nc_ht=scontent.cdninstagram.com&_nc_gid=0RW1GDyVrebbswzt3R6SrQ&oh=00_Afj1maC_VUIklgLS_S4fYFbMFzuZXqGrNZEjTtWNGWHlpg&oe=693113D5;Spilkent Toplu Konut, Kentsel Dönüşüm ve Gelişim Proje alanımızda incelemelerde bulunarak yüklenici firma yetkililerimizden son duruma ilişkin bilgiler aldık.  1. etapta 832 daire,  2. etapta ise 624 daire inşa ediyoruz.  Hak sahiplerimize konutlarını zamanında teslim etmek için var gücümüzle çalışıyoruz.  Manisa Büyükşehir Belediyesi olarak, halkımıza uygun fiyatlı ve nitelikli konutlar kazandırmak amacıyla yeni projeler üretmeye devam edeceğiz.;;0
https://www.instagram.com/p/DQ857WVjCqm/;Photo;528;3;0;2025-11-12 12:37:37;https://scontent.cdninstagram.com/v/t51.82787-15/580729851_18539254810040314_2658556507911873099_n.jpg?stp=dst-jpg_e35_tt6&_nc_cat=103&ig_cache_key=Mzc2NDEzODE1NTY1ODk4MDAwNg%3D%3D.3-ccb7-5&ccb=7-5&_nc_sid=58cdad&efg=eyJ2ZW5jb2RlX3RhZyI6InhwaWRzLjEzNTB4MTY4OC5zZHIuQzMifQ%3D%3D&_nc_ohc=CLjRHtaMwTYQ7kNvwHbgcbR&_nc_oc=Adl4B0Kp--ngREUItVWMY24D0E_O2XsgAV6K15pF1vU09EBgb3qMS_J2yDPZzX2gTC8&_nc_ad=z-m&_nc_cid=0&_nc_zt=23&_nc_ht=scontent.cdninstagram.com&_nc_gid=0RW1GDyVrebbswzt3R6SrQ&oh=00_Afh2Y7sLs5L0Q50ee9nltySz1twL6kdcq6X2ur3dNoyffg&oe=693107C2;12 Kasım 1999 Düzce Depremi’nde hayatını kaybeden vatandaşlarımızı rahmetle anıyor, yakınlarını kaybeden tüm yurttaşlarımıza bir kez daha başsağlığı diliyorum. Unutmadık, unutmayacağız...;;0
https://www.instagram.com/p/DQ8yKvZjKa5/;Photo;1659;35;0;2025-11-12 11:29:48;https://scontent.cdninstagram.com/v/t51.82787-15/581022290_18539249725040314_8084472898090180420_n.jpg?stp=dst-jpg_e35_tt6&_nc_cat=104&ig_cache_key=Mzc2NDEwNDAyODk4OTcyODQ0MQ%3D%3D.3-ccb7-5&ccb=7-5&_nc_sid=58cdad&efg=eyJ2ZW5jb2RlX3RhZyI6InhwaWRzLjEzNTB4MTY4OC5zZHIuQzMifQ%3D%3D&_nc_ohc=UFD_9DctzWUQ7kNvwFkCeVH&_nc_oc=Adn6pdb_LGTlxoEjyQJ9otjPtY45YkgP55wkICgHQ24N25s889nRJNwRGxYDS4SB2Vg&_nc_ad=z-m&_nc_cid=0&_nc_zt=23&_nc_ht=scontent.cdninstagram.com&_nc_gid=0RW1GDyVrebbswzt3R6SrQ&oh=00_Afg0tqRQOLD4QjHVEfMNnHx2NAhbHJB4TCgAcjefMK-oMA&oe=69311A38;Dün meydana gelen uçak kazasında 20 kahraman askerimizin şehit olduğunu büyük bir üzüntüyle öğrendik.  Vatanı için canını feda eden yiğitlerimize Allah’tan rahmet, kederli ailelerine ve milletimize başsağlığı diliyorum.  Ruhları şad, mekânları cennet olsun. 🇹🇷;;0
https://www.instagram.com/p/DQ7LyxsjAgb/;Photo;1061;9;0;2025-11-11 20:35:15;https://scontent.cdninstagram.com/v/t51.82787-15/581815792_18539071843040314_5021858854616113463_n.jpg?stp=dst-jpg_e35_tt6&_nc_cat=108&ig_cache_key=Mzc2MzY1Mzc4MTQ0NDM2NDMxNQ%3D%3D.3-ccb7-5&ccb=7-5&_nc_sid=58cdad&efg=eyJ2ZW5jb2RlX3RhZyI6InhwaWRzLjExOTl4NjI4LnNkci5DMyJ9&_nc_ohc=cA2jJyDYiNgQ7kNvwGbZBF-&_nc_oc=Adk0ku1Kkc9SnoTEX96y95-Iuan4krE272kh76wPU85lIbn6AQZhcz07NRbWOQYsdmw&_nc_ad=z-m&_nc_cid=0&_nc_zt=23&_nc_ht=scontent.cdninstagram.com&_nc_gid=0RW1GDyVrebbswzt3R6SrQ&oh=00_Afhx2YBqxVim5YyzvGxsbOxT7EgVotZ95QnYmax2b38M1g&oe=69311003;Başımız sağ olsun Türkiye’m 🇹🇷  Azerbaycan’dan ülkemize gelmek üzere havalanan askeri kargo uçağımızın Gürcistan-Azerbaycan sınırında düştüğünü derin bir üzüntüyle öğrendim.   Kahraman Mehmetçiklerimize Allah’tan rahmet, kederli ailelerine başsağlığı ve sabır diliyorum.  Milletimizin başı sağ olsun 🇹🇷;;0
https://www.instagram.com/p/DQ7JunvjBl1/;Carousel;1135;2;0;2025-11-11 20:17:12;https://scontent.cdninstagram.com/v/t51.82787-15/580502498_18539069989040314_3684138128059498627_n.jpg?stp=dst-jpg_e35_tt6&_nc_cat=102&ig_cache_key=Mzc2MzY0NDY4MjcwNzE0NTk1Ng%3D%3D.3-ccb7-5&ccb=7-5&_nc_sid=58cdad&efg=eyJ2ZW5jb2RlX3RhZyI6InhwaWRzLjEwNjV4NzEwLnNkci5DMyJ9&_nc_ohc=pE29kXPGZ6cQ7kNvwF9HOw7&_nc_oc=AdlFgw3OCe4PLjFjf27A6fpjWoCPSLV-u8uj5ff2j2N-iFok6PmSDRpgDJIHzTkG8qE&_nc_ad=z-m&_nc_cid=0&_nc_zt=23&_nc_ht=scontent.cdninstagram.com&_nc_gid=0RW1GDyVrebbswzt3R6SrQ&oh=00_AfjVkTV9NP8Inp3RKf-j_Yw15rHCTtjo5ypnktSdR41JcA&oe=69310F6C;Manisa Büyükşehir Belediye Meclisi Kasım Ayı Olağan Toplantımız ile MASKİ 2025 Yılı 2. Olağan Genel Kurulu’muzun birinci oturumlarını gerçekleştirdik.  Şehrimizin geleceğine yön verecek, hizmet kalitemizi artıracak ve vatandaşlarımızın refahını yükseltecek çalışmalarımızı meclis üyesi arkadaşlarımızla birlikte değerlendirdik.  Aldığımız kararlar, Manisa’mıza hayırlı olsun. Hemşehrilerimize hizmet yolunda durmadan çalışmaya devam edeceğiz.;;0
https://www.instagram.com/p/DQ67s1vDG9T/;Reels;2459;24;98265;2025-11-11 18:15:41;https://scontent.cdninstagram.com/v/t51.71878-15/579849426_1210343501152578_7468099470912888981_n.jpg?stp=dst-jpg_e15_tt6&_nc_cat=100&ig_cache_key=Mzc2MzU4MzAwNDcyMDI2Mjk5NQ%3D%3D.3-ccb7-5&ccb=7-5&_nc_sid=58cdad&efg=eyJ2ZW5jb2RlX3RhZyI6InhwaWRzLjY0MHgxMTM2LnNkci5DMyJ9&_nc_ohc=ym0GGk6cqK0Q7kNvwFW2xy8&_nc_oc=Adku1BaHf7au1JDDmX8kF00ZHS64WC_Ikp_hp0ilqwgnHMJ7ZGgl5WhNh3aOX-AlW6g&_nc_ad=z-m&_nc_cid=0&_nc_zt=23&_nc_ht=scontent.cdninstagram.com&_nc_gid=0RW1GDyVrebbswzt3R6SrQ&oh=00_AfhpdY4dBeDQJnaEqM6V78l7HVAX6McbCn8OkMoQJC0S6A&oe=69310F41;Manisa’mızdaki her sorunu çözmek için elimizden geleni yapacağız.   Atacağımız her adımda, yapacağımız her hizmette daima halkımızın mutluluğu ve geleceği için çalışacağız.;;0
https://www.instagram.com/p/DQ6w9T4jDsn/;Carousel;587;2;0;2025-11-11 16:40:45;https://scontent-lhr8-2.cdninstagram.com/v/t51.82787-15/580113552_18538963288040314_2285169144973600972_n.jpg?stp=dst-jpg_e35_tt6&_nc_cat=103&ig_cache_key=Mzc2MzUzNTc1MTMyMjMxOTUwNg%3D%3D.3-ccb7-5&ccb=7-5&_nc_sid=58cdad&efg=eyJ2ZW5jb2RlX3RhZyI6InhwaWRzLjE0NDB4OTU5LnNkci5DMyJ9&_nc_ohc=6pzARgfCnEUQ7kNvwGB1HLB&_nc_oc=Admf8ZfNsr-V1nASI-w8x_OStO4kMlwqi0KFGY_81A4j5TsloU7laf2eqCneE0n9r38&_nc_ad=z-m&_nc_cid=0&_nc_zt=23&_nc_ht=scontent-lhr8-2.cdninstagram.com&_nc_gid=ctWQcuQCoChm2iwl7kBhcw&oh=00_Afhmpu-xRglQ_93gtIxpdabvsgSThqMK7CzKV3EBPfX-8g&oe=693129D7;Muradiye Mahallesi sakinlerimizin yaşadığı mağduriyetin artık daha fazla sürmesine izin veremeyiz.  Bu kapsamda, projemizin başlangıçta belirlenen hedeflere tam zamanında ulaşması adına, sorumlu ekibimiz ve yüklenici firmalarımızla bir araya gelerek kapsamlı bir değerlendirme ve hızlandırma toplantısı gerçekleştirdik.  Muradiye’deki öncelikli yol haritamızı belirleyerek, sorunların hızlıca giderilmesi ve söz verdiğimiz sürede projeyi tamamlamak için var gücümüzle çalışmaya devam edeceğiz.;;0
https://www.instagram.com/p/DQ6R-gHDCyv/;Carousel;1015;4;0;2025-11-11 12:10:02;https://scontent-lhr6-1.cdninstagram.com/v/t51.82787-15/580550863_18538896340040314_1811248409045004260_n.jpg?stp=dst-jpg_e35_tt6&_nc_cat=109&ig_cache_key=Mzc2MzM5OTQ4NzQ5NTM4ODI3MA%3D%3D.3-ccb7-5&ccb=7-5&_nc_sid=58cdad&efg=eyJ2ZW5jb2RlX3RhZyI6InhwaWRzLjE0NDB4OTU5LnNkci5DMyJ9&_nc_ohc=7rmbVmTTe_wQ7kNvwGPdJAA&_nc_oc=AdkKqiv5dICBA-pqWDAUPYDoQ_SWZgdVNYaeQ_6MiJ6JDKch2Rvcb0H8WP_5eiYDAms&_nc_ad=z-m&_nc_cid=0&_nc_zt=23&_nc_ht=scontent-lhr6-1.cdninstagram.com&_nc_gid=ctWQcuQCoChm2iwl7kBhcw&oh=00_AfiubGJAecFlHuObgqPdx9gxtWeSeeUKf98EgofcUKzsjw&oe=69311630;Fatih Mahallemizi ziyaret ederek, mahalle sakinlerimizle hem sohbet ettik, hem de taleplerini dinleyerek yapacağımız çalışmaları konuştuk.  Yeni Mahalle, Hafsa Sultan ve Fatih Mahallelerimizde ada bazlı kentsel dönüşüm çalışmalarıyla ilgili mahalle halkımızın ihtiyaç ve beklentilerini dinledik, projelerimizi anlattık.  Manisa’mızı geleceğe hazırlarken, atacağımız her adımda halkımızın isteklerini ön planda tutmaya devam edeceğiz.;;0
https://www.instagram.com/p/DQ6EsZ3DG5N/;Carousel;1266;15;0;2025-11-11 10:13:58;https://scontent-lhr8-1.cdninstagram.com/v/t51.82787-15/580032382_18538889503040314_1208728225622164136_n.jpg?stp=dst-jpg_e35_tt6&_nc_cat=107&ig_cache_key=Mzc2MzM0MTA3NzQ0MTY5ODAwNA%3D%3D.3-ccb7-5&ccb=7-5&_nc_sid=58cdad&efg=eyJ2ZW5jb2RlX3RhZyI6InhwaWRzLjE0NDB4OTU5LnNkci5DMyJ9&_nc_ohc=wE8X8_Q1vCQQ7kNvwHPCpAs&_nc_oc=AdldSSnVU4-Q3ZRDX1XeoCgRffM_p63fk44UuOmxOvmKir7fUiKogUHVZlT52sWaH20&_nc_ad=z-m&_nc_cid=0&_nc_zt=23&_nc_ht=scontent-lhr8-1.cdninstagram.com&_nc_gid=ctWQcuQCoChm2iwl7kBhcw&oh=00_AfgGPFzKyDEldLDhLcWn6GQM43gD7j3hOB7Wu8pKt5r-tA&oe=693101A4;"MASKİ Genel Müdürlüğümüzde bu haftaki yönetim kurulu toplantımızı gerçekleştirdik.  Manisa genelinde devam eden yatırımlarımızla ilgili fikir alışverişinde bulunarak, kentimizin altyapısını güçlendirecek yeni projeler üzerine değerlendirmelerde bulunduk.  Hedefimiz; suyun her damlasını koruyan, çevreye duyarlı ve modern bir altyapı ile Manisa’mıza hizmet etmek.";;0
https://www.instagram.com/p/DQ4zRZVDiiD/;Carousel;1345;5;0;2025-11-10 22:22:29;https://scontent-lhr6-2.cdninstagram.com/v/t51.82787-15/579716634_18538622884040314_8191890897772376378_n.jpg?stp=dst-jpg_e35_tt6&_nc_cat=104&ig_cache_key=Mzc2Mjk4Mjk3MTUyNDQxOTM2Mw%3D%3D.3-ccb7-5&ccb=7-5&_nc_sid=58cdad&efg=eyJ2ZW5jb2RlX3RhZyI6InhwaWRzLjEwNjZ4NzExLnNkci5DMyJ9&_nc_ohc=P-xCYgLloVEQ7kNvwGWIE4Z&_nc_oc=AdlOVFOHhdvwCpvWjPyXHc7GcWERURjzZAn-wp4O5n0Y3ktIhjA4kUy0iGnS06Krb9o&_nc_ad=z-m&_nc_cid=0&_nc_zt=23&_nc_ht=scontent-lhr6-2.cdninstagram.com&_nc_gid=ctWQcuQCoChm2iwl7kBhcw&oh=00_AfiYIIK_BaWD_IC3yJJ4alzDxlFKS9oLwtesZ71UQQB_IQ&oe=69311B1D;"Ulu Önderimiz Gazi Mustafa Kemal Atatürk’ü, sonsuzluğa uğurlayışımızın yıldönümünde saygı, özlem ve minnetle andık.  “Ata’nın Son Günü” adlı fotoğraf sergisiyle Atatürk’ün ölümsüz hatıralarını bir kez daha yüreğimizde hissederken; “Ata’nın Sanat Mirası” başlıklı söyleşi ve dinletide ise değerli sanatçılar Pelin Batu ve Haluk Çetin, Ata’mızın sanata ve kültüre verdiği önemi bizlere içten ve duygulu bir biçimde hatırlattılar.  Bu topraklarda bilimin ve sanatın ışığını sonsuza dek yaşatacak; Atamızın gösterdiği yolda, Cumhuriyet’in aydınlık değerleriyle yürümeye devam edeceğiz.  Bu anlamlı gecenin gerçekleşmesinde emeği geçen herkese gönülden teşekkür ediyorum.";;0
https://www.instagram.com/p/DQ4VcoJDE8T/;Reels;1581;15;41478;2025-11-10 18:02:20;https://scontent-lhr8-1.cdninstagram.com/v/t51.71878-15/574715273_1203953218263333_3220675064562155656_n.jpg?stp=dst-jpg_e15_tt6&_nc_cat=108&ig_cache_key=Mzc2Mjg1MTgxNDg5MTYwNTc3OQ%3D%3D.3-ccb7-5&ccb=7-5&_nc_sid=58cdad&efg=eyJ2ZW5jb2RlX3RhZyI6InhwaWRzLjY0MHgxMTM2LnNkci5DMyJ9&_nc_ohc=VaaSJhHyrSwQ7kNvwEjcT2S&_nc_oc=Adk45m_HWjmlkxmW7uINDUtmRJcE1IDVh1e6kiiSIXdaXobmEVqRwAFGIayztR324ZY&_nc_ad=z-m&_nc_cid=0&_nc_zt=23&_nc_ht=scontent-lhr8-1.cdninstagram.com&_nc_gid=ctWQcuQCoChm2iwl7kBhcw&oh=00_AfjsmKiCdsLcxdpUyBrY19QR8p_as82b5_dI0NZDkJHq6A&oe=693125F8;#Manisa, daima #Atatürk’ün izinde olmaya devam edecek…♾️;;0
https://www.instagram.com/p/DQ4JhlMjALj/;Carousel;1474;4;0;2025-11-10 16:17:42;https://scontent-lhr8-2.cdninstagram.com/v/t51.82787-15/575349594_18538552942040314_6594139308206225126_n.jpg?stp=dst-jpg_e35_tt6&_nc_cat=103&ig_cache_key=Mzc2Mjc5OTM1OTQ5OTczMDc1Mw%3D%3D.3-ccb7-5&ccb=7-5&_nc_sid=58cdad&efg=eyJ2ZW5jb2RlX3RhZyI6InhwaWRzLjE0NDB4OTYwLnNkci5DMyJ9&_nc_ohc=vgiqKt5IXvkQ7kNvwF86dtc&_nc_oc=AdlIHndfjlIb33P9Ag97YsmqCSl_HVzfpqiKJgry7nYPFFO2nJIbn5jXUOTePiM2rlY&_nc_ad=z-m&_nc_cid=0&_nc_zt=23&_nc_ht=scontent-lhr8-2.cdninstagram.com&_nc_gid=ctWQcuQCoChm2iwl7kBhcw&oh=00_AfjXt1Y7vp5B9S6WyXYMOyz8ePhVrEuhbqbumybgX2F3Ug&oe=6930FBC2;#10Kasım yalnızca bir yas günü değil, bize bırakılan bir emanetin ve sorumluluğun yeniden hatırlanma günüdür.  Cumhuriyet Halk Partisi Manisa İl Başkanlığımızın düzenlediği etkinlikle, Ulu Önderimiz Gazi Mustafa Kemal Atatürk’ün bizlere bıraktığı en değerli miraslardan, bağımsızlık mücadelemizin ve kuruluş felsefemizin ölümsüz eseri ‘Nutuk’u evlatlarımıza hediye ettik.  Onun mirası, düşünmeyi sürdüren her zihinde, direnmekten vazgeçmeyen her kalpte yaşamaya devam ediyor. Sonsuza dek izindeyiz.   Saygı, özlem ve minnetle…;;0
https://www.instagram.com/p/DQ3x6pWDN5o/;Carousel;900;1;0;2025-11-10 12:51:24;https://scontent-lhr6-1.cdninstagram.com/v/t51.82787-15/579920017_18538529593040314_3384439932881324582_n.jpg?stp=dst-jpg_e35_tt6&_nc_cat=110&ig_cache_key=Mzc2MjY5NTUzNjUxNzA1ODEyNQ%3D%3D.3-ccb7-5&ccb=7-5&_nc_sid=58cdad&efg=eyJ2ZW5jb2RlX3RhZyI6InhwaWRzLjE0NDB4OTYwLnNkci5DMyJ9&_nc_ohc=rIHUAnUfOxsQ7kNvwEJ0xzy&_nc_oc=AdnbC_DQ5Cjx5odTU7t4pv04XIjZQDXHiVLRivzytAU-D2Y9ZPR3_tHBfxDzIwlkVk8&_nc_ad=z-m&_nc_cid=0&_nc_zt=23&_nc_ht=scontent-lhr6-1.cdninstagram.com&_nc_gid=ctWQcuQCoChm2iwl7kBhcw&oh=00_AfhONFeyTYEFmDvajMqHZQpjGtbQ2CMxD1NDm7uyKj7kxw&oe=69311FDD;Hasan Türek Anadolu Lisesi öğrencilerinin hazırladığı “Sönmeyen Işık” oratoryosu, bize Atatürk’ün yaşamını ve Cumhuriyet’in kuruluş destanını büyük bir duygu yoğunluğuyla yeniden yaşattı.  Gazi Mustafa Kemal Atatürk’ün mirasını omuzlarında taşıyan gençlerimizin bu muhteşem performansı, geleceğe olan inancımızı da pekiştirdi.   Emeği geçen tüm öğrencilerimizi ve öğretmenlerimizi yürekten kutluyorum.;;0
https://www.instagram.com/p/DQ3lwtojIcl/;Carousel;3201;7;0;2025-11-10 11:05:12;https://scontent-lhr8-1.cdninstagram.com/v/t51.82787-15/580684345_18538487935040314_4043162885104895481_n.jpg?stp=dst-jpg_e35_tt6&_nc_cat=108&ig_cache_key=Mzc2MjY0MjA3MTc0OTE5MjYzMA%3D%3D.3-ccb7-5&ccb=7-5&_nc_sid=58cdad&efg=eyJ2ZW5jb2RlX3RhZyI6InhwaWRzLjEwNjV4NzEwLnNkci5DMyJ9&_nc_ohc=FOn5_HQEfC8Q7kNvwGY6AvW&_nc_oc=Adluzbsv3IlTq0VF_C83hKjFIlQUQHP5YtXm1T6GtFhr2Vj3tLCQ4O_eTuRlOt0ckyA&_nc_ad=z-m&_nc_cid=0&_nc_zt=23&_nc_ht=scontent-lhr8-1.cdninstagram.com&_nc_gid=ctWQcuQCoChm2iwl7kBhcw&oh=00_AfiPI6tT_nCA6m5MFSplGIPhQIcAaj5yqkbdNmKpzcWShQ&oe=6930FB0D;Saatler 09.05’i gösterdiğinde Manisa’da hayat durdu.  Cumhuriyetimizin kurucusu, bağımsızlığımızın mimarı, eşsiz liderimiz Gazi Mustafa Kemal Atatürk’ü aramızdan ayrılışının 87. yıl dönümünde bir kez daha büyük bir özlem, minnet ve saygıyla anıyoruz.  Sadece bir gün değil, sonsuza dek aklımızda, fikrimizde ve kalbimizdesin.  Ruhun şad olsun. Daima izindeyiz...;;0
https://www.instagram.com/p/DQ3U5OSjJr_/;Photo;3601;23;0;2025-11-10 08:37:48;https://scontent-lhr8-2.cdninstagram.com/v/t51.82787-15/575728870_18538444357040314_5154966853656707044_n.jpg?stp=dst-jpg_e35_tt6&_nc_cat=106&ig_cache_key=Mzc2MjU2NzkwNjk3NTMyNDkyNw%3D%3D.3-ccb7-5&ccb=7-5&_nc_sid=58cdad&efg=eyJ2ZW5jb2RlX3RhZyI6InhwaWRzLjE0MjV4MTkwMC5zZHIuQzMifQ%3D%3D&_nc_ohc=pTQ06SQnTGQQ7kNvwGklhMD&_nc_oc=Adklbdhgbd4FFPopCLiXTlgbh51fdxSOFGvmNnL7-eR5ZDNcpAsG6hPv_CCrlKG64Mc&_nc_ad=z-m&_nc_cid=0&_nc_zt=23&_nc_ht=scontent-lhr8-2.cdninstagram.com&_nc_gid=ctWQcuQCoChm2iwl7kBhcw&oh=00_AfhBoQh8X7lvdxoM0RBgLxdhHl5iqEhAC3SMdEmJeTm8aQ&oe=693122B9;“Büyük ölülere matem gerekmez, fikirlerine bağlılık gerekir.”  Türkiye Cumhuriyeti’mizin kurucusu Büyük Önder Mustafa Kemal Atatürk’ü, ölümsüzlüğe uğurladığımız günün 87. yıl dönümünde saygı, sevgi, minnet ve tükenmeyen hasretle anıyorum.   Daima izinde yürüyeceğimize ve emanet ettiği Cumhuriyet meşalesini ilelebet taşıyacağımıza söz veriyoruz. ♾️;;0
https://www.instagram.com/p/DQ2R9hDDERy/;Reels;4987;325;165448;2025-11-09 22:53:41;https://scontent-lhr8-2.cdninstagram.com/v/t51.71878-15/581070961_772214939106292_7794110895288150217_n.jpg?stp=dst-jpg_e15_tt6&_nc_cat=101&ig_cache_key=Mzc2MjI3MzUzMjg3ODAxMzU1NA%3D%3D.3-ccb7-5&ccb=7-5&_nc_sid=58cdad&efg=eyJ2ZW5jb2RlX3RhZyI6InhwaWRzLjY0MHgxMTM4LnNkci5DMiJ9&_nc_ohc=BxT5IPIV5ewQ7kNvwHajz9a&_nc_oc=AdkzQCqr5eJk669rcjW7aZaPYW5XDxsiOl2MecC4eZltB2iZ8V-MKSWQaRd6L8tTB_w&_nc_ad=z-m&_nc_cid=0&_nc_zt=23&_nc_ht=scontent-lhr8-2.cdninstagram.com&_nc_gid=ctWQcuQCoChm2iwl7kBhcw&oh=00_AfgVIP-OdrkeXEI1YTRAJvkNsVe9OAXDQgEZw_8xr18KnA&oe=6931281C;"Ata’mızı andığımız billboardlara bile isteye zarar veren şahsa sesleniyorum;   O’nu bu milletin kalbinden nasıl söküp atacaksın?   Asla başaramayacaksınız.  İlgili şahıs emniyet güçlerine bildirilmiştir. Halkımıza duyurulur.";;0
