PostLink;PostTürü;BeğeniSayısı;YorumSayısı;Görüntülenme Sayısı;Tarih;DisplayPhoto;Caption;Takipçi;TahminMi
https://www.instagram.com/p/DRpN5oKjGzv/;Carousel;1372;15;0;2025-11-29 17:38:43;https://scontent-atl3-3.cdninstagram.com/v/t51.82787-15/588071606_18541872637040314_1087225103956217968_n.jpg?stp=dst-jpg_e35_tt6&_nc_cat=110&ig_cache_key=Mzc3NjYxMDg4Mzg1NDkzNTYyOA%3D%3D.3-ccb7-5&ccb=7-5&_nc_sid=58cdad&efg=eyJ2ZW5jb2RlX3RhZyI6InhwaWRzLjEwNjV4NzEwLnNkci5DMyJ9&_nc_ohc=1US2nqUyRKQQ7kNvwFGBDRz&_nc_oc=AdmzvbiP808tas5xN7dGdtlxv6SsJsnUFu80yNUIjkszizfJXrE8cCH6IBrEhBnIbMAdzwQ20ptn8LwL_j28sK_3&_nc_ad=z-m&_nc_cid=0&_nc_zt=23&_nc_ht=scontent-atl3-3.cdninstagram.com&_nc_gid=-0dzjp797826dUquvpFrxA&oh=00_Afho8te1q1U1bg0wFtEOWcB-k3nQCbhtv1WtwWzDm9qgfw&oe=69312970;"Muhalefetteki son kurultayımız…  Cumhuriyet Halk Partisi 39. Olağan Kurultayımızda oyumuzu gururla kullandık.  Türkiye’nin birinci partisi olarak, milyonların umudunu ve değişim arzusunu gerçeğe dönüştürmeye; hak, hukuk ve adaletin egemen olduğu bir Türkiye’yi hep birlikte kurmaya artık çok az kaldı.  Gazi Mustafa Kemal Atatürk’ün kurduğu Cumhuriyet Halk Partisi; Manisa’nın gururu, Türkiye’nin umudu Genel Başkanımız Sayın Özgür Özel’in liderliğinde emin adımlarla iktidara yürüyor.  #ŞimdiİktidarZamanı";124058.0;0
https://www.instagram.com/p/DRpHP6yDNm6/;Reels;729;19;37184;2025-11-29 16:41:05;https://scontent-atl3-2.cdninstagram.com/v/t51.71878-15/589252335_3126764820835196_4453969852951399720_n.jpg?stp=dst-jpg_e15_tt6&_nc_cat=102&ig_cache_key=Mzc3NjU4MTY0Mjc2MTMyOTA4Mg%3D%3D.3-ccb7-5&ccb=7-5&_nc_sid=58cdad&efg=eyJ2ZW5jb2RlX3RhZyI6InhwaWRzLjY0MHgxMTM2LnNkci5DMyJ9&_nc_ohc=uNor6Xt4ksAQ7kNvwEE5hKs&_nc_oc=AdnESy7wl48kYakRZct2hyto885kMp5T6XoOnzs20ws3wpDf4NihADc2j3vfS0Hj2_c6u2jfs0bNK629SC6gNUm4&_nc_ad=z-m&_nc_cid=0&_nc_zt=23&_nc_ht=scontent-atl3-2.cdninstagram.com&_nc_gid=-0dzjp797826dUquvpFrxA&oh=00_Afjh6cgmRsy6cjCxk-uTBt3cLl5n4AOaT00izO0vPM0A6A&oe=69311621;Manisa’mızda gece başlayan sağanak yağışa karşı tüm ekiplerimizle sahadayız!  Kış gelmeden önce bitirdiğimiz kanalizasyon ve mazgal temizlikleri sayesinde, olası sorunları en aza indirdik. Bundan sonra sorun yaşanmaması için çalışmaya devam edeceğiz.  Herhangi bir olumsuzluk yaşamanız durumunda, 7/24 Alo 185 MASKİ Destek Hattımızı arayabilirsiniz. Manisa’mızın huzuru için sahada ve görevimizin başındayız...;;0
https://www.instagram.com/p/DRogpbiDStB/;Reels;1690;44;65120;2025-11-29 11:03:48;https://scontent-atl3-2.cdninstagram.com/v/t51.82787-15/589779986_18541829590040314_5639549687121966567_n.jpg?stp=dst-jpg_e15_tt6&_nc_cat=104&ig_cache_key=Mzc3NjQxMTg3MjA5OTM4MDAzMzE4NTQxODI5NTg3MDQwMzE0.3-ccb7-5&ccb=7-5&_nc_sid=58cdad&efg=eyJ2ZW5jb2RlX3RhZyI6InhwaWRzLjEwODB4MTkyMC5zZHIuQzMifQ%3D%3D&_nc_ohc=ZY964DSHs5gQ7kNvwHfcsxa&_nc_oc=Adk26XsgNBJu3kNjPwF-zG9YLtwC0HuGq9GbXq6cdBcq6R4qBLrSgSxdIcGsAyl2TnRC37E0TdWIylrmwVihRtIu&_nc_ad=z-m&_nc_cid=0&_nc_zt=23&_nc_ht=scontent-atl3-2.cdninstagram.com&_nc_gid=-0dzjp797826dUquvpFrxA&oh=00_Afht_Vt1GE27lkW2y48ig0GeZJLfem1crEKp9W8YE06oxA&oe=6930FF5A;"1 Aralık’tan itibaren Manisa Eczacı Odası iş birliğiyle atık ilaç toplama kampanyamızı başlatıyoruz.  Son kullanma tarihi geçmiş ilaçlar çöp değildir. Doğaya, suya ve canlılara zarar vermemesi için mutlaka toplanmalı ve doğru şekilde bertaraf edilmelidir.  Evlerimizde biriken atık ilaçları eczanelerde oluşturulacak atık ilaç toplama noktalarına teslim ederek; çevremizi korumaya, suyumuzu temiz tutmaya, çocuklarımıza daha sağlıklı bir gelecek bırakmaya katkı sağlayabilirsiniz.  Doğamızı korumak ve gelecek nesillere daha yaşanabilir bir Manisa bırakmak, hepimizin görevi.";;0
https://www.instagram.com/p/DRm81jTjKc7/;Reels;3549;164;224342;2025-11-28 20:37:14;https://scontent-atl3-2.cdninstagram.com/v/t51.71878-15/590403344_1572384790448896_3354618903361946223_n.jpg?stp=dst-jpg_e15_tt6&_nc_cat=105&ig_cache_key=Mzc3NTk3MjkwMDQyODYyMTYyNw%3D%3D.3-ccb7-5&ccb=7-5&_nc_sid=58cdad&efg=eyJ2ZW5jb2RlX3RhZyI6InhwaWRzLjY0MHgxMTM2LnNkci5DMyJ9&_nc_ohc=rrxvVa6FomoQ7kNvwG10c_5&_nc_oc=Admqb8SgD80M3qdyDiE541orPlZo6XGTdACqg4LBGmbby5duv1ig1dN9YDjjqmqA9SGb5lFYZUYO4cGjyB_Pv8OS&_nc_ad=z-m&_nc_cid=0&_nc_zt=23&_nc_ht=scontent-atl3-2.cdninstagram.com&_nc_gid=-0dzjp797826dUquvpFrxA&oh=00_AfhwsCc7EQZJImJjbPLjTN5hDQqz033tftWVL5x79ncQ5w&oe=693107BC;#Manisa’da halkımızın sağlığıyla oynayan kim olursa olsun karşısında bizi bulacak.  Sağlıksız koşullarda gıda satışı yapan işletmeleri hiç tereddüt etmeden mühürleyip faaliyetten men edeceğiz.  Zabıta ekiplerimiz 17 ilçemizde denetimlerine aralıksız devam edecek.;;0
https://www.instagram.com/p/DRmpO-QjB1c/;Carousel;812;4;0;2025-11-28 17:39:51;https://scontent-atl3-2.cdninstagram.com/v/t51.82787-15/588236057_18541727344040314_1912526929954703673_n.jpg?stp=dst-jpg_e35_tt6&_nc_cat=102&ig_cache_key=Mzc3NTg4NjY3MTM2ODQ2MzEwOA%3D%3D.3-ccb7-5&ccb=7-5&_nc_sid=58cdad&efg=eyJ2ZW5jb2RlX3RhZyI6InhwaWRzLjEwNjV4NzEwLnNkci5DMyJ9&_nc_ohc=kkq1rP6Pv_UQ7kNvwFaSrJF&_nc_oc=AdnvFtgzuCrtakyHjuONwT3cvZ6ESssHW9RDBVlEjQP96MYDhVPZVhWGoV-ixucFDULQI0JS2Fr7TGpMENdF8R6M&_nc_ad=z-m&_nc_cid=0&_nc_zt=23&_nc_ht=scontent-atl3-2.cdninstagram.com&_nc_gid=-0dzjp797826dUquvpFrxA&oh=00_AfjekdM8m8Y-EO2LZbDJH--8wv-N9YgMaHnQMADG-AOvAQ&oe=69311757;"Şimdi İktidar Zamanı!  Türkiye’nin birinci partisi Cumhuriyet Halk Partimizin 39. Olağan Kurultayı, Manisa’mızın gururu, ülkemizin umudu Genel Başkanımız Sayın Özgür Özel’in liderliğinde başladı.  Kuruluşun ve Kurtuluşun Partisini iktidara taşıyacak; yarınların Türkiye’sini omuz omuza, hep birlikte kuracağız.  #ŞimdiİktidarZamanı";;0
https://www.instagram.com/p/DRmMDWvFTFd/;Reels;1391;40;53626;2025-11-28 13:25:24;https://scontent-atl3-2.cdninstagram.com/v/t51.82787-15/588602217_18541698223040314_6720655122162485358_n.jpg?stp=dst-jpg_e15_tt6&_nc_cat=102&ig_cache_key=Mzc3NTc1ODM0NDcyNTU0MTIxMzE4NTQxNjk4MjIwMDQwMzE0.3-ccb7-5&ccb=7-5&_nc_sid=58cdad&efg=eyJ2ZW5jb2RlX3RhZyI6InhwaWRzLjEwODB4MTkyMC5zZHIuQzMifQ%3D%3D&_nc_ohc=8v7TZXc2bX4Q7kNvwHFXPTO&_nc_oc=AdmW5PAHlwTpVHW7gev0GUbvExJPSSP_0ZygqBC-gJiB9UYi8ammqlWfODiC8d89W867U2wXHOy1zGGM-RgxiPeD&_nc_ad=z-m&_nc_cid=0&_nc_zt=23&_nc_ht=scontent-atl3-2.cdninstagram.com&_nc_gid=-0dzjp797826dUquvpFrxA&oh=00_AfhvJ8EGhXQKqqyKeBia5W0qnydFQqz4NzA85Fhqh9nWbg&oe=693101A5;Değerli büyüklerimizi ziyaret ederek gönüllerine dokunduk.  Bir tebessümün, bir sohbetin, bir hatır sormanın değerini onlarla bir kez daha hissettik.  Dünü bugünle buluşturan, hayat tecrübeleriyle bize ışık olan tüm büyüklerimiz iyi ki var.  Her zaman yanlarında olmaya, onların sesine, talebine, gülümsemesine kulak vermeye devam edeceğiz.  Tüm büyüklerimize sağlıklı, huzurlu, uzun bir ömür dilerim.;;0
https://www.instagram.com/p/DRl4Ku0lEJi/;Reels;489;3;31403;2025-11-28 10:31:40;https://scontent-atl3-3.cdninstagram.com/v/t51.82787-15/588035040_18541683703040314_6367818961357424642_n.jpg?stp=dst-jpg_e15_tt6&_nc_cat=109&ig_cache_key=Mzc3NTY3MDg5MDY5MzY3MzU3MDE4NTQxNjgzNzAwMDQwMzE0.3-ccb7-5&ccb=7-5&_nc_sid=58cdad&efg=eyJ2ZW5jb2RlX3RhZyI6InhwaWRzLjEwODB4MTkyMC5zZHIuQzMifQ%3D%3D&_nc_ohc=cLueYL1OScsQ7kNvwEbk-_G&_nc_oc=AdmwjeiwymZcUOHQOlGvdQPaYPwwqYi3zt1RstdbYngRICYvmiQcCgxvr3-vSeSCxSW66SgacZOHMdaDmKaEjeFY&_nc_ad=z-m&_nc_cid=0&_nc_zt=23&_nc_ht=scontent-atl3-3.cdninstagram.com&_nc_gid=-0dzjp797826dUquvpFrxA&oh=00_AfiwjptoCiZzfiKboHlSNk94iZOFvVgvdHBfT-6T4xL39g&oe=69312ACD;Alaşehir ilçemize bağlı Piyadeler Mahallesi'nde, 2 bin 600 vatandaşımızın sağlığını ve yaşam kalitesini doğrudan etkileyen, 30 yıldır süregelen kanalizasyon sorununu, başlattığımız 2 bin metrelik kolektör hattı çalışmasıyla kökten çözüyoruz!  Manisa'mızı modern, sağlıklı ve yaşanabilir bir şehir haline getirmek için şehrimizin her noktasında sorunlara neşter vurmaya devam edeceğiz.;;0
https://www.instagram.com/p/DRlv4dnjUau/;Photo;489;4;0;2025-11-28 09:18:42;https://scontent-atl3-3.cdninstagram.com/v/t39.30808-6/592411645_1438308424317839_6360214488229909980_n.jpg?stp=dst-jpg_e35_tt6&_nc_cat=108&ig_cache_key=Mzc3NTYzNDQ1MDg5ODgzMTAyMg%3D%3D.3-ccb7-5&ccb=7-5&_nc_sid=58cdad&efg=eyJ2ZW5jb2RlX3RhZyI6InhwaWRzLjEwODB4MTM1MC5zZHIuQzMifQ%3D%3D&_nc_ohc=_MJKYLtciV0Q7kNvwG7k_pR&_nc_oc=Adn3B0HrLC6fSuBF9pW8j5mXmsVCx47058IPIx_I7DdmEgtVkRJr9_Lt73M5xE1R93ZVOHugE4V3VVrE7_EC1SF4&_nc_ad=z-m&_nc_cid=0&_nc_zt=23&_nc_ht=scontent-atl3-3.cdninstagram.com&_nc_gid=-0dzjp797826dUquvpFrxA&oh=00_AfivwTHAJkdZJGGmOFZU449FIfwMo7AsHgEW3LemIhVweQ&oe=69310111;İşlerimizden bereket, hanelerimizden huzur, mutluluk ve sağlık eksik olmasın.   Tüm halkımıza Hayırlı Cumalar dilerim.;;0
https://www.instagram.com/p/DRkDN1zCT9L/;Reels;1932;189;151926;2025-11-27 17:29:45;https://scontent-atl3-1.cdninstagram.com/v/t51.82787-15/589917367_18541575922040314_1359218675666905716_n.jpg?stp=dst-jpg_e15_tt6&_nc_cat=103&ig_cache_key=Mzc3NTE1NjUzMjkwMDYwOTg2NzE4NTQxNTc1OTE5MDQwMzE0.3-ccb7-5&ccb=7-5&_nc_sid=58cdad&efg=eyJ2ZW5jb2RlX3RhZyI6InhwaWRzLjEwODB4MTkyMC5zZHIuQzMifQ%3D%3D&_nc_ohc=5MWUV_rDhxwQ7kNvwG82Ppt&_nc_oc=AdmQngvoCBTAu3VhQOtMUwt-e14MG9D7AI4YatIMDGdH3RVJnUAhcTK952GWt2q38Ht0cZnPHFiAWWSV5qwSsJ0W&_nc_ad=z-m&_nc_cid=0&_nc_zt=23&_nc_ht=scontent-atl3-1.cdninstagram.com&_nc_gid=-0dzjp797826dUquvpFrxA&oh=00_AfibfUu07iRS8B_kgmed-MjDWJjJdqtbc5iYXJXCC3ap0g&oe=693119C2;"Manisa’da Kaldırım İşgallerine Geçit Yok!  Zabıta ekiplerimiz, yaya güvenliğini sağlamak için kent genelinde kaldırım işgali denetimlerini aralıksız sürdürüyor.  Kaldırımların; sandalye, masa, ürün, duba, tabela ve benzeri malzemelerle işgal edilmesinin yasak olduğu hatırlatılarak, yapılan uyarılara rağmen kurallara uymayan işletmelere yasal işlem uygulanıyor.  Denetimlerimiz kararlılıkla devam edecek.";;0
https://www.instagram.com/p/DRjhB-lguma/;Reels;4158;54;715499;2025-11-27 12:31:07;https://scontent-atl3-3.cdninstagram.com/v/t51.82787-15/587957789_18541545319040314_4029553012084330509_n.jpg?stp=dst-jpg_e15_tt6&_nc_cat=108&ig_cache_key=Mzc3NTAwNjE4NDEyMjI4MDM0NjE4NTQxNTQ1MzEzMDQwMzE0.3-ccb7-5&ccb=7-5&_nc_sid=58cdad&efg=eyJ2ZW5jb2RlX3RhZyI6InhwaWRzLjcyMHgxMjgwLnNkci5DMiJ9&_nc_ohc=EB9BGSc7vPsQ7kNvwEyiA3J&_nc_oc=AdkzFsD5QeyWeW-3iDaje8kOQOpZIXBFZJ0x8qdaFlrfBawN3CAtVws2IWY3s1_Bm9WD9OntYmA4d_-HAjV85os2&_nc_ad=z-m&_nc_cid=0&_nc_zt=23&_nc_ht=scontent-atl3-3.cdninstagram.com&_nc_gid=-0dzjp797826dUquvpFrxA&oh=00_AfhC2ON9nch-_28A8FzqlRKdHA6Nl77CzhDeTZF9jnS_yQ&oe=69311A3C;"Küçücük bir pil ama etkisi tonlarca toprağı kirletecek kadar büyük.  Atık piller çöp değildir; doğru toplandığında doğayı koruyan bir farkındalığa dönüşür. ♻️🌍  Manisa’da çevre bilinci için güzel bir adım attık. Toprağımızı, suyumuzu ve geleceğimizi korumak için hep birlikte mücadele etmeye devam edeceğiz. 💚";;0
https://www.instagram.com/p/DRhzpMjjNOE/;Carousel;405;6;0;2025-11-26 20:34:36;https://scontent-atl3-2.cdninstagram.com/v/t39.30808-6/589723228_1437196554429026_3866649601160426660_n.jpg?stp=c0.0.2047.1365a_dst-jpg_e35_s2047x1365_tt6&_nc_cat=105&ig_cache_key=Mzc3NDUyNTA3NTEyMzY1MDYyMg%3D%3D.3-ccb7-5&ccb=7-5&_nc_sid=58cdad&efg=eyJ2ZW5jb2RlX3RhZyI6InhwaWRzLjIwNDh4MTM2NS5zZHIuQzMifQ%3D%3D&_nc_ohc=lMjD76GfEdYQ7kNvwES_gFC&_nc_oc=Adl77_l_iCZahcNoJ2m7G02Uc2TT0PBhO94ubzMGQ8IkIKsNEarLKmrwd_Gf1nYBhJQwyWeojm7_vneEKGXNUtmg&_nc_ad=z-m&_nc_cid=0&_nc_zt=23&_nc_ht=scontent-atl3-2.cdninstagram.com&_nc_gid=-0dzjp797826dUquvpFrxA&oh=00_Afh8U30V1stJiSdIHxsfhypHqj4kN80x6dwQ5joFYwmN_Q&oe=69310125;Bugün belediyemizde ağırladığımız:  ♦️İzmir Yeminli Müşavirler Odası Başkanı Yaşar Zengin, Manisa İl Temsilcisi Sedat Tetiker ve yönetim kurulu üyelerine, ♦️Toprak Mahsulleri Ofisi Manisa Müdürü Birol Güleç’e, ♦️Soma Engelsiz Yaşam Derneği Başkanı Hamza Aydın ve yönetimine, ♦️Turgutlu İstasyonaltı, Mustafa Kemal ve Atatürk mahalle muhtarlarımız ile iş insanı Burhan İrk’e, nazik ziyaretlerinden dolayı teşekkür ediyorum.;;0
https://www.instagram.com/p/DRhu9p5jGQw/;Carousel;2381;13;0;2025-11-26 19:53:42;https://scontent-atl3-1.cdninstagram.com/v/t51.82787-15/587986524_18541450885040314_2190008348867281627_n.jpg?stp=dst-jpg_e35_tt6&_nc_cat=106&ig_cache_key=Mzc3NDUwNDQ5ODE5NTM2Mjg2Ng%3D%3D.3-ccb7-5&ccb=7-5&_nc_sid=58cdad&efg=eyJ2ZW5jb2RlX3RhZyI6InhwaWRzLjEwNjV4NzEwLnNkci5DMyJ9&_nc_ohc=TLKFRwMJPSgQ7kNvwE8Ix3m&_nc_oc=AdkukC3MmYjsK_A5Au31qW1DvYQiVxJiibwBTqb511iYMIj7HZzfKiUikDzlVF_8HqbeaOvy4xcvm8vIfzxnniQu&_nc_ad=z-m&_nc_cid=0&_nc_zt=23&_nc_ht=scontent-atl3-1.cdninstagram.com&_nc_gid=-0dzjp797826dUquvpFrxA&oh=00_AfjSb6xUUBtiS50VAUZoRH4qEzGAXRKIERWXh7FjL7W60Q&oe=6931130E;"Manisa Büyükşehir Belediyesporumuzun altın çocukları ile bir araya geldik. 💪🏻🥇  Manisa Büyükşehir Belediyespor Kulübümüzü ziyaret ederek, göğsümüzü kabartan şampiyonlarımız, teknik heyetimiz ve yönetimimizle buluştuk. Emeklerinin karşılığını kupalarla ve madalyalarla taçlandıran sporcularımızın heyecanına ortak olduk.   Azerbaycan’da İstiklal Marşımızı okutan Avrupa Şampiyonu jimnastikçilerimizden, pistlerin tozunu attıran şampiyon motorcularımıza; minderin aslanları judocularımızdan, Avrupa Ligi’ne yükselen Espor takımımıza kadar sporcularımızın gözlerindeki başarı ışığına şahitlik ettik.  Manisa’yı “Şampiyonların Şehri” yapan bu koca yürekli gençleri, onları yetiştiren değerli hocalarımızı ve kulüp yönetimimizi canıgönülden kutluyorum. Başarılarınız daim olsun!👏🏻";;0
https://www.instagram.com/p/DRhkc1XDK79/;Carousel;875;5;0;2025-11-26 18:21:50;https://scontent.cdninstagram.com/v/t51.82787-15/587653413_18541437610040314_3960129324741632916_n.jpg?stp=dst-jpg_e35_tt6&_nc_cat=108&ig_cache_key=Mzc3NDQ1ODI2MjA3NTUzNTMyOQ%3D%3D.3-ccb7-5&ccb=7-5&_nc_sid=58cdad&efg=eyJ2ZW5jb2RlX3RhZyI6InhwaWRzLjEwNjZ4NzExLnNkci5DMyJ9&_nc_ohc=L3ajS6aJYgYQ7kNvwGJgIPW&_nc_oc=AdkaY3dXLyGV7UDhNvpqW46EDXE-36yYa-ID-VJ0gP4h1u_8jq1xhZSyVi9W8n1yOmY&_nc_ad=z-m&_nc_cid=0&_nc_zt=23&_nc_ht=scontent.cdninstagram.com&_nc_gid=inUIXRoEIQ_0vPuDlODjIA&oh=00_AfjC8kQiCqCpHsLOg3yetW50Lktyza75JhNqD7VfszRxWQ&oe=69312AC9;İsmail-Muammer Cider Huzurevi ile Manisa Huzurevi Vakfı Özel Huzurevi sakini değerli büyüklerimizi ziyaret ettik. Onların hatırlarını sormak, istek ve taleplerini dinlemek benim için çok kıymetli.  Manisa Büyükşehir Belediyesi olarak, dünümüz ile bugünümüz arasında köprü olan kıymetli büyüklerimizin her zaman yanındayız ve yanında olmaya devam edeceğiz.   Misafirperverlikleri ve hoş sohbetleri için kendilerine teşekkür ediyor, tüm büyüklerimize sağlıklı, uzun ömürler diliyorum.;;0
https://www.instagram.com/p/DRhhUlTjFp2/;Photo;955;39;0;2025-11-26 17:54:30;https://scontent.cdninstagram.com/v/t51.82787-15/588253980_18540678997058522_8149258715496495448_n.jpg?stp=dst-jpg_e35_tt6&_nc_cat=109&ig_cache_key=Mzc3NDQ0NDUxMjY5NDAwMDI0Ng%3D%3D.3-ccb7-5&ccb=7-5&_nc_sid=58cdad&efg=eyJ2ZW5jb2RlX3RhZyI6InhwaWRzLjE0NDB4MTkyMC5zZHIuQzMifQ%3D%3D&_nc_ohc=YIKrTtVKAucQ7kNvwGQ2jFz&_nc_oc=Adk3GF02Mp6Ts6OUFaPnkY6TMF_E2Ll4W7XuD2VLMr_NJVNlUJcX2wTYuWOZdBwDej0&_nc_ad=z-m&_nc_cid=0&_nc_zt=23&_nc_ht=scontent.cdninstagram.com&_nc_gid=inUIXRoEIQ_0vPuDlODjIA&oh=00_AfjoZ1tUnNdBeAhljj47MHArTe8VyihMHXDqWrpWmN9Oaw&oe=693128BC;Manisa’mızda gök gürültülü sağanak yağış bekleniyor❗📢;;0
https://www.instagram.com/p/DRha5AJjBf2/;Carousel;746;3;0;2025-11-26 16:58:18;https://scontent.cdninstagram.com/v/t39.30808-6/588306715_1437068904441791_4380160160549661859_n.jpg?stp=c0.0.1440.985a_dst-jpg_e35_tt6&_nc_cat=109&ig_cache_key=Mzc3NDQxNjIwNzkwMzIxNjUxMQ%3D%3D.3-ccb7-5&ccb=7-5&_nc_sid=58cdad&efg=eyJ2ZW5jb2RlX3RhZyI6InhwaWRzLjE0NDB4OTg2LnNkci5DMyJ9&_nc_ohc=XPWocjGq9EgQ7kNvwHT_1VQ&_nc_oc=AdmqVPo7iKqZkC7I3v_KL_6XhQvDC-zDwT5V2b_FVGS_HYHCgN8WWJh8CjDEfsAzRgo&_nc_ad=z-m&_nc_cid=0&_nc_zt=23&_nc_ht=scontent.cdninstagram.com&_nc_gid=inUIXRoEIQ_0vPuDlODjIA&oh=00_Afh4aD7VJiuG7awYGh3RKVvc2oPl0JV32DrhT_-Ut8myxw&oe=693131A0;Milliyetçi Hareket Partisi Manisa İl Başkanlığını ziyaret ederek, İl Başkanı Cüneyt Tosuner ve yönetim kurulu üyeleriyle bir araya geldik.  Siyasi görüşlerimiz farklı olsa da ortak paydamız her zaman Manisa’nın geleceği ve gelişimidir. Şehrimizin yararına olacak her konuda kurumlar arası diyalog ve iş birliğini sürdüreceğiz.  Misafirperverlikleri için kendilerine teşekkür ediyorum.;;0
https://www.instagram.com/p/DRhYKREDADa/;Carousel;1108;2;0;2025-11-26 16:34:27;https://scontent.cdninstagram.com/v/t51.82787-15/588238653_18541423147040314_1595730422342731060_n.jpg?stp=dst-jpg_e35_tt6&_nc_cat=104&ig_cache_key=Mzc3NDQwNDIwNTk2MTAzOTEyOQ%3D%3D.3-ccb7-5&ccb=7-5&_nc_sid=58cdad&efg=eyJ2ZW5jb2RlX3RhZyI6InhwaWRzLjEwNjV4NzEwLnNkci5DMyJ9&_nc_ohc=ROWn7YESDmsQ7kNvwHKeUyM&_nc_oc=AdnGxjloQnlLQ8-BQKPwyTm3VFGSdMvS8ehXJUDoL9NAMPD5YeBNZ0j5itIpQQ2yPaI&_nc_ad=z-m&_nc_cid=0&_nc_zt=23&_nc_ht=scontent.cdninstagram.com&_nc_gid=inUIXRoEIQ_0vPuDlODjIA&oh=00_Afg8Bkk2k9QFW4rIB1Ij5KHuCvGWPvHmTGSsCtUZdMiRmQ&oe=69312B57;Kullanılmış pillerin doğaya verdiği zarara dikkat çekmek ve çevremizi korumak amacıyla başlattığımız Atık Pil Toplama kampanyamızın ilk etkinliğini, büyük katılımla gerçekleştirdik. 1 Kilo pil getiren her vatandaşımıza 1 zeytin fidanı hediye ettik.🌱 🔋♻️  Kullanılmış bir pilin bile tonlarca toprağı kirletebildiğini biliyoruz. Bu nedenle atık pillerimizi çöpe değil, doğru toplama noktalarına bırakmak hem toprağımız hem de geleceğimiz için büyük önem taşıyor.  Hep birlikte daha temiz, daha sağlıklı, daha yeşil bir Manisa için çalışmaya devam edeceğiz. Emeği geçen, katılan herkese sonsuz teşekkürler. 🙏;;0
https://www.instagram.com/p/DRhDRlQDDR8/;Carousel;443;5;0;2025-11-26 13:31:57;https://scontent.cdninstagram.com/v/t39.30808-6/589178353_1436943534454328_4959655924153793325_n.jpg?stp=c0.0.2047.1365a_dst-jpg_e35_s2047x1365_tt6&_nc_cat=109&ig_cache_key=Mzc3NDMxMjM0NjA5ODEyNzIwMg%3D%3D.3-ccb7-5&ccb=7-5&_nc_sid=58cdad&efg=eyJ2ZW5jb2RlX3RhZyI6InhwaWRzLjIwNDh4MTM2NS5zZHIuQzMifQ%3D%3D&_nc_ohc=kVd5iGH64SsQ7kNvwHQUueM&_nc_oc=Adl0dlPYzfxd4ddVmSfHTt79C_XVDYUgTt3jfYLL3zvfONhNz8fCl034t-GbrzHKRB8&_nc_ad=z-m&_nc_cid=0&_nc_zt=23&_nc_ht=scontent.cdninstagram.com&_nc_gid=inUIXRoEIQ_0vPuDlODjIA&oh=00_AfjZhUrud6q5oexj8UpZrmAqW3GXh-bhpP8U3SPtHPI0Sg&oe=69310613;"Manisa’mızın enerjisini geleceğe dönüştürüyoruz!   Şubat ayında başlattığımız ve büyük bir titizlikle yürüttüğümüz çalışmalar sonucunda, belediyemizin enerji yönetimindeki yetkinliğini uluslararası standartlarda tescilledik. Enerji Yönetim Sistemleri Başdenetçisi Melih Kemer’i ağırlayarak TS EN ISO 50001 Enerji Yönetim Sistemi sertifikamızı teslim aldık.  Bu belge ile enerji verimliliği çalışmalarımızı genel bir yaklaşımdan çıkarıp; izlenebilir, ölçülebilir ve sürekli iyileştirilen sistematik bir kurumsal yapıya kavuşturduk. Artık sadece enerjiyi tüketen değil, verilerle yöneten ve performans hedefleriyle optimize eden bir belediyeyiz.  Manisa’mızın kaynaklarını en verimli şekilde kullanmak ve sürdürülebilir bir gelecek inşa etmek adına attığımız bu adım, şehrimize hayırlı olsun. Emeği geçen tüm çalışma arkadaşlarıma teşekkür ediyorum.";;0
https://www.instagram.com/p/DRg-QpeDO0j/;Carousel;347;0;0;2025-11-26 12:48:08;https://scontent.cdninstagram.com/v/t39.30808-6/589210455_1436920657789949_8870777298945579856_n.jpg?stp=c0.0.2048.1365a_dst-jpg_e35_tt6&_nc_cat=107&ig_cache_key=Mzc3NDI5MDI5Mjk2Nzc1Nzk3MQ%3D%3D.3-ccb7-5&ccb=7-5&_nc_sid=58cdad&efg=eyJ2ZW5jb2RlX3RhZyI6InhwaWRzLjIwNDh4MTM2Ni5zZHIuQzMifQ%3D%3D&_nc_ohc=HNeXqlaQ5LAQ7kNvwFMMGTx&_nc_oc=Adn7aBcLYF2zDl575NIXyo8y5M-ulhl7I5XhGX2Xu4bmYZxCGvFvj_AyxDpDF8AA_fI&_nc_ad=z-m&_nc_cid=0&_nc_zt=23&_nc_ht=scontent.cdninstagram.com&_nc_gid=inUIXRoEIQ_0vPuDlODjIA&oh=00_Afgu4FkiIu4MCy0Vk0wLemR5G1hU9_AGjfCDytCjcJvy3g&oe=693108A1;Enez Belediye Başkanı Sn. Özkan Günenç ve Başkan Yardımcısı Sn. Kemal Çelik'i belediyemizde ağırlamaktan mutluluk duydum.   Nazik ziyaretleri ve takdim ettikleri plaket için kendilerine teşekkür ediyorum. Şehirlerimizin kalkınması ve vatandaşlarımızın huzuru için birlik ve beraberlik içinde çalışmaya devam edeceğiz.;;0
https://www.instagram.com/p/DRg0PRrDEtJ/;Photo;1317;4;0;2025-11-26 11:20:34;https://scontent.cdninstagram.com/v/t39.30808-6/590943021_1436877444460937_708349152881571429_n.jpg?stp=dst-jpg_e35_tt6&_nc_cat=100&ig_cache_key=Mzc3NDI0NjIzNTkyMzA0MTA5Nw%3D%3D.3-ccb7-5&ccb=7-5&_nc_sid=58cdad&efg=eyJ2ZW5jb2RlX3RhZyI6InhwaWRzLjEwODB4MTM1MC5zZHIuQzMifQ%3D%3D&_nc_ohc=mYyGbH9SWJcQ7kNvwFHM3pB&_nc_oc=AdlNKek5L2wkMokUsc2xiPSLFOGPVeMUCu7QD5dv98ifqYrtLMKNbKb6zV2iSrHEkFs&_nc_ad=z-m&_nc_cid=0&_nc_zt=23&_nc_ht=scontent.cdninstagram.com&_nc_gid=inUIXRoEIQ_0vPuDlODjIA&oh=00_AfiiU9tURHa33ldu0TRxqJO1nVoanfdh9soqpskpe5hiZg&oe=693127A3;Barışın, uzun ömrün ve bereketin kadim sembolü zeytin ağacına sahip çıkmak, geleceğimize sahip çıkmaktır.   Manisa'mızın zeytinlikleri daima yeşil kalsın, sofralarımızın bereketi hiç eksik olmasın.   #DünyaZeytinAğacıGünü kutlu olsun.;;0
https://www.instagram.com/p/DRfX4-djFGE/;Carousel;1123;6;0;2025-11-25 21:53:36;https://scontent.cdninstagram.com/v/t51.82787-15/587672075_18541316332040314_7256833511881003753_n.jpg?stp=dst-jpg_e35_tt6&_nc_cat=109&ig_cache_key=Mzc3Mzg0MDA2OTU2NDgzMjU3NA%3D%3D.3-ccb7-5&ccb=7-5&_nc_sid=58cdad&efg=eyJ2ZW5jb2RlX3RhZyI6InhwaWRzLjEwNjZ4NzExLnNkci5DMyJ9&_nc_ohc=MduA-GN5CKwQ7kNvwFYvTG0&_nc_oc=AdkCMMXOVeXnCl_8u0qNAgd0CQjIuR6BQzmyy-Vlx159BGkR8PMPYhd6D2LNxy5Ujy8&_nc_ad=z-m&_nc_cid=0&_nc_zt=23&_nc_ht=scontent.cdninstagram.com&_nc_gid=inUIXRoEIQ_0vPuDlODjIA&oh=00_AfgtNRWvEVNXnVAFo4rQpuo8iWbSvt0KnEnITr2lIeUP9g&oe=6930FCFD;"25 Kasım Kadına Yönelik Şiddetle Uluslararası Mücadele Günü’nde, kadınlara yönelik şiddeti önlemek ve toplumsal farkındalık yaratmak için düzenlenen yürüyüşte hep birlikte #KadınaŞiddeteHayır dedik.  Kadına yönelik şiddetin, ayrımcılığın ve sömürünün tamamen son bulduğu; kadınların yaşam haklarının korunduğu, eşit ve özgür bir geleceğin mümkün olduğuna inanıyoruz.  Kadınların hak ettikleri değeri gördüğü, güvenle ve umutla yarınlara baktığı bir Manisa ve Türkiye için tüm gücümüzle çalışmaya devam edeceğiz.";;0
https://www.instagram.com/p/DRfItu5DRjX/;Carousel;680;2;0;2025-11-25 19:41:00;https://scontent.cdninstagram.com/v/t39.30808-6/588244847_1436411641174184_5374408597540789239_n.jpg?stp=c0.1.1440.958a_dst-jpg_e35_tt6&_nc_cat=100&ig_cache_key=Mzc3Mzc3MzMyMTY3MTA5ODE3Ng%3D%3D.3-ccb7-5&ccb=7-5&_nc_sid=58cdad&efg=eyJ2ZW5jb2RlX3RhZyI6InhwaWRzLjE0NDB4OTYwLnNkci5DMyJ9&_nc_ohc=R7csFa5yYXEQ7kNvwGhnvpI&_nc_oc=AdmMA99LrbAipV9Cv5qyYgh5lUfsGc2pNntyAD79sqDSvrc0y1O5MRymzGklK3V2kWU&_nc_ad=z-m&_nc_cid=0&_nc_zt=23&_nc_ht=scontent.cdninstagram.com&_nc_gid=inUIXRoEIQ_0vPuDlODjIA&oh=00_AfiMt9WWNdM9tCEoVpLu5idD6xblIPxWnuqvh8YB_4wT-Q&oe=6930FBD3;"Manisa Büyükşehir Belediye Meclisimiz ve MASKİ Genel Kurulumuzun ikinci oturumlarını bugün tamamladık. Toplantımızda, Manisa’mıza değer katacak gündem maddelerini, kıymetli meclis üyesi arkadaşlarımızla birlikte görüşerek karara bağladık.  Ayrıca yatırımlarımızı öncelediğimiz 2026 yılı bütçemiz, meclisimizde kabul edildi. Manisa’mızın ihtiyaçlarını gözeten, güçlü bir yatırım vizyonuyla hazırladığımız bu bütçe; altyapıdan ulaşıma, sosyal belediyecilikten çevresel projelere kadar pek çok alanda şehrimize yeni bir ivme kazandıracak.  Almış olduğumuz tüm kararlarımız ve kabul edilen 2026 bütçemiz Manisa’mıza hayırlı olsun.";;0
https://www.instagram.com/p/DRfD6bXjAnf/;Carousel;946;6;0;2025-11-25 18:59:03;https://scontent.cdninstagram.com/v/t39.30808-6/587794458_1436385127843502_2038816683351230593_n.jpg?stp=dst-jpg_e35_tt6&_nc_cat=104&ig_cache_key=Mzc3Mzc1MjIwODA3MzIxNDI2NQ%3D%3D.3-ccb7-5&ccb=7-5&_nc_sid=58cdad&efg=eyJ2ZW5jb2RlX3RhZyI6InhwaWRzLjE0NDB4OTYwLnNkci5DMyJ9&_nc_ohc=wieDdG2XdUcQ7kNvwF_uPFQ&_nc_oc=AdnlhZuqadDgZ0fYqKbnYURWM8MTKbUUTFZuc4QnemRQd5KBa82n1gUA7vwimxEhamA&_nc_ad=z-m&_nc_cid=0&_nc_zt=23&_nc_ht=scontent.cdninstagram.com&_nc_gid=inUIXRoEIQ_0vPuDlODjIA&oh=00_AficF6Z_69H3L6lHzteO548inIehS00W_lRSlZdiIEAX5g&oe=693110B1;Güzel yüreğiyle hepimize umut olan Ceylin kızımızın doğum günü mutluluğuna ortak olduk 💐  Nice güzel yaşlara güzel kızımız Ceylin… Yolun da bahtın da hep aydınlık olsun. 💙;;0
https://www.instagram.com/p/DRe2kgSDCi8/;Carousel;408;2;0;2025-11-25 17:02:27;https://scontent.cdninstagram.com/v/t39.30808-6/588013741_1436311997850815_4239670525148324692_n.jpg?stp=c0.1.1440.958a_dst-jpg_e35_tt6&_nc_cat=109&ig_cache_key=Mzc3MzY5MzUyMjQyODYxMDc2OA%3D%3D.3-ccb7-5&ccb=7-5&_nc_sid=58cdad&efg=eyJ2ZW5jb2RlX3RhZyI6InhwaWRzLjE0NDB4OTYwLnNkci5DMyJ9&_nc_ohc=hLBH3VGvuGAQ7kNvwH8-k4G&_nc_oc=AdnTCBR56ag-o5n7K6eaGITJAZ7IkirmPzBLeAplrruWh7DhQaya-v_RhLBr8L7UGys&_nc_ad=z-m&_nc_cid=0&_nc_zt=23&_nc_ht=scontent.cdninstagram.com&_nc_gid=inUIXRoEIQ_0vPuDlODjIA&oh=00_AfgibHhpuJ6IiDldtbSzI2Mw2zphqj3S_0Q196xkcH_4wA&oe=69311E38;Bugün belediyemizde misafir ettiğimiz:  ♦️Manisa İl Müftümüz Şükrü Kabukçu'ya, ♦️Şehzadeler Sancaklıiğdecik Mahalle Muhtarımıza, ♦️Kula Çiftlik, Alacalar ve Söğütalan mahalle muhtarlarımıza nazik ziyaretlerinden dolayı teşekkür ediyorum.;;0
