PostLink;PostTürü;BeğeniSayısı;YorumSayısı;Görüntülenme Sayısı;Tarih;DisplayPhoto;Caption;Takipçi;TahminMi
https://www.instagram.com/p/DRmi3HGDEtf/;Photo;221;1;0;2025-11-28 16:44:09;https://scontent.cdninstagram.com/v/t51.82787-15/589097568_18541861369020172_5186466945205634818_n.jpg?stp=dst-jpg_e35_tt6&_nc_cat=109&ig_cache_key=Mzc3NTg1ODY1ODM2Njk5OTM5MQ%3D%3D.3-ccb7-5&ccb=7-5&_nc_sid=58cdad&efg=eyJ2ZW5jb2RlX3RhZyI6InhwaWRzLjE0NDB4MTgwMC5zZHIuQzMifQ%3D%3D&_nc_ohc=Ry6knxZpqJAQ7kNvwEXT2-y&_nc_oc=Adn3zS-YjWxgvYSNU46aX2T8_-co8Lobdl5KuKdYpY1QLDMLaMeiGqBNQPwp7KpzZuk&_nc_ad=z-m&_nc_cid=0&_nc_zt=23&_nc_ht=scontent.cdninstagram.com&_nc_gid=e8zis-kK5Agv-WQ4DRH0lQ&oh=00_Afiri2t5bTZ2_gj_etaH_wIvLUe2o530EDIxlSMNA6_AFA&oe=69310D0E;Tokyo’da düzenlenen 2025 İşitme Engelliler Yaz Olimpiyatları’nda (Deaflympics) 110 metre engellide altın madalya kazanıp olimpiyat şampiyonu olan ve bizlere büyük bir gurur yaşatan hemşehrimiz Yasin Süzen’i yürekten kutluyorum.  Tebrikler Yasin Süzen. Gururumuzsun! 🥇🧿;35739.0;0
https://www.instagram.com/p/DRkbr-VjMnH/;Carousel;751;1;0;2025-11-27 21:02:59;https://scontent.cdninstagram.com/v/t51.82787-15/589127178_18541744282020172_8515467079066699002_n.jpg?stp=dst-jpg_e35_tt6&_nc_cat=100&ig_cache_key=Mzc3NTI2NDE0NzE5ODcxNzQ1Ng%3D%3D.3-ccb7-5&ccb=7-5&_nc_sid=58cdad&efg=eyJ2ZW5jb2RlX3RhZyI6InhwaWRzLjE0NDB4MTEwMC5zZHIuQzMifQ%3D%3D&_nc_ohc=3zck0X4k5EgQ7kNvwFUHZtq&_nc_oc=AdlK49eee5Z2Zi2rMSg_Nkb-axENWzxIvE0JE5hTrugGCn8vK342MWhx_72JhSVzgKc&_nc_ad=z-m&_nc_cid=0&_nc_zt=23&_nc_ht=scontent.cdninstagram.com&_nc_gid=e8zis-kK5Agv-WQ4DRH0lQ&oh=00_Afjaj1Dk-FQODuz5sVHQKad8SbPQo-QnR7skzpBxTdg2jw&oe=69312E96;"Gaziantep’e kazandırdığı vizyoner projeler ve yerel yönetimde ortaya koyduğu başarılı çalışmalarıyla ülkemize ilham veren Gaziantep Büyükşehir Belediye Başkanımız Sayın Fatma Şahin’i makamında ziyaret ettik.  Yerel yönetimlerde iş birliğini, dayanışmayı ve tecrübe paylaşımını çok kıymetli buluyor; bu anlayışın şehirlerimizin geleceğine güç katacağına yürekten inanıyorum.  Bu doğrultuda gerçekleştirdiğimiz ziyarette, Sayın Bakanımızın tecrübelerinden ve vizyoner kişiliğinden istifade ettik.  Sayın Şahin’e nazik misafirperverlikleri ve işbirliği için çok teşekkür ediyor, çalışmalarında başarılar diliyorum.  “Üretken Belediyecilik” anlayışımızla, kendimizi ve kentimizi geliştirmeye devam edeceğiz. 💙";;0
https://www.instagram.com/p/DRhkNLUDBCU/;Photo;445;4;0;2025-11-26 18:19:42;https://scontent.cdninstagram.com/v/t51.82787-15/588236957_18541568305020172_1736644820327379259_n.jpg?stp=dst-jpg_e35_tt6&_nc_cat=103&ig_cache_key=Mzc3NDQ1NzE5Nzg4ODI3ODY3Ng%3D%3D.3-ccb7-5&ccb=7-5&_nc_sid=58cdad&efg=eyJ2ZW5jb2RlX3RhZyI6InhwaWRzLjE0NDB4ODExLnNkci5DMyJ9&_nc_ohc=iKe6bzkbj2MQ7kNvwGVnOdl&_nc_oc=AdkciKYEqbe3Xvmz9PzihhSRABxrxPVGzJGs9fohizDe_S1CEGKW_dNlqqa2sz24UQg&_nc_ad=z-m&_nc_cid=0&_nc_zt=23&_nc_ht=scontent.cdninstagram.com&_nc_gid=e8zis-kK5Agv-WQ4DRH0lQ&oh=00_AfgtQaIuvmOGXeTzEW1X4luN9nJ4dnWxJ9bqfFlYdhUB-A&oe=69312C46;Kırklareli Eğitim ve Araştırma Hastanesi’nde tedavi görmekte olan Belediye Başkan Yardımcımız Doç. Dr. Soner Yeler’i ziyaret ederek geçmiş olsun dileklerimizi ilettik. Kendisine acil şifalar diliyor, en kısa sürede sağlığına kavuşmasını temenni ediyorum.  Bu vesileyle tüm hastalarımıza acil şifalar, fedakar sağlık çalışanlarımıza ise görevlerinde kolaylıklar diliyorum.;;0
https://www.instagram.com/p/DRhYdnrjGyv/;Photo;143;0;0;2025-11-26 16:37:06;https://scontent.cdninstagram.com/v/t51.82787-15/587907419_18541554499020172_6873932463930975955_n.jpg?stp=dst-jpg_e35_tt6&_nc_cat=107&ig_cache_key=Mzc3NDQwNTU1MTMwMDgzMjQzMQ%3D%3D.3-ccb7-5&ccb=7-5&_nc_sid=58cdad&efg=eyJ2ZW5jb2RlX3RhZyI6InhwaWRzLjE0NDB4MTQ0MC5zZHIuQzMifQ%3D%3D&_nc_ohc=9vg3XFPwh0AQ7kNvwGZpaBb&_nc_oc=Adk9i2lv9Rd4vFiqPLDTMx9WgLAgtkmiI8Ms_K1hy8H_94lMFUp7-wEp8h_2gcl00_s&_nc_ad=z-m&_nc_cid=0&_nc_zt=23&_nc_ht=scontent.cdninstagram.com&_nc_gid=e8zis-kK5Agv-WQ4DRH0lQ&oh=00_AfhbO9I10GsStSyzo8mGJFQnGYcKEVXfYbTzFcIYae4Qjw&oe=6931086A;Kış mevsiminin getirebileceği yoğun yağış, sis, kar ve buzlanma gibi risklere karşı şehrimizin hazırlıklarını gözden geçirmek üzere, Valimiz Sayın Uğur Turan’ın başkanlığında düzenlenen “Kış Tedbirleri Toplantısı”na katılım sağladık.  Tüm ilgili kurumlarımızla birlikte, olası olumsuz hava koşullarında vatandaşlarımızın güvenliği için yürütülecek çalışmaların koordinasyonunu değerlendirdik.  Hemşehrilerimizin kışı daha güvenli ve sorunsuz geçirmesi için belediye olarak üzerimize düşen tüm görevleri titizlikle yerine getirmeye devam edeceğiz.;;0
https://www.instagram.com/p/DRhL3-ijAnR/;Carousel;157;2;0;2025-11-26 14:47:06;https://scontent.cdninstagram.com/v/t51.82787-15/587805012_18541541821020172_2788702257084059452_n.jpg?stp=dst-jpg_e35_tt6&_nc_cat=108&ig_cache_key=Mzc3NDM1MDE4MTg0OTEyODMxOQ%3D%3D.3-ccb7-5&ccb=7-5&_nc_sid=58cdad&efg=eyJ2ZW5jb2RlX3RhZyI6InhwaWRzLjE0NDB4ODQwLnNkci5DMyJ9&_nc_ohc=twxXqOcNwEwQ7kNvwGMvyxe&_nc_oc=Adm2PXgPA8a2IJawaoZpxElDbBOeViqIDUDkXErH60j7q2K3_QnEIRKMlsS2N0Iqu08&_nc_ad=z-m&_nc_cid=0&_nc_zt=23&_nc_ht=scontent.cdninstagram.com&_nc_gid=e8zis-kK5Agv-WQ4DRH0lQ&oh=00_AfhK0SkFO52qLL9NMhvOwgcVRU4e_jeYt9-7X1-JBSY3SA&oe=69310A5B;Bu yıl, 04 - 07 Aralık tarihleri arasında, Belediyemiz Kapalı Pazar ve Fuar Alanı’nda gerçekleştirilecek olan, “Kırklareli 5. Tarım, Hayvancılık, Gıda, Sanayi ve Otomotiv Fuarı Koordinasyon Toplantısı”na katıldık.;;0
https://www.instagram.com/p/DRfKAgDjEUB/;Reels;1085;32;44024;2025-11-25 19:54:21;https://scontent.cdninstagram.com/v/t51.71878-15/588613874_2393057001137365_9046908857940655725_n.jpg?stp=dst-jpg_e15_tt6&_nc_cat=105&ig_cache_key=Mzc3Mzc3OTAyNzY0NDEzODc1Mw%3D%3D.3-ccb7-5&ccb=7-5&_nc_sid=58cdad&efg=eyJ2ZW5jb2RlX3RhZyI6InhwaWRzLjY0MHgzNjAuc2RyLkMzIn0%3D&_nc_ohc=zEd4uEJxhnIQ7kNvwGejHDx&_nc_oc=Admlvm8zvxZne46ed1vSkTIrNL24FdJQ7QQFY_CbQJTaDank9j4PPx14bsv94q3id70&_nc_ad=z-m&_nc_cid=0&_nc_zt=23&_nc_ht=scontent.cdninstagram.com&_nc_gid=e8zis-kK5Agv-WQ4DRH0lQ&oh=00_AfhUxOK1KUV4y8D7EybJzCC9TXQDYblFSL_Dj1IiFjpjWQ&oe=69310C4B;"Değerli Hemşehrilerim, Atatürk Mahallemize ferah bir nefes, şehrimize yepyeni bir yaşam alanı kazandıracak önemli bir projemizi sizlerle paylaşmaktan mutluluk duyuyorum.  Mahallemize; basketbol, futbol ve tenis sahalarıyla, barfiks ve açık hava fitness bölümleriyle, 3.863 metrekarelik yeşil alanıyla, oturma ve dinlenme unsurlarıyla, parkur ve piknik alanlarıyla, yürüyüş ve bisiklet yollarıyla, Kırklareli’mizin sağlıklı yaşam kültürünü güçlendirecek, sosyal etkileşimi artıracak modern bir tesis kazandırıyoruz. 💙";;0
https://www.instagram.com/p/DRezumpjF_1/;Reels;1485;72;48338;2025-11-25 16:49:30;https://scontent.cdninstagram.com/v/t51.71878-15/586844399_1331241952080970_4602866150461026527_n.jpg?stp=dst-jpg_e15_tt6&_nc_cat=104&ig_cache_key=Mzc3MzY4MTA0MDc1MDMwNTI2OTg5MDAwMDk5MzQ3NjE0Mg%3D%3D.3-ccb7-5&ccb=7-5&_nc_sid=58cdad&efg=eyJ2ZW5jb2RlX3RhZyI6InhwaWRzLjY0MHgxMTM2LnNkci5DMyJ9&_nc_ohc=VWKyAkg1g-MQ7kNvwEUajbU&_nc_oc=Admyq4XFUuGi04R0M_cOuHpxgy4AmzHvy2jTd7gHJwsKrLvzFnXbtHLA4gNZueVvJtg&_nc_ad=z-m&_nc_cid=0&_nc_zt=23&_nc_ht=scontent.cdninstagram.com&_nc_gid=e8zis-kK5Agv-WQ4DRH0lQ&oh=00_Afg3VtULH1W52IGiHpewK-NJBvdLLsQAVFTUqTj1kVeGNA&oe=6930FD6E;;;0
https://www.instagram.com/p/DRcNEqNjPld/;Carousel;200;1;0;2025-11-24 16:21:22;https://scontent.cdninstagram.com/v/t51.82787-15/587493451_18541237000020172_4462499896028490819_n.jpg?stp=dst-jpg_e35_tt6&_nc_cat=106&ig_cache_key=Mzc3Mjk0ODA3OTU0OTYyMjgyMQ%3D%3D.3-ccb7-5&ccb=7-5&_nc_sid=58cdad&efg=eyJ2ZW5jb2RlX3RhZyI6InhwaWRzLjE0NDB4ODEwLnNkci5DMyJ9&_nc_ohc=Tq9Lq9wOCmAQ7kNvwFxklAV&_nc_oc=AdkDcevCpYK1-sDHPjSlJ2qysZ82oZQhJ_CprWatxi-D-AhQNWr4bWfV0Y1t7WAxM70&_nc_ad=z-m&_nc_cid=0&_nc_zt=23&_nc_ht=scontent.cdninstagram.com&_nc_gid=e8zis-kK5Agv-WQ4DRH0lQ&oh=00_AfgSGF-eerNjhlf8ic_V6Jbiav1f52BbwBXHL5I8zP5FvA&oe=6931072F;Doğu mahallesi sakinlerinden, Fırıncı Cemal ve Arife Akbacı’nın oğlu, Necmi, Celil, Emeti, Necmiye, Ümran, Serpil ve Serap’ın abisi, Özlem Kolay ve Özer Akbacı’nın babası, Kırklareli Sağlık Meslek Lisesi’nden emekli Cemil Akbacı’yı son yolculuğuna uğurladık. Merhuma Allah’tan rahmet, ailesine ve sevenlerine başsağlığı diliyorum. Mekanı cennet olsun.;;0
https://www.instagram.com/p/DRcL82tjOy2/;Carousel;401;1;0;2025-11-24 16:11:33;https://scontent.cdninstagram.com/v/t51.82787-15/588432790_18541235758020172_4603062292978941965_n.jpg?stp=dst-jpg_e35_tt6&_nc_cat=101&ig_cache_key=Mzc3Mjk0MzE0MjY1MjQ5MTkzOA%3D%3D.3-ccb7-5&ccb=7-5&_nc_sid=58cdad&efg=eyJ2ZW5jb2RlX3RhZyI6InhwaWRzLjE0NDB4MTgwMC5zZHIuQzMifQ%3D%3D&_nc_ohc=99wdYJO_CuwQ7kNvwHUUIb3&_nc_oc=AdnJ-1edulliFW4sOkf6pfLvXEH40s9V1Dh9tbr_uS1aXFj9L8yqMLOWbBTWhazZ8Vs&_nc_ad=z-m&_nc_cid=0&_nc_zt=23&_nc_ht=scontent.cdninstagram.com&_nc_gid=e8zis-kK5Agv-WQ4DRH0lQ&oh=00_AfjXFMs5scOIwSWA7fPYghJCraDb_UbQe0NnSkaAmZ4ZCA&oe=693115D0;Tarım ve Orman Bakanlığımız ile Orman Genel Müdürlüğü’nün “Geleceğe Nefes” projesi kapsamında, 24 Kasım Öğretmenler Günü vesilesiyle  öğretmenlerimiz adına yaptığımız fidan bağışları çerçevesinde, Evlad-ı Fatihan Halk Eğitim Merkezi’ne yönelik düzenlenen sertifikaları Müdürümüz Esin Ataseven’e ve okulun değerli öğretmenlerine takdim ettik.  Tüm öğretmenlerimizin Öğretmenler Günü’nü bir kez daha yürekten kutluyorum.;;0
https://www.instagram.com/p/DRcJ9nCDEBk/;Carousel;413;0;0;2025-11-24 15:54:11;https://scontent-atl3-1.cdninstagram.com/v/t51.82787-15/587040697_18541233349020172_2098014314334459483_n.jpg?stp=dst-jpg_e35_tt6&_nc_cat=100&ig_cache_key=Mzc3MjkzNDM5MjY4ODQxNTY2MA%3D%3D.3-ccb7-5&ccb=7-5&_nc_sid=58cdad&efg=eyJ2ZW5jb2RlX3RhZyI6InhwaWRzLjE0NDB4MTgwMC5zZHIuQzMifQ%3D%3D&_nc_ohc=JNlY9JNwrSEQ7kNvwGNIDh_&_nc_oc=AdmZFTMFBXeGKm7EwYVFi5XKxY5A9eSQPzVBuSueTXUy4ljuDbgNi8KRvD3YRiEr49XsIJK_PnErtDPxgqSQ4gsC&_nc_ad=z-m&_nc_cid=0&_nc_zt=23&_nc_ht=scontent-atl3-1.cdninstagram.com&_nc_gid=X0DepcpQ7ilWMGzluvcoIA&oh=00_AfiODDlHzAbjRmPIxii-jBSTzLG_Hb7DhKvKPEsn6hfnSg&oe=69311C19;Değerli Hemşehrilerim,  Kırklareli Belediyesi olarak, Tarım ve Orman Bakanlığımız ile Orman Genel Müdürlüğü’nün “Geleceğe Nefes” projesi kapsamında, 24 Kasım Öğretmenler Günü’nde, şehrimizin geleceğine emek veren 1636 öğretmenimiz adına fidan bağışında bulunduk. Bu yıl artan orman yangınları ve yeşil alan kayıplarımız, bu anlamlı hediyeyi daha da anlamlı kıldı.  Bu vesileyle, TOBB Anadolu Lisesi Müdürü Sinan Çiftlik ve okulun değerli öğretmenlerine kendi adlarına dikilecek fidanların sertifikalarını takdim ettim. Bu fidanlar büyüdükçe, öğretmenlerimizin adı da gelecekte yaşamaya devam edecek.  Tüm öğretmenlerimizin Öğretmenler Günü kutlu olsun.;;0
https://www.instagram.com/p/DRcFHvhjJ0D/;Carousel;558;1;0;2025-11-24 15:11:53;https://scontent-atl3-3.cdninstagram.com/v/t51.82787-15/589089307_18541227997020172_2281214637114546390_n.jpg?stp=dst-jpg_e35_tt6&_nc_cat=110&ig_cache_key=Mzc3MjkxMzA5NzIxNzIwNzAzMw%3D%3D.3-ccb7-5&ccb=7-5&_nc_sid=58cdad&efg=eyJ2ZW5jb2RlX3RhZyI6InhwaWRzLjE0NDB4MTgwMC5zZHIuQzMifQ%3D%3D&_nc_ohc=Ki4GnR41i-0Q7kNvwENhXhl&_nc_oc=Adku0dJ5GXNrue7feMIuM921GMBYkWCiAxFvBdExe6_zWOtUuWAbAdgddgXRWRXfvfVkyp_xCgAYNRDGzfqdBqu5&_nc_ad=z-m&_nc_cid=0&_nc_zt=23&_nc_ht=scontent-atl3-3.cdninstagram.com&_nc_gid=X0DepcpQ7ilWMGzluvcoIA&oh=00_AfiaFbFBJZ-Pg0vl4ank-Pq-iR4IUPs4Jq_CSiGZPI0_BQ&oe=693114AA;"24 Kasım Öğretmenler Günü vesilesiyle, şehrimizin geleceğini sabırla, emekle ve sevgiyle inşa eden 1636 öğretmenimiz adına birer fidan bağışında bulunduk. Bu yıl ülkemizde yaşanan orman yangınlarının artması, yeşil alan kayıplarının çoğalması ve çevre duyarlılığının öneminin giderek büyümesi, bu armağanı bizim için çok daha anlamlı kıldı.  Belediye Başkanlığımızca düzenlediğimiz bu özel etkinlikte, Tarım ve Orman Bakanlığı ile Orman Genel Müdürlüğü’nün “Geleceğe Nefes” projesi kapsamında ilimiz merkezinde görev yapan 1636 öğretmenimiz adına bağılaşmış olduğumuz fidanlar, Tarım ve Orman Bakanlığımız ve Orman Genel Müdürlüğümüz tarafından toprakla buluşturularak yarınlara nefes olacak.  Bugün, bu özel fidanların sertifikalarını, özel sahiplerine teslim ediyoruz.   TOBB Sosyal Bilimler Lisemizin Müdürü Murat Baltalı ve lisemizde görev yapan kıymetli öğretmenlerimize de sertifikalarını bizzat takdim etme fırsatı buldum. İleride büyüyüp gölgesinde nice nesillerin serinleyeceği bu fidanlar kıymetli öğretmenlerimizin adlarını sonsuza dek yaşatacaklar.  Bu vesileyle; Başöğretmen Gazi Mustafa Kemal Atatürk başta olmak üzere, ülkemizin her köşesinde gençlerimizi sevgiyle yeşerten tüm öğretmenlerimizin Öğretmenler Günü’nü yürekten kutluyorum.";;0
https://www.instagram.com/p/DRb6XjXjMto/;Carousel;224;0;0;2025-11-24 13:37:55;https://scontent-atl3-2.cdninstagram.com/v/t51.82787-15/589385553_18541217875020172_6027942172885036514_n.jpg?stp=dst-jpg_e35_tt6&_nc_cat=105&ig_cache_key=Mzc3Mjg2NTgxMTQ5Nzg5MzIzMg%3D%3D.3-ccb7-5&ccb=7-5&_nc_sid=58cdad&efg=eyJ2ZW5jb2RlX3RhZyI6InhwaWRzLjE0NDB4ODEyLnNkci5DMyJ9&_nc_ohc=1JixW0bIkvoQ7kNvwEtsYHb&_nc_oc=Adn0HgZZ8jHtkPA1N6jxoERCxbQN7EHdjKZhA2q_ExGrPH3F_2MSgiTiXre8f6bWZWZpBsBbpOQMSLSUYM0qcPH6&_nc_ad=z-m&_nc_cid=0&_nc_zt=23&_nc_ht=scontent-atl3-2.cdninstagram.com&_nc_gid=X0DepcpQ7ilWMGzluvcoIA&oh=00_Afhv_lcelOYCO92tNGIvjC2MHq3sMX92njpQquKAcz1QxQ&oe=6931069A;24 Kasım Öğretmenler Günü vesilesiyle İl Milli Eğitim Müdürümüz Sayın Murat Altınöz’ü makamında ziyaret ettik. Şehrimizin geleceğini sabırla, emekle ve sevgiyle inşa eden öğretmenimiz adına gerçekleştirdiğimiz fidan bağışlarımız kapsamında, kendileri için bağışladığımız fidanın sertifikasını da Sayın Müdürümüze takdim ettik. Sayın Altınöz’e eğitime verdikleri kıymetli katkılar ve nazik ev sahiplikleri için teşekkür ediyor, Öğretmenler Günü’nü içtenlikle kutluyorum.;;0
https://www.instagram.com/p/DRb4fWqDK-Z/;Carousel;402;1;0;2025-11-24 13:21:30;https://scontent-atl3-3.cdninstagram.com/v/t51.82787-15/587818157_18541215889020172_1830908497788248689_n.jpg?stp=dst-jpg_e35_tt6&_nc_cat=108&ig_cache_key=Mzc3Mjg1NzU0NjE4NTY0MzAwMw%3D%3D.3-ccb7-5&ccb=7-5&_nc_sid=58cdad&efg=eyJ2ZW5jb2RlX3RhZyI6InhwaWRzLjE0NDB4MTgwMC5zZHIuQzMifQ%3D%3D&_nc_ohc=2M_jNUxYAI4Q7kNvwFj72a1&_nc_oc=Adk5P4lS5FsCb38_ZPKTq5QHMuQ5D-Jg8Igqf2_4klrY_uC541FR4Nw55PyoBtwyFYr6mNB2NVNwN80pPHupCi3X&_nc_ad=z-m&_nc_cid=0&_nc_zt=23&_nc_ht=scontent-atl3-3.cdninstagram.com&_nc_gid=X0DepcpQ7ilWMGzluvcoIA&oh=00_AfgHFvqvHRtVW0M2Fp4410lq4tqw89EWigiBO6heKwfa2A&oe=693100F1;24 Kasım Öğretmenler Günü vesilesiyle, il protokolümüzle birlikte Valiliğimiz tarafından Halk Eğitim Merkezi’nde düzenlenen kutlama programına katıldık. Günün anlam ve önemini yansıtan sergi, gösteri ve öğretmenler korosu konseriyle bezenmiş bu kıymetli  buluşmaya emek veren tüm öğretmenlerimize ve öğrencilerimize teşekkür ediyorum.  Bu vesileyle, başta Başöğretmen Gazi Mustafa Kemal Atatürk olmak üzere, ülkemizin dört bir yanında büyük bir fedakârlık ve sevgiyle görev yapan tüm öğretmenlerimizin 24 Kasım Öğretmenler Günü’nü bir kez daha en içten duygularımla kutluyorum.;;0
https://www.instagram.com/p/DRbNYFwivqd/;Photo;206;0;0;2025-11-24 07:04:46;https://scontent-atl3-3.cdninstagram.com/v/t51.82787-15/586681392_18541181617020172_2654179551268326875_n.jpg?stp=dst-jpg_e35_tt6&_nc_cat=108&ig_cache_key=Mzc3MjY2Nzk0MjkwODEzMTk5Nw%3D%3D.3-ccb7-5&ccb=7-5&_nc_sid=58cdad&efg=eyJ2ZW5jb2RlX3RhZyI6InhwaWRzLjEzNTB4MTY4OC5zZHIuQzMifQ%3D%3D&_nc_ohc=cTSH4Zxn0Z0Q7kNvwF3A16G&_nc_oc=AdnSiJof_C91GHDOYBfDwMmu9OilYOSaNNq9qYPzIphW-OltHMZp8ydrELKT6Spi0V5uueR1a7ogg5BdRG3yBS_Q&_nc_ad=z-m&_nc_cid=0&_nc_zt=23&_nc_ht=scontent-atl3-3.cdninstagram.com&_nc_gid=X0DepcpQ7ilWMGzluvcoIA&oh=00_AfhEtAZpw2M-2OIfsvW1rx9nQr5YGLBJ-AsA4MctobEkwg&oe=69311D39;Başöğretmen Gazi Mustafa Kemal Atatürk’ün izinde, geleceğimizi şekillendiren tüm öğretmenlerimizin 24 Kasım Öğretmenler Günü kutlu olsun.;;0
https://www.instagram.com/p/DRZyFRKDHF5/;Photo;148;1;0;2025-11-23 17:47:02;https://scontent-atl3-2.cdninstagram.com/v/t51.82787-15/589154560_18541082806020172_7251903873146150909_n.jpg?stp=dst-jpg_e35_tt6&_nc_cat=102&ig_cache_key=Mzc3MjI2NjQyNzI0NDYzODU4NQ%3D%3D.3-ccb7-5&ccb=7-5&_nc_sid=58cdad&efg=eyJ2ZW5jb2RlX3RhZyI6InhwaWRzLjE0NDB4ODExLnNkci5DMyJ9&_nc_ohc=3GnagvQI1bgQ7kNvwF189Xc&_nc_oc=AdlYAopyBEhNL1GV8L_Hw0Ao_Ng7L7g_20J7C2ZTk2Fhg47lNhLzOvLsS-aN_Rj1s1qBQwXO4ihAFCOx9ygCXZ4g&_nc_ad=z-m&_nc_cid=0&_nc_zt=23&_nc_ht=scontent-atl3-2.cdninstagram.com&_nc_gid=X0DepcpQ7ilWMGzluvcoIA&oh=00_AfiqJunC_-GAVmYpKHIQ6J1Q4H5amR-Ph-5yUwmk5uhMCg&oe=693115CB;Ülkü Ocakları Eğitim ve Kültür Vakfı Kırklareli İl Başkanlığı tarafından düzenlenen Şehit Fırat Yılmaz Çakıroğlu Futsal Turnuvası’nda gençlerimizin heyecanına ortak olduk.  Turnuvanın şampiyonu olan Kırklareli Ocak Ortaöğretim Takımını yürekten tebrik ediyorum.  Sporun birleştirici gücüyle gençlerimizin azmini, disiplinini ve kardeşlik ruhunu görmek bizlere umut veriyor. Emeği geçen herkese teşekkür ediyorum.;;0
https://www.instagram.com/p/DRZpWt9DH7E/;Reels;253;1;15902;2025-11-23 16:31:50;https://scontent-atl3-1.cdninstagram.com/v/t51.71878-15/586677946_1177735863805297_3603743284382309070_n.jpg?stp=dst-jpg_e15_tt6&_nc_cat=106&ig_cache_key=Mzc3MjIyODA0Mzk3NzU1NTY1Mg%3D%3D.3-ccb7-5&ccb=7-5&_nc_sid=58cdad&efg=eyJ2ZW5jb2RlX3RhZyI6InhwaWRzLjY0MHgzNjAuc2RyLkMzIn0%3D&_nc_ohc=u3Dby311Be0Q7kNvwEBvxXt&_nc_oc=AdmCHj-4F1GWGF5IKJj5pYDsW-pZtp8LsHy8ui-lJCITt9S-UUXjFfE78n-YPmuOlf9a_RLQb1dNsAUD6rVDJJV-&_nc_ad=z-m&_nc_cid=0&_nc_zt=23&_nc_ht=scontent-atl3-1.cdninstagram.com&_nc_gid=X0DepcpQ7ilWMGzluvcoIA&oh=00_AfizWUU9oAIyav6Vcg3T9SeaSEqjhMzxMSrRg62lSjCBvQ&oe=693100F1;Bugün, ömrünü bilgiye, sabra ve sevgiye adamış emekli öğretmenlerimizle bir araya gelmenin mutluluğunu yaşadık. Başöğretmenimiz Gazi Mustafa Kemal Atatürk’ün açtığı yolda, gönüllere dokunan tüm öğretmenlerimizin Öğretmenler Günü’nü bir kez daha yürekten kutluyorum. 💙;;0
https://www.instagram.com/p/DRZQ1VujPdM/;Carousel;663;6;0;2025-11-23 12:56:30;https://scontent-atl3-3.cdninstagram.com/v/t51.82787-15/587044141_18541044910020172_5967663884781788446_n.jpg?stp=dst-jpg_e35_tt6&_nc_cat=109&ig_cache_key=Mzc3MjEyMDE4NTM2OTgyNDU2OA%3D%3D.3-ccb7-5&ccb=7-5&_nc_sid=58cdad&efg=eyJ2ZW5jb2RlX3RhZyI6InhwaWRzLjE0NDB4MTgwMC5zZHIuQzMifQ%3D%3D&_nc_ohc=cvYyU9jTOO8Q7kNvwGczfh2&_nc_oc=AdkMu7yCxbFO3_sK7JbrNU43bHRo-XmHTvaWwnuqY-JhOGoCvPOIocw-rqvUwfdrNopHTAPJbxwvitaIfZR9j7pi&_nc_ad=z-m&_nc_cid=0&_nc_zt=23&_nc_ht=scontent-atl3-3.cdninstagram.com&_nc_gid=X0DepcpQ7ilWMGzluvcoIA&oh=00_AfjiLw_w5sKKIhK5u-fI1qeUgoodYify9fQ9CNSI5OkWBA&oe=69312338;"Bugün, Öğretmenler Günü vesilesiyle Paşa Kafe’de bir araya geldiğimiz emekli öğretmenlerimizle aynı sofrayı ve aynı duyguları paylaşmak benim için tarifsiz bir onurdu.  Hayatlarını, bir çocuğun gözlerindeki merakı büyütmeye; bir şehrin geleceğini ilmek ilmek dokumaya adamış değerli öğretmenlerimize; emekleri, sabırları, gönlünlerinden taşan sevgileri ve Kırklareli’mizin hafızasında bıraktıkları silinmez izler için çok teşekkür ediyorum.  Bu anlamlı buluşmada, kıymetli öğretmenlerimizle, Kırklareli’mizin geleceğini güçlendirmek adına hayata geçirdiğimiz ve sürdürdüğümüz projelerimizi de paylaşarak, onların yıllarca emek verdiği bu güzel şehri nasıl daha ileri taşıyacağımızı konuştuk. Çünkü biliyorum ki her biri, bu şehrin en güçlü vicdanı ve en kıymetli rehberleri.  Bu vesile ile tüm öğretmenlerimizin Öğretmenler Günü’nü yürekten kutluyorum. 💙";;0
https://www.instagram.com/p/DRXQgIBDDKZ/;Reels;210;1;18135;2025-11-22 18:16:34;https://scontent-atl3-3.cdninstagram.com/v/t51.71878-15/584390422_3031593400367207_2114215287856094757_n.jpg?stp=dst-jpegr_e15_tt6&_nc_cat=108&ig_cache_key=Mzc3MTU1NTc4OTMyMTAyNDE1Mw%3D%3D.3-ccb7-5&ccb=7-5&_nc_sid=58cdad&efg=eyJ2ZW5jb2RlX3RhZyI6InhwaWRzLjY0MHgxMTM2Lmhkci5DMyJ9&_nc_ohc=h4S1rOmsb3sQ7kNvwH3FvgM&_nc_oc=AdntIHWqVHFjH0yxnpO_wrUkoZ7iAIM0FWGzqT1fxoU4rJYCHiHTKD1_eqvu6MYa0a0fi6x1TFWhtNwv7AtmFU9j&_nc_ad=z-m&_nc_cid=0&_nc_zt=23&se=-1&_nc_ht=scontent-atl3-3.cdninstagram.com&_nc_gid=X0DepcpQ7ilWMGzluvcoIA&oh=00_Afh05o6-AsZs-hTiOEVjfEND1UWFG9Lzo1ifVhZzuvDhCA&oe=69311BC3;Değerli Hemşehrilerim, Kırklareli Belediyesi FBO Kadın Basketbol Takımımız, sahaya yüreğini koyarak çok değerli bir galibiyete daha imza attı. Her top için savaşan oyuncularımızı, büyük emek veren teknik ekibimizi ve salona enerji katan taraftarlarımızı gönülden tebrik ediyorum. 🏀💙❤️;;0
https://www.instagram.com/p/DRXNG9QjHG_/;Photo;83;1;0;2025-11-22 17:46:41;https://scontent-atl3-2.cdninstagram.com/v/t51.82787-15/587834275_18540916897020172_8368270409310578049_n.jpg?stp=dst-jpg_e35_tt6&_nc_cat=102&ig_cache_key=Mzc3MTU0MDg2NTY0MzQ3NTM5MQ%3D%3D.3-ccb7-5&ccb=7-5&_nc_sid=58cdad&efg=eyJ2ZW5jb2RlX3RhZyI6InhwaWRzLjE0NDB4MTgwMC5zZHIuQzMifQ%3D%3D&_nc_ohc=yRcTDulqFQQQ7kNvwEYBYVt&_nc_oc=Adm2RWXz-xu5Lstybg0Cp8hrIzsHZvdfcO9nzNuHdUrFSP1OLDlG4B3WtcYGkwQJECr3YV89tK0MgEGgRb_Aj8zr&_nc_ad=z-m&_nc_cid=0&_nc_zt=23&_nc_ht=scontent-atl3-2.cdninstagram.com&_nc_gid=X0DepcpQ7ilWMGzluvcoIA&oh=00_AfhKXZxo3pL6XeXg3sg2C65UG5xaKAEqWRrBbSahbUhE-w&oe=6930FB2E;Kırklareli’mizin gururu Kırklareli Belediyesi FBO Kadın Basketbol Takımımızı, sahada ortaya koydukları üstün mücadele ve 85–71’lik güzel galibiyetleri için yürekten tebrik ediyorum.  Bu değerli başarıda emeği olan teknik ekibimize, terinin son damlasına kadar mücadele eden oyuncularımıza ve bir maç aradan sonra tribünleri doldurarak takımımıza güç veren kıymetli taraftarlarımıza teşekkür ediyorum.  Şehrimizin spor kültürüne, gençlerimizin başarısına ilham olmaya devam edeceğiz. Tebrikler kızlar, sizinle gurur duyuyoruz!  🏀💙❤️;;0
https://www.instagram.com/p/DRW4ho9DDuA/;Carousel;530;2;0;2025-11-22 14:45:37;https://scontent-atl3-3.cdninstagram.com/v/t51.82787-15/587941656_18540892591020172_4067707412408953811_n.jpg?stp=dst-jpg_e35_tt6&_nc_cat=107&ig_cache_key=Mzc3MTQ1MDA5NDIyNzU5NzcxMw%3D%3D.3-ccb7-5&ccb=7-5&_nc_sid=58cdad&efg=eyJ2ZW5jb2RlX3RhZyI6InhwaWRzLjE0NDB4ODEwLnNkci5DMyJ9&_nc_ohc=qkCncLZI21YQ7kNvwFON4Ce&_nc_oc=AdmUjN-WsqxV039of6T9gXgogErLboUVOHWxI60JoiznHv0SHJ78mZd9Us1-arOAIMmRrXdOsygrvoMX905wjGQk&_nc_ad=z-m&_nc_cid=0&_nc_zt=23&_nc_ht=scontent-atl3-3.cdninstagram.com&_nc_gid=X0DepcpQ7ilWMGzluvcoIA&oh=00_AfizHBXEw04QB8nDZopKH1PdXJlwoLSN5FEafGhrNV5DKQ&oe=6931176A;Değerli Hemşehrilerim, Eczacı Bilgehan Cebe’nin şehrimize kazandırdığı Kırklareli Eczanesi’nin açılışını gerçekleştirdik.  Sağlık alanında atılan her yeni adım, Kırklareli’mizin daha güçlü ve yaşanabilir bir şehir olmasına katkı sağlıyor.  Bu anlamda, Bilgehan Cebe’ye teşekkür ediyor, yeni eczanesinin kendisine ve Kırklareli’mize hayırlı, uğurlu olmasını diliyorum.;;0
https://www.instagram.com/p/DRW3PZeDOBx/;Carousel;559;1;0;2025-11-22 14:34:23;https://scontent-atl3-1.cdninstagram.com/v/t51.82787-15/587501199_18540891685020172_4657110186155461678_n.jpg?stp=dst-jpg_e35_tt6&_nc_cat=106&ig_cache_key=Mzc3MTQ0NDMwNDQyNzE0Mzk1Mg%3D%3D.3-ccb7-5&ccb=7-5&_nc_sid=58cdad&efg=eyJ2ZW5jb2RlX3RhZyI6InhwaWRzLjE0NDB4ODEwLnNkci5DMyJ9&_nc_ohc=-7R-j9e2X3wQ7kNvwGvpWxH&_nc_oc=AdmgnomP5-5JY7yjO6AYwVKm2g8rBotM1TpAPG1wpI_ND1ZVD5oAY2Ve_oNLJOFSUB0NrKbFTy_57UztQ2cM21gn&_nc_ad=z-m&_nc_cid=0&_nc_zt=23&_nc_ht=scontent-atl3-1.cdninstagram.com&_nc_gid=X0DepcpQ7ilWMGzluvcoIA&oh=00_AfihoGZ64koJlHZTslcWEyKyKqv8fyjzp4wwwX3yxdJZzg&oe=693109CA;"Değerli Hemşehrilerim, Bugün, şehrimizin vizyonuna değer katan girişimci kadınlarımız Melisa Şumnulu ve Aysu Nişikli’nin büyük bir emekle Kırklareli’mize kazandırdığı Cennet Davet ve Organizasyon’un açılışına katıldık.  Kırklareli’nde faaliyete geçen her yeni işletme; ekonomimize, istihdama ve sosyal yaşamımıza canlılık katan önemli bir adımdır. Bu güzel girişimlerinden ötürü iki kardeşimizi gönülden kutluyor, Cennet Davet ve Organizasyon’un şehrimize hayırlı ve uğurlu olmasını diliyorum.";;0
https://www.instagram.com/p/DRW1mKADOOp/;Carousel;351;0;0;2025-11-22 14:20:01;https://scontent.cdninstagram.com/v/t51.82787-15/587471685_18540890302020172_6995859147488806480_n.jpg?stp=dst-jpg_e35_tt6&_nc_cat=106&ig_cache_key=Mzc3MTQzNzI1NzU1MTc3ODAyOA%3D%3D.3-ccb7-5&ccb=7-5&_nc_sid=58cdad&efg=eyJ2ZW5jb2RlX3RhZyI6InhwaWRzLjE0NDB4ODEwLnNkci5DMyJ9&_nc_ohc=FiQSJvzjDE4Q7kNvwH112Gb&_nc_oc=AdkdtDhIdSI7SdSmOdtM10_g_-SE1E0-meef-jTWpy9wu0KqP2LXKuQAutdHdrJ1El4&_nc_ad=z-m&_nc_cid=0&_nc_zt=23&_nc_ht=scontent.cdninstagram.com&_nc_gid=nq7xgtPcpuG1WRqoPdA0uA&oh=00_AfjOAyBPrFYAPo_VOmImFPu9je9QWxlvLkJqwZwIDqBudQ&oe=693131BD;"Değerli Hemşehrilerim, Bugün, Parla Psikolojik Danışmanlık Merkezi’nin açılışını gerçekleştirmenin mutluluğunu yaşadık.  Merkezin kurucusu Berna Yıldız Ertoğum’a bu kıymetli adım için teşekkür ediyorum. Psikolojik danışmanlık hizmetlerinin güçlenmesi; bireylerin, ailelerin, çocukların ve toplumun daha sağlıklı bir geleceğe yürümesi adına son derece önemli.  Parla Psikolojik Danışmanlık Merkezi’nin, şehrimizde nice insana dokunmasını, iyilik ve farkındalık yolunda rehber olmasını diliyorum.  Kırklareli’mize hayırlı, uğurlu olsun.";;0
