PostLink;PostTürü;BeğeniSayısı;YorumSayısı;Görüntülenme Sayısı;Tarih;DisplayPhoto;Caption;Takipçi;TahminMi
https://www.instagram.com/p/DQ3YCeeDOLl/;Reels;520;18;34134;2025-11-10 09:05:00;https://scontent-fra5-1.cdninstagram.com/v/t51.71878-15/575974929_2320349285068253_3331409466150324415_n.jpg?stp=dst-jpg_e15_tt6&_nc_cat=110&ig_cache_key=Mzc2MjU4MTczNjk2Mjk3NDQzNw%3D%3D.3-ccb7-5&ccb=7-5&_nc_sid=58cdad&efg=eyJ2ZW5jb2RlX3RhZyI6InhwaWRzLjY0MHgzNjAuc2RyLkMzIn0%3D&_nc_ohc=1dFk5h9MQYUQ7kNvwFGIgDO&_nc_oc=Adl3bK8FQ5NRoU22xnG8g3kc66Kx0ETfaEgV2xzJzXBcaw98WuYP8lKPdH_9oKTmO1l2oZkSNneo3GYvRv4-4mWh&_nc_ad=z-m&_nc_cid=0&_nc_zt=23&_nc_ht=scontent-fra5-1.cdninstagram.com&_nc_gid=eMNldd7LkaJ6BQCgk6Z2eg&oh=00_Afhjvz8okSw_OgirXc6pvVE74BBQB5kcUk78HMw9FLkjBg&oe=69312320;Kırklareli Belediyesi Çocuk Koromuzun,  29 Ekim Cumhuriyet Bayramımızda gerçekleştirdikleri konserde ilk kez seslendirdikleri “Adı Mustafa Kemal” adlı, söz ve müziği Koro Şefimiz Barış Gülhane’ye ait olan eseri sizlerle paylaşmaktan mutluluk duyuyoruz. Rüyasında Atatürk’ü gören küçük bir çocuğun duygularını konu alan eser, Kırklareli Belediyesi Çocuk Koromuzun  yorumuyla hayat buldu. Özel olarak hazırlanan animasyon klibini izleyeceğiniz eserin yaratılmasında emeği geçenlere ve çocuk koromuza çok teşekkür ediyor, Büyük Önder Gazi Mustafa Kemal Atatürk’ün aziz hatırası önünde bir kez daha saygı ve minnetle eğiliyorum.;;0
https://www.instagram.com/p/DQ3ChNEChnB/;Photo;480;4;0;2025-11-10 05:57:14;https://scontent-fra5-2.cdninstagram.com/v/t51.82787-15/575511901_18538469287020172_1032345369250120006_n.jpg?stp=dst-jpg_e35_tt6&_nc_cat=107&ig_cache_key=Mzc2MjQ4NzA5MTU1MzUwNzc3Nw%3D%3D.3-ccb7-5&ccb=7-5&_nc_sid=58cdad&efg=eyJ2ZW5jb2RlX3RhZyI6InhwaWRzLjE0NDB4MTgwMC5zZHIuQzMifQ%3D%3D&_nc_ohc=nJwPSxL4VVMQ7kNvwF3Kwj6&_nc_oc=AdnFOiBFNR-YXoFxTHfJDkppyNKEtrReLiHJ-P_7-kNzGW5eYY9LFtwVtCQZRscVLPj1okHx0dj26qzhSw0KOUXw&_nc_ad=z-m&_nc_cid=0&_nc_zt=23&_nc_ht=scontent-fra5-2.cdninstagram.com&_nc_gid=eMNldd7LkaJ6BQCgk6Z2eg&oh=00_Afie1UcTtXVh3mhVJb4T_ZgcLMyCAPoMElObvJqGf1v7Tg&oe=693124DC;"Değerli Hemşehrilerim,  Her 10 Kasım’da bir kez daha anlıyoruz ki; Gazi Mustafa Kemal Atatürk’ün izi asla silinmeyecek. Fikirleri, karanlık günlerimizde yolumuzu aydınlatan bir yıldız gibi parlayacak ve bize emanet ettiği Cumhuriyet, yarınlara yürüyüşümüzde en sağlam rehberimiz olmaya devam edecek.  Ebediyete irtihalinin 87. yıl dönümünde, Aziz Atatürk’ü saygı, rahmet ve minnetle anıyorum.  Ruhun şad olsun, Atam!  Emanetin, bugün de yarın da emin ellerde…";;0
https://www.instagram.com/p/DQxP_LBDBg5/;Reels;800;1;48421;2025-11-08 00:00:30;https://scontent-fra3-2.cdninstagram.com/v/t51.71878-15/575513126_1867917777926222_1557457537766152867_n.jpg?stp=dst-jpg_e15_tt6&_nc_cat=111&ig_cache_key=Mzc2MDg1NzQ3NTY4NDUwNTY1Nw%3D%3D.3-ccb7-5&ccb=7-5&_nc_sid=58cdad&efg=eyJ2ZW5jb2RlX3RhZyI6InhwaWRzLjY0MHgxMTM2LnNkci5DMyJ9&_nc_ohc=W6vILhGxGNgQ7kNvwFtarFd&_nc_oc=AdnQjrOBosBYIMh_Xt-7B4fDDx_04PRDLLP1cSIpkoxSbtbHxvTIFC7uyDGxxe9nYdgMoiAhaWSdIe93dFrrh6g8&_nc_ad=z-m&_nc_cid=0&_nc_zt=23&_nc_ht=scontent-fra3-2.cdninstagram.com&_nc_gid=eMNldd7LkaJ6BQCgk6Z2eg&oh=00_Afhv2IiOPRS3DQV8KK0DIstRUwjMB1Ikc0E4zLWnajWt0Q&oe=6931108C;"Değerli Hemşehrilerim, Sevgili Basketbolseverler, 🏀 TKBL’de muazzam bir performans ortaya koyan Kırklareli Belediyesi FBO Kadın Basketbol Takımımızı yarın, her zamanki gibi tribünlerde büyük bir coşku ile desteklemeyi planlıyorduk. Ancak yaşanan münferit bir olay nedeniyle maçın seyircisiz oynanmasına karar verildi. 🏀 Bu karar kabul edilebilir değil; çünkü bir şehrin tamamı münferit bir olayla cezalandırılamaz. Yarın tribünlerde olamayacağız belki ama Yeni Kapalı Spor Salonu’nun dışına kuracağımız dev ekranda aynı coşku ve enerjiyle takımımızın yanında olacağız.  Gelin, en güçlü cevabı birlik olarak verelim ve saat 16.00’da dev ekran karşısında buluşalım. Kırklareli’nin yüreğini ve kararlılığını hep birlikte gösterelim. 💙♥️🏀";;0
https://www.instagram.com/p/DQxCe0xjPcY/;Carousel;753;2;0;2025-11-07 22:01:28;https://scontent-fra3-2.cdninstagram.com/v/t51.82787-15/573141639_18537970684020172_7226011277855404671_n.jpg?stp=dst-jpg_e35_tt6&_nc_cat=104&ig_cache_key=Mzc2MDc5ODA2NzY0NjU0NjIzMA%3D%3D.3-ccb7-5&ccb=7-5&_nc_sid=58cdad&efg=eyJ2ZW5jb2RlX3RhZyI6InhwaWRzLjE0NDB4MTAxMS5zZHIuQzMifQ%3D%3D&_nc_ohc=dvWUtTLFerYQ7kNvwHrFB8-&_nc_oc=Adm2yxCjK41sE1x-Zsxvp7_C7810ZDymkQXiyXwax2ksPu1-B7qwB9IOtGK9hha0VmTQPx5O25k1f2S3cqqdoUiO&_nc_ad=z-m&_nc_cid=0&_nc_zt=23&_nc_ht=scontent-fra3-2.cdninstagram.com&_nc_gid=eMNldd7LkaJ6BQCgk6Z2eg&oh=00_Afh_GAuqk43L5Lc3uG1RoR4-w3xzPT1kU9p1qmclFqhXDg&oe=69311DCC;Milliyetçi Hareket Partimizin Genel Merkezi’nde düzenlenen “Belediye Başkanları İstişare ve Değerlendirme Toplantısı” sonrası, Genel Başkanımız Sayın Devlet Bahçeli Beyefendi’nin teşrifleriyle, ATO Congresium’da düzenlenen yemek programına katıldık.;;0
https://www.instagram.com/p/DQww9hJDI2P/;Carousel;315;1;0;2025-11-07 19:28:23;https://scontent-iad3-2.cdninstagram.com/v/t51.82787-15/573684262_18537935332020172_424466578910953046_n.jpg?stp=dst-jpg_e35_tt6&_nc_cat=100&ig_cache_key=Mzc2MDcyMTAxNjc5NzMwNTUwNg%3D%3D.3-ccb7-5&ccb=7-5&_nc_sid=58cdad&efg=eyJ2ZW5jb2RlX3RhZyI6InhwaWRzLjE0NDB4MTA4MC5zZHIuQzMifQ%3D%3D&_nc_ohc=t31_w0L6xz4Q7kNvwGfUA-f&_nc_oc=AdlBxb54LuDwwTQSQ4kMNAaRSCTNJJYTkSL12Y5feZzJHUqse100HKKU0jt9QFR78ACLoEyRdDc6yRi8yfkWI8-j&_nc_ad=z-m&_nc_cid=0&_nc_zt=23&_nc_ht=scontent-iad3-2.cdninstagram.com&_nc_gid=xwhCLyVAvat8biqhF8CCaQ&oh=00_Afihv5Ap--D412lAkhI5WQ3N6tLHLMG-akGMtnU5NjGwcA&oe=69310D39;Genel Başkanımız Sayın Devlet Bahçeli Beyefendi’nin himayelerinde, Yerel Yönetimlerden Sorumlu Genel Başkan Yardımcımız Sayın Sadir Durmaz’ın katılımlarıyla, Milliyetçi Hareket Partisi Genel Merkezi’nde düzenlenen “Belediye Başkanları İstişare ve Değerlendirme Toplantısı”na iştirak ettik.  Yerel yönetim çalışmalarına ilişkin değerlendirmelerin yapıldığı toplantıda, şehir yönetimlerinde “Üretken Belediyecilik” anlayışı çerçevesinde yürütülen hizmetler ve gelecek dönem hedefleri ele alındı.  Şehirlerimizi daha yaşanabilir, daha güçlü ve daha üretken kılmak adına, aynı inanç ve kararlılıkla çalışmaya devam edeceğiz.;;0
https://www.instagram.com/p/DQwKZEfjENa/;Reels;1108;34;47343;2025-11-07 13:56:52;https://scontent-iad3-2.cdninstagram.com/v/t51.71878-15/575751590_1199990655279598_9160329821219694305_n.jpg?stp=dst-jpegr_e15_tt6&_nc_cat=103&ig_cache_key=Mzc2MDU1MTM5MjEzMDY0Njg3NA%3D%3D.3-ccb7-5&ccb=7-5&_nc_sid=58cdad&efg=eyJ2ZW5jb2RlX3RhZyI6InhwaWRzLjY0MHgxMTM2Lmhkci5DMyJ9&_nc_ohc=UtJiUvuwq2IQ7kNvwE_lZdb&_nc_oc=AdnOypgbQN1JBNiUPflaARuhwyM5_mOVrofhEWVKzKIw5G78gvTGqeWTR5nlp_3mjZupnvJbExwI5zStm-SFlGSz&_nc_ad=z-m&_nc_cid=0&_nc_zt=23&se=-1&_nc_ht=scontent-iad3-2.cdninstagram.com&_nc_gid=xwhCLyVAvat8biqhF8CCaQ&oh=00_Afjuy2gzxQ0H6PDW2Dsj7eQy_sF4irYqTUaPnPXR-7noZg&oe=693116F3;Değerli Hemşehrilerim,  Güzel Kırklareli’mizin yarınlarını güvence altına alacak olan altyapı projemizin, artık ihale sürecine gelmiş olduğunu sizlerle paylaşmaktan mutluluk duyuyorum.  Çok yakın bir süreçte gerçekleştirilecek ihale sonrasında, Asrın Projesi’ne kazmayı vuruyoruz. İhalenin, İLBANK A.Ş. tarafından yapılacağını da özellikle belirtmek istiyorum.  Biz, kolay olanı değil, zor olanı seçtik. Önce zahmet, sonra rahmet.  Hep birlikte başaracağız. Kırklareli’mize hayırlı, uğurlu olsun. 💙;;0
https://www.instagram.com/p/DQv--ZejGl1/;Photo;245;0;0;2025-11-07 12:11:35;https://scontent-iad3-1.cdninstagram.com/v/t51.82787-15/574769422_18537862948020172_70843054231449430_n.jpg?stp=dst-jpg_e35_tt6&_nc_cat=104&ig_cache_key=Mzc2MDUwMTE4MDcyNDk2MzcwMQ%3D%3D.3-ccb7-5&ccb=7-5&_nc_sid=58cdad&efg=eyJ2ZW5jb2RlX3RhZyI6InhwaWRzLjE0NDB4MTA4MC5zZHIuQzMifQ%3D%3D&_nc_ohc=vUGWbYHcKbIQ7kNvwGFJ6QM&_nc_oc=AdkoNTce_yh-cFkmXpZDFiO2Xy1iphctPgYIxI_xuA1B2eIDcnnGZlbdLCqvZGeyvh1tFJAezg3KjglnoOl7bu4e&_nc_ad=z-m&_nc_cid=0&_nc_zt=23&_nc_ht=scontent-iad3-1.cdninstagram.com&_nc_gid=xwhCLyVAvat8biqhF8CCaQ&oh=00_AfhdYitdSqC1QkyW2qpKTJBOXOHhg-V3HD00AhTJSi_bHA&oe=69310938;"Değerli Hemşehrilerim,  Çevre, Şehircilik ve İklim Değişikliği Bakanlığı Yerel Yönetimler Genel Müdürü Sayın Turan Konak’ı makamında ziyaret ettik.  Kırklareli’mizin geleceğini kurtaracak altyapı projemiz dahilinde bulunan; içme suyu, yağmur suyu ve kanalizasyon çalışmalarımız için gerekli Bakanlık izinlerimizin alındığını, siz değerli hemşehrilerimle paylaşmaktan büyük mutluluk duyuyorum.  Bu süreçte desteklerini esirgemeyen Çevre, Şehircilik ve İklim Değişikliği Bakanımız Sayın Murat Kurum’a ve Yerel Yönetimler Genel Müdürü Sayın Turan Konak’a şükranlarımı sunuyorum. Her şey daha yaşanılabilir bir Kırklareli için. 💙";;0
https://www.instagram.com/p/DQvv-hYDARb/;Reels;2353;125;73828;2025-11-07 10:07:42;https://scontent-iad3-2.cdninstagram.com/v/t51.71878-15/573978623_825471960097733_8683366400461531457_n.jpg?stp=dst-jpg_e15_tt6&_nc_cat=100&ig_cache_key=Mzc2MDQzNTIxODUwODE1Mzk0NzEwNzk2ODc5MTA3NzE2NTg%3D.3-ccb7-5&ccb=7-5&_nc_sid=58cdad&efg=eyJ2ZW5jb2RlX3RhZyI6InhwaWRzLjY0MHgxMTM2LnNkci5DMiJ9&_nc_ohc=5yNm2cgCqJoQ7kNvwFURm6O&_nc_oc=Adk_hKr0eLYZb7Dlzw7qz6aZspsDD8F75PB3DfaEvTuHiawdUubDtk0bj76uuFuYHhwe74tLRlxC_aFN5cCUhOQM&_nc_ad=z-m&_nc_cid=0&_nc_zt=23&_nc_ht=scontent-iad3-2.cdninstagram.com&_nc_gid=xwhCLyVAvat8biqhF8CCaQ&oh=00_AfhBAXexb0uvaBgzcKIxaHKAFChy0-5tbnBQUZmt4JO6Yw&oe=69311BFD;Değerli Hemşehrilerim, Dün, kıymetli basın mensuplarımızla bir araya gelerek 1,5 yıllık görev sürecimizde neler yaptığımızı ve bundan sonra hangi projeleri hayata geçireceğimizi kendileriyle paylaştık. Bilgilendirme toplantımızın ardından gelen soruları içtenlikle yanıtladık.;;0
https://www.instagram.com/p/DQumTHNDsBl/;Reels;1002;5;34313;2025-11-06 23:18:40;https://scontent-iad3-2.cdninstagram.com/v/t51.71878-15/573630413_803918605848984_106333917567501839_n.jpg?stp=dst-jpegr_e15_tt6&_nc_cat=106&ig_cache_key=Mzc2MDExMTE3ODA3MzY4NjExNw%3D%3D.3-ccb7-5&ccb=7-5&_nc_sid=58cdad&efg=eyJ2ZW5jb2RlX3RhZyI6InhwaWRzLjY0MHgxMTM2Lmhkci5DMyJ9&_nc_ohc=WVgTvANzbKQQ7kNvwG9jzRD&_nc_oc=AdmTgX49_cFYHwfSPg3_diYzwit7l-Mz7Ran1JdWZ13b4oTfaLVhKHzQAdSnvcLBPvBp5QWhEWc2HW8ugfOOtCRR&_nc_ad=z-m&_nc_cid=0&_nc_zt=23&se=-1&_nc_ht=scontent-iad3-2.cdninstagram.com&_nc_gid=xwhCLyVAvat8biqhF8CCaQ&oh=00_AfjXHm6r7L9DDv1vhkcNMNQgt6FVZ-r8DX3ZwDNGlP_BzA&oe=69310F67;Değerli Hemşehrilerim, Bu yıl, Kurtuluş Bayramımızı, Türk Hava Kuvvetlerimizin gökyüzündeki gururu SOLOTÜRK’ün gösteri uçuşuyla taçlandırıyoruz. 🇹🇷 Tüm hemşehrilerimi, 11 Kasım Salı günü, saat 16.30’da, Kırklareli Üniversitesi Kayalı Kampüsü’nde bu coşku ve heyecanı birlikte yaşamaya davet ediyorum. 🇹🇷;;0
https://www.instagram.com/p/DQuaJqljGMF/;Reels;1067;29;49674;2025-11-06 21:31:23;https://scontent-iad3-2.cdninstagram.com/v/t51.71878-15/573341632_1129271868947772_2443958162572162857_n.jpg?stp=dst-jpg_e15_tt6&_nc_cat=111&ig_cache_key=Mzc2MDA1Nzc1MjMxMjYzNjE2NQ%3D%3D.3-ccb7-5&ccb=7-5&_nc_sid=58cdad&efg=eyJ2ZW5jb2RlX3RhZyI6InhwaWRzLjY0MHgzNjAuc2RyLkMzIn0%3D&_nc_ohc=jNzXyA4WTe8Q7kNvwG1fS1N&_nc_oc=AdkILimRaZQW55vLlVbgNJXXqXJB4MG6QmXgz7C2rhZhnb1AhzmPT1-0FNyRUlDxwwpbrgO8IHGMlv8BWPr1nqAq&_nc_ad=z-m&_nc_cid=0&_nc_zt=23&_nc_ht=scontent-iad3-2.cdninstagram.com&_nc_gid=xwhCLyVAvat8biqhF8CCaQ&oh=00_AfhsjPGQREhLfKs9wbDMlnk43fvaUyR-fi7Le35XurVtzw&oe=69310657;Değerli Hemşehrilerim, Cumhuriyet Mahallemize kazandıracağımız 5347 metrekarelik alanda, spor tesisimizin çevresinin peyzaj projesini tamamladık. Kırklareli’mize ve Cumhuriyet Mahallemize hayırlı, uğurlu olsun. Her şey daha yaşanılabilir bir Kırklareli için. 💙;;0
https://www.instagram.com/p/DQt4AOCDJma/;Photo;276;0;0;2025-11-06 16:32:11;https://scontent-iad3-1.cdninstagram.com/v/t51.82787-15/574194368_18537683605020172_4213106754912784810_n.jpg?stp=dst-jpg_e35_tt6&_nc_cat=110&ig_cache_key=Mzc1OTkwNzU2OTU5NTYxOTczOA%3D%3D.3-ccb7-5&ccb=7-5&_nc_sid=58cdad&efg=eyJ2ZW5jb2RlX3RhZyI6InhwaWRzLjE0NDB4OTYwLnNkci5DMyJ9&_nc_ohc=szr16y1IwxAQ7kNvwFzSRLr&_nc_oc=AdnAYfVpGyWNxMr3JXYUEypCh8MxCzLAOd64fiFBa-76j0MwzIgzAx-RYaOS0Tmq4X6nO7-TXScRYJEJ8NXGjx44&_nc_ad=z-m&_nc_cid=0&_nc_zt=23&_nc_ht=scontent-iad3-1.cdninstagram.com&_nc_gid=xwhCLyVAvat8biqhF8CCaQ&oh=00_AfjD5mtmAVUIaQJa2jvtOsCkIKa9aBCa8MVVnxrccvabgA&oe=693121CB;Kırklareli’mizin Düşman İşgalinden Kurtuluşunun 103. Yılı vesilesiyle düzenleyeceğimiz etkinliklerimizin davetiyesini, Valimiz Sayın Uğur Turan’a Valilik makamında takdim ettik. Nazik kabulleri ve güzel dilekleri için Sayın Valimize teşekkür ediyorum. Kurtuluş Bayramımız, birlik ve beraberliğimizin simgesi olarak tüm hemşehrilerimize şimdiden kutlu olsun.  🇹🇷;;0
https://www.instagram.com/p/DQtsTTBjB6z/;Photo;416;3;0;2025-11-06 14:49:56;https://scontent-iad3-1.cdninstagram.com/v/t51.82787-15/572491613_18537669664020172_4575238253921368939_n.jpg?stp=dst-jpg_e35_tt6&_nc_cat=101&ig_cache_key=Mzc1OTg1NjEwNDA2NzgzMzUyMw%3D%3D.3-ccb7-5&ccb=7-5&_nc_sid=58cdad&efg=eyJ2ZW5jb2RlX3RhZyI6InhwaWRzLjE0NDB4ODA4LnNkci5DMyJ9&_nc_ohc=B5LgXjlgL0sQ7kNvwEc7iga&_nc_oc=AdmnqmrPn2Ax_09B_YvAi-GaKFDk-pFoNXQpt9iQHQwa7NpIHcMXyF-UEpHw6P6NJcgG_Gaq0nOL28PbP2WSrjvp&_nc_ad=z-m&_nc_cid=0&_nc_zt=23&_nc_ht=scontent-iad3-1.cdninstagram.com&_nc_gid=xwhCLyVAvat8biqhF8CCaQ&oh=00_Afgowxmti71nQrLQw3uPbUrlbXnhBIvJh7yEZdrklOzBdA&oe=6930FBD1;Gençlik ve Spor İl Müdürümüz Emrah Yüksel Babuşçu’yu, Kırklareli Eğitim ve Araştırma Hastanemizde ziyaret ederek kendisine geçmiş olsun dileklerimizi ilettik. Tüm hastalarımıza acil şifalar diliyorum. 💙;;0
https://www.instagram.com/p/DQsCirvjq-S/;Carousel;644;4;0;2025-11-05 23:25:48;https://scontent-iad3-1.cdninstagram.com/v/t51.82787-15/565548070_18537520900020172_8068498248873664480_n.jpg?stp=dst-jpg_e35_tt6&_nc_cat=104&ig_cache_key=Mzc1OTM5MDk1NTM3Njg5NDMyMg%3D%3D.3-ccb7-5&ccb=7-5&_nc_sid=58cdad&efg=eyJ2ZW5jb2RlX3RhZyI6InhwaWRzLjE0NDB4OTU5LnNkci5DMyJ9&_nc_ohc=mUlam15N2D0Q7kNvwF72agp&_nc_oc=AdlJHw6JyU9w6AUqByi5uEeW8lFwViflX7a20SVyC5HsHw1sdMYd4k2ZykQh7lGGvtB_BXoLFnTJWsjN_7duyl8o&_nc_ad=z-m&_nc_cid=0&_nc_zt=23&_nc_ht=scontent-iad3-1.cdninstagram.com&_nc_gid=xwhCLyVAvat8biqhF8CCaQ&oh=00_AfjoSdbladr3iNkm-WlqJVWUGOmSiEgVyUuWxZgcKDCngw&oe=6931150A;Genel Başkanımız Sayın Devlet Bahçeli Beyefendi’nin talimatlarıyla başlatılan #HayırlıGünlerKomşum ve #DerdinDerdimizdir programı kapsamında ilk ziyaretimizi Karakaş Mahallemizde gerçekleştirdik ve Özay ailesinin misafiri olduk. Kıymetli ailemize misafirperverlikleri için teşekkür ederiz.;;0
https://www.instagram.com/p/DQrOmKvjH_S/;Carousel;370;0;0;2025-11-05 15:51:53;https://scontent-iad3-1.cdninstagram.com/v/t51.82787-15/573052952_18537426181020172_3331658459732228543_n.jpg?stp=dst-jpg_e35_tt6&_nc_cat=108&ig_cache_key=Mzc1OTE2MjUwMDc4MTQ5MTAyNA%3D%3D.3-ccb7-5&ccb=7-5&_nc_sid=58cdad&efg=eyJ2ZW5jb2RlX3RhZyI6InhwaWRzLjkwMHg1MDYuc2RyLkMzIn0%3D&_nc_ohc=rDbVT5UuE-AQ7kNvwGz0qok&_nc_oc=Adns5IXvd0__zI5vzn5Rc3neZ9GbVUbuIroNbNgvilXh9RjECV97jW56dDSw3rWaS8wbHSddsoUape-Ye-oAneaV&_nc_ad=z-m&_nc_cid=0&_nc_zt=23&_nc_ht=scontent-iad3-1.cdninstagram.com&_nc_gid=xwhCLyVAvat8biqhF8CCaQ&oh=00_AfjHVhWL7z_k6ysilEqj89e38HCVcPpCQPSgFuRwrhKq5w&oe=69312814;2-8 Kasım Lösemili Çocuklar Haftası dolayısıyla, Lösemili Çocuklar Vakfı (LÖSEV) Kırklareli İl Temsilcisi Sayın Seher Erçek ve beraberindeki kıymetli heyet konuğumuz oldular. Hayata inançla tutunan tüm çocuklarımız için, farkındalık ve dayanışmayı büyütmeye devam edeceğiz.  Her zaman onların yanındayız, her zaman destekçileri olacağız.  💙🧡;;0
https://www.instagram.com/p/DQmlAW4DIsE/;Carousel;453;2;0;2025-11-03 20:31:30;https://scontent-iad3-1.cdninstagram.com/v/t51.82787-15/573535818_18537116593020172_4877279761469715441_n.jpg?stp=dst-jpg_e35_tt6&_nc_cat=102&ig_cache_key=Mzc1Nzg1MzY4MDU5MTQ0MDExMw%3D%3D.3-ccb7-5&ccb=7-5&_nc_sid=58cdad&efg=eyJ2ZW5jb2RlX3RhZyI6InhwaWRzLjc4NXg1MzEuc2RyLkMzIn0%3D&_nc_ohc=K1cWHI4iFDAQ7kNvwGFF92Q&_nc_oc=Adm7P6n9v-oX6490jCPUoR-CFzzj3Ii6pAHyvUvQuEZkiqPaN9LE9seR-lnD6kf-bGLy9IcTZ9T3HqahRdR-fHhW&_nc_ad=z-m&_nc_cid=0&_nc_zt=23&_nc_ht=scontent-iad3-1.cdninstagram.com&_nc_gid=xwhCLyVAvat8biqhF8CCaQ&oh=00_Afhf6TW28LoTwzwZnhGuATXoNaUadV_LDBKTz6Z3aWLJBw&oe=693120A4;Genel Başkanımız Sayın Devlet Bahçeli Beyefendi’nin himayelerinde düzenlenen, gelenek ile geleceği, sözü ve imgeyi buluşturan “Ulu Bozkırın Ruhu – Türk Dünyası Ressamları Cengiz Aytmatov’u Anıyor” temalı uluslararası resim sergisinin açılışına katıldık. Cengiz Aytmatov’un felsefesini ve eserlerini seçkin ressamların fırçalarından yansıtan bu tablolar aracılığıyla, Türk dünyasının ortak kültürünü ve sanatın birleştirici gücünü görmekten büyük bir mutluluk duydum. Köklü mirasımızın geleceğe taşındığı bu anlamlı etkinlikte emeği geçen herkese teşekkür ediyorum.;;0
https://www.instagram.com/p/DQjc5lXDD0g/;Carousel;263;1;0;2025-11-02 15:22:57;https://scontent-iad3-1.cdninstagram.com/v/t51.82787-15/573837752_18536907490020172_8430624659601882881_n.jpg?stp=dst-jpg_e35_tt6&_nc_cat=102&ig_cache_key=Mzc1Njk3MzYwNDMzNzQwNjA5OA%3D%3D.3-ccb7-5&ccb=7-5&_nc_sid=58cdad&efg=eyJ2ZW5jb2RlX3RhZyI6InhwaWRzLjE0NDB4ODgxLnNkci5DMyJ9&_nc_ohc=O_ALStsVb-gQ7kNvwESmjmu&_nc_oc=AdnRfIAroH3onEORjg6I9LPD3NpubaYHU2Vb2_AQhX8gSpV5FI9umta67CYcA3W4Dkk0jkvv6rUTR3cwIwABhSKI&_nc_ad=z-m&_nc_cid=0&_nc_zt=23&_nc_ht=scontent-iad3-1.cdninstagram.com&_nc_gid=xwhCLyVAvat8biqhF8CCaQ&oh=00_AfhZttjM4b3PXGh0o6Os8uyc8aR_T88oCod6146dOFXnQQ&oe=69310CFC;Sultangazi Belediyesi ile Habibler Trakya ve Rumelililer Derneği tarafından düzenlenen Trakya Rumeli ve Balkan Günleri Festivali’ne katıldık.  Vatandaşlarımızla bir araya gelerek, üreticilerimizin stantlarını ziyaret ettik.  Kültürümüzü yaşatan, dayanışmayı büyüten bu anlamlı organizasyonu düzenleyen ve etkinliğe katkı sunan herkese teşekkür ediyorum.;;0
https://www.instagram.com/p/DQgzIinDE0f/;Carousel;372;0;0;2025-11-01 14:39:30;https://scontent.cdninstagram.com/v/t51.82787-15/573807778_18536728255020172_3999433367439315965_n.jpg?stp=dst-jpg_e35_tt6&_nc_cat=109&ig_cache_key=Mzc1NjIyNjk2NTMxMDAzNjc4MQ%3D%3D.3-ccb7-5&ccb=7-5&_nc_sid=58cdad&efg=eyJ2ZW5jb2RlX3RhZyI6InhwaWRzLjE0NDB4ODA4LnNkci5DMyJ9&_nc_ohc=1Bw7JbIgZhsQ7kNvwH9W2rl&_nc_oc=AdnaSfHqg-lxPbpu7kBKFQd3iUSl9i0z5f_FM34JKFFUpG3IHfo37OZvC91KSW-SHlQ&_nc_ad=z-m&_nc_cid=0&_nc_zt=23&_nc_ht=scontent.cdninstagram.com&_nc_gid=7ZmTsYTxfVNV0V-hzLJIQg&oh=00_AfgtTkOplf6ViDXhlrJtUQ0BKcjOq9sJPIT3nuEFeisUZg&oe=693116B1;Kırklareli Eğitim ve Araştırma Hastanesi’nde tedavi gören hastalarımızı ziyaret ettik. Kendilerine geçmiş olsun dileklerimizi ileterek, en kısa sürede sağlıklarına kavuşmalarını temenni ettik.  Tüm hastalarımıza acil şifalar, özveriyle görev yapan sağlık çalışanlarımıza da kolaylıklar diliyorum.;;0
https://www.instagram.com/p/DQe3QjIDPv-/;Carousel;1518;17;0;2025-10-31 20:37:04;https://scontent.cdninstagram.com/v/t51.82787-15/573715154_18536593411020172_1759672161618535694_n.jpg?stp=dst-jpg_e35_tt6&_nc_cat=102&ig_cache_key=Mzc1NTY4MjE2NDYwNDkyODc1Ng%3D%3D.3-ccb7-5&ccb=7-5&_nc_sid=58cdad&efg=eyJ2ZW5jb2RlX3RhZyI6InhwaWRzLjE0NDB4OTYwLnNkci5DMyJ9&_nc_ohc=PEvwm1hxvj0Q7kNvwHVPC0x&_nc_oc=Adn8JhtHL-SLusmGyCEZRXbtGwNVzzadDzuyK9yyS8pBMM1BRo5iyi5cNB9_qN1peLQ&_nc_ad=z-m&_nc_cid=0&_nc_zt=23&_nc_ht=scontent.cdninstagram.com&_nc_gid=7ZmTsYTxfVNV0V-hzLJIQg&oh=00_AfgNN8sPlt0Lclcoc97yrz7zqt-CUA-OXeOLgG6kMVLgEg&oe=6931090E;Dışişleri Bakanımız Sayın Hakan Fidan ile Bakanlığımızda bir araya geldik. Sayın Bakanımıza nazik kabulleri, konularımıza gösterdiği samimi ilgi, yapıcı yaklaşım ve destekleri için şükranlarımı sunuyorum.;;0
https://www.instagram.com/p/DQe1akUjIXB/;Photo;103;0;0;2025-10-31 20:20:58;https://scontent.cdninstagram.com/v/t51.82787-15/573141643_18536590483020172_3149697912960449418_n.jpg?stp=dst-jpg_e35_tt6&_nc_cat=107&ig_cache_key=Mzc1NTY3NDA2MTQ0NDUxNTI2NQ%3D%3D.3-ccb7-5&ccb=7-5&_nc_sid=58cdad&efg=eyJ2ZW5jb2RlX3RhZyI6InhwaWRzLjEzNTB4MTY4OC5zZHIuQzMifQ%3D%3D&_nc_ohc=j0-0HiqVVUgQ7kNvwFVI1sp&_nc_oc=AdmpwQPXCoE_cByL7WA-Ll1NyLRQu-5WGbglA7k1pEiiRTGBO1eYcWdNKs6e0Pg938Y&_nc_ad=z-m&_nc_cid=0&_nc_zt=23&_nc_ht=scontent.cdninstagram.com&_nc_gid=7ZmTsYTxfVNV0V-hzLJIQg&oh=00_AfjZ7yVzgIYejQRZCvsRt0gZnYI0sbOkdfUI7H_wgCwkcA&oe=69310932;Zorlu deplasmandan inançla, azimle ve takım ruhuyla galip dönen Kırklareli Belediyesi FBO Kadın Basketbol Takımımızı yürekten kutluyorum. Bu güzel başarı, şehrimizin sporla büyüyen enerjisinin en güçlü göstergesi! Her birinizle gurur duyuyoruz.  💙❤️;;0
https://www.instagram.com/p/DQeRnAYjOct/;Photo;996;4;0;2025-10-31 15:08:05;https://scontent.cdninstagram.com/v/t51.82787-15/572217986_18536543632020172_6835138102367318717_n.jpg?stp=dst-jpg_e35_tt6&_nc_cat=101&ig_cache_key=Mzc1NTUxNjU4NjUzNTc0MTIyOQ%3D%3D.3-ccb7-5&ccb=7-5&_nc_sid=58cdad&efg=eyJ2ZW5jb2RlX3RhZyI6InhwaWRzLjE0NDB4MTkyMC5zZHIuQzMifQ%3D%3D&_nc_ohc=BqdhjwwNMswQ7kNvwHxRUji&_nc_oc=Adm0-DVuouKg_qQhNeZl4Ty5Q2vCkCHcH4Z_tu7mD4JhG3cIHGWmTr3ZezA2N1EF_uk&_nc_ad=z-m&_nc_cid=0&_nc_zt=23&_nc_ht=scontent.cdninstagram.com&_nc_gid=7ZmTsYTxfVNV0V-hzLJIQg&oh=00_AfgrxLRFJUz2TBo_hkIgAE1z9kNkDTc4thgoG6fGqoGMdQ&oe=69310902;Milliyetçi Hareket Partisi Genel Başkanımız Sayın Devlet Bahçeli Beyefendi’yi makamında ziyaret ederek Kırklareli’mizle ilgili projelerimizi kıymetli görüşlerine sunduk. Şehrimize olan ilgisi, desteği ve hassasiyetleriyle her zaman yanımızda olan Sayın Genel Başkanımıza, nazik kabulleri için en içten teşekkürlerimi ve şükranlarımı sunuyorum.;;0
https://www.instagram.com/p/DQcgFyMji0w/;Reels;554;4;21985;2025-10-30 22:38:26;https://scontent.cdninstagram.com/v/t51.71878-15/571781717_1278129277663793_1884396732056347901_n.jpg?stp=dst-jpg_e15_tt6&_nc_cat=109&ig_cache_key=Mzc1NTAxNzMyNDMwMzYyNTUyMA%3D%3D.3-ccb7-5&ccb=7-5&_nc_sid=58cdad&efg=eyJ2ZW5jb2RlX3RhZyI6InhwaWRzLjY0MHgxMTM2LnNkci5DMyJ9&_nc_ohc=UqgLygkp6LIQ7kNvwGNa5so&_nc_oc=AdmAnZ4cmQjWaUqP9XP3hFANpHBE552h_RJ12kXobZhu8VghDHOy34jpYe-ca7vyIpk&_nc_ad=z-m&_nc_cid=0&_nc_zt=23&_nc_ht=scontent.cdninstagram.com&_nc_gid=7ZmTsYTxfVNV0V-hzLJIQg&oh=00_AfgokqEvKiP0w5JkNQaMa3fkMMj-58v9nFSfdzIEjrhouA&oe=69310A79;Dün akşam, Cumhuriyetimizin 102. yılı coşkusunu, Kırklareli Belediyesi Çocuk Koromuzun büyüleyici konseriyle taçlandırdık. 🇹🇷 Cumhuriyetimizi yaşatan, geleceğe taşıyan çocuklarımızla bir kez daha gurur duydum.  🇹🇷 Konserin ardından, günün ve gecenin yoğun duygusunu sevgili hemşehrilerimle paylaştım…  Yaşasın Türkiye Cumhuriyeti! Yaşasın Aziz Türk Milleti! Ne Mutlu Türk’üm Diyene! 🇹🇷;;0
