PostLink;PostTürü;BeğeniSayısı;YorumSayısı;Görüntülenme Sayısı;Tarih;DisplayPhoto;Caption;Takipçi;TahminMi
https://www.instagram.com/p/DQ37M4nksGR/;Carousel;626;2;0;2025-11-10 14:12:32;https://scontent-ham3-1.cdninstagram.com/v/t39.30808-6/580135781_724014987385365_7700877621498625012_n.jpg?stp=c0.0.1440.959a_dst-jpg_e35_tt6&_nc_cat=100&ig_cache_key=Mzc2MjczNjM1OTQxODI5NTI0OQ%3D%3D.3-ccb7-5&ccb=7-5&_nc_sid=58cdad&efg=eyJ2ZW5jb2RlX3RhZyI6InhwaWRzLjE0NDB4OTYwLnNkci5DMyJ9&_nc_ohc=mVYx96t_tFsQ7kNvwEhv30i&_nc_oc=AdnHRT_q_MZ-BLhuCZ-grmlF2GBnmSogIKYXWY_eaZIKi-jWs-kFWsfpFWHa6eO9MKg&_nc_ad=z-m&_nc_cid=1128&_nc_zt=23&_nc_ht=scontent-ham3-1.cdninstagram.com&_nc_gid=HSfFeDfxSOdDtxDMZ6po5Q&oh=00_Afh456JpdjQATDYCAEwmx3CrcpSeGpH6w7uwPjt7O5B8Pg&oe=693101DF;📍Canpolat Paşa Gençlik Merkezi   10 Kasım’a özel olarak düzenlenen “Mavi Gözün İzinde” resim sergisinde, öğrencilerimizin Atatürk sevgisini ve duygu dolu eserlerini gururla izledik. 🇹🇷  Ulu Önderimiz Mustafa Kemal Atatürk’ü saygı, sevgi ve özlemle anıyoruz. 🤍;;0
https://www.instagram.com/p/DQ30Fq4FSjb/;Carousel;521;1;0;2025-11-10 13:10:23;https://scontent-ham3-1.cdninstagram.com/v/t39.30808-6/581504748_724013517385512_4039461405007211280_n.jpg?stp=c0.0.1440.959a_dst-jpg_e35_tt6&_nc_cat=109&ig_cache_key=Mzc2MjcwNTA4NDMwNTQ2ODA0Mg%3D%3D.3-ccb7-5&ccb=7-5&_nc_sid=58cdad&efg=eyJ2ZW5jb2RlX3RhZyI6InhwaWRzLjE0NDB4OTYwLnNkci5DMyJ9&_nc_ohc=Cc36SDyj1x0Q7kNvwGuiMUo&_nc_oc=Admz67KFeeEzLaE0MNga6_8K4oNVanTxidL2rJpz35rKHXCOZ3a4nUj7XQ-1bJqW4wE&_nc_ad=z-m&_nc_cid=1128&_nc_zt=23&_nc_ht=scontent-ham3-1.cdninstagram.com&_nc_gid=HSfFeDfxSOdDtxDMZ6po5Q&oh=00_AfhxkC4-oiQjWSDvQwW2F70esDC-dg3bC8CrQCJDay-cEA&oe=6931052A;Alâeddin Yavaşca Kültür Merkezinde düzenlenen Atatürk’ü Anma Programına katıldık.  Ulu Önderimizi saygı, sevgi ve minnetle anıyoruz. 🇹🇷🤍;;0
https://www.instagram.com/p/DQ3qfgpDn9t/;Carousel;659;2;0;2025-11-10 11:46:32;https://scontent-ham3-1.cdninstagram.com/v/t39.30808-6/577354261_724010650719132_3119333989802614576_n.jpg?stp=c0.0.1440.959a_dst-jpg_e35_tt6&_nc_cat=102&ig_cache_key=Mzc2MjY2Mjg3ODU5MjU1NjM5NA%3D%3D.3-ccb7-5&ccb=7-5&_nc_sid=58cdad&efg=eyJ2ZW5jb2RlX3RhZyI6InhwaWRzLjE0NDB4OTYwLnNkci5DMyJ9&_nc_ohc=T3weQo3Dh9YQ7kNvwHSlnsI&_nc_oc=AdnEo63d-e28f-3Xht-AWFhOpc9eW0xvIw1JSbxs97gNA9cbQB8qf28Zk6gWeR0gI4I&_nc_ad=z-m&_nc_cid=1128&_nc_zt=23&_nc_ht=scontent-ham3-1.cdninstagram.com&_nc_gid=HSfFeDfxSOdDtxDMZ6po5Q&oh=00_Afhj6MzvRka19zFzOXs4yUfTLtXloVWEX7VDTCfEYTRB7A&oe=693104FC;Cumhuriyetimizin kurucusu Gazi Mustafa Kemal Atatürk'ü anma programı münasebetiyle çelenk sunma törenimizi gerçekleştirdik.  Cumhuriyetimizin kurucusu Gazi Mustafa Kemal Atatürk’ü, vefatının 87. yıl dönümünde saygıyla anıyorum.  #10Kasım;;0
https://www.instagram.com/p/DQ3TotdEhD2/;Reels;1324;24;52526;2025-11-10 08:31:16;https://scontent-ham3-1.cdninstagram.com/v/t51.82787-15/576582161_18050604590654757_8921389997415161452_n.jpg?stp=dst-jpg_e15_tt6&_nc_cat=103&ig_cache_key=Mzc2MjU2MjM3NDE2MDIyNDUwMg%3D%3D.3-ccb7-5&ccb=7-5&_nc_sid=58cdad&efg=eyJ2ZW5jb2RlX3RhZyI6InhwaWRzLjEyMTV4MjE2MC5zZHIuQzMifQ%3D%3D&_nc_ohc=MvIegXqhWgIQ7kNvwGIMgIs&_nc_oc=AdlkW2IqeraKfKMlSssplL_vx6E1B1WojmScX7xkBCaFVw-wS4uGUxwXdM0GEccAhEE&_nc_ad=z-m&_nc_cid=1128&_nc_zt=23&_nc_ht=scontent-ham3-1.cdninstagram.com&_nc_gid=HSfFeDfxSOdDtxDMZ6po5Q&oh=00_Afi5CmC0_kzb5ZB0qyldNxuSRmLmj_XKol-EnpBD7yLmiw&oe=6931353E;🇹🇷 ATAMIZIN İZİNDE…  Her gün, her görevde, her adımda onun ışığında çalışıyoruz. Cesaretle, emekle, eşitlikle, ileriyi hedefleyerek…  Bugün, bizi biz yapan değerleri hatırlıyor, sonsuz saygı ve minnetle Atamızı anıyoruz. 🤍;;0
https://www.instagram.com/p/DQ2RdEFEgRx/;Reels;1345;26;54797;2025-11-09 22:54:16;https://scontent-ham3-1.cdninstagram.com/v/t51.82787-15/574729565_18050569232654757_1537876017149189884_n.jpg?stp=dst-jpg_e15_tt6&_nc_cat=109&ig_cache_key=Mzc2MjI3MTMwMjc1MDE3NjM2OQ%3D%3D.3-ccb7-5&ccb=7-5&_nc_sid=58cdad&efg=eyJ2ZW5jb2RlX3RhZyI6InhwaWRzLjEyMTV4MjE2MC5zZHIuQzMifQ%3D%3D&_nc_ohc=fuaHSE3sAuUQ7kNvwFB5oZV&_nc_oc=Adl5CV6yw4fr1MCgZHQzJDOY7UPYIcPIlGBI2-ZLBfsEHVtGG2r6Oh2ujjeZaPg3UFU&_nc_ad=z-m&_nc_cid=1128&_nc_zt=23&_nc_ht=scontent-ham3-1.cdninstagram.com&_nc_gid=HSfFeDfxSOdDtxDMZ6po5Q&oh=00_AfiH8vXqeJEXVPBFqKJq9blOvCbMhR8OhyYuTxZVgLm-4Q&oe=693103FE;“On Eserle Onsuz Kasım” dinletisinde hemşehrilerimizle bir aradaydık.  Cumhuriyetimizin kurucusu Gazi Mustafa Kemal Atatürk’ü saygı ve özlemle andığımız bu anlamlı gecede, kalplerimize dokunan ezgiler için tüm sanatçılarımıza teşekkür ediyorum. 🎶❤️;;0
https://www.instagram.com/p/DQuf5X1gLYs/;Carousel;315;2;0;2025-11-06 22:20:47;https://scontent-ham3-1.cdninstagram.com/v/t39.30808-6/577024986_720942294359301_3280160121744992028_n.jpg?stp=c0.1.1440.982a_dst-jpg_e35_tt6&_nc_cat=109&ig_cache_key=Mzc2MDA4MzAwMzA3MDQ5Nzg1NA%3D%3D.3-ccb7-5&ccb=7-5&_nc_sid=58cdad&efg=eyJ2ZW5jb2RlX3RhZyI6InhwaWRzLjE0NDB4OTg0LnNkci5DMyJ9&_nc_ohc=--l_bJr4XZMQ7kNvwGCGO2X&_nc_oc=AdlRUqhDj_qJ86SLQSFtbCqS3ljczhhbqnmglr-eLWh8lRjJUWXjElwZtFKCr3i1LIw&_nc_ad=z-m&_nc_cid=1128&_nc_zt=23&_nc_ht=scontent-ham3-1.cdninstagram.com&_nc_gid=HSfFeDfxSOdDtxDMZ6po5Q&oh=00_AfgE90GQWujjPhw9WYWtlKYZLtaCF_aTd2Wl2mF0l2gGAw&oe=69311EA1;Kilis için bir aradayız! 🤝  Valimiz Sayın Tahir Şahin, milletvekillerimiz Sayın Ahmet Salih Dal ve Sayın Mustafa Demir ile birlikte, Çevre, Şehircilik ve İklim Değişikliği Bakanımız Sayın Murat Kurum’u ziyaret ettik.  Şehrimizin sorunlarını çözmek, ihtiyaçlarını karşılamak ve Kilis’i daha yaşanabilir bir şehir haline getirmek için ortak akılla hareket ediyoruz.  Şehrimizin sorunlarıyla yakından ilgilenen Sayın Cumhurbaşkanımıza ve Sayın Bakanımıza şehrim adına teşekkür ediyorum.  Birlik ve dayanışmayla, Kilis için güçlü adımlar atmaya devam edeceğiz. 🌿🏙️🇹🇷;;0
https://www.instagram.com/p/DQtqSJ0jiA0/;Photo;519;10;0;2025-11-06 14:32:19;https://scontent-ham3-1.cdninstagram.com/v/t39.30808-6/577889272_720660647720799_5395407222656754656_n.jpg?stp=dst-jpg_e35_tt6&_nc_cat=108&ig_cache_key=Mzc1OTg0NzIyOTM3MzY4NTgxMg%3D%3D.3-ccb7-5&ccb=7-5&_nc_sid=58cdad&efg=eyJ2ZW5jb2RlX3RhZyI6InhwaWRzLjEyMDl4MTA4MC5zZHIuQzMifQ%3D%3D&_nc_ohc=HzCk17VQx8MQ7kNvwHvc6We&_nc_oc=AdkXpGJBs5JBCMsl96-EX4MyxU6enjsLbrBp9dMUIh2PHLFQGwwbfUWK_HY1Nprd4co&_nc_ad=z-m&_nc_cid=1128&_nc_zt=23&_nc_ht=scontent-ham3-1.cdninstagram.com&_nc_gid=HSfFeDfxSOdDtxDMZ6po5Q&oh=00_AfiHfU8opSD6j-mYtA9xbY4z0mbL9BMXifstHfcapiJMFg&oe=69310CC3;📍Valimiz Sayın Tahir Şahin ile birlikte milletvekillerimiz Sayın Ahmet Salih Dal ve Sayın Mustafa Demir’i ziyaret ettik.  Kilis’i ve şehrimizin öncelikli sorunlarını ele alarak çözüm odaklı değerlendirmelerde bulunduk.  Kilis’in geleceği için iş birliğiyle çalışmaya devam ediyoruz. 💪🇹🇷;;0
https://www.instagram.com/p/DQqxUUtiWHF/;Carousel;552;4;0;2025-11-05 11:36:03;https://scontent-ham3-1.cdninstagram.com/v/t39.30808-6/574852138_719680741152123_5932833961770180141_n.jpg?stp=c0.1.1440.958a_dst-jpg_e35_tt6&_nc_cat=101&ig_cache_key=Mzc1OTAzMzcyNzE3NTk5MDMwOA%3D%3D.3-ccb7-5&ccb=7-5&_nc_sid=58cdad&efg=eyJ2ZW5jb2RlX3RhZyI6InhwaWRzLjE0NDB4OTYwLnNkci5DMyJ9&_nc_ohc=fUZP-AT093EQ7kNvwGytWqc&_nc_oc=Adl_1Fq-VsVRmbgEyrjw2tgxC5ONsFEalbuxZWbDScrT8lUWj2xfXhtD7uNMNmVyF10&_nc_ad=z-m&_nc_cid=1128&_nc_zt=23&_nc_ht=scontent-ham3-1.cdninstagram.com&_nc_gid=HSfFeDfxSOdDtxDMZ6po5Q&oh=00_Afgg2YuRPJlHneuEfsZwJXfSswG9rpZHQyR7tyB15_4jYQ&oe=69310758;Günün ilk enerjisini Sanayi esnafımızla yaptığımız kahvaltıda aldık ☕🍞 Hem sohbet ettik hem de güzel fikirler paylaştık. Emek veren tüm esnafımıza teşekkür ediyorum.;;0
https://www.instagram.com/p/DQi1hmWDfzV/;Photo;272;1;0;2025-11-02 09:38:54;https://scontent-ham3-1.cdninstagram.com/v/t39.30808-6/574975720_717072924746238_6501440792640994479_n.jpg?stp=dst-jpg_e35_tt6&_nc_cat=101&ig_cache_key=Mzc1NjgwMDQ0NDU2MDQ0MDUzMw%3D%3D.3-ccb7-5&ccb=7-5&_nc_sid=58cdad&efg=eyJ2ZW5jb2RlX3RhZyI6InhwaWRzLjE0NDB4MTA4MC5zZHIuQzMifQ%3D%3D&_nc_ohc=HEz1c0l3iKMQ7kNvwHVQbJf&_nc_oc=Adl0PlOal7ELhVIpn-0NCRQLGtR3R9Twfx3gwgMMbp3Vt1gHxGYJ5llCMhL08EmW6j8&_nc_ad=z-m&_nc_cid=1128&_nc_zt=23&_nc_ht=scontent-ham3-1.cdninstagram.com&_nc_gid=HSfFeDfxSOdDtxDMZ6po5Q&oh=00_AfieDBkezHFYIBQLzUOUxkJJWZdDc8fEizNGn32m5CO-PA&oe=693126F4;💪 ÇINARLI GENÇLİK SPOR’DAN SEZONUN İLK GALİBİYETİ  Takımımız, Nevşehir Derinkuyu Gücü karşısında üstün bir performans sergileyerek 3–0’lık net bir galibiyet aldı. ⚽🔥  Teknik ekibimizi ve sahada yüreğini ortaya koyan tüm futbolcularımızı tebrik ediyorum. Sezonun geri kalanında da aynı azim ve kararlılıkla başarılar diliyorum.;;0
https://www.instagram.com/p/DQeoR1CjD_E/;Photo;282;1;0;2025-10-31 18:26:11;https://scontent-ham3-1.cdninstagram.com/v/t39.30808-6/574887970_715662661553931_2599445532707106806_n.jpg?stp=dst-jpg_e35_tt6&_nc_cat=109&ig_cache_key=Mzc1NTYxNjI4NjMxNjE4MzQ5Mg%3D%3D.3-ccb7-5&ccb=7-5&_nc_sid=58cdad&efg=eyJ2ZW5jb2RlX3RhZyI6InhwaWRzLjE0NDB4OTYwLnNkci5DMyJ9&_nc_ohc=i8DnKey0WgAQ7kNvwGFuGdE&_nc_oc=Adn2lZR89DBQfUTXBwA_IlBUEbs1shoj7dkD_7Umbf5bkPe_85vIub9yoIw-Vj2SKJs&_nc_ad=z-m&_nc_cid=1128&_nc_zt=23&_nc_ht=scontent-ham3-1.cdninstagram.com&_nc_gid=HSfFeDfxSOdDtxDMZ6po5Q&oh=00_Afh7ZrPxRQpFKglimosXSx-FOJ4xVCBpQYUoC-4ElP-FRg&oe=6931006E;Cumhuriyet Halk Partisi İl Başkanlığına seçilen değerli kardeşim Av. Umut Sapan’a, belediye meclis üyelerimizle birlikte hayırlı olsun ziyaretinde bulunduk.  Yeni görevinde başarılar diliyor, şehrimiz ve partimiz adına hayırlı olmasını temenni ediyorum.;;0
https://www.instagram.com/p/DQeVbF5isu3/;Reels;2562;54;101358;2025-10-31 15:43:17;https://scontent-ham3-1.cdninstagram.com/v/t51.82787-15/573679028_18049616753654757_8175186806660355534_n.jpg?stp=dst-jpg_e15_tt6&_nc_cat=102&ig_cache_key=Mzc1NTUzMzM2MDAxMDI4Mzk1OTE4MDQ5NjE2NzQ3NjU0NzU3.3-ccb7-5&ccb=7-5&_nc_sid=58cdad&efg=eyJ2ZW5jb2RlX3RhZyI6InhwaWRzLjExNTJ4MjA0OC5zZHIuQzMifQ%3D%3D&_nc_ohc=AVEVj3PX37gQ7kNvwHaz8eW&_nc_oc=Adnn7J6KWgmdsIbBxzPwtEYlzIbEtvT3iYuRbTlAKHBIuFkdy5934ooOqUpZuM6XlZU&_nc_ad=z-m&_nc_cid=1128&_nc_zt=23&_nc_ht=scontent-ham3-1.cdninstagram.com&_nc_gid=HSfFeDfxSOdDtxDMZ6po5Q&oh=00_AfijMfIrBugTaIuQJmhl0RRGTLCd1eWjMAD5019NTkIk4Q&oe=69310753;📍Cumhuriyet Caddesi esnafımızı ziyaret ettik.   Her zaman olduğu gibi vatandaşlarımızın görüşlerini dinleyip birlikte çözüm aradık.   Huzurlu ve bereketli bir Kilis için çalışmaya devam.;;0
