PostLink;PostTürü;BeğeniSayısı;YorumSayısı;Görüntülenme Sayısı;Tarih;DisplayPhoto;Caption;Takipçi;TahminMi
https://www.instagram.com/p/DRhbNnmDIIu/;Reels;2003;71;75547;2025-11-26 17:03:32;https://scontent-lga3-3.cdninstagram.com/v/t51.71878-15/587035898_695268920315580_2941831099232937921_n.jpg?stp=dst-jpg_e15_tt6&_nc_cat=108&ig_cache_key=Mzc3NDQxNzY0NTgzNjQ2ODc4Mg%3D%3D.3-ccb7-5&ccb=7-5&_nc_sid=58cdad&efg=eyJ2ZW5jb2RlX3RhZyI6InhwaWRzLjY0MHgxMTM2LnNkci5DMyJ9&_nc_ohc=kSfvjZTrfJQQ7kNvwFEU77b&_nc_oc=AdntcGkvadSHybudH9x8rwPFbEElQBHgZXOuUT1jGL9_EiDvWsn5NXdf400sXuyaQA2EVz_DqM82qn2R0-QWdVSe&_nc_ad=z-m&_nc_cid=0&_nc_zt=23&_nc_ht=scontent-lga3-3.cdninstagram.com&_nc_gid=adJgvPU2nTx8MWWYztbwkg&oh=00_AfildBzMUmtXli5__OQORHF79MqErRg58l8577--cS7EMA&oe=69312C37;"Çocuklarımızın emri başımızın üstüne… 💐 Bugün belediyemizin gerçek sahiplerini, geleceğimizin mimarı olan evlatlarımızı ağırladık. İlerleyen yıllarda ise biz onların misafiri olacağız; daha güzel bir şehirde, daha umutlu bir gelecekte…  Onlar için çalışmaya, üretmeye ve şehrimizi birlikte büyütmeye devam edeceğiz.";57954.0;0
https://www.instagram.com/p/DRfITZ4jvxa/;Carousel;776;2;0;2025-11-25 19:37:24;https://scontent-lga3-2.cdninstagram.com/v/t39.30808-6/589601195_736079339512263_3642544312571231636_n.jpg?stp=dst-jpg_e35_tt6&_nc_cat=101&ig_cache_key=Mzc3Mzc3MTUxMzQ1NjQyMjc4OQ%3D%3D.3-ccb7-5&ccb=7-5&_nc_sid=58cdad&efg=eyJ2ZW5jb2RlX3RhZyI6InhwaWRzLjEyODB4ODU0LnNkci5DMyJ9&_nc_ohc=d9DHeEXmD6kQ7kNvwFIlchd&_nc_oc=AdlwQZwN_GMnT73mo-p57WO4m9eGf4XJT74s5W8C-Qe8eTM93t5fVETGmhbmKmdYJkcTcQ041CB0dgViJ5G7uwgr&_nc_ad=z-m&_nc_cid=0&_nc_zt=23&_nc_ht=scontent-lga3-2.cdninstagram.com&_nc_gid=adJgvPU2nTx8MWWYztbwkg&oh=00_AfhcHhwP3BxO2Lyn3ZydXs9Pr663rj9FSVVmKO8YYY4FRg&oe=69311288;📍Genç çiftlerimizin nikâh akitlerini gerçekleştirdik.  Bu özel günde onların mutluluklarına şahitlik etmek bizim için büyük bir onur.Bir ömür boyu huzur, muhabbet ve birlik diliyorum.  Rabbim mesut etsin. ❤️;;0
https://www.instagram.com/p/DRcrYGajnI_/;Photo;214;2;0;2025-11-24 20:46:10;https://scontent-lga3-1.cdninstagram.com/v/t39.30808-6/586159254_735360552917475_6073298112835390602_n.jpg?stp=dst-jpg_e35_tt6&_nc_cat=103&ig_cache_key=Mzc3MzA4MTM1OTk4NTA0NjA3OQ%3D%3D.3-ccb7-5&ccb=7-5&_nc_sid=58cdad&efg=eyJ2ZW5jb2RlX3RhZyI6InhwaWRzLjIwNDh4MTUzNi5zZHIuQzMifQ%3D%3D&_nc_ohc=EcBkYPw782sQ7kNvwGgdo5A&_nc_oc=Adnb9f8yQNXtoQ6ncRFGaB3ZD29lj4asDg1uiuYI68zpX4R6UdejbJkk0prTetnqRx3VDheHCToB4E8451EWS-dY&_nc_ad=z-m&_nc_cid=0&_nc_zt=23&_nc_ht=scontent-lga3-1.cdninstagram.com&_nc_gid=adJgvPU2nTx8MWWYztbwkg&oh=00_Afjo9FWI9vvwinDEZPpkmU5I9zoPwZIXETqOXDv9NRxTHg&oe=69311761;Haftaya dolu dolu bir başlangıç! 🤝✨  Cumhuriyet Halk Partisi İl Başkanımız Av. Umut Sapan, Merkez İlçe Başkanımız Ahmet Geloglu ve Belediye meclis üyelerimiz ile bir araya gelerek hem istişare toplantımızı yaptık hem de memleket üzerine güzel sohbetler ettik.  Birlikte konuşuyor, birlikte üretiyor, birlikte güçleniyoruz. 💪🇹🇷;;0
https://www.instagram.com/p/DRcNREmEnSa/;Reels;1307;42;39073;2025-11-24 16:27:59;https://scontent-lga3-3.cdninstagram.com/v/t51.82787-15/586060988_18052073672654757_3414490108541117457_n.jpg?stp=dst-jpg_e15_tt6&_nc_cat=104&ig_cache_key=Mzc3Mjk0ODkzNTU5OTA5Mjg5MA%3D%3D.3-ccb7-5&ccb=7-5&_nc_sid=58cdad&efg=eyJ2ZW5jb2RlX3RhZyI6InhwaWRzLjEyMTV4MjE2MC5zZHIuQzMifQ%3D%3D&_nc_ohc=CdrG7wQdmksQ7kNvwF3pZnx&_nc_oc=AdnrHMFr8AZqK4dLnOMiapBHd0o-Chj_K42VoZ_pNPo6M2JVuWG_jJeJh7kC4y3UjQ-lkQreO7rLoY2L-JZvTaVp&_nc_ad=z-m&_nc_cid=0&_nc_zt=23&_nc_ht=scontent-lga3-3.cdninstagram.com&_nc_gid=adJgvPU2nTx8MWWYztbwkg&oh=00_AfikClhEgyXq9ZGdTTGu_XX29Cnn7QEd2p-fnEvVL-ulxQ&oe=6930FFEB;Şehit öğretmen kardeşlerim, sizleri ve aziz hatıralarınızı unutturmayacağız...  24 Kasım Öğretmenler Gününüz kutlu olsun.;;0
https://www.instagram.com/p/DRb9fJ1jktY/;Carousel;727;11;0;2025-11-24 14:05:10;https://scontent-lga3-3.cdninstagram.com/v/t39.30808-6/588724817_735118742941656_5937494735108294198_n.jpg?stp=dst-jpg_e35_tt6&_nc_cat=108&ig_cache_key=Mzc3Mjg3OTUxOTExMjY0MzI3OQ%3D%3D.3-ccb7-5&ccb=7-5&_nc_sid=58cdad&efg=eyJ2ZW5jb2RlX3RhZyI6InhwaWRzLjEyODB4ODU0LnNkci5DMyJ9&_nc_ohc=mwKinwWJnXMQ7kNvwEVIweV&_nc_oc=AdkKYhYrXWePz6G2nmC8cG131sw9zBW_nmK9dpL71pBS4RaujkI7UfwdpfDjNgxCzlKMphGlDaH3yzmA5-vwrRqM&_nc_ad=z-m&_nc_cid=0&_nc_zt=23&_nc_ht=scontent-lga3-3.cdninstagram.com&_nc_gid=adJgvPU2nTx8MWWYztbwkg&oh=00_AfhLbxDLg41YRK7QhUC14gv7sDguz9mocc6r-F-Ub59c-A&oe=693129A1;"Açtığın yolda, gösterdiğin hedefte…  Cumhuriyet’in güçlü, üretken ve ilham veren kadınlarını anlatan Cumhuriyet Kadınları Sergisi kapılarını açtı! 🇹🇷  Her bir eser; emekle, umutla ve Atatürk’ün izinde yürüyen kadınların hikâyesini taşıyor. Sanata, Cumhuriyet’e ve kadınlara gönül veren herkesi bu özel sergiye bekliyoruz. ✨💫";;0
https://www.instagram.com/p/DRZOSgHjOZD/;Reels;441;6;39138;2025-11-23 12:54:42;https://scontent-lga3-3.cdninstagram.com/v/t51.71878-15/587193606_9732345116890104_5875435114659501113_n.jpg?stp=dst-jpg_e15_tt6&_nc_cat=104&ig_cache_key=Mzc3MjEwOTAwNjk4NzY1MDYyNw%3D%3D.3-ccb7-5&ccb=7-5&_nc_sid=58cdad&efg=eyJ2ZW5jb2RlX3RhZyI6InhwaWRzLjY0MHgxMTM2LnNkci5DMyJ9&_nc_ohc=FHfIK1x1-ucQ7kNvwFK7D67&_nc_oc=AdmGCMyCd0oSkJiRIuIGP6JN-dbHMvNGEgy3NXyh7FopcA1Ck5y28v_EIByWCM11UNP4yAFtaerhsVNtuv5VKJCM&_nc_ad=z-m&_nc_cid=0&_nc_zt=23&_nc_ht=scontent-lga3-3.cdninstagram.com&_nc_gid=adJgvPU2nTx8MWWYztbwkg&oh=00_AfjzvStUpug51J6-YHmzkyMfXGITiAkgRV-k6J27FdhtKQ&oe=6931003E;📍Şehrimizde gerçekleşen mitingi vatandaşımıza sorduk…  Sahada nabzı tuttuk, mikrofonu hem esnafa hem vatandaşa uzattık.  Herkesin ortak beklentisi belli: Daha canlı bir şehir, daha hareketli bir ekonomi, daha güçlü bir esnaf.  Biz de tam bunun için buradayız.Her adımımız, her etkinliğimiz, her organizasyonumuz şehrimize değer katsın, esnafımıza kazanç olsun diye.  ✅Ne yapıyorsak, şehrimiz ve esnafımız fayda görsün diye yapıyoruz.;;0
https://www.instagram.com/p/DRXg1zSjAMV/;Photo;166;0;0;2025-11-22 20:37:54;https://scontent-lga3-3.cdninstagram.com/v/t51.82787-15/587816783_18051887144654757_5758509318706788633_n.jpg?stp=dst-jpg_e35_tt6&_nc_cat=106&ig_cache_key=Mzc3MTYyNzY0NzYzODcwMDgyMQ%3D%3D.3-ccb7-5&ccb=7-5&_nc_sid=58cdad&efg=eyJ2ZW5jb2RlX3RhZyI6InhwaWRzLjE0NDB4MTAxNC5zZHIuQzMifQ%3D%3D&_nc_ohc=st5JEXiL8UUQ7kNvwEFzLv3&_nc_oc=AdlnMa8gF4KUqAhOCVq6OKa4vgdAKIhsIrfRRdwxridt7Hc3PewxYKRzAw_dAIGz8tJMlCum6S5W92pOF8V9rhEG&_nc_ad=z-m&_nc_cid=0&_nc_zt=23&_nc_ht=scontent-lga3-3.cdninstagram.com&_nc_gid=adJgvPU2nTx8MWWYztbwkg&oh=00_AfjFkA1o9euOQoN7vA7IG5rIhuiLpU6jp8OcKZMnCJ2qMg&oe=693113D2;"Söğütlüdere Mesire Alanımızda; çim ekimi, ağaç budama ve bitkilendirme çalışmalarımızı başlatıyoruz. Sizlerin daha keyifli, daha yeşil ve huzurlu bir ortamda vakit geçirebilmeniz için alanımız 10 gün süreyle piknik kullanımına kapatılmıştır.  Bu süre boyunca Söğütlüdere Restoranımız sizlere hizmet vermeye devam edecektir.  Daha güzel günlerde buluşmak dileğiyle… Anlayışınız için teşekkür ederiz.";;0
https://www.instagram.com/p/DRWkhrUjQUX/;Carousel;569;4;0;2025-11-22 11:50:51;https://scontent-lga3-3.cdninstagram.com/v/t39.30808-6/588696159_733474856439378_5234593254791460911_n.jpg?stp=dst-jpg_e35_tt6&_nc_cat=106&ig_cache_key=Mzc3MTM2MjM3MzgyNDAxMjEyNw%3D%3D.3-ccb7-5&ccb=7-5&_nc_sid=58cdad&efg=eyJ2ZW5jb2RlX3RhZyI6InhwaWRzLjEwODB4MTM1MS5zZHIuQzMifQ%3D%3D&_nc_ohc=P_q9FXEC3FYQ7kNvwF7q_Ak&_nc_oc=AdkHaY_8CBnBwiD-GNEAaFiJvaCQHl3nwJNvuLUq-E72IQAOSfUzXmm_dBulyXPpq7s4gCJ8tJx6PvJYz8Ts4lOo&_nc_ad=z-m&_nc_cid=0&_nc_zt=23&_nc_ht=scontent-lga3-3.cdninstagram.com&_nc_gid=adJgvPU2nTx8MWWYztbwkg&oh=00_AfhSchWAErJJA6w1ToX2X1Iy32Eh_aw_adO8Po3gYd-AOg&oe=6931367B;Birleşmiş Milletler Kalkınma Programı (UNDP) ile yaptığımız görüşmede, Kilis’te hayata geçirilen Dijital Gençlik Merkezi (DİGEM) projemizin son durumunu değerlendirdik. Gençlerimizin yapay zekâ ve çeşitli teknolojik alanlarda eğitim alarak nitelikli meslekler edinmesini hedefleyen bu önemli yatırımın ilerleme sürecini ele aldık. İnşaat süreci önümüzdeki günlerde başlayacağı haberini kıymetli hemşehrilerime sunarız.   Ayrıca, Birleşmiş Milletler hibesiyle kurulacak olan yeni Atık Ayrıştırma Tesisi’nin mevcut durumu ve yapılacak çalışmalar üzerine kapsamlı bir değerlendirme gerçekleştirdik.  Ayrıca şehrimizdeki kadınların ekonomik ve sosyal hayata daha güçlü katılımını sağlamak amacıyla, kadın meslek edindirme merkezlerimizin yeniden faaliyete geçirilmesine ilişkin son derece verimli bir görüşme yaptık.;;0
https://www.instagram.com/p/DRUl5b3jHMp/;Photo;1800;20;0;2025-11-21 17:24:21;https://scontent-lga3-1.cdninstagram.com/v/t51.82787-15/584248828_18051765125654757_4011930072632352452_n.jpg?stp=dst-jpg_e35_tt6&_nc_cat=103&ig_cache_key=Mzc3MDgwNTQ2MjY3MDAxMzIyNQ%3D%3D.3-ccb7-5&ccb=7-5&_nc_sid=58cdad&efg=eyJ2ZW5jb2RlX3RhZyI6InhwaWRzLjE0NDB4MTkyMC5zZHIuQzMifQ%3D%3D&_nc_ohc=ConQryBt3uUQ7kNvwGmoSzJ&_nc_oc=Adm8PoXNtPTgGstQoB1SLHzrFXv_GjGuMPPEVNyq0gylH8CPhFkik4L5Nr8i6C-Iaskc0RmHhnFjUQQfR71Nes1n&_nc_ad=z-m&_nc_cid=0&_nc_zt=23&_nc_ht=scontent-lga3-1.cdninstagram.com&_nc_gid=adJgvPU2nTx8MWWYztbwkg&oh=00_AfgjH9xOD0l7pGkFw_xg0KZNV_9dZT3blY6poYaBdrMqeA&oe=693115DD;İsveç büyükelçisi Malena Mård ile Kilis’te içme suyu altyapısının revizyonu ve kayıp-kaçak oranlarını azaltmaya yönelik kurulacak yeni teknolojik sistemin finansmanı hakkında verimli bir görüşme gerçekleştirdik.;;0
https://www.instagram.com/p/DRMbSFmks9l/;Reels;1386;37;38889;2025-11-18 13:21:54;https://scontent-lga3-2.cdninstagram.com/v/t51.82787-15/581533040_18051422315654757_8022809268097490462_n.jpg?stp=dst-jpg_e15_tt6&_nc_cat=105&ig_cache_key=Mzc2ODUwNjk3ODQyNDUwODI2MQ%3D%3D.3-ccb7-5&ccb=7-5&_nc_sid=58cdad&efg=eyJ2ZW5jb2RlX3RhZyI6InhwaWRzLjE0NDB4MTQ0MC5zZHIuQzMifQ%3D%3D&_nc_ohc=rqdS7BvfpmYQ7kNvwEgMeFE&_nc_oc=AdlmCzYgd3XTJYOHk6gNbcX-lWy3zwiY8KoHAT4frmKIsXVKYamiUF9aXgt5kyfBlXb90dIWUp326vMDMM7aYPex&_nc_ad=z-m&_nc_cid=0&_nc_zt=23&_nc_ht=scontent-lga3-2.cdninstagram.com&_nc_gid=adJgvPU2nTx8MWWYztbwkg&oh=00_AfjO_ZDZx30C9HpuhTQX1SHz73y_XRQ_Dphr6F4upRo2pg&oe=69312E4F;Türkiye’nin Çaresi Genel Başkanımız Özgür Özel’i ve Ankara’nın gururu Mansur Yavaş’ı şehrimizde ağırlamanın büyük mutluluğunu yaşadık. ❤️  20 yıl sonra yeniden Cumhuriyet Halk Partisi’ne kazandırdığımız belediyemizde, halkımızın coşkusuyla unutulmaz bir gün yaşadık.   Genel Başkanımızın güçlü duruşu, örgütümüzün dayanışması ve hemşehrilerimizin desteğiyle daha yapacak çok işimiz, kazanacak çok yolumuz var.  Birlikte büyüyoruz. Birlikte güçleniyoruz. Birlikte kazanıyoruz. 🇹🇷;;0
https://www.instagram.com/p/DRIGL2tjsDk/;Carousel;1593;39;0;2025-11-16 20:56:22;https://scontent-lga3-3.cdninstagram.com/v/t39.30808-6/584297476_729181093535421_2791896409492581814_n.jpg?stp=c0.0.1440.959a_dst-jpg_e35_tt6&_nc_cat=108&ig_cache_key=Mzc2NzI4ODI2ODI3NTQ5MDUwNw%3D%3D.3-ccb7-5&ccb=7-5&_nc_sid=58cdad&efg=eyJ2ZW5jb2RlX3RhZyI6InhwaWRzLjE0NDB4OTYwLnNkci5DMyJ9&_nc_ohc=JaSUmLJI_PMQ7kNvwHLHg12&_nc_oc=AdkZGHGbtj9SXWxwxLLDwKkb9AesPCb8CBg04Vf5oEn595M-PXhp-KedOZou5ZZU7ZoukjLn_Hvr06n02UEcZ8bX&_nc_ad=z-m&_nc_cid=0&_nc_zt=23&_nc_ht=scontent-lga3-3.cdninstagram.com&_nc_gid=adJgvPU2nTx8MWWYztbwkg&oh=00_Afju9-nak7a5Ujzf1uqd-J8UpyOrMzYu6Ej0F_GZ1gGAHA&oe=69312AFA;Teşekkürler Kilis! ❤️  Haksızlık karşısında susmayan, bu ülkenin yılmaz savunucuları Genel Başkanımız Sayın Özgür Özel ve ABB Başkanımız Sayın Mansur Yavaş’ı büyük bir sevgiyle bağrına basan tüm hemşehrilerimize yürekten teşekkür ederiz.  Kilis’in sıcaklığı, samimiyeti ve dayanışması yine farkını ortaya koydu. 🙏🇹🇷;;0
https://www.instagram.com/p/DRHiquYEbRp/;Carousel;2851;45;0;2025-11-16 15:46:00;https://scontent-lga3-1.cdninstagram.com/v/t39.30808-6/583324327_728963276890536_1188141168004338784_n.jpg?stp=c0.0.1440.959a_dst-jpg_e35_tt6&_nc_cat=103&ig_cache_key=Mzc2NzEzMjA2Njg5MTgxNTUzNA%3D%3D.3-ccb7-5&ccb=7-5&_nc_sid=58cdad&efg=eyJ2ZW5jb2RlX3RhZyI6InhwaWRzLjE0NDB4OTYwLnNkci5DMyJ9&_nc_ohc=unCmxvfT-BEQ7kNvwH6fzvH&_nc_oc=AdkIC6fdyxEXUqx-WbvOQ976u1hvy2cs7cqyP5ins8S1vy6asz1witm2WshY_PC_v-OQomxPyMaOhCuDZHYUvhU8&_nc_ad=z-m&_nc_cid=0&_nc_zt=23&_nc_ht=scontent-lga3-1.cdninstagram.com&_nc_gid=adJgvPU2nTx8MWWYztbwkg&oh=00_AfgMOyLLkqcwxhCqOgQX8ThTkmnwp5D_wzIOXepriUo_WA&oe=69312FBD;Genel Başkanımız Özgür Özel ve Ankara Büyükşehir Belediye Başkanımız Mansur Yavaş’ı Kilis Belediyemizde ağırladık.   Personelimizle bir araya gelip yürüttüğümüz çalışmaları, hizmetlerimizi ve hedeflerimizi paylaştık.   Kilis için durmadan üretmeye devam.;;0
https://www.instagram.com/p/DRHddO8jp2q/;Carousel;1411;15;0;2025-11-16 15:00:29;https://scontent-lax3-1.cdninstagram.com/v/t39.30808-6/584430895_728957603557770_122071519836927050_n.jpg?stp=c0.0.1440.959a_dst-jpg_e35_tt6&_nc_cat=102&ig_cache_key=Mzc2NzEwOTE1MDYzMjIzODk0Mw%3D%3D.3-ccb7-5&ccb=7-5&_nc_sid=58cdad&efg=eyJ2ZW5jb2RlX3RhZyI6InhwaWRzLjE0NDB4OTYwLnNkci5DMyJ9&_nc_ohc=NUtAgn-UPnUQ7kNvwGbMi1a&_nc_oc=Admtc4DZDW_62kyCl3j5b4OckHDmcDkNgcqLHvqFQEiSgLrtk9P_kgpcucgnf_CJfwjx8yP4c3j78eCg1cN0YVVj&_nc_ad=z-m&_nc_cid=0&_nc_zt=23&_nc_ht=scontent-lax3-1.cdninstagram.com&_nc_gid=No0t4r2_Oio3W41p_2sIMg&oh=00_AfhjU38j_qaabqiHqQLN1lUsXkyy0_9makYbo9AgSZCg2w&oe=693137D7;Genel Başkanımız Özgür Özel ve Ankara Büyükşehir Belediye Başkanımız Mansur Yavaş ile birlikte Cumhuriyet Halk Partisi Kilis İl Başkanlığımızı ziyaret ettik.   Örgütümüzle buluştuk, partililerimizle gönül gönüle sohbet ettik.   Kilis’te birlik var, heyecan var, umut var 🇹🇷;;0
https://www.instagram.com/p/DRHJJwBDkIW/;Carousel;1992;36;0;2025-11-16 12:03:03;https://scontent-lax7-1.cdninstagram.com/v/t39.30808-6/582765874_728860486900815_5826347410006577897_n.jpg?stp=c0.0.1440.959a_dst-jpg_e35_tt6&_nc_cat=105&ig_cache_key=Mzc2NzAxOTg1NDY4ODU4MDM0Ng%3D%3D.3-ccb7-5&ccb=7-5&_nc_sid=58cdad&efg=eyJ2ZW5jb2RlX3RhZyI6InhwaWRzLjE0NDB4OTYwLnNkci5DMyJ9&_nc_ohc=r6LCQE1mIU4Q7kNvwFwmLIz&_nc_oc=AdlSY-SextHffCDkF1b1r66G2BoyYC7-izZoBu9Dd3xd5KJwrYuQkq7s0sXQn4RcEDqw5C_NrzWu6q73UNSgpFiB&_nc_ad=z-m&_nc_cid=0&_nc_zt=23&_nc_ht=scontent-lax7-1.cdninstagram.com&_nc_gid=No0t4r2_Oio3W41p_2sIMg&oh=00_Afia7qoXHdMDVBnlHujG5BL7SDdbuXScLIGf1fH-DumVvw&oe=6931351C;Cumhuriyet Halk Partisi Genel Başkanımız Sayın Özgür Özel’i ve Ankara Büyükşehir Belediye Başkanımız Sayın Mansur Yavaş’ı havalimanında coşkuyla karşıladık.  Kilis’e hoş geldiniz…  Şehrimiz sizinle daha güzel, daha güçlü.;;0
https://www.instagram.com/p/DRE_-fAEnps/;Reels;1942;44;88721;2025-11-15 16:12:37;https://scontent-lax3-1.cdninstagram.com/v/t51.82787-15/581734106_18051137930654757_7713408916770316430_n.jpg?stp=dst-jpg_e15_tt6&_nc_cat=102&ig_cache_key=Mzc2NjQxNjU1OTIxMzU0MTk5Ng%3D%3D.3-ccb7-5&ccb=7-5&_nc_sid=58cdad&efg=eyJ2ZW5jb2RlX3RhZyI6InhwaWRzLjEyMTV4MjE2MC5zZHIuQzMifQ%3D%3D&_nc_ohc=UiYS2PQEBTwQ7kNvwG1-BfT&_nc_oc=AdkG6zk7kwUUX9h251jfDBZEYJsZgl57SnfHTKJiWJSGAsZ3TJzsSUwwYP7CGB4N9ZgcOpU36d-Wo7ih0jvQsKXS&_nc_ad=z-m&_nc_cid=0&_nc_zt=23&_nc_ht=scontent-lax3-1.cdninstagram.com&_nc_gid=No0t4r2_Oio3W41p_2sIMg&oh=00_AfihNR-6vWELDJ6j4hNKfbPLVDtuNk9xyLt8IHTkxS2n3g&oe=693134C5;Esnafımızı, vatandaşımızı mitinge davet etmeye devam ediyoruz.  Kalpler bizle, yalnız bırakmayacaklar ❤️   Herkese şimdiden teşekkürler. 😇;;0
https://www.instagram.com/p/DRCo90hkqY0/;Reels;1427;33;67617;2025-11-14 18:08:43;https://scontent-lax3-2.cdninstagram.com/v/t51.82787-15/581745629_18051054158654757_2533237649218738025_n.jpg?stp=dst-jpg_e15_tt6&_nc_cat=106&ig_cache_key=Mzc2NTc1MjQwODU4MTUxNDgwNA%3D%3D.3-ccb7-5&ccb=7-5&_nc_sid=58cdad&efg=eyJ2ZW5jb2RlX3RhZyI6InhwaWRzLjEyMTV4MjE2MC5zZHIuQzMifQ%3D%3D&_nc_ohc=cXq5870ld8oQ7kNvwFcc904&_nc_oc=Adnag7at26Zym6y9AI5ysqMG7n9Yyzg_D3fR_URI2NCJI6GuEUdisqykXDbYUoJybAegUqY8kyyozv6s-wjFlZfF&_nc_ad=z-m&_nc_cid=0&_nc_zt=23&_nc_ht=scontent-lax3-2.cdninstagram.com&_nc_gid=No0t4r2_Oio3W41p_2sIMg&oh=00_AfjlYWSiAU-YzLqY96vFwaWVju-ctos7AcFu3UeG-MLqiw&oe=69311A6E;📍 Sertifikalı Tohum Dağıtım Programındayız  Kıymetli hemşehrilerim,  Tarım Arazilerinin Kullanımının Etkinleştirilmesi (TAKE) Projesi kapsamında 1.500 çiftçimize, toplam 20 milyon TL değerinde 737 ton sertifikalı tohumun dağıtımına bugün itibarıyla başladık.  Ayrıca Kilis Belediyesi olarak 4 milyon TL destek sağlayarak bu sürece gönülden katkı sunduk.  Çiftçimizin yanında duran, üretimi güçlendiren her çalışma bizim için çok kıymetli.  Hayırlı, bereketli olsun. 🌾🇹🇷;;0
https://www.instagram.com/p/DRCM14Ijj1-/;Carousel;594;12;0;2025-11-14 13:59:05;https://scontent-lax3-2.cdninstagram.com/v/t39.30808-6/583279887_727396937047170_1899594851506429474_n.jpg?stp=dst-jpg_e35_tt6&_nc_cat=107&ig_cache_key=Mzc2NTYyODY4OTQ5ODE3NjQ0Nw%3D%3D.3-ccb7-5&ccb=7-5&_nc_sid=58cdad&efg=eyJ2ZW5jb2RlX3RhZyI6InhwaWRzLjIwNDh4MTM2NS5zZHIuQzMifQ%3D%3D&_nc_ohc=Ojtti8dORXcQ7kNvwGUHbDR&_nc_oc=AdlQdcHIiO3LrEdymgbp0SCaug2kwqTwqu7wLZT9H-MDn7OkVqvqDR8iAW41dhdzjMwOBjd2iLNY86ClnIX1kp_-&_nc_ad=z-m&_nc_cid=0&_nc_zt=23&_nc_ht=scontent-lax3-2.cdninstagram.com&_nc_gid=No0t4r2_Oio3W41p_2sIMg&oh=00_Afh98FOG7DXCuuNygiJ-jt3_2JrLR9UWXmohBluJpwL9pg&oe=6931283D;Gürcistan’daki uçak kazasında şehit düşen kahraman Mehmetçiklerimiz için bugün Kent Lokantamızda tüm yemekleri ücretsiz yaptık, Cumhuriyet Meydanı’nda helva ikramında bulunduk. 🇹🇷  Bu vatan için canını ortaya koyan yiğitlerimizin hakkı ödenmez. Onlar bu milletin onuru, şerefi, gururudur. Ruhları şad, mekânları cennet olsun.  Milletimizin başı sağ olsun. 🇹🇷;;0
https://www.instagram.com/p/DRBqxWijChO/;Reels;2134;61;91788;2025-11-14 09:07:13;https://scontent-lax3-2.cdninstagram.com/v/t51.71878-15/581767051_2056961418468634_8088374079326990729_n.jpg?stp=dst-jpg_e15_tt6&_nc_cat=107&ig_cache_key=Mzc2NTQ3ODg3Mjg2ODIwMjU3NA%3D%3D.3-ccb7-5&ccb=7-5&_nc_sid=58cdad&efg=eyJ2ZW5jb2RlX3RhZyI6InhwaWRzLjY0MHgxMTM2LnNkci5DMyJ9&_nc_ohc=uFVzZ0nVBj4Q7kNvwGkB95b&_nc_oc=AdldUlO6BKFNEwAgyJI4xGtveHKg2FHvfsywIJmRK-6PjdhB8wYZgHBvxGK2aLNid7YSdosMrkS7h39XKjqG6nrZ&_nc_ad=z-m&_nc_cid=0&_nc_zt=23&_nc_ht=scontent-lax3-2.cdninstagram.com&_nc_gid=No0t4r2_Oio3W41p_2sIMg&oh=00_Afjo43ECiJeVJ1UVdwapthZ3pMsJ4wwIRD29CG0lKIrBcA&oe=69313479;Kıymetli hemşehrilerim…  Bu şehrin yollarında birlikte yürüdük, aynı sofrayı paylaştık, aynı dertlere omuz verdik. Şimdi yine kalplerimizi bir araya getireceğimiz çok özel bir gün yaklaşıyor.  📍 Pazar günü saat 16.00’da Cumhuriyet Meydanı’nda, Genel Başkanımız Özgür Özel ve Ankara Büyükşehir Belediye Başkanımız Mansur Yavaş Kilis’imizde olacak.  Bu buluşmada yanımda olmanız, Kilis’in geleceği için attığımız her adımda güç verir, moral verir, umut verir. Geliniz, bu güzel meydanı hep birlikte dolduralım…  ❤️ Bizleri yalnız bırakmayın, birlikte daha güçlüyüz.;;0
https://www.instagram.com/p/DRAZwmLDq4H/;Photo;764;6;0;2025-11-13 21:13:30;https://scontent-lax3-2.cdninstagram.com/v/t39.30808-6/583302461_726874687099395_6977617069772836011_n.jpg?stp=dst-jpg_e35_tt6&_nc_cat=111&ig_cache_key=Mzc2NTEyMjU3OTE2NzA5NjMyNw%3D%3D.3-ccb7-5&ccb=7-5&_nc_sid=58cdad&efg=eyJ2ZW5jb2RlX3RhZyI6InhwaWRzLjE0NDB4MTA4MC5zZHIuQzMifQ%3D%3D&_nc_ohc=9eSYYnC0eY0Q7kNvwERghaZ&_nc_oc=AdmnEXI_5EXvr0wkrEO-VC_-G2SNFrnsQmNfJ7nXd7er_c9Hnucf08ISkfQywDzDNZge2WAEzYQCs9YvkiMZ-xSk&_nc_ad=z-m&_nc_cid=0&_nc_zt=23&_nc_ht=scontent-lax3-2.cdninstagram.com&_nc_gid=No0t4r2_Oio3W41p_2sIMg&oh=00_Afi6182KCxhMxmyOTzTJIsOg6vvxsEaA7KvweTRz7_alaQ&oe=693113F3;Kilis Belediye Başkanımız Merhum Av. Mehmet Abdi Bulut’un kardeşi Dr. Ahmet Bulut’un eşi, Kilis 7 Aralık Üniversitesi emekli öğretim görevlisi Dr. Şehadet Bulut’un cenaze törenine katıldık.   Merhumeye Allah’tan rahmet, kıymetli ailesine sabır ve başsağlığı diliyorum. Ruhu şad, mekanı cennet olsun.;;0
https://www.instagram.com/p/DQ_ounljEwK/;Carousel;541;7;0;2025-11-13 14:05:03;https://scontent-lax3-1.cdninstagram.com/v/t51.82787-15/581799240_18050929757654757_1815741566004510334_n.jpg?stp=dst-jpg_e35_tt6&_nc_cat=110&ig_cache_key=Mzc2NDkwNjkzNDY1NTU0NDk3Nw%3D%3D.3-ccb7-5&ccb=7-5&_nc_sid=58cdad&efg=eyJ2ZW5jb2RlX3RhZyI6InhwaWRzLjExMDV4NzY0LnNkci5DMyJ9&_nc_ohc=ABA6mxGkHaIQ7kNvwEzUd82&_nc_oc=AdkOUyukwGY-Izi-TW6ntFQ5qPxm6mA0iMxxon8VSidS-6a-YhT5wA9Tkqk5GHg6zaYyzJbC8y9MaHOc9STrKZkJ&_nc_ad=z-m&_nc_cid=0&_nc_zt=23&_nc_ht=scontent-lax3-1.cdninstagram.com&_nc_gid=No0t4r2_Oio3W41p_2sIMg&oh=00_AfgZN2bPvKnOkiE9LX7xJX_RpuP1xgghmnYXxEY-wgUqFA&oe=6931202A;Birleşmiş Milletler Çocuklara Yardım Fonu (UNICEF) Türkiye Temsilcisi Paolo Marchi, Saha Ofisi Şefi Filippo Mazzarelli ve beraberlerindeki heyetle bir araya geldik.  Şehrimizde çocukların daha iyi bir geleceğe sahip olması için yürütülebilecek projeler üzerine verimli bir görüşme gerçekleştirdik.   Çocuklarımız için atacağımız her adım, geleceğimize yapılan en değerli yatırımdır.;;0
https://www.instagram.com/p/DQ_JXMdEvF4/;Reels;3370;95;96005;2025-11-13 09:36:00;https://scontent-lax3-2.cdninstagram.com/v/t51.82787-15/580204414_18050914301654757_4049528246744487358_n.jpg?stp=dst-jpg_e15_tt6&_nc_cat=111&ig_cache_key=Mzc2NDc2ODk4OTg0NDI3MTQ4MA%3D%3D.3-ccb7-5&ccb=7-5&_nc_sid=58cdad&efg=eyJ2ZW5jb2RlX3RhZyI6InhwaWRzLjEyMTV4MjE2MC5zZHIuQzMifQ%3D%3D&_nc_ohc=WsfcQfCrFIMQ7kNvwE_Vi86&_nc_oc=Adliqan7OUidVtKaocqK2CJFvjf6CVeHLvcA7LK8fiHiDl2WZmVfvKjOAYI-NWw1RLpRY53GubXS0YcPXm30SPWd&_nc_ad=z-m&_nc_cid=0&_nc_zt=23&_nc_ht=scontent-lax3-2.cdninstagram.com&_nc_gid=No0t4r2_Oio3W41p_2sIMg&oh=00_AfgfG1nnWIWQTncub64QCVASEF4Lyvb1LLr51i83HTJFqw&oe=69312AF0;Herkesin “Dinazorlu Park” olarak bildiği yerin asıl adı Şehit Alaaddin Çaycı Parkı 🇹🇷  Bu parkı, şehidimizin adına yakışır şekilde baştan sona yeniledik, genişlettik ve daha yaşanabilir bir hale getirdik. 🌳✨  Kilis’imize ve aziz şehidimize yakışır bir eser olacak. 💫;;0
https://www.instagram.com/p/DQ86k7mEkyu/;Reels;2474;74;89590;2025-11-12 12:49:18;https://scontent-lax3-1.cdninstagram.com/v/t51.82787-15/580109838_18050824892654757_2407366127152285597_n.jpg?stp=dst-jpg_e15_tt6&_nc_cat=110&ig_cache_key=Mzc2NDE0MTAxMzE2MzE5OTY2Mg%3D%3D.3-ccb7-5&ccb=7-5&_nc_sid=58cdad&efg=eyJ2ZW5jb2RlX3RhZyI6InhwaWRzLjEyMTV4MjE2MC5zZHIuQzMifQ%3D%3D&_nc_ohc=TGCmInhCbVYQ7kNvwHEob6Y&_nc_oc=Adl2spYUNkHr2RnxvH_RPEZs5R0LxT6FAAd714c6GX9ZoKxUarN49jANsVNQTE2rbKSfhhNOYH_HUkQQoj10GY73&_nc_ad=z-m&_nc_cid=0&_nc_zt=23&_nc_ht=scontent-lax3-1.cdninstagram.com&_nc_gid=No0t4r2_Oio3W41p_2sIMg&oh=00_Afhy4d6y2IM1_QRwqn-FdG-O7ADBnQPpXKvsZb1Q0oR_Hw&oe=69310302;Bugün Milli Ağaçlandırma Günü'nde doğaya nefes, geleceğe umut olduk 🌿🍁🌲  Şehrimizin 3 farklı noktasında fidanlarımızı toprakla buluşturduk.  Her diktiğimiz fidan, geleceğe bırakacağımız en yeşil miras olacak. 🌳  Doğayı korumak, geleceği korumaktır. 💚;;0
https://www.instagram.com/p/DQ6JtokEoKd/;Reels;42514;2620;1483565;2025-11-11 11:03:09;https://scontent-lax7-1.cdninstagram.com/v/t51.82787-15/581160012_18050718659654757_4927603443549780104_n.jpg?stp=dst-jpg_e15_tt6&_nc_cat=105&ig_cache_key=Mzc2MzM2MzE1Njk3MTM4OTU5Nw%3D%3D.3-ccb7-5&ccb=7-5&_nc_sid=58cdad&efg=eyJ2ZW5jb2RlX3RhZyI6InhwaWRzLjEyMTV4MjE2MC5zZHIuQzMifQ%3D%3D&_nc_ohc=sf8acsrWMmAQ7kNvwHIBnhQ&_nc_oc=AdmymJAUKghVRCE6u9bCsYzfCp9Y5gcWLhmjFnbmRkJW0Cuj1G3Q7FC8FxfbIS1QTiudeR1RtUNoUA871eKHONiq&_nc_ad=z-m&_nc_cid=0&_nc_zt=23&_nc_ht=scontent-lax7-1.cdninstagram.com&_nc_gid=No0t4r2_Oio3W41p_2sIMg&oh=00_AfhOy_L-753sUF4wUSskUkscF3yBBJcPOI75K8hXAazpwQ&oe=693105B7;“Merdiven altı üretime asla göz açtırmayız! 💪  Halkımızın sağlığı bizim kırmızı çizgimiz. Kanun herkes için aynı, kimseye ayrıcalık yok.;;0
https://www.instagram.com/p/DQ59gFoDmiN/;Photo;286;5;0;2025-11-11 09:11:07;https://scontent-lax3-1.cdninstagram.com/v/t39.30808-6/579903512_724802187306645_7951717153210931400_n.jpg?stp=dst-jpg_e35_tt6&_nc_cat=102&ig_cache_key=Mzc2MzMwOTQ0OTU0NTkzNDk4OQ%3D%3D.3-ccb7-5&ccb=7-5&_nc_sid=58cdad&efg=eyJ2ZW5jb2RlX3RhZyI6InhwaWRzLjE0NDB4OTYwLnNkci5DMyJ9&_nc_ohc=wOG58ubhvJEQ7kNvwEb8imI&_nc_oc=AdnxNPIeAGUBNNT5NILJGVhKl460uf3F7Iewrm43drIUKn-etImSvO1dO4Z0Ymg2ntRb4-4WInel2sCrN1WESaxA&_nc_ad=z-m&_nc_cid=0&_nc_zt=23&_nc_ht=scontent-lax3-1.cdninstagram.com&_nc_gid=No0t4r2_Oio3W41p_2sIMg&oh=00_AfjeIPtnKuIK849rR5bO54CbAkwkEE9c9Yrc9fgmOu4VhA&oe=69310FA3;Çınarlı Gençlik Spor’umuzu 3-0’lık güzel galibiyetlerinden dolayı yürekten tebrik ediyorum. 💪  Sahada gösterdikleri mücadeleyle bizleri gururlandırdılar. Şehrimizin aslanlarına başarılarının devamını diliyorum. 🦁⚽  Spora ve sporcuya desteğimiz her zaman sürecek.;;0
https://www.instagram.com/p/DQ4wwGrkhj5/;Reels;823;15;42047;2025-11-10 22:05:44;https://scontent-ham3-1.cdninstagram.com/v/t51.82787-15/576640889_18050672207654757_3822411353753757595_n.jpg?stp=dst-jpg_e15_tt6&_nc_cat=107&ig_cache_key=Mzc2Mjk3MTkwMDYwODkxMTYwOQ%3D%3D.3-ccb7-5&ccb=7-5&_nc_sid=58cdad&efg=eyJ2ZW5jb2RlX3RhZyI6InhwaWRzLjEyMTV4MjE2MC5zZHIuQzMifQ%3D%3D&_nc_ohc=qLVZSUUIS1AQ7kNvwGoDutd&_nc_oc=Adn3JX-H54WkeGLWgh3hU8U_2SWudyEQhuD-0Ujj6AkGTDIGxocKlG2-aRqWNdVdPRU&_nc_ad=z-m&_nc_cid=1128&_nc_zt=23&_nc_ht=scontent-ham3-1.cdninstagram.com&_nc_gid=HSfFeDfxSOdDtxDMZ6po5Q&oh=00_AfjkHpcg-Ats2zdTvMALUlyaI0OTMlMb_siZWeJYkoLVcA&oe=693102F2;Cumhuriyetimizin Kurucusu Gazi Mustafa Kemal Atatürk’ü vefatının 87’nci yıl dönümünde saygı ve şükranla anıyoruz.  #10Kasım;;0
