PostLink;PostTürü;BeğeniSayısı;YorumSayısı;Görüntülenme Sayısı;Tarih;DisplayPhoto;Caption;Takipçi;TahminMi
https://www.instagram.com/p/DQpRuunDMrA/;Reels;6360;698;144260;2025-11-04 21:43:58;https://scontent-bos5-1.cdninstagram.com/v/t51.82787-15/573066846_18227122885307214_3209749079802057980_n.jpg?stp=dst-jpg_e15_tt6&_nc_cat=110&ig_cache_key=Mzc1ODYxMzM0MTk1MTI4MTg1NjE4MjI3MTIyODc5MzA3MjE0.3-ccb7-5&ccb=7-5&_nc_sid=58cdad&efg=eyJ2ZW5jb2RlX3RhZyI6InhwaWRzLjcyMHgxMjgwLnNkci5DMyJ9&_nc_ohc=QgVFrEcqA8oQ7kNvwFtV0Wc&_nc_oc=AdmbsLvKGYnrPPk3otiHyWvlqqWWCDb0mGsSXRwExRHzpsysFkfuyzw_bkvrp5jvuZY&_nc_ad=z-m&_nc_cid=0&_nc_zt=23&_nc_ht=scontent-bos5-1.cdninstagram.com&_nc_gid=wQPJdV4DiesetK3_olnG0A&oh=00_Afghx7kDoG4qmgfBhLZ3yRKMG5xzyN79XNYRfy1KDvILRQ&oe=69310545;"Yoğunluğumuzu anlamanızı beklemiyoruz, zira Neşet babanın da dediği gibi ""Sevdayı çeken bilir..."" 😉🫶🏻  Çorum Belediye Başkanı olarak parka da gitsek yakamızı bırakmayan bir pazar sorunu vardı ve son olayda da Mahzuni Şerif Parkı'mızda rastladığımız bir teyzemizin başına gelen olay üzerine pazara gitmiştik. Bu ziyaretler ve ilgimiz neticesinde pazar sorununu kökünden çözmeyi de artık başarıyoruz. Pazarlarımızda 1 Ocak'tan itibaren seçmek serbest olacak.  Çorum'a yaptıklarımızı, yapacaklarımızı, sevdamızı ve şehrimizin tanıtımını içeren paylaşımlarımız neden rahatsızlık verdi bilmesek de biz, bu şehrin her metrekaresine gece-gündüz hizmet edip bunu da paylaşmaya devam edeceğiz; şehrimizin gelişmişliği ve temizliğini tanıttığımız videolarımız belki çöpleriyle barışık olan malum belediyelere örnek de olur. Bizi izlemeye devam edin... Aşk ola...😉  #ÇorumİçinAşkla  📍Çorum Belediyesi Kasım Ayı Meclis Toplantısı";;0
https://www.instagram.com/p/DQpGGPLDGLp/;Reels;12134;596;340295;2025-11-04 20:00:24;https://scontent-bos5-1.cdninstagram.com/v/t51.82787-15/573593682_18227113945307214_5658393367272047665_n.jpg?stp=dst-jpg_e15_tt6&_nc_cat=104&ig_cache_key=Mzc1ODU2MjE4MDkwNDgwNTA5NzE4MjI3MTEzOTQyMzA3MjE0.3-ccb7-5&ccb=7-5&_nc_sid=58cdad&efg=eyJ2ZW5jb2RlX3RhZyI6InhwaWRzLjU0MHg5NjAuc2RyLkMzIn0%3D&_nc_ohc=HbJ1yBZgamYQ7kNvwHxG-V2&_nc_oc=AdkMXbkh-eRr7fNZdiGpPkmUgN7z83fdXByffVpfHbSGUqipkAd4fE8A4_TLQ4SA8zU&_nc_ad=z-m&_nc_cid=0&_nc_zt=23&_nc_ht=scontent-bos5-1.cdninstagram.com&_nc_gid=wQPJdV4DiesetK3_olnG0A&oh=00_Afi16g7AoXxccIkIeRxomhfneWP-1LPJ9u5jzJsSEktziA&oe=6931207B;"❤️1 Ocak'ta Pazarlar Çorumlunun İstediği Gibi Oluyor🖤  Belediye Meclisimizde Cumhur İttifakı, Cumhuriyet Halk Partisi ve Yeniden Refah Partisi gruplarının tamamının desteğiyle alacağımız kararla 1 Ocak'tan itibaren semt pazarlarımızdaki tüm tezgahlarda ""Seçerek Alışveriş""i serbest hale getiriyoruz.  Çorumlunun ve dürüst esnafımızın hakkı için oluşan bu birlik ve beraberlikten dolayı tüm meclis gruplarımıza ve üyelerimize sonsuz şükranlarımı sunuyorum.  Hemşehrilerimize ve Çorumluyu seven, koruyan, örnek esnafımıza hayırlı olsun.  📍Çorum Belediyesi Kasım Ayı Meclis Toplantısı   #ÇorumİçinAşkla";;0
https://www.instagram.com/p/DQn0-YXCPBM/;Reels;1210;24;118365;2025-11-04 08:10:43;https://scontent-bos5-1.cdninstagram.com/v/t51.82787-15/572478306_18227055466307214_7092151885667092683_n.jpg?stp=dst-jpg_e15_tt6&_nc_cat=100&ig_cache_key=Mzc1ODIwNTM5OTI0NjM2ODg0NDE4MjI3MDU1NDYwMzA3MjE0.3-ccb7-5&ccb=7-5&_nc_sid=58cdad&efg=eyJ2ZW5jb2RlX3RhZyI6InhwaWRzLjU0MHg5NjAuc2RyLkMzIn0%3D&_nc_ohc=ADytEeqMAY0Q7kNvwEOkiSZ&_nc_oc=AdlTpjhWKtSebsQIV2h-k-qQFq0IyWN9R1pM9Ll73txrowb0qkb1NStvW5iyLd4SP1w&_nc_ad=z-m&_nc_cid=0&_nc_zt=23&_nc_ht=scontent-bos5-1.cdninstagram.com&_nc_gid=wQPJdV4DiesetK3_olnG0A&oh=00_AfjRcUuObGQO3QiQvkqrWdXs2AAu5c0eRV5FYqJ8UkdbkA&oe=693106CD;Yeter ki Çorum gelişsin, biz gerekeni yaparız ❤️🖤  📍Akkent Mahallesi / Otonomi Galericiler Sitesi   #ÇorumİçinAşkla;;0
https://www.instagram.com/p/DQmWU0WDGFJ/;Reels;4833;77;170316;2025-11-03 18:28:41;https://scontent-bos5-1.cdninstagram.com/v/t51.71878-15/573047110_1229418085662881_3573620620187246421_n.jpg?stp=dst-jpg_e15_tt6&_nc_cat=109&ig_cache_key=Mzc1Nzc4OTEyNjcwNDUyMTU0NTcwODQwNDUyODM3NDE5MQ%3D%3D.3-ccb7-5&ccb=7-5&_nc_sid=58cdad&efg=eyJ2ZW5jb2RlX3RhZyI6InhwaWRzLjY0MHgxMTM2LnNkci5DMyJ9&_nc_ohc=Kjb2o5b1_2YQ7kNvwGtZQQg&_nc_oc=Adm0A6Ir-e7vb8y_CUEXkIq7-lMO-HaoCA___KcTrDosttWths36nw5n5b5CofRG_U4&_nc_ad=z-m&_nc_cid=0&_nc_zt=23&_nc_ht=scontent-bos5-1.cdninstagram.com&_nc_gid=wQPJdV4DiesetK3_olnG0A&oh=00_AfjNhjcsk5yLHd__qzjd8GoWX_yd9DVpss1R_I26loj5Fg&oe=6931049C;"Çorum'un Kadınları Başarır; Bunu Defalarca Gördük, Yanlarındayız.  Bizim Ora Kadın Kooperatifi tarafından Eskice köyümüzde ekilen safranın hasatına katıldık. Bu güzel projede emeği geçenlere teşekkür ediyorum.   Çalışkan ve maharetli kadınlarımızın çalışmalarını desteklemeye, Hanımeli Yöresel ve Kadın El Emeği Çarşısı projelerimizde olduğu gibi şimdi de Bedesten meydanında hayata geçireceğimiz ""Kadın El Emeği Pazarı"" projemizle onların yanında olmaya devam ediyoruz.  #ÇorumİçinAşkla #kadınelemeğipazarı #Keşkek #Safran";;0
https://www.instagram.com/p/DQjjkPNjFCz/;Reels;3717;75;120235;2025-11-02 16:23:05;https://scontent-bos5-1.cdninstagram.com/v/t51.71878-15/573814163_863885496062673_334615405731847496_n.jpg?stp=dst-jpg_e15_tt6&_nc_cat=103&ig_cache_key=Mzc1NzAwMjkzNjAxOTYwMzYzNQ%3D%3D.3-ccb7-5&ccb=7-5&_nc_sid=58cdad&efg=eyJ2ZW5jb2RlX3RhZyI6InhwaWRzLjY0MHgxMTM2LnNkci5DMyJ9&_nc_ohc=hYoWoBepefoQ7kNvwGJe_gp&_nc_oc=AdmdM68sKxNK8sq5n8X6lh_t1ddTbQtXiItUcZF2T056JYWQRSmGZGgmUzrxM02y7wU&_nc_ad=z-m&_nc_cid=0&_nc_zt=23&_nc_ht=scontent-bos5-1.cdninstagram.com&_nc_gid=wQPJdV4DiesetK3_olnG0A&oh=00_Afj3GWgVwSehw7t2oLCy15QsLanfDVbnNvLymJv8yZLUsg&oe=69312D17;“Çıkalım yaylaya inelim düze Himmet eylen yaran ahbaplar bize Bir selam göndersem gelir mi size Dostlar bizi safa ile gönderin…”  #PirSultanAbdal #ÇorumİçinAşkla;;0
https://www.instagram.com/p/DQhgbUljO98/;Photo;4811;43;0;2025-11-01 21:55:20;https://scontent-bos5-1.cdninstagram.com/v/t51.82787-15/574040020_18226751974307214_7299761253845397177_n.webp?_nc_cat=109&ig_cache_key=Mzc1NjQyNjE3OTIyMjc2MTM0MA%3D%3D.3-ccb7-5&ccb=7-5&_nc_sid=58cdad&efg=eyJ2ZW5jb2RlX3RhZyI6InhwaWRzLjEwODB4MTQ0MC5zZHIuQzIifQ%3D%3D&_nc_ohc=4OC7c9och_4Q7kNvwFLr-vi&_nc_oc=Adlv5q7fCb4QQR_r4IrEQc8YqZsMmLk_cACicaJ0X4RaCgVJwcQsSfa4gEyUD2SW46c&_nc_ad=z-m&_nc_cid=0&_nc_zt=23&_nc_ht=scontent-bos5-1.cdninstagram.com&_nc_gid=wQPJdV4DiesetK3_olnG0A&oh=00_Afjqf5e6r6yZKCUi1x72E_WZgrdGmY-T1dfRGI2wQffPaQ&oe=69312866;Tek hayalimiz, güzelliğin... ❤️🖤 Aşk ola...  #HayırlıGeceler #Çorum #ÇorumİçinAşkla;;0
https://www.instagram.com/p/DQhYOT7jIF0/;Reels;2392;29;123739;2025-11-01 20:19:45;https://scontent-bos5-1.cdninstagram.com/v/t51.71878-15/571967094_1190216376346814_508918148843905179_n.jpg?stp=dst-jpg_e15_tt6&_nc_cat=100&ig_cache_key=Mzc1NjM5MDEwMDc5MjgwMzcwMA%3D%3D.3-ccb7-5&ccb=7-5&_nc_sid=58cdad&efg=eyJ2ZW5jb2RlX3RhZyI6InhwaWRzLjY0MHgxMTM2LnNkci5DMyJ9&_nc_ohc=9lcVWj9kExQQ7kNvwH9tM48&_nc_oc=Adlu7Opni_RfMJ4Junh0zcCBK6-BP3HjN1CUCI0guajulmHFEzCsFrzlbMcigFJY-NY&_nc_ad=z-m&_nc_cid=0&_nc_zt=23&_nc_ht=scontent-bos5-1.cdninstagram.com&_nc_gid=wQPJdV4DiesetK3_olnG0A&oh=00_AfgZ_dM09wStYQGJKOo9-vSGPx6_9-s9gk38SHUCZSulsg&oe=69310F88;Çorum’un ve Çorumlunun güzelliği enerji verir. 😉😎 #ÇorumİçinAşkla   📌 Enerji Kentleri Birliği Heyeti;;0
https://www.instagram.com/p/DQgm9E4jPTX/;Reels;691;5;77637;2025-11-01 12:54:34;https://scontent-fra5-2.cdninstagram.com/v/t51.71878-15/572157104_1218766113404749_8067418350242239486_n.jpg?stp=dst-jpg_e15_tt6&_nc_cat=107&ig_cache_key=Mzc1NjE3MzQxMjEyNjIyNTYyMw%3D%3D.3-ccb7-5&ccb=7-5&_nc_sid=58cdad&efg=eyJ2ZW5jb2RlX3RhZyI6InhwaWRzLjY0MHgxMTM2LnNkci5DMyJ9&_nc_ohc=NaFZwiPdVpQQ7kNvwHwGPYa&_nc_oc=AdkLx-DYfH7qmSz-pVChiBQNbLLW9kWijduoeErjUN2CXrDYVDt6JGpCWwPZOqNaiin4FVwjvEiOuKeuA8d8rCKP&_nc_ad=z-m&_nc_cid=0&_nc_zt=23&_nc_ht=scontent-fra5-2.cdninstagram.com&_nc_gid=c22O-M-I3Su8WEGFWGXcew&oh=00_AfjU9YNYPwaEu6bV42taDvZEHdnZelIdI6MCuyRf1_N-tA&oe=69312E9D;Yenilenebilir enerji kaynaklarının çevreye duyarlı ve en verimli şekilde yerel ve ulusal kalkınmaya katkısını amaçlayan Enerji Kentleri Birliği’mizin 2025 yılı ekim ayı olağan meclis toplantısına ev sahipliği yaptık.  Birlik Başkanımız-Erzurum Büyükşehir Belediye Başkanımız Mehmet Sekmen ve ülkemizin dört bir yanından şehrimize gelen belediye başkanlarımıza teşekkür ediyor, toplantımızın ve alınan kararların şehirlerimiz için hayırlara vesile olmasını diliyorum.  #YenilenebilirEnerji #EnerjiKentleriBirliği;;0
https://www.instagram.com/p/DQgKlX0jEkc/;Reels;7089;60;353685;2025-11-01 08:45:30;https://scontent-fra3-2.cdninstagram.com/v/t51.82787-15/573300491_18226757185307214_1854010410889787673_n.jpg?stp=dst-jpg_e15_tt6&_nc_cat=104&ig_cache_key=Mzc1NjA0ODYzNzg5MDQxNDg3NjE4MjI2NzU3MTgyMzA3MjE0.3-ccb7-5&ccb=7-5&_nc_sid=58cdad&efg=eyJ2ZW5jb2RlX3RhZyI6InhwaWRzLjU0MHg5NjAuc2RyLkMzIn0%3D&_nc_ohc=S5sUsUsi1z4Q7kNvwE7gVz0&_nc_oc=Adm2SvSgH69QL57BRMM3zt9MIqlbuotEWNUwBC418A7BEBKEH309ZXaHKX8GDEstsCwAzVlL77Hy33g0Pi8lB2Ek&_nc_ad=z-m&_nc_cid=0&_nc_zt=23&_nc_ht=scontent-fra3-2.cdninstagram.com&_nc_gid=c22O-M-I3Su8WEGFWGXcew&oh=00_AfhvLNNQy-dYcaaUTtGSXyQwMTmcjICq6xvDwKUMcX5NIQ&oe=6930FD81;Kimse görmeden, dersi bölmeden... Kaçamadık 😉🫶🏼  Çok mutlu bir #haftasonu geçirmeniz dileğiyle 🥰  📍Gazi Paşa Ortaokulu ❤️🧿  #HayırlıSabahlar #Çorum #ÇorumİçinAşkla;;0
https://www.instagram.com/p/DQenfRujNKb/;Reels;3339;32;111408;2025-10-31 18:25:16;https://scontent-fra5-2.cdninstagram.com/v/t51.82787-15/571862231_18226725007307214_7689477473280906986_n.jpg?stp=dst-jpg_e15_tt6&_nc_cat=107&ig_cache_key=Mzc1NTYxMjgxMjQyNTg3NjEyMzE4MjI2NzI1MDAxMzA3MjE0.3-ccb7-5&ccb=7-5&_nc_sid=58cdad&efg=eyJ2ZW5jb2RlX3RhZyI6InhwaWRzLjU0MHg5NjAuc2RyLkMzIn0%3D&_nc_ohc=mFJ0tq-cBHkQ7kNvwFKBQeX&_nc_oc=AdntWqIS_gONlSi14vVcskGg5Bi6Qt1axb7FJhsw1uuLtGSTJ0aMB9UktZq1eCromoFlvBmwUygatrOig8VfB8CC&_nc_ad=z-m&_nc_cid=0&_nc_zt=23&_nc_ht=scontent-fra5-2.cdninstagram.com&_nc_gid=c22O-M-I3Su8WEGFWGXcew&oh=00_AfhL1uGdVx4mpPTEcJiip6HWbrdjTBzDs9UAuyRFV4bIHQ&oe=69312055;Esnafımız istedi, biz yaptık 🫶🏼  Çorum'da tekstil denince akla ilk gelen yerlerden olan Dr. Pertevbey Sokak, artık çok daha güzel.  Güzeller güzeline bu güzellik de hayırlı olsun ❤️🖤🧿  #ÇorumİçinAşkla;;0
https://www.instagram.com/p/DQdgI-gDIdA/;Reels;7901;84;317407;2025-10-31 07:55:12;https://scontent-fra3-1.cdninstagram.com/v/t51.82787-15/573175464_18226664215307214_2501985853144815178_n.jpg?stp=dst-jpg_e15_tt6&_nc_cat=108&ig_cache_key=Mzc1NTI5OTAxODY1MDcxNTk2ODE4MjI2NjY0MjA5MzA3MjE0.3-ccb7-5&ccb=7-5&_nc_sid=58cdad&efg=eyJ2ZW5jb2RlX3RhZyI6InhwaWRzLjU0MHg5NjAuc2RyLkMyIn0%3D&_nc_ohc=J5jhWfA-zhYQ7kNvwG20-nr&_nc_oc=Adlsgz8GX-RtEyKfGB5WTWgHOwhTPS7vymoTDR-Jr61ju6fm5HdPDRNDPlNzF_NAaewFMIIxyLWcFb-Cd23tU4bA&_nc_ad=z-m&_nc_cid=0&_nc_zt=23&_nc_ht=scontent-fra3-1.cdninstagram.com&_nc_gid=c22O-M-I3Su8WEGFWGXcew&oh=00_AfhYTTviANDumLqIeFwVaU8EXtwXMQWXmbcRGCv7czo25g&oe=6931124F;Bedesten, her yönüyle bambaşka geliyor 😉🧿❤️🖤  #ÇorumİçinAşkla #HayırlıSabahlar #HayırlıCumalar #Çorum;;0
https://www.instagram.com/p/DQca5mlDMW1/;Reels;15338;144;342529;2025-10-30 22:28:44;https://scontent-fra3-1.cdninstagram.com/v/t51.82787-15/573693528_18226649503307214_1219293528849580004_n.jpg?stp=dst-jpg_e15_tt6&_nc_cat=108&ig_cache_key=Mzc1NDk5NDQ5Njk2MzM5NzA0NQ%3D%3D.3-ccb7-5&ccb=7-5&_nc_sid=58cdad&efg=eyJ2ZW5jb2RlX3RhZyI6InhwaWRzLjU0MHg5NjAuc2RyLkMzIn0%3D&_nc_ohc=yCU8unjYlEwQ7kNvwEvXIDM&_nc_oc=AdkV7yCRZibBadOlesBvMCeE2Cb0Ik0YeXuUDBmH_Ml1RQCmnS-ifDoRkGJDLF-bXXTZGgSyWzIHurTzm3n9666Y&_nc_ad=z-m&_nc_cid=0&_nc_zt=23&_nc_ht=scontent-fra3-1.cdninstagram.com&_nc_gid=c22O-M-I3Su8WEGFWGXcew&oh=00_AfjtIUaBYkJoTVeUsS-mVMf9lSpyrqBF_EggwLG6dU87AQ&oe=69311ED1;Pelin Çift ile Güzel Ötesi Çorum ❤️🖤  Kitap Kültür Günleri çerçevesinde değerli gazeteci, tv programcısı ve yazar @pelincift, güzel şehrimizde konuğumuzdu. Değerli konuğumuza teşekkür ediyorum.   #ÇorumİçinAşkla #PelinÇift #gündemötesi #Çorum;;0
