PostLink;PostTürü;BeğeniSayısı;YorumSayısı;Görüntülenme Sayısı;Tarih;DisplayPhoto;Caption;Takipçi;TahminMi
https://www.instagram.com/p/DRpbX7SjTTY/;Carousel;213;2;0;2025-11-29 19:36:27;https://scontent.cdninstagram.com/v/t51.82787-15/588865733_18329850208244863_3838339403612056612_n.webp?_nc_cat=107&ig_cache_key=Mzc3NjY3MDE0NzIwNjMwNjk5MQ%3D%3D.3-ccb7-5&ccb=7-5&_nc_sid=58cdad&efg=eyJ2ZW5jb2RlX3RhZyI6InhwaWRzLjE0NDB4OTYwLnNkci5DMyJ9&_nc_ohc=CKc2PSj6T8MQ7kNvwH2GIGs&_nc_oc=Adn81Y4_VECXwLItvcZ5K8H90voYwwugXv8HjvbEMCSMRYmKWOhNE2XoL_0aPF5jHMc&_nc_ad=z-m&_nc_cid=0&_nc_zt=23&_nc_ht=scontent.cdninstagram.com&_nc_gid=0Cfq2ioIqF5YEUKgy84O3g&oh=00_AfhGpS9bw0VMCKLUeaCl7LDBD9ICw3aEUYZKdsWh40ZHLw&oe=693129C2;"Cumhuriyet Halk Partimizin 39’uncu Olağan Kurultayı’nda yeniden Genel Başkanlığa seçilen Sayın Özgür Özel’i yürekten kutluyorum.  Kurultayımızda kabul ettiğimiz yeni parti programımız; iktidar programıdır, milletin programıdır.  Umudu örgütlemek, demokrasiyi, hukuku, refahı ve adaleti yeniden inşa etmek için yola çıkıyoruz. Bu ülkenin geleceğini, alın teriyle, emekle, dayanışmayla hep birlikte kuracağız.  #şimdii̇ktidarzamanı";45589.0;0
https://www.instagram.com/p/DRhBfcXDUcD/;Reels;452;7;21999;2025-11-26 13:24:10;https://scontent.cdninstagram.com/v/t51.82787-15/589273325_18329514118244863_4183103259179886556_n.jpg?stp=dst-jpg_e15_tt6&_nc_cat=103&ig_cache_key=Mzc3NDMwNDUyMTUxNDk5MzQxMTE4MzI5NTE0MTE1MjQ0ODYz.3-ccb7-5&ccb=7-5&_nc_sid=58cdad&efg=eyJ2ZW5jb2RlX3RhZyI6InhwaWRzLjU0MHg5NjAuc2RyLkMzIn0%3D&_nc_ohc=IXOCGN7SJDgQ7kNvwHrqfjk&_nc_oc=AdmCr4NjkckZldhZ4ZzmAIomapMPi5aldibXWairFDp2AU8D_PP1B3l3Om__nCF1gWU&_nc_ad=z-m&_nc_cid=0&_nc_zt=23&_nc_ht=scontent.cdninstagram.com&_nc_gid=0Cfq2ioIqF5YEUKgy84O3g&oh=00_AfgVQ0AonuTI9HW-7CpWIG129JborW3hXfysn8s4GqY57g&oe=69310544;Daha temiz, daha yaşanabilir bir Kastamonu için çalışıyoruz. 🌿  Yuvamız Kastamonu’da zamanla yıpranan çöp konteynerlerimizi onarıp yeniden kullanıma kazandırarak hem çevremizi hem de bütçemizi koruyoruz. ♻️;;0
https://www.instagram.com/p/DRelj98jVdN/;Reels;532;7;33563;2025-11-25 14:34:48;https://scontent.cdninstagram.com/v/t51.82787-15/588167994_18329418160244863_6523883357380457854_n.jpg?stp=dst-jpg_e15_tt6&_nc_cat=108&ig_cache_key=Mzc3MzYxODczNzE5OTc5ODA5MzE4MzI5NDE4MTU0MjQ0ODYz.3-ccb7-5&ccb=7-5&_nc_sid=58cdad&efg=eyJ2ZW5jb2RlX3RhZyI6InhwaWRzLjU0MHg5NjAuc2RyLkMyIn0%3D&_nc_ohc=GFivpBqYb7MQ7kNvwEA7u1S&_nc_oc=AdntYEku3-0N-0Tx3xWp4Ma5wLwY-yMLW1MTCCMtOyod_XlXQ8yye6nrlUzQUqnDIG0&_nc_ad=z-m&_nc_cid=0&_nc_zt=23&_nc_ht=scontent.cdninstagram.com&_nc_gid=0Cfq2ioIqF5YEUKgy84O3g&oh=00_AfhsPxuFALO4FkCDSr_PgeAENmzT7Ni9-8prYcTtj_i1SA&oe=6930F9B7;Saraçlar Mahallesi ana isale hattında gece saat 03.35’te meydana gelen arıza ekiplerimizin yoğun çalışması sonucu giderilerek kesinti yaşanan bölgelere içme suyu yeniden verilmiştir.  Sabrınız için sizlere, emekleri için ekiplerimize teşekkür ederiz.;;0
https://www.instagram.com/p/DReeXyHjapd/;Photo;163;4;0;2025-11-25 13:31:00;https://scontent.cdninstagram.com/v/t51.82787-15/587791854_18329413711244863_8838145677534753930_n.heic?stp=dst-jpg_e35_tt6&_nc_cat=110&ig_cache_key=Mzc3MzU4NzExMzU0MDE2ODI4NQ%3D%3D.3-ccb7-5&ccb=7-5&_nc_sid=58cdad&efg=eyJ2ZW5jb2RlX3RhZyI6InhwaWRzLjExNTJ4MTQ0MC5zZHIuQzMifQ%3D%3D&_nc_ohc=XuXZdxFM2MsQ7kNvwGsg7KA&_nc_oc=AdlPxBLK_fbdybLb8t-9RQ_PAj36XMTuaPRGEYslNAqX1ufo1ijbKwDQTzpaYeqXs-s&_nc_ad=z-m&_nc_cid=0&_nc_zt=23&_nc_ht=scontent.cdninstagram.com&_nc_gid=0Cfq2ioIqF5YEUKgy84O3g&oh=00_Afi9cuc3fMWray2zG8mpbscIqtliC9O9a_pEz2npJWOeKg&oe=69312F29;Gibi dizisinin sevilen oyuncularından hemşehrimiz Ahmet Kürşat Öçalan’ın sahne alacağı “İnteraktif Komedi Oyunu: Toplantı” 29 Kasım Cumartesi günü şehrimizde ücretsiz olarak sahnelenecek.  Tüm hemşehrilerimiz davetlidir.  🗓️ 29 Kasım Cumartesi ⏰ 20.00 📍 Kuzeykent Nikah ve Konferans Salonu;;0
https://www.instagram.com/p/DRePNJ8jW1w/;Photo;321;3;0;2025-11-25 11:18:29;https://scontent.cdninstagram.com/v/t51.82787-15/587504704_18329405092244863_6617429418428080287_n.heic?stp=dst-jpg_e35_tt6&_nc_cat=100&ig_cache_key=Mzc3MzUyMDQxMjUxMzQ5NjQzMg%3D%3D.3-ccb7-5&ccb=7-5&_nc_sid=58cdad&efg=eyJ2ZW5jb2RlX3RhZyI6InhwaWRzLjE0Mzl4OTU5LnNkci5DMyJ9&_nc_ohc=h5f7Nwg-OoAQ7kNvwE2SeN-&_nc_oc=AdmimJV7KAzkQLrwumERZbeYZYMraSS1OxsfP0fxi26PUcPmVKr5W-CcY-yYzpvi_XY&_nc_ad=z-m&_nc_cid=0&_nc_zt=23&_nc_ht=scontent.cdninstagram.com&_nc_gid=0Cfq2ioIqF5YEUKgy84O3g&oh=00_AfgHEAoEsKtQfNyrkAezqZWg8qv8hyQ2wOhwcOo_rICN9w&oe=693110BB;Kastamonu Çalışma ve İş Kurumu İl Müdürü Zeynep Demir'i belediyemizde misafir ettik.  Nazik ziyaretleri için teşekkür ediyor, çalışmalarında başarılar diliyorum.;;0
https://www.instagram.com/p/DRcfRAKjZdI/;Carousel;1177;4;0;2025-11-24 19:00:20;https://scontent.cdninstagram.com/v/t51.82787-15/587019749_18329343559244863_7146668136130640335_n.heic?stp=dst-jpg_e35_tt6&_nc_cat=106&ig_cache_key=Mzc3MzAyODA3OTI5NjY3OTE0Mg%3D%3D.3-ccb7-5&ccb=7-5&_nc_sid=58cdad&efg=eyJ2ZW5jb2RlX3RhZyI6InhwaWRzLjE0Mzl4OTU5LnNkci5DMyJ9&_nc_ohc=3yNYjsrHhAwQ7kNvwHGxDas&_nc_oc=AdmvdH95Alxo0nSK7RdJAGqccq2T-hI0G66U-aKMNOVTYcGghE3TiAjjxfAZiRr3lqE&_nc_ad=z-m&_nc_cid=0&_nc_zt=23&_nc_ht=scontent.cdninstagram.com&_nc_gid=0Cfq2ioIqF5YEUKgy84O3g&oh=00_AfiVbvC3aZkQnisMJ2mlQfCA3iWtynUyQwz35Bo7x06tLA&oe=69312C96;"Prof. Dr. Saime İnal Savi Sosyal Bilimler Lisesi, 10 Aralık Kız Mesleki ve Teknik Anadolu Lisesi, Akademi Kastamonu Eğitim Merkezimiz, Çocuk Bakımevimiz ve Engelsiz Yaşam Merkezimizi ziyaret ederek öğretmenlerimizin Öğretmenler Günü’nü kutladık.  Geleceğimizin ışığı çocuklarımızı ve gençlerimizi; fikri hür, vicdanı hür, irfanı hür nesiller olarak yetiştiren, yarınlarımızı aydınlatan tüm öğretmenlerimize gönülden teşekkür ediyorum.";;0
https://www.instagram.com/p/DRbV4S3DLxE/;Photo;278;0;0;2025-11-24 08:19:05;https://scontent.cdninstagram.com/v/t51.82787-15/587533536_18329296342244863_1786497575807736933_n.webp?_nc_cat=111&ig_cache_key=Mzc3MjcwNTM0MDM3MTI4NzEwOA%3D%3D.3-ccb7-5&ccb=7-5&_nc_sid=58cdad&efg=eyJ2ZW5jb2RlX3RhZyI6InhwaWRzLjExNTJ4MTQ0MC5zZHIuQzIifQ%3D%3D&_nc_ohc=Cz3po3wfFCIQ7kNvwGQw9Nc&_nc_oc=AdmhbsYw59pu6udsZSIb_tNwblR-nbBhhzTi0om9Ru-mFX1_B9o2r_gTa6Y2tfzbItc&_nc_ad=z-m&_nc_cid=0&_nc_zt=23&_nc_ht=scontent.cdninstagram.com&_nc_gid=0Cfq2ioIqF5YEUKgy84O3g&oh=00_AfjK2mdY2LiVL568g-xaNq8srMrx-5KrFO5hWMR8GfVVag&oe=69310EFF;Başöğretmenimiz Gazi Mustafa Kemal Atatürk’ün aydınlattığı yolda “fikri hür, vicdanı hür” nesiller yetiştiren öğretmenlerimizin 24 Kasım Öğretmenler Günü’nü kutlarım.;;0
https://www.instagram.com/p/DRZ3F2ZDV3R/;Carousel;1029;19;0;2025-11-23 18:30:48;https://scontent.cdninstagram.com/v/t51.82787-15/588440797_18329240965244863_7641090114101361025_n.heic?stp=dst-jpg_e35_tt6&_nc_cat=109&ig_cache_key=Mzc3MjI4ODQzOTI0NTcwNzQyNA%3D%3D.3-ccb7-5&ccb=7-5&_nc_sid=58cdad&efg=eyJ2ZW5jb2RlX3RhZyI6InhwaWRzLjE0Mzl4OTU5LnNkci5DMyJ9&_nc_ohc=A9hLYweLKYYQ7kNvwHW0UhC&_nc_oc=AdnyYUVWXSmBrIyLfuqL2TtE9Z2Slgdih23jvY5X8GKTxDsu9EHg-pR8NtgVknQBQvU&_nc_ad=z-m&_nc_cid=0&_nc_zt=23&_nc_ht=scontent.cdninstagram.com&_nc_gid=0Cfq2ioIqF5YEUKgy84O3g&oh=00_AfijmMEzVFPa9zWA-zRECFopl_cTnEVpe3XRwShWEiUUbg&oe=6931149F;"#YuvamızKastamonu'nun her sokağını, her caddesini, her mahallesini en güzeli ile buluşturmak için çalışmalarımızı gece gündüz demeden sürdürüyoruz.   Bu kapsamda;  📍Kuzeykent Mahallemizde 44. Sokak'ta sıcak asfalt serimi 📍Yurtlar bölgesinde parke yol, kaldırım ve tretuvar yapımı 📍BARO binası önünde tamamladığımız sıcak asfalt serimi 📍İnönü Mahallemizde de kapalı otoparklar üzerinde devam eden yürüyüş yolu akrilik zemin kaplama çalışmalarımızı inceledik.   Şehrimize emekleri ile değer katan tüm çalışma arkadaşlarımıza teşekkür ediyorum.";;0
https://www.instagram.com/p/DRXTMFhjXVW/;Carousel;821;5;0;2025-11-22 18:38:36;https://scontent.cdninstagram.com/v/t51.82787-15/587732255_18329132947244863_663578885874867300_n.heic?stp=dst-jpg_e35_tt6&_nc_cat=106&ig_cache_key=Mzc3MTU2NzU5MTAxMDQ0MTk1NQ%3D%3D.3-ccb7-5&ccb=7-5&_nc_sid=58cdad&efg=eyJ2ZW5jb2RlX3RhZyI6InhwaWRzLjE0Mzd4OTYwLnNkci5DMyJ9&_nc_ohc=I9WByP5-ZUUQ7kNvwGXSGZq&_nc_oc=Adkj0211kelLgUe4BDNpISibQOfS5uEaYvQGSyU1_19tFUssuWsx0QzjSsGAFAT9Px8&_nc_ad=z-m&_nc_cid=0&_nc_zt=23&_nc_ht=scontent.cdninstagram.com&_nc_gid=0Cfq2ioIqF5YEUKgy84O3g&oh=00_AfjIqdCeYrZLzwgUI6ytxfJlJBu9VxTD0Vc0Qs8vsUvsrw&oe=69311E2B;"Genel Başkanımız Sayın @eczozgurozel, Parti Meclisi Üyemiz @hikmeterbilgin ve İl Başkanımız @ilkekarabacakchp ile birlikte Zonguldaklı hemşehrilerimiz ile buluştuk.  Genel Başkanımız ile birlikte Belediye Başkanımız @tahsinerdem67'i ziyaret ettik.  Geri adım atmayacağız; baskıların ve karalama kampanyalarının karşısında cesaretle duracak, mücadelemizi büyüterek Türkiye’yi hak ettiği aydınlık yarınlara birlikte ulaştıracağız.  Kurtuluş Yok Tek Başına Ya Hep Beraber Ya Hiçbirimiz!";;0
https://www.instagram.com/p/DRWnMgyjbpL/;Reels;644;19;28972;2025-11-22 12:14:41;https://scontent.cdninstagram.com/v/t51.71878-15/586674269_1172537411670400_1630455284043401127_n.jpg?stp=dst-jpg_e15_tt6&_nc_cat=105&ig_cache_key=Mzc3MTM3NDEyMTYyNDkxMDQxMTExNTM5ODE3NTY0NDg5NDg%3D.3-ccb7-5&ccb=7-5&_nc_sid=58cdad&efg=eyJ2ZW5jb2RlX3RhZyI6InhwaWRzLjY0MHgzNjAuc2RyLkMzIn0%3D&_nc_ohc=Zkv0qvycsi0Q7kNvwF1wwKC&_nc_oc=AdkV_D3263a1Ll2abniVcmoZrVqT9Qqn_Hsz07jNNBgw4vds3uut2snFg1mpIb8txMs&_nc_ad=z-m&_nc_cid=0&_nc_zt=23&_nc_ht=scontent.cdninstagram.com&_nc_gid=0Cfq2ioIqF5YEUKgy84O3g&oh=00_AfiShce1XmXQWzjwXzd4q2QgnXLvf3QRMNBGwGs7b1fWhw&oe=693110FD;Mahalle Temizlik timlerimiz çalışmalarına kesintisiz devam ediyor. Her köşesi pırıl pırıl bir Kastamonu için çalışıyoruz.  #YuvamızKastamonu;;0
https://www.instagram.com/p/DRUzLZADTr5/;Reels;425;8;17103;2025-11-21 19:35:09;https://scontent.cdninstagram.com/v/t51.82787-15/584912453_18329034499244863_326211690692120897_n.jpg?stp=dst-jpg_e15_tt6&_nc_cat=107&ig_cache_key=Mzc3MDg2Mzg3MTE0NjY3MDg0MTE4MzI5MDM0NDk2MjQ0ODYz.3-ccb7-5&ccb=7-5&_nc_sid=58cdad&efg=eyJ2ZW5jb2RlX3RhZyI6InhwaWRzLjU0MHg5NjAuc2RyLkMzIn0%3D&_nc_ohc=OGGsEOpaE-0Q7kNvwHi1AzR&_nc_oc=AdkXSjUzo9XQikAmH5-NDjnTfAFXWSKTJb_SvaybRLDUbJBO5-3nSApc7veVkI5uJiY&_nc_ad=z-m&_nc_cid=0&_nc_zt=23&_nc_ht=scontent.cdninstagram.com&_nc_gid=0Cfq2ioIqF5YEUKgy84O3g&oh=00_AfgEVHwjdXvDt0xJnjy3Kz0V0orAh19D8T3UZGHidvS-JQ&oe=6930FE9F;"Bu bütçenin tek bir hedefi vardır: Yuvamız Kastamonu’ya hizmet etmek ve hemşehrilerimizin yaşam kalitesini yükseltmek, bu kadim şehrin kaynaklarını, çevresini, tabiatını ve tarihini korumak; milletin evlatlarına eşit, adil ve yeni fırsatlar sunmaktır.   Bu ilkeye, bu ideale sahip bizler, gelecek nesillere daha güçlü bir belediye bırakacağız.";;0
https://www.instagram.com/p/DRUkRBIjVYK/;Reels;772;17;23090;2025-11-21 17:12:59;https://scontent.cdninstagram.com/v/t51.82787-15/586663625_18329021329244863_2867871579941484377_n.jpg?stp=dst-jpg_e15_tt6&_nc_cat=107&ig_cache_key=Mzc3MDc5ODI4NzEzODY3NDE4NjE4MzI5MDIxMzI2MjQ0ODYz.3-ccb7-5&ccb=7-5&_nc_sid=58cdad&efg=eyJ2ZW5jb2RlX3RhZyI6InhwaWRzLjU0MHg5NjAuc2RyLkMzIn0%3D&_nc_ohc=3Qb7tZOBvxQQ7kNvwG4qZ00&_nc_oc=AdmViBsVhU6V1_19orfhH88beLfpOawYCH9YDBGBPlCzeO41v14CcbVgwkoHKdANOGo&_nc_ad=z-m&_nc_cid=0&_nc_zt=23&_nc_ht=scontent.cdninstagram.com&_nc_gid=0Cfq2ioIqF5YEUKgy84O3g&oh=00_AfhP_W08YxAnZRfgPKu5A1FMCGqouKpQve_tdRXQsTIZOw&oe=693122B8;El işçiliğinin inceliği, yöresel sanatların zarafeti, yaklaşık üç asırdır tarihin nefes aldığı Münire Medresesi’nde hayat buluyor.   Kastamonu Turizm Altyapı Hizmet Birliği (KASTAB) olarak kültürel değerlerimizin tanıtımı ve turizmin gelişmesi için çalışmalarımızı sürdüreceğiz.;;0
https://www.instagram.com/p/DRSBK8GDbth/;Photo;474;2;0;2025-11-20 17:24:57;https://scontent-atl3-3.cdninstagram.com/v/t51.82787-15/587776343_18328917499244863_4381364099720904825_n.webp?_nc_cat=108&ig_cache_key=Mzc3MDA4MDk4NzgyOTg3NzYwMQ%3D%3D.3-ccb7-5&ccb=7-5&_nc_sid=58cdad&efg=eyJ2ZW5jb2RlX3RhZyI6InhwaWRzLjE0Mzl4OTU5LnNkci5DMyJ9&_nc_ohc=uzEL8zD2ujYQ7kNvwEqoJS1&_nc_oc=AdmgGNXOhq7WFEqXBe3jRhaNE974spaSIKnbuQmTxNVT-F3KeqpRy6JHpvSVTnIP1sc&_nc_ad=z-m&_nc_cid=0&_nc_zt=23&_nc_ht=scontent-atl3-3.cdninstagram.com&_nc_gid=vmHlGacZt0S4-POkSL4Aig&oh=00_Afih8bNaaYP_tKQkf-n67gkUO-PRXGBzXYt6lsTDvAq8wQ&oe=69311FF8;Türkiye Futbol Federasyonu U14 Millî Takım Kastamonu Bölge Seçmeleri için şehrimize gelen Genç Millî Takımlar Teknik Koordinatörü Samet Aybaba, Elit Futbolcu Gelişim Sorumlusu Caner Kaya ve Amatör Futbolcu Gelişim Sorumlusu Halil İbrahim Toy’u belediyemizde ağırladık.  Nazik ziyaretleri için kendilerine teşekkür ediyor, çalışmalarında başarılar diliyorum.;;0
https://www.instagram.com/p/DRQZY1RjPs5/;Carousel;629;17;0;2025-11-20 02:18:05;https://scontent-atl3-2.cdninstagram.com/v/t51.82787-15/582499997_18328856356244863_6356674268871890458_n.heic?stp=dst-jpg_e35_tt6&_nc_cat=102&ig_cache_key=Mzc2OTYyNDUzNjI2MjkzODMyMw%3D%3D.3-ccb7-5&ccb=7-5&_nc_sid=58cdad&efg=eyJ2ZW5jb2RlX3RhZyI6InhwaWRzLjE0Mzl4OTU5LnNkci5DMyJ9&_nc_ohc=xT7L2qcqLw0Q7kNvwGxHCpo&_nc_oc=AdlloyOkEsFHW_MWAx0bs5jF6Vinx5N-H_D_k0-g2WrCcxSPDSxkAdezfSNeL3hM8Cg&_nc_ad=z-m&_nc_cid=0&_nc_zt=23&_nc_ht=scontent-atl3-2.cdninstagram.com&_nc_gid=vmHlGacZt0S4-POkSL4Aig&oh=00_AfidO96rBASU-zPPbl4ARXRatspbwS3nuM_VzoiIxUYNEg&oe=69310D63;Belediyemizin 2026 yılı bütçesini görüştüğümüz Kasım ayı olağan ikinci toplantımızı tamamladık.  2026 bütçemiz yüzde 20,85 artarak 3 milyar 100 milyon liraya ulaştı. Bunun 1 milyar 70 milyon lirasını doğrudan yatırıma ayırıyoruz. 163 milyon liralık borcumuzun, bütçemizin sadece yüzde 5,25’i olması ise mali disiplinimizin ne kadar sağlam olduğunu gösteriyor.  Önümüzdeki yıl şehirde büyük bir yatırım hamlesi başlatıyoruz: Yolları ve kaldırımları yenileyecek, yeni köprüler inşa edecek, su ve kanalizasyon altyapımızı güçlendirerek Kastamonu’nun geleceğini sağlam temellere oturtacağız.  Adil, şeffaf ve kapsayıcı bir bütçe ile Kastamonu’ya güçlü bir hizmet yılı yaşatacağız.  Yuvamız Kastamonu’ya hayırlı olsun.;;0
https://www.instagram.com/p/DRPXr3pDaiN/;Carousel;591;7;0;2025-11-19 16:43:58;https://scontent-atl3-3.cdninstagram.com/v/t51.82787-15/583296371_18328815754244863_3317065398073817557_n.heic?stp=dst-jpg_e35_tt6&_nc_cat=107&ig_cache_key=Mzc2OTMzNTU3MjI4MDk4MzMzNQ%3D%3D.3-ccb7-5&ccb=7-5&_nc_sid=58cdad&efg=eyJ2ZW5jb2RlX3RhZyI6InhwaWRzLjE0Mzl4OTU5LnNkci5DMyJ9&_nc_ohc=ZNl5zLpRn6kQ7kNvwHsv-C_&_nc_oc=AdlAbvbvQ-aBVYsrxL4nPa-YvUNyqEaNoRf1swjjIeAePEvZDlDb8SsLL9hkQS7tExk&_nc_ad=z-m&_nc_cid=0&_nc_zt=23&_nc_ht=scontent-atl3-3.cdninstagram.com&_nc_gid=vmHlGacZt0S4-POkSL4Aig&oh=00_Afj-UJqSJpmPVacHfw-AIYw7O_5tTQyZ_B9DKBJCstOd5g&oe=693111D4;Candaroğulları Mahallemizde Nakkaş Sokak'ta sıcak asfalt serimi ile tesviye çalışmamıza ve İnönü Mahallemizde Karaçomak Deresi üzerinde köprü yapımına devam ediyoruz.  Şehir içi ulaşıma nefes aldıracak eylem planımız kapsamında çalışmalarımızı hızla tamamlayacağız. Emek veren ekiplerimize teşekkür ediyorum.;;0
https://www.instagram.com/p/DRPCb-ojW6p/;Carousel;731;20;0;2025-11-19 13:38:18;https://scontent-atl3-1.cdninstagram.com/v/t51.82787-15/584315809_18328800934244863_7529812642760736955_n.heic?stp=dst-jpg_e35_tt6&_nc_cat=103&ig_cache_key=Mzc2OTI0MjExMjI1NzQ5NDcxNw%3D%3D.3-ccb7-5&ccb=7-5&_nc_sid=58cdad&efg=eyJ2ZW5jb2RlX3RhZyI6InhwaWRzLjE0NDB4MTA4MC5zZHIuQzMifQ%3D%3D&_nc_ohc=ZVi8XfNxZ8sQ7kNvwGIZASD&_nc_oc=AdlbnKaRxMP8blc0LWpAWkHy59CjnYZXheK_BLH4J8KYFdb18FIprbmMcquAQuIeito&_nc_ad=z-m&_nc_cid=0&_nc_zt=23&_nc_ht=scontent-atl3-1.cdninstagram.com&_nc_gid=vmHlGacZt0S4-POkSL4Aig&oh=00_Afh0xNiVRFkOaY1g2hrhi6_jLU9c-CtjPOfhDJsfAtdbIg&oe=69310E8F;Daha temiz, daha güzel bir Kastamonu için Mahalle Temizlik Timlerimiz saha çalışmalarını kesintisiz sürdürüyor.  Caddeler, sokaklar, kaldırımlar, yollar ve parklar... #YuvamızKastamonu'nun her köşesine eli değen ekiplerimize emekleri için teşekkür ederim.;;0
https://www.instagram.com/p/DRNGxmQDXQS/;Carousel;402;2;0;2025-11-18 19:37:43;https://scontent-atl3-3.cdninstagram.com/v/t51.82787-15/581370605_18328735912244863_7781507233270510642_n.heic?stp=dst-jpg_e35_tt6&_nc_cat=110&ig_cache_key=Mzc2ODY5ODI1Mjc0NTg4OTY5Mw%3D%3D.3-ccb7-5&ccb=7-5&_nc_sid=58cdad&efg=eyJ2ZW5jb2RlX3RhZyI6InhwaWRzLjE0NDB4OTYwLnNkci5DMyJ9&_nc_ohc=RPAyl1q8aFEQ7kNvwFlFN5C&_nc_oc=AdkYS0PeaHsM1-XRQaDkvo2jCBlcNNEwTcxmY6BQybM-AT-RsMCGoiak8vs8YCjt9C4&_nc_ad=z-m&_nc_cid=0&_nc_zt=23&_nc_ht=scontent-atl3-3.cdninstagram.com&_nc_gid=vmHlGacZt0S4-POkSL4Aig&oh=00_AfhTeEBisJOw9_sii0oPd6TdDdPtEbxq2VCc0R31tt9vwA&oe=693117B8;Genel Başkanımız Sayın Özgür Özel’in öncülüğünde gerçekleştirilen Cumhuriyet Halk Partimizin TBMM Grup Toplantısı'na il belediye başkanlarımız ile birlikte katıldık.  Karanlık düzenden birlikte kurtulacak, ülkemizi Cumhuriyetimizin temel değerlerini güçlendirerek aydınlık yarınlara kararlılıkla ve cesaretle birlikte taşıyacağız.;;0
https://www.instagram.com/p/DRKeVdmDYcU/;Carousel;579;10;0;2025-11-17 19:05:52;https://scontent-atl3-2.cdninstagram.com/v/t51.82787-15/583134487_18328637293244863_2088542586036992588_n.heic?stp=dst-jpg_e35_tt6&_nc_cat=105&ig_cache_key=Mzc2Nzk1NzQ0MjQxNjk0MzQyNQ%3D%3D.3-ccb7-5&ccb=7-5&_nc_sid=58cdad&efg=eyJ2ZW5jb2RlX3RhZyI6InhwaWRzLjE0Mzl4OTU5LnNkci5DMyJ9&_nc_ohc=SYwGi3CQci8Q7kNvwFkXQFY&_nc_oc=AdmW35v4J0BzzZLJdlyU007pZdtyBob0EElb-SQEqYew4EiNiOWxSn1z-j3UYK12ovQ&_nc_ad=z-m&_nc_cid=0&_nc_zt=23&_nc_ht=scontent-atl3-2.cdninstagram.com&_nc_gid=vmHlGacZt0S4-POkSL4Aig&oh=00_AfgrAY8I7zywyu74qmwZTWAMqIP3XIzuh9ltLuWJwSAEvw&oe=693112F1;"Yuvamız Kastamonu’nun daha güvenli ve konforlu bir ulaşıma kavuşması için hazırladığımız Ulaşım Ana Planı kapsamında; Candaroğulları Mahallesi Nakkaş Sokak’ta sıcak asfalt öncesi yapılan tesviye çalışmasını ve İnönü Mahallesi’ndeki köprü yapım çalışmalarını yerinde inceledik.  Şehrimiz için emek veren tüm çalışma arkadaşlarıma gönülden teşekkür ediyorum.";;0
https://www.instagram.com/p/DRKWU4QDSWA/;Photo;346;1;0;2025-11-17 17:55:53;https://scontent-atl3-2.cdninstagram.com/v/t51.82787-15/582652652_18328631074244863_8126809556528643699_n.heic?stp=dst-jpg_e35_tt6&_nc_cat=102&ig_cache_key=Mzc2NzkyMjIzMDA2MDQ1OTM5Mg%3D%3D.3-ccb7-5&ccb=7-5&_nc_sid=58cdad&efg=eyJ2ZW5jb2RlX3RhZyI6InhwaWRzLjE0Mzl4OTU5LnNkci5DMyJ9&_nc_ohc=ak1kd0f9sKAQ7kNvwHIa1gc&_nc_oc=Adk_acuV_ShibZ_1Z0WOFjrWiZplshdkFolFQYvwpJJ81iFTpoA08BY0jJfFlfm504s&_nc_ad=z-m&_nc_cid=0&_nc_zt=23&_nc_ht=scontent-atl3-2.cdninstagram.com&_nc_gid=vmHlGacZt0S4-POkSL4Aig&oh=00_AfhProrTvG-XWh-wW3tUTrdFHXuH3D_kvSSf9cbZPbzelw&oe=69311A0C;Safranbolu Belediye Başkanımız Elif Köse ve Başkan Yardımcısı Taner Timar'ı belediyemizde misafir ettik.   Nazik ziyaretleri için Safranbolu Belediye Başkanımız Elif Köse ve Başkan Yardımcısı Taner Timar'a teşekkür eder, çalışmalarında başarılar dilerim.;;0
https://www.instagram.com/p/DRFjkBTDY7m/;Carousel;525;5;0;2025-11-15 21:15:21;https://scontent-atl3-3.cdninstagram.com/v/t51.82787-15/582613027_18328455466244863_6666202204909236394_n.heic?stp=dst-jpg_e35_tt6&_nc_cat=111&ig_cache_key=Mzc2NjU3MzA2MDQxNDMxODc4MQ%3D%3D.3-ccb7-5&ccb=7-5&_nc_sid=58cdad&efg=eyJ2ZW5jb2RlX3RhZyI6InhwaWRzLjE0Mzl4OTU5LnNkci5DMyJ9&_nc_ohc=1BtGuWMSrEwQ7kNvwFnVQvO&_nc_oc=Adm2cyjNwZGqjss4gcNqf91fPQBZuIFCT22jKt7jBbencOYhqE3_oOWTXvm4SpdKFaE&_nc_ad=z-m&_nc_cid=0&_nc_zt=23&_nc_ht=scontent-atl3-3.cdninstagram.com&_nc_gid=vmHlGacZt0S4-POkSL4Aig&oh=00_Afg4fB73ZsCadFNXPLPjkYASUkMPopdypHniz3-egSyMtg&oe=6931012C;Yuvamız Kastamonu’nun yollarını, kaldırımlarını, caddelerini ve sokaklarını daha konforlu hale getirmek için 7/24 çalışmalarımızı sürdürüyoruz.;;0
https://www.instagram.com/p/DRCV18HjRBe/;Carousel;829;9;0;2025-11-14 15:17:44;https://scontent-atl3-2.cdninstagram.com/v/t51.82787-15/582632681_18328324798244863_2722055931569223916_n.heic?stp=dst-jpg_e35_tt6&_nc_cat=104&ig_cache_key=Mzc2NTY2ODI5MjM2ODEzMTgxOQ%3D%3D.3-ccb7-5&ccb=7-5&_nc_sid=58cdad&efg=eyJ2ZW5jb2RlX3RhZyI6InhwaWRzLjE0NDB4OTYwLnNkci5DMyJ9&_nc_ohc=uY9sl21F-X8Q7kNvwE1ksvB&_nc_oc=AdlzsizWXI6vCYJ7gEZ5tyocoe_F_haXleyVFHze0-_sPg4eZD3TSe0O1AT3aamCB24&_nc_ad=z-m&_nc_cid=0&_nc_zt=23&_nc_ht=scontent-atl3-2.cdninstagram.com&_nc_gid=vmHlGacZt0S4-POkSL4Aig&oh=00_AfhzLEuNdgLyEX6tY-k6BptokSS2dZ1eKFpqSr4t-YlnNA&oe=69310A24;Mahalle Temizlik Timlerimiz, Yuvamız Kastamonu’nun her bir köşesini, sokağını, kaldırımını ve yeşil alanını titizlikle temizlemeye devam ediyor.  Mahallelerimizin daha temiz ve daha güzel olması için girilmedik ara, ulaşılmadık nokta bırakmadan gece gündüz çalışmalarımızı sürdüreceğiz.;;0
https://www.instagram.com/p/DQ_1fI3DGh1/;Reels;531;3;31685;2025-11-13 15:58:12;https://scontent-atl3-3.cdninstagram.com/v/t51.82787-15/581897850_18328230517244863_1491524549151375113_n.jpg?stp=dst-jpg_e15_tt6&_nc_cat=111&ig_cache_key=Mzc2NDk2MzA0OTc4NzM4NTk3Mw%3D%3D.3-ccb7-5&ccb=7-5&_nc_sid=58cdad&efg=eyJ2ZW5jb2RlX3RhZyI6InhwaWRzLjU0MHg5NjAuc2RyLkMzIn0%3D&_nc_ohc=IC8PsCJVKYcQ7kNvwH2CX_b&_nc_oc=Adk8w6wqYR7u_-guLlzjb6NkDTs9MXs1-Orgv2TGSvrGEY7ujSp2VsrAwv0LuD-Hrhk&_nc_ad=z-m&_nc_cid=0&_nc_zt=23&_nc_ht=scontent-atl3-3.cdninstagram.com&_nc_gid=vmHlGacZt0S4-POkSL4Aig&oh=00_AfiQNYbxjKk_wwh0WwEArmMkAJTKiat2s-4jaKG2J6xZ-Q&oe=693124E1;Yuvamız Kastamonu’da yağış mevsiminde meydana gelebilecek su baskınları ve taşkınların önüne geçebilmek için ekiplerimiz gece gündüz çalışmalarını sürdürüyor.   Su ve Kanalizasyon İşleri Müdürlüğü’ne bağlı ekiplerimiz, 20 mahallemizde mazgal onarım, bakım ve temizlik çalışmalarını titizlikle yürütüyor. 🧰🕳️  Yağışlı günlerde güvenli ve sorunsuz bir ulaşım için çalışmalarımız aralıksız devam ediyor.;;0
https://www.instagram.com/p/DQ9oTxYDGQ3/;Reels;1333;44;56454;2025-11-12 19:24:00;https://scontent-atl3-3.cdninstagram.com/v/t51.71878-15/581029478_1025083309753433_4426425130578769665_n.jpg?stp=dst-jpg_e15_tt6&_nc_cat=110&ig_cache_key=Mzc2NDM0MjE0NDA5ODkxOTQ3OTgzNDE0NDU2OTQ3ODM1Mg%3D%3D.3-ccb7-5&ccb=7-5&_nc_sid=58cdad&efg=eyJ2ZW5jb2RlX3RhZyI6InhwaWRzLjY0MHgzNjAuc2RyLkMzIn0%3D&_nc_ohc=zQOQ7V8aP4UQ7kNvwGZfYai&_nc_oc=AdmA6EswmGzrja_J4vQBnVhn5ZmAHi6zX54XAPgp3gnqRj52FUhE5L4luj3Z1PXNjmI&_nc_ad=z-m&_nc_cid=0&_nc_zt=23&_nc_ht=scontent-atl3-3.cdninstagram.com&_nc_gid=vmHlGacZt0S4-POkSL4Aig&oh=00_Afh2E_Klh8S-2_NXKpOZVDJ7Z2y_xBjgS6HcYVYXG4CfOg&oe=693111FA;🌳 Saraçlar Mahallesi Yaşam Alanı çok güzel oldu! 🌿  Yuvamız Kastamonu’ya modern, konforlu, huzurlu, eğlenceli ve ferah bir park alanı daha kazandırdık. 💚  🌱 6.300 m² yeşil alan 🚴‍♀️ 440 metrelik bisiklet ve yürüyüş yolu 🌳 29 farklı ağaç türü 🛝 Üç farklı oyun alanı ⚽ Futbol sahası 🏐 Voleybol sahası 🏀 Basketbol sahası 🧗‍♂️🎢 Çocuklar için survivor konsepti ve zeplin parkuru  Çocuklarımızın gülümseyeceği, ailelerimizin huzurla vakit geçireceği yeni alanlar için çalışmalarımızı sürdürüyoruz.;;0
https://www.instagram.com/p/DQ85Vp3jQBX/;Photo;329;18;0;2025-11-12 12:32:28;https://scontent-atl3-2.cdninstagram.com/v/t51.82787-15/581224858_18328051084244863_6666707498285622388_n.webp?_nc_cat=105&ig_cache_key=Mzc2NDEzNTU2NTI5MDQzODc0Mw%3D%3D.3-ccb7-5&ccb=7-5&_nc_sid=58cdad&efg=eyJ2ZW5jb2RlX3RhZyI6InhwaWRzLjExNTJ4MTQ0MC5zZHIuQzMifQ%3D%3D&_nc_ohc=kDxs9c5Rn1cQ7kNvwGOBNd4&_nc_oc=AdklIPhFBWtWgdZaG-MP2vroktr0yBrLLR1tpxHYhwxvvvBzy12-TqAyrqiCjYAOj9A&_nc_ad=z-m&_nc_cid=0&_nc_zt=23&_nc_ht=scontent-atl3-2.cdninstagram.com&_nc_gid=vmHlGacZt0S4-POkSL4Aig&oh=00_AfgwD2wexGlFNFnIFErb4y8lGrS_b2HAFQcEcUZVK7RFBA&oe=6931127A;Azerbaycan’dan dönerken askeri kargo uçağımızın düşmesi sonucu şehit olan 20 askerimize Allah’tan rahmet, ailelerine ve sevenlerine sabır diliyorum.  Milletimizin başı sağ olsun.;;0
https://www.instagram.com/p/DQ3tX3SjTjD/;Carousel;1327;0;0;2025-11-10 12:11:42;https://scontent-atl3-2.cdninstagram.com/v/t51.82787-15/580568483_18327636532244863_1016434802707913105_n.heic?stp=dst-jpg_e35_tt6&_nc_cat=104&ig_cache_key=Mzc2MjY3NTU0OTYxMDA0MzY5Mg%3D%3D.3-ccb7-5&ccb=7-5&_nc_sid=58cdad&efg=eyJ2ZW5jb2RlX3RhZyI6InhwaWRzLjE0Mzl4OTU5LnNkci5DMyJ9&_nc_ohc=wNuXEHzUcVkQ7kNvwFq5aLc&_nc_oc=Adnght13cd-3Wqm8OaOZ1d7dmi8QcjqUihpUEc4yTVH-zovtk1jcKQJC7fSsNETMkoI&_nc_ad=z-m&_nc_cid=0&_nc_zt=23&_nc_ht=scontent-atl3-2.cdninstagram.com&_nc_gid=I5KAkdup1IE6MJ8AVV5zhg&oh=00_AfhhtHxVCbkBUsFlsRG2BWxNyed-VHkEDtGJgRAFCpQGvw&oe=693100C5;Fikirleri ve devrimleri yolumuzu aydınlatmaya devam edecek, bize bıraktığı emanet ilelebet payidar kalacaktır.   Cumhuriyetimizin Kurucusu Büyük Önderimiz Gazi Mustafa Kemal Atatürk'ü aramızdan ayrılışının 87. yıl dönümünde saygı, minnet ve özlemle andık.   Kastamonu Valiliği tarafından düzenlenen anma programına İl Başkanımız İlke Karabacak, Merkez İlçe Başkanımız Damla Yılmaz Özcan, il, ilçe yöneticilerimiz, il genel meclisi ve belediye meclisi üyelerimiz ile birlikte katıldık.   #10Kasım;;0
https://www.instagram.com/p/DQ3P286DCRu/;Photo;798;3;0;2025-11-10 07:53:48;https://scontent-atl3-3.cdninstagram.com/v/t51.82787-15/576006114_18327602662244863_5985018179999112568_n.webp?_nc_cat=108&ig_cache_key=Mzc2MjU0NTc2MDYzOTEzMjc4Mg%3D%3D.3-ccb7-5&ccb=7-5&_nc_sid=58cdad&efg=eyJ2ZW5jb2RlX3RhZyI6InhwaWRzLjE0NDB4MTQ0MC5zZHIuQzMifQ%3D%3D&_nc_ohc=bcjyFWLdiOIQ7kNvwHLn2A2&_nc_oc=AdkHF6F73u5RQqqzoX6feSjTHQaPhMu6ZsIDV03V3mu5pW8ysZI99wAemJ8RndRq6g0&_nc_ad=z-m&_nc_cid=0&_nc_zt=23&_nc_ht=scontent-atl3-3.cdninstagram.com&_nc_gid=I5KAkdup1IE6MJ8AVV5zhg&oh=00_Afj0Tt5TSspTwvdWVJ4i4ADMWmB5ZKc6NmwLKuwmWaS57A&oe=69310A9E;Fikirleri, devrimleri ve ilkeleriyle aydınlattığı yolda ilelebet yürüyeceğiz.   Cumhuriyetimizin kurucusu Gazi Mustafa Kemal Atatürk’ü sevgi, saygı ve minnetle anıyoruz.;;0
