PostLink;PostTürü;BeğeniSayısı;YorumSayısı;Görüntülenme Sayısı;Tarih;DisplayPhoto;Caption;Takipçi;TahminMi
https://www.instagram.com/p/DQ3rjpsjMet/;Carousel;169;0;0;2025-11-10 11:55:50;https://scontent.cdninstagram.com/v/t51.82787-15/579421991_18072372578340029_8860278848199933989_n.jpg?stp=dst-jpg_e35_tt6&_nc_cat=105&ig_cache_key=Mzc2MjY2NzU2NzgwNzUwNTU1Mw%3D%3D.3-ccb7-5&ccb=7-5&_nc_sid=58cdad&efg=eyJ2ZW5jb2RlX3RhZyI6InhwaWRzLjE0NDB4OTYwLnNkci5DMyJ9&_nc_ohc=P38yq8bBYe0Q7kNvwH-ouQl&_nc_oc=Adny8P2CHl9Gay35DHSTWD6yynBF0kRtmXwF8GczfgfITuT54CcypdIvMXfH4TCo2G98XnCeWa17HjZOV23HtSa1&_nc_ad=z-m&_nc_cid=0&_nc_zt=23&_nc_ht=scontent.cdninstagram.com&_nc_gid=M5Xvao5NFgyK_T80ym1NJw&oh=00_AfjK_bObB1k3DTSobFCTXriyv83JEO27JEODPFfu4pK25Q&oe=69311C87;✨Cumhuriyetimizin kurucusu, Gazi Mustafa Kemal Atatürk’ün ebediyete irtihalinin 87. yıl dönümü dolayısıyla 10 Kasım Atatürk’ü Anma Programı düzenlendi.  Anma programına, Valimiz Sayın @dr.kemalkizilkaya , eşi Nurten Kızılkaya Hanımefendi, il protokolü, adli, mülki ve askeri erkân, siyasi parti ve sivil toplum örgütlerinin temsilcileri, öğrenciler, şehit yakınları, gaziler ve vatandaşlar katıldı.  📍 İl Milli Eğitim Müdürlüğü Konferans Salonu  #10Kasım193∞  #MustafaKemalAtatürk #Siirt🇹🇷;;0
https://www.instagram.com/p/DQ3gCKmjBEh/;Carousel;384;0;0;2025-11-10 10:15:09;https://scontent.cdninstagram.com/v/t51.82787-15/575732947_18072364955340029_2991807582212555451_n.jpg?stp=dst-jpg_e35_tt6&_nc_cat=104&ig_cache_key=Mzc2MjYxNjg4NzI0Mzc2NjM1NA%3D%3D.3-ccb7-5&ccb=7-5&_nc_sid=58cdad&efg=eyJ2ZW5jb2RlX3RhZyI6InhwaWRzLjE0NDB4OTYwLnNkci5DMyJ9&_nc_ohc=UAVEj9nLZ0sQ7kNvwGcFV6J&_nc_oc=Adl56WJcLdU0O__UeyMOAoAF8sDjXrLT8Wc6jtMNyyJCSk7lpH62nt8vADImw3pW9mb44iYxpjjLqG7CBHcEdcoy&_nc_ad=z-m&_nc_cid=0&_nc_zt=23&_nc_ht=scontent.cdninstagram.com&_nc_gid=M5Xvao5NFgyK_T80ym1NJw&oh=00_AfgXtq52Lq9DH-9AUjlAP2XRqFwUExPgM9_efIm5QSaF6Q&oe=69312A1E;Saygı, Sevgi ve Özlemle... 193∞  💫Cumhuriyetimizin banisi Gazi Mustafa Kemal Atatürk’ün aramızdan ayrılışının 87. yıl dönümü dolayısıyla düzenlenen anma programı, Valimiz Sayın @dr.kemalkizilkaya ’nın Atatürk Anıtına çelenk sunumu ile başladı.  Programa, şehit yakınları, gaziler, il protokolü, askeri ve mülki erkan, siyasi parti ve sivil toplum örgütlerinin temsilcileri, öğrenciler ve vatandaşlar katıldı.  Bize büyük bir miras olarak bu güzel ülkeyi ve Cumhuriyeti bırakan başta Gazi Mustafa Kemal Atatürk’ü ve istiklâl mücadelemizin tüm kahramanlarını, aziz şehitlerimizi ve kahraman gazilerimizi saygı, özlem ve rahmetle anıyoruz.🤲  Ruhları şâd olsun 🇹🇷  📍#Siirt Cumhuriyet Meydanı  #10Kasım193∞ #MustafaKemalAtatürk   #siirt;;0
https://www.instagram.com/p/DQ0-scWDJ91/;Reels;243;12;41891;2025-11-09 10:48:15;https://scontent.cdninstagram.com/v/t51.71878-15/575978594_1451715132580427_3718772127186472427_n.jpg?stp=dst-jpg_e15_tt6&_nc_cat=100&ig_cache_key=Mzc2MTkwNzMyMTczNjU2ODY5Mw%3D%3D.3-ccb7-5&ccb=7-5&_nc_sid=58cdad&efg=eyJ2ZW5jb2RlX3RhZyI6InhwaWRzLjY0MHgxMTM2LnNkci5DMiJ9&_nc_ohc=BRIoQ55ydXUQ7kNvwH9JFGr&_nc_oc=AdkRRBOwC0rtPHZRNRBATOJB6CjUMriHgkk3oIwqylWpbKkgFzsJ_b7JYKuxnqZZKdAk_OMgIabGQK7P7e57Hvai&_nc_ad=z-m&_nc_cid=0&_nc_zt=23&_nc_ht=scontent.cdninstagram.com&_nc_gid=M5Xvao5NFgyK_T80ym1NJw&oh=00_AfiWPnPkrMiw5p1gCyrdEk0DBRGDRrkvgzvGwLJU66x1fQ&oe=69311F9C;"Vatandaşlarımızın gönül rızası ve  duası, yolumuzu güzelleştirmeye devam ediyor.🤲  Yol kalkınmadır, yol berekettir.🌾🇹🇷  Kırsal alanda kalkınma, güçlü altyapı ile mümkündür. İşte bunun için;  #baykan ilçemizde Çamtaşı–Günbuldu–Derince Grup Köy Yolu ile Ulaştı, İkizler, Obalı ve Eğridere köyleri güzergâhlarında toplam 2️⃣3️⃣.4️⃣0️⃣0️⃣ metre Bitümlü Sıcak Karışım (BSK) Asfalt Yol ile Yol Çizgi ve Şerit Çalışmalarımız tamamlandı. Memleketimize hayırlı olsun.👏  Yollarımız güzelleştikçe hemşerilerimizin yüzleri de gülmeye devam ediyor.🧑‍🌾  #siirt ’imizde toplamda 💯 kilometrenin üzerindeki Bitümlü Sıcak Karışım (BSK) Asfalt Yollarımızı, İl Özel İdaremize ait şantiyemizdeki makinelerimizle, kendi mühendislerimiz, teknik personelimiz ve işçilerimizin emeğiyle tamamlamanın haklı gururunu da yaşıyoruz.🌟  Yatırımlarımızla birlikte vatandaşlarımızın ulaşım konforu ve güvenliği artarken, köylerimizin ekonomik ve sosyal hayatına da yeni bir ivme kazandırıyoruz.📈  Yolumuz güzel👍 çizgimiz net 🇹🇷  @tcicisleri  #canlabaşla  #türkiyeyüzyılı  #terörsüztürkiye  #durmakyokyoladevam  #durmadanduraksamadan 🇹🇷";;0
https://www.instagram.com/p/DQyxVGcjIBK/;Photo;112;6;0;2025-11-08 14:10:05;https://scontent.cdninstagram.com/v/t51.82787-15/575115500_18085876376296327_2829392182929936452_n.jpg?stp=dst-jpg_e35_tt6&_nc_cat=103&ig_cache_key=Mzc2MTI4NTU5MzExNzI2MTg5OA%3D%3D.3-ccb7-5&ccb=7-5&_nc_sid=58cdad&efg=eyJ2ZW5jb2RlX3RhZyI6InhwaWRzLjg1M3gxMTM4LnNkci5DMyJ9&_nc_ohc=Qc8l0sagRnoQ7kNvwFK9XA8&_nc_oc=AdnOnF-6_J6pUNJbQwM7QucgwzDvCe14k3Sh80esZEAPl7U11Tbr4qE0cDEe4ak3sOxO9FUZe7RoSUxzXCyje6fD&_nc_ad=z-m&_nc_cid=0&_nc_zt=23&_nc_ht=scontent.cdninstagram.com&_nc_gid=M5Xvao5NFgyK_T80ym1NJw&oh=00_AfjPQ2X5ZSF43lxktG_45AKU6HMn9d2Qx2359opBLKbtvg&oe=69311B5E;🌱 Şahidimiz toprak,  imzamız fidan,  sevdamız yeşil vatan #yeşilvatanseferberliği   Haydi #siirt 1️⃣1️⃣ Kasım Milli Ağaçlandırma Günün’de fidan sahipleniyor ve toprakla buluşturuyoruz.🌲#eruh 🇹🇷  👉 Siz de gelecegenefes.gov.tr adresinden fidan sahiplenin, 11 Kasım’da toprağa imzanızı atın.;;0
https://www.instagram.com/p/DQyj6FyDHAk/;Reels;346;16;33521;2025-11-08 12:15:43;https://scontent.cdninstagram.com/v/t51.71878-15/574261717_1362228655578607_3788938971600081671_n.jpg?stp=dst-jpg_e15_tt6&_nc_cat=109&ig_cache_key=Mzc2MTIyNjU2MjM3MzcwOTg2MA%3D%3D.3-ccb7-5&ccb=7-5&_nc_sid=58cdad&efg=eyJ2ZW5jb2RlX3RhZyI6InhwaWRzLjY0MHgxMTM2LnNkci5DMyJ9&_nc_ohc=I5IoU8xkcYIQ7kNvwGgIaCj&_nc_oc=AdkPSvtrGAqj90X3cHCgJWoINFKfMRVZCQPj63jEeIHYHJK7ZmDXW3KvZ-urmEdNVCK9KhbYmulvlVrVVxFEL9hS&_nc_ad=z-m&_nc_cid=0&_nc_zt=23&_nc_ht=scontent.cdninstagram.com&_nc_gid=M5Xvao5NFgyK_T80ym1NJw&oh=00_AfisQiEczrF8LZN3PuEXA8e1ID27RnOZFnrBSVxM7KFSTA&oe=693112C5;Uzun ve kararlı bir mücadele sonucunda geçtiğimiz ay tescilini aldığımız #siirtfıstığı ile birlikte sayısı şimdilik 1️⃣2️⃣ olan coğrafi tescilli ürünlerimizin üretimi destekliyor, #siirt ’imizin marka değerini yükseltmek için #canlabaşla çalışmaya devam ediyoruz.🇹🇷  İlimizin ilk Avrupa Birliği tescili alan ürünü olacak #pervaribalı için AB 🇪🇺 #coğrafii̇şaret Tescil Başvuru sürecinde destek ve katkılarıyla bizlere güç veren başta @tcsanayi Bakanımız Sayın @mfatihkacir ’a, @turkpatentt ve Marka Kurumu Başkanımız değerli dostum Sayın Prof. Dr. @mzekidurak ’a ve değerli heyetine teşekkür ediyorum.  #türkiyeyüzyılı 🇹🇷 #durmadanduraksamadan;;0
https://www.instagram.com/p/DQwfftYDNU4/;Reels;322;3;12353;2025-11-07 16:56:46;https://scontent.cdninstagram.com/v/t51.71878-15/573289228_854359100276556_8600235303728141185_n.jpg?stp=dst-jpg_e15_tt6&_nc_cat=105&ig_cache_key=Mzc2MDY0NDIwNzMyMTg2MzQ4MA%3D%3D.3-ccb7-5&ccb=7-5&_nc_sid=58cdad&efg=eyJ2ZW5jb2RlX3RhZyI6InhwaWRzLjY0MHgxMTM2LnNkci5DMyJ9&_nc_ohc=ezq0jJtXPuYQ7kNvwEvjKCv&_nc_oc=Adnha5LOFkHGs0RX8qPwkaVc2JHlRADksoPP-fKVJ45jvchdTEnnb8MTQIe336GxZXsZ2Ssi3NdZrbdxlmiGeGB-&_nc_ad=z-m&_nc_cid=0&_nc_zt=23&_nc_ht=scontent.cdninstagram.com&_nc_gid=M5Xvao5NFgyK_T80ym1NJw&oh=00_AfhG6H-pISlqMICGF-kCwIzMwr0ZOSk2sNXLkKW8WfCzRw&oe=69311306;Sizi Toprağa Değil Yüreğimize Gömdük 🇹🇷  #siirt ’in Pervari ilçesine bağlı Köprüçay köyü, Hasan Tepe Mevkiinde, 10 Kasım 2012 tarihinde elim bir Helikopter kazası sonucu şehit olan 17 kahraman evladımızı, #jandarma mızı, sene-i devriyelerinde rahmetle, minnetle ve şükranla anıyoruz.  Ruhları şâd, makamları âli olsun🤲🏻 #vatansizeminnettar 🇹🇷;;0
https://www.instagram.com/p/DQwdokfDFbw/;Carousel;157;0;0;2025-11-07 16:39:29;https://scontent.cdninstagram.com/v/t51.82787-15/576004189_18072127553340029_6902139813764056662_n.jpg?stp=dst-jpg_e35_tt6&_nc_cat=110&ig_cache_key=Mzc2MDYzNjAwNDE0NDAwNDYwNw%3D%3D.3-ccb7-5&ccb=7-5&_nc_sid=58cdad&efg=eyJ2ZW5jb2RlX3RhZyI6InhwaWRzLjE0NDB4OTYwLnNkci5DMyJ9&_nc_ohc=FWRYnFY4jYgQ7kNvwGeGHqy&_nc_oc=AdnsonkOsl-0qbLpqfxH-pxxXXjgcK8CnGG0USqDMqEbOiRCXQ81wJTZF1qwbutN4_UD-abOunb46mteUnloVPTe&_nc_ad=z-m&_nc_cid=0&_nc_zt=23&_nc_ht=scontent.cdninstagram.com&_nc_gid=M5Xvao5NFgyK_T80ym1NJw&oh=00_AfhT4Or4lSoqg6ilyrdIiDU478anPuD32aBY7KY3Vb60VQ&oe=6931245F;"✨ Siirt’in kültürel mirası, coğrafi işaretli ürünlerle korunuyor, güçleniyor ve geleceğe taşınıyor❗️  Valimiz Sayın @dr.kemalkizilkaya ve Türk Patent ve Marka Kurumu Başkanı Prof. Dr. Muhammed Zeki Durak’ınkatılımıyla “Sınai Mülkiyet Hakları ve Coğrafi İşaretler Farkındalık Konferansı” düzenlendi. 📘  Programda hitap eden Vali Kızılkaya, Siirt’in huzurun, kardeşliğin ve kadim medeniyetlerin buluştuğu bir şehir olduğunu belirterek bu anlamlı etkinliğe ev sahipliği yapmaktan duyduğu memnuniyeti dile getirdi.  Vali Kızılkaya, #Siirt ’in zengin tarihi, doğal güzellikleri ve çok kültürlü yapısıyla bölgenin önemli bir turizm ve üretim merkezi olma potansiyeline sahip olduğunu vurguladı. Coğrafi işaretlerin, yerel üretimi güçlendiren, istihdamı artıran ve ekonomiye katkı sağlayan önemli bir araç olduğunun altını çizdi.  Tescilli ürünler arasında Siirt Battaniyesi, Pervari Balı, Büryan Kebabı, Şal-Şepik Kumaşı, Bıttım Sabunu ve Siirt Fıstığı gibi değerlerin yer aldığını; Zivzik Narı, Bumbar, Pırtike Çorbası ve Varak Keek Tatlısı için de tescil çalışmalarının sürdüğünü ifade etti.  Vali Kızılkaya, “Hedefimiz; emeğin, üretimin ve markalaşmanın şehri olan Siirt’i huzur ve güven içinde daha güçlü bir geleceğe taşımaktır.” dedi.  🐝 Pervari Balı Avrupa Yolunda! 🌍  Türk Patent ve Marka Kurumu Başkanı Prof. Dr. Muhammed Zeki Durak ta yaptığı konuşmada; #PervariBalı için Avrupa Birliği Coğrafi İşaret Tescil Başvuru sürecinin başlatıldığını müjdeledi.  Siirt’in eşsiz florası ve zengin bitki çeşitliliğiyle üretilen Pervari Balı’nın, yüzyıllardır süregelen doğal üretim geleneğiyle Türkiye’nin en saf ve kaliteli ballarından biri olduğunu belirten Durak, “Pervari Balı, yalnızca Türkiye’de değil, Avrupa Birliği nezdinde de tescil edilmesi hedeflenen bir değerimizdir. Bu süreç tamamlandığında, Pervari Balı dünya pazarlarında markalaşacak, üreticilerimizin katma değeri artacak ve bölge ekonomisine önemli katkı sağlayacaktır.” ifadelerini kullandı.  Program, coğrafi işaretlere değer katan kurum ve üreticilere belge takdimleri ve Siirt’e özgü coğrafi işaretli ürünlerin sergilendiği stantların gezilmesiyle sona erdi. ✨  @tcsanayi @turkpatentt";;0
https://www.instagram.com/p/DQwXqM0DFyV/;Carousel;367;0;0;2025-11-07 15:47:17;https://scontent.cdninstagram.com/v/t51.82787-15/574542405_18072122714340029_1471667946248660520_n.jpg?stp=dst-jpg_e35_tt6&_nc_cat=103&ig_cache_key=Mzc2MDYwOTczMjA4MDc0MzU3Ng%3D%3D.3-ccb7-5&ccb=7-5&_nc_sid=58cdad&efg=eyJ2ZW5jb2RlX3RhZyI6InhwaWRzLjEwNjZ4NzExLnNkci5DMyJ9&_nc_ohc=1y_kqTcmnhIQ7kNvwH1-0u-&_nc_oc=Adn-cnVE_R1n-dR93bQrwrWjWc7-RABWiJns1myxpIST5F26kcLwueGrXWjYiIk3h3lu-cf3Gc1ClQ-NeZy9V9GW&_nc_ad=z-m&_nc_cid=0&_nc_zt=23&_nc_ht=scontent.cdninstagram.com&_nc_gid=M5Xvao5NFgyK_T80ym1NJw&oh=00_AfgPyBy8X4bc8EVu1YU5b98MlwjFVoni0CTTulVJTczREA&oe=69310764;"#Siirt’te Helikopter Kazasında Şehit Olan 17 Kahraman Mehmetçik Dualarla Anıldı 🇹🇷  Siirt’in Pervari ilçesi Köprüçay köyü Hasan Tepe Mevkiinde, 10 Kasım 2012 tarihinde yaşanan elim helikopter kazasında şehit olan 17 kahraman Mehmetçik ve tüm şehitlerimiz için dualar edildi, mevlit okutuldu.  İl #Jandarma Komutanlığınca Şehitler Camiinde düzenlenen programda, okunan mevlidin ardından aziz şehitlerimiz için dualar edildi. Programın sonunda ise katılımcılara gül suyu ve lokum ikram edildi.  Programın ardından, 17 kahraman şehidimiz için ‘Dadaşlar Anıtı’nda bir anma programı düzenlendi. Saygı duruşu ve İstiklal Marşı’nın okunmasıyla başlayan programda, Kur’an-ı Kerim tilavetinin ardından şehitlerimiz için dualar edildi.  Vali Kızılkaya, Şehit Uzm. Çvş. Kürşat Güneş’in ailesiyle yakından ilgilenerek kendileriyle bir süre sohbet etti.  Vali Kızılkaya, aziz şehitlerimizin hatırlarını her daim yaşatacaklarını belirterek, “10 Kasım 2012 tarihinde elim bir helikopter kazası sonucu şehit olan kahramanlarımızı rahmetle, minnetle ve şükranla anıyorum. Ruhları şad, mekânları cennet olsun” dedi.  Program, Dadaşlar Anıtı’na karanfiller bırakılması ile sona erdi.  Programa; Siirt Cumhuriyet Başsavcı Vekili Aziz Ayaz, İl Jandarma Komutanı Tuğgeneral Uğur Özmen, İl Emniyet Müdürü Necmettin Öztürk, şehit yakınları, gaziler, askeri erkân, sivil toplum örgütlerinin temsilcileri ve vatandaşlar katıldı.  Aziz şehitlerimizin ruhları şad, makamları âli olsun. 🇹🇷  @tcicisleri  #VatanSizeMinnettar";;0
https://www.instagram.com/p/DQwXeMlDGLv/;Carousel;151;0;0;2025-11-07 15:45:39;https://scontent.cdninstagram.com/v/t51.82787-15/574223403_18374132662149072_2358471186574200415_n.webp?_nc_cat=105&ig_cache_key=Mzc2MDYwODkwNjUyNDI0OTQ0MA%3D%3D.3-ccb7-5&ccb=7-5&_nc_sid=58cdad&efg=eyJ2ZW5jb2RlX3RhZyI6InhwaWRzLjE0NDB4OTYwLnNkci5DMyJ9&_nc_ohc=5Vusnmf-_xsQ7kNvwFPxiPM&_nc_oc=Admv72ngWNrNx1KsL0NomSkePHsJTBO6neYkGrplTDptCWVfZMPIwiELSQilTczmkcBIEkLgzwT2IKmg_3NhUqXO&_nc_ad=z-m&_nc_cid=0&_nc_zt=23&_nc_ht=scontent.cdninstagram.com&_nc_gid=M5Xvao5NFgyK_T80ym1NJw&oh=00_AfhzvFV2dXVohiY7ilGmVv7QCxa2ljShKwwCeTzfvKSfIQ&oe=69310F0D;"#Siirt’te Helikopter Kazasında Şehit Olan 17 Kahraman Mehmetçik Dualarla Anıldı 🇹🇷  Siirt’in Pervari ilçesi Köprüçay köyü Hasan Tepe Mevkiinde, 10 Kasım 2012 tarihinde yaşanan elim helikopter kazasında şehit olan 17 kahraman Mehmetçik ve tüm şehitlerimiz için dualar edildi, mevlit okutuldu.  İl #Jandarma Komutanlığınca Şehitler Camiinde düzenlenen programda, okunan mevlidin ardından aziz şehitlerimiz için dualar edildi. Programın sonunda ise katılımcılara gül suyu ve lokum ikram edildi.  Programın ardından, 17 kahraman şehidimiz için ‘Dadaşlar Anıtı’nda bir anma programı düzenlendi. Saygı duruşu ve İstiklal Marşı’nın okunmasıyla başlayan programda, Kur’an-ı Kerim tilavetinin ardından şehitlerimiz için dualar edildi.  Vali ve Belediye Başkanı Sayın Dr. Kemal Kızılkaya, Şehit Uzm. Çvş. Kürşat Güneş’in ailesiyle yakından ilgilenerek kendileriyle bir süre sohbet etti.  Vali Kızılkaya, aziz şehitlerimizin hatırlarını her daim yaşatacaklarını belirterek, ""10 Kasım 2012 tarihinde elim bir helikopter kazası sonucu şehit olan kahramanlarımızı rahmetle, minnetle ve şükranla anıyorum. Ruhları şad, mekânları cennet olsun"" dedi.  Program, Dadaşlar Anıtı’na karanfiller bırakılması ile sona erdi.  Programa; Siirt Cumhuriyet Başsavcı Vekili Aziz Ayaz, İl Jandarma Komutanı Tuğgeneral Uğur Özmen, İl Emniyet Müdürü Necmettin Öztürk, şehit yakınları, gaziler, askeri erkân, sivil toplum örgütlerinin temsilcileri ve vatandaşlar katıldı.  Aziz şehitlerimizin ruhları şad, makamları âli olsun. 🇹🇷  #VatanSizeMinnettar";;0
https://www.instagram.com/p/DQwSuqcDFCq/;Photo;112;0;0;2025-11-07 15:04:12;https://scontent.cdninstagram.com/v/t51.82787-15/574534181_18072120185340029_3669867533041216280_n.jpg?stp=dst-jpg_e35_tt6&_nc_cat=103&ig_cache_key=Mzc2MDU4ODA2MDM1NTIxOTYyNg%3D%3D.3-ccb7-5&ccb=7-5&_nc_sid=58cdad&efg=eyJ2ZW5jb2RlX3RhZyI6InhwaWRzLjE0NDB4OTYwLnNkci5DMyJ9&_nc_ohc=yqahr3FoLMwQ7kNvwFMGCtb&_nc_oc=Adm3l4LSvtogpqPMB3S-E8nc686LYfLG92uxNvoDXfywZmOmnWbhhXOMRatDo9ZzUMp5KGfdBPeqhFG1U9rNcT0c&_nc_ad=z-m&_nc_cid=0&_nc_zt=23&_nc_ht=scontent.cdninstagram.com&_nc_gid=M5Xvao5NFgyK_T80ym1NJw&oh=00_AfgARJUtUM4-TS13vgfDaUh0Ybd8ylFYCdk9n81x807hTw&oe=69312648;"‘Türk Patent ve Marka Kurumu Sınai Mülkiyet Hakları ve Coğrafi İşaretler Konferansı’na katılmak üzere ilimize gelen Türk Patent ve Marka Kurumu Başkanı Prof. Dr. Muhammed Zeki Durak ve beraberindeki heyet, Valimiz Sayın @dr.kemalkizilkaya ‘yı makamında ziyaret etti.  Ziyarette; Siirt’te coğrafi işaret tescil süreçleri, marka bilincinin artırılması, yerel ürünlerin katma değerinin yükseltilmesine ilişkin konular ele alındı.  Vali Kızılkaya, ziyaretten duyduğu memnuniyeti ifade ederek Prof. Dr. Durak ve beraberindeki heyete nazik ziyaretleri için teşekkür etti.   @tcsanayi @turkpatentt";;0
https://www.instagram.com/p/DQvrJtdjMnP/;Carousel;65;0;0;2025-11-07 09:18:22;https://scontent.cdninstagram.com/v/t51.82787-15/575184978_18374092297149072_1202298181841660874_n.webp?_nc_cat=108&ig_cache_key=Mzc2MDQxMzk5MDQwNTgxNTE4MA%3D%3D.3-ccb7-5&ccb=7-5&_nc_sid=58cdad&efg=eyJ2ZW5jb2RlX3RhZyI6InhwaWRzLjE0Mzl4MTAxNi5zZHIuQzMifQ%3D%3D&_nc_ohc=GGKnb-5hUd0Q7kNvwEjCd0V&_nc_oc=AdmFrSjGcEmdtWO77uJ8qh1btse64P1qXWeO1Xjy9FIhARnBbjb2Y0anMMm92c7mCU_j-t9mNfVFndjUwEYZdliP&_nc_ad=z-m&_nc_cid=0&_nc_zt=23&_nc_ht=scontent.cdninstagram.com&_nc_gid=fGziME1AAlCM-oLwOfJp-Q&oh=00_Afjuymdo_o-RP3HvdL6SpuAxZxVU1YxmCFP9NaVmPZfZKw&oe=693130EA;🔍 Fiyat Etiketi ve Haksız Fiyat Artışı Denetimleri Sürüyor!  Vatandaşlarımızın ekonomik çıkarlarının korunması amacıyla, Siirt Ticaret İl Müdürlüğü personeli ile Belediyemiz Zabıta ekipleri iş birliğinde fiyat etiketi ve haksız fiyat artışı denetimleri gerçekleştirildi.  📋 Fiyat etiketi ve liste mevzuatına aykırı uygulamalarda bulunan işletmelere idari yaptırım uygulanırken, haksız fiyat artışı tespit edilen işletmeler hakkında gerekli işlemler yapılmak üzere Haksız Fiyat Değerlendirme Kurulu’na bildirimde bulunulmuştur.  Halkımızın refahı ve adil piyasa koşullarının korunması için denetimlerimiz düzenli olarak devam edecektir.   #Siirt  #CanlaBaşla  #DurmadanDuraksamadan;;0
https://www.instagram.com/p/DQvqc_CjI5V/;Carousel;69;0;0;2025-11-07 09:12:16;https://scontent.cdninstagram.com/v/t51.82787-15/574520303_18374091835149072_6358284859451768323_n.jpg?stp=dst-jpg_e15_tt6&_nc_cat=102&ig_cache_key=Mzc2MDQxMDYwNjgyNzIzMTA3MA%3D%3D.3-ccb7-5&ccb=7-5&_nc_sid=58cdad&efg=eyJ2ZW5jb2RlX3RhZyI6InhwaWRzLjcyMHg5NjAuc2RyLkMzIn0%3D&_nc_ohc=-GjiY25GfPkQ7kNvwH2GXoc&_nc_oc=Adl9AoNFlq80mWViDJSweKuhYxIN5Ntwz6U1B9s1pYJitgBITGFXgrLYclj6mGVU4r24XVBInAQflPUoCfxksLVc&_nc_ad=z-m&_nc_cid=0&_nc_zt=23&_nc_ht=scontent.cdninstagram.com&_nc_gid=fGziME1AAlCM-oLwOfJp-Q&oh=00_AfgkXeNSIprkrO4gldj3nqhzr4MAaaydQVoERV6uxSy8mw&oe=69312F53;“Temiz Bir Kent ve Sağlıklı Bir Çevre” için başttığımız #TemizlikSeferberliği hız kesmeden devam ediyor. 💦🌪️🧹🚮  Halkımızın refahı ve esenliği için Cuma gününün ilk ışıkları ve bereketiyle okul çevreleri, cadde ve sokaklarda temizlik çalışmalarımız  sürüyor.🌿  Daha temiz bir #Siirt  için #CanlaBaşla çalışıyoruz.   📍Doğan Mahallesi  #BaşımGözümÜstüne #DurmadanDuraksamadan 🇹🇷;;0
https://www.instagram.com/p/DQt5e1xjECz/;Reels;116;1;7182;2025-11-06 16:48:28;https://scontent.cdninstagram.com/v/t51.71878-15/574044995_1154461636270803_7291444173359144287_n.jpg?stp=dst-jpg_e15_tt6&_nc_cat=106&ig_cache_key=Mzc1OTkxNDA3MTg5OTI1OTA1OQ%3D%3D.3-ccb7-5&ccb=7-5&_nc_sid=58cdad&efg=eyJ2ZW5jb2RlX3RhZyI6InhwaWRzLjY0MHgxMTM2LnNkci5DMyJ9&_nc_ohc=3bNdR7yCh64Q7kNvwFipxqo&_nc_oc=Adk8zDlcWoR1hxhZ69OWlWSQjuAD9ehyi0b51r1V2NqJWzc6254RZ6PG4l8iGOS4AOWST10PyefMmnKpDFnDq3gQ&_nc_ad=z-m&_nc_cid=0&_nc_zt=23&_nc_ht=scontent.cdninstagram.com&_nc_gid=fGziME1AAlCM-oLwOfJp-Q&oh=00_Afg3Hj-2Soss1rTpw4KXZMHLxpjwvpiJt_vJR__PAEJhoQ&oe=69311FE4;"🌱 Hedefimiz; verimli topraklar, güçlü üreticiler ve sürdürülebilir bir #siirt tarımıdır.  Tarım ve Orman Bakanlığımızın destekleriyle yürütülen TAKE Projesi kapsamında, Siirt Merkez, #kurtalan , #baykan ve #eruh ilçelerinde toplam 15 bin dekar alanda üretim yapılmak üzere 2️⃣0️⃣3️⃣ ton sertifikalı kırmızı mercimek tohumu 5️⃣8️⃣8️⃣ çiftçimize dağıttık.   🤝 %75’i Bakanlığımız hibesi, %25’i çiftçi katkısı ile hayata geçirilen 1️⃣3️⃣ milyon 3⃣3⃣3⃣ bin TL’lik bu proje ile; kuraklığa dayanıklı üretim artacak, sertifikalı tohum kullanımı yaygınlaşacak.🇹🇷  Tohumlar bereketle filizlensin, çiftçimize kazanç, ülkemize güç getirsin.🌾  Tüm üreticilerimize, çiftçilerimize bol kazançlı, bereketli bir sezon diliyorum. 🤲  @tc_tarim_ormancilik_bakanligi  #türkiyeyüzyılı 🇹🇷";;0
https://www.instagram.com/p/DQtfoUnDB45/;Carousel;162;0;0;2025-11-06 12:59:13;https://scontent.cdninstagram.com/v/t51.82787-15/573956815_18072020588340029_4298022149052728390_n.jpg?stp=dst-jpg_e35_tt6&_nc_cat=103&ig_cache_key=Mzc1OTgwMDM1ODA0MzE3MzI0NA%3D%3D.3-ccb7-5&ccb=7-5&_nc_sid=58cdad&efg=eyJ2ZW5jb2RlX3RhZyI6InhwaWRzLjE0NDB4MTIxMC5zZHIuQzMifQ%3D%3D&_nc_ohc=pzEEQFAd_acQ7kNvwFwHvsp&_nc_oc=AdlI_elmE7FwF731oplU48FvzzWCVl4S7sZI4EBy9WLd1o-KKLvS-6Wk0Pqtn6JkzCdqXbshr73g9n204vvZXtMv&_nc_ad=z-m&_nc_cid=0&_nc_zt=23&_nc_ht=scontent.cdninstagram.com&_nc_gid=fGziME1AAlCM-oLwOfJp-Q&oh=00_Afjh6czykm7yWU6Oj8UHuM9Fms0Z1f2U_facwFSj8KTV_A&oe=6930FF3C;"🌾 Tohumlar ile Bereketli Topraklar Can Bulacak! 🌾  Valimiz Sayın @dr.kemalkizilkaya ,Tarım ve Orman Bakanlığımızın destekleriyle yürütülen “Tarım Arazilerinin Kullanımının Etkinleştirilmesi (#TAKE) Projesi” kapsamında #Kurtalan ilçemizde düzenlenen Sertifikalı Kırmızı Mercimek Dağıtım Törenine katıldı.  TAKE Projesi kapsamında; Siirt Merkez, #Kurtalan, #Baykan ve #Eruh ilçelerinde toplam 15 bin dekar alanda üretim yapılmak üzere 2⃣0⃣3⃣ ton sertifikalı kırmızı mercimek tohumu, bugün 5⃣8⃣8⃣ çiftçimize dağıtıldı.  💧 %75’i Bakanlığımız hibesi, %25’i çiftçi katkısı ile hayata geçirilen 1⃣3⃣ milyon 3⃣3⃣3⃣ bin TL’lik bu proje ile;  ➡️ Kuraklığa dayanıklı çeşitlerin üretimi artacak, ➡️ Sertifikalı tohum kullanımı yaygınlaşacak, ➡️ Ürün kalitesi yükselecek, ➡️ Üreticimizin geliri güçlenecek.  🌱 “Hedefimiz; verimli topraklar, güçlü üreticiler ve sürdürülebilir bir #Siirt tarımıdır.”  Bugün dağıtılan tohumlar, bereketli topraklarımızda umutla filizlensin, çiftçimize kazanç, ülkemize güç getirsin. 🇹🇷  Program, yapılan duanın ardından tohumların üreticilerimize teslim edilmesiyle sona erdi.  Tüm üreticilerimize bol kazançlı, bereketli bir sezon diliyoruz.🌾  @tarimgovtr  #CanlaBaşla #DurmadanDuraksamadan #TürkiyeYüzyılı 🇹🇷";;0
https://www.instagram.com/p/DQrBC5uDHBw/;Carousel;133;0;0;2025-11-05 13:53:29;https://scontent.cdninstagram.com/v/t51.82787-15/573439137_18071941697340029_8134699107983789093_n.jpg?stp=dst-jpg_e35_tt6&_nc_cat=109&ig_cache_key=Mzc1OTEwMjkwNTE1NzQzODYxMg%3D%3D.3-ccb7-5&ccb=7-5&_nc_sid=58cdad&efg=eyJ2ZW5jb2RlX3RhZyI6InhwaWRzLjE0NDB4OTA1LnNkci5DMyJ9&_nc_ohc=O21qEHjMdR8Q7kNvwG9YnVT&_nc_oc=Admcxu1f-Iyup4ZE6LCCGFcXQ6ZhD1oHCYk_frWGsRyKkApu6sjaLuBcPTxGj8W9-2ybqnZgLHHliiUHa5d7uwTl&_nc_ad=z-m&_nc_cid=0&_nc_zt=23&_nc_ht=scontent.cdninstagram.com&_nc_gid=fGziME1AAlCM-oLwOfJp-Q&oh=00_AfhhDm_aJIr1S-21G5UBvtcd6VP0dB0XCIkdG_tr7aCRbg&oe=69312A96;"Bağımlılıkla Mücadele İl Koordinasyon Kurulu Toplantısı, Valimiz Sayın @dr.kemalkizilkaya başkanlığında gerçekleştirildi.  Toplantıda, İl Sağlık Müdürlüğü ve Yeşilay Danışmanlık Merkezi #YEDAM tarafından hazırlanan Bağımlılıkla  Mücadele İl Faaliyet Raporu ve yürütülen çalışmalar hakkında sunum yapıldı.  Bağımlılıkla mücadelede yürütülen koruyucu ve önleyici faaliyetler, farkındalık eğitimleri, sosyal, kültürel ve sportif çalışmalar, tedavi hizmetleri ile çocukların suçtan korunmasına yönelik konular ayrıntılı olarak ele alındı.  💬Vali Kızılkaya, toplantıda yaptığı değerlendirmede: “Hiçbir gencimizin karanlığa sürüklenmesine asla izin vermeyeceğiz. Bağımlılıkla mücadelemizi, her bireyin yeniden kazanılabileceğine inanan, umut ve yaşam odaklı bir anlayışla; kamu kurumlarımız ve sivil toplum kuruluşlarımızın iş birliğiyle koordineli bir şekilde kararlılıkla sürdüreceğiz.” ifadelerini kullandı.  💬 Vali Kızılkaya “Bağımlılıkla mücadele sadece güvenlik önlemleriyle sınırlı kalamaz. Bu mücadele; eğitimciler, sağlık çalışanları, aileler ve toplumun tüm kesimlerinin ortak ve kararlı çabalarıyla mümkündür. Bu doğrultuda yürütülen projelere her türlü desteği vermeye devam edeceğiz.” dedi.  📍#Siirt Valiliği Toplantı Salonu  #BağımlılıklaMücadele";;0
