PostLink;PostTürü;BeğeniSayısı;YorumSayısı;Görüntülenme Sayısı;Tarih;DisplayPhoto;Caption;Takipçi;TahminMi
https://www.instagram.com/p/DRSv4rYDGpK/;Carousel;217;0;0;2025-11-21 00:13:09;https://scontent-fra3-2.cdninstagram.com/v/t51.82787-15/587776376_18073281215340029_2017934172903794465_n.jpg?stp=dst-jpg_e15_tt6&_nc_cat=104&ig_cache_key=Mzc3MDI4NTgwOTkxMjgyMjIxNw%3D%3D.3-ccb7-5&ccb=7-5&_nc_sid=58cdad&efg=eyJ2ZW5jb2RlX3RhZyI6InhwaWRzLjcyMHg5NjAuc2RyLkMzIn0%3D&_nc_ohc=2af1FGgSm7YQ7kNvwEYnbgC&_nc_oc=AdlahGeBu6Iy3ccJXNJb7QRkNf9FyyUF7mLGAWd4F9754Rl-86qCfcqmaZINdAR5qBsCAfZoEn9VjBToF0gzq1Xl&_nc_ad=z-m&_nc_cid=0&_nc_zt=23&_nc_ht=scontent-fra3-2.cdninstagram.com&_nc_gid=bRy2TzeLBiMFiWovwNnZcg&oh=00_AfilvJxOFPptBLf20ajaPbQ6eSR2RIUw2bf6pVDSqId4CA&oe=6931246E;"Aşkın Sen Hali” #Siirt’te Sanatseverlerle Buluştu! 🎭✨  #SiirtValiliği İl Kültür ve Turizm Müdürlüğü organizasyonuyla, Diyarbakır Devlet Tiyatrosu tarafından sahnelenen “Aşkın Sen Hali” tiyatro oyunu Siirtli sanatseverlere unutulmaz bir akşam yaşattı.  İl Milli Eğitim Müdürlüğü Konferans Salonu’nda sahnelenen oyunu; Valimiz Sayın @dr.kemalkizilkaya , eşi Hanımefendi Nurten Kızılkaya ve çok sayıda tiyatro sever izledi.  İki perdeden oluşan komedi türündeki oyun, müzikal yapısıyla izleyicilerden büyük beğeni topladı. 🎶👏  Gösteri sonunda tiyatro ekibini tebrik eden Vali Kızılkaya, Siirt’te kültür ve sanat etkinliklerini artırarak vatandaşlarımızla buluşturmaya devam edeceklerini ifade etti.  Diyarbakır Devlet Tiyatrosu yapımı oyunun yönetmeni M. Doğan Yağcı, yazarı Pervin Ünalp. Eserde dekor tasarımını Seyhan Kırca, kostüm tasarımını Ebru Culpınar, ışık tasarımını Hakan Özdemir, müzikleri Tarkan Erkan ve koreografiyi Sema Erkan üstlendi.  @tckulturturizm  #SiirtKültürŞehri 🎭";;0
https://www.instagram.com/p/DRSNbHYjF4Z/;Carousel;172;0;0;2025-11-20 19:12:01;https://scontent-fra5-1.cdninstagram.com/v/t51.82787-15/583624832_18073262252340029_3444128812700489774_n.jpg?stp=dst-jpg_e35_tt6&_nc_cat=102&ig_cache_key=Mzc3MDEzNDg2ODAzNTE2MDYyNQ%3D%3D.3-ccb7-5&ccb=7-5&_nc_sid=58cdad&efg=eyJ2ZW5jb2RlX3RhZyI6InhwaWRzLjE0NDB4MTAyNi5zZHIuQzMifQ%3D%3D&_nc_ohc=80HycHhu8ZoQ7kNvwGBfe_H&_nc_oc=AdnuoyBondU4ddQhIH4QXpsan2Uvsd5_B_caxmntCjx-pyJ8EcOfm35_pcOaUp3FEAxpV9vHFCgrs-XrbPOZZ5cG&_nc_ad=z-m&_nc_cid=0&_nc_zt=23&_nc_ht=scontent-fra5-1.cdninstagram.com&_nc_gid=bRy2TzeLBiMFiWovwNnZcg&oh=00_AfiVcySFYszp7GWNbnq6EUqje4nhTxK_dtfHgm3YBlkasQ&oe=6931243D;Şehit Ailelerimize Minnet Borçluyuz🇹🇷  Valimiz Sayın @dr.kemalkizilkaya ve eşi Hanımefendi Nurten Kızılkaya, 1990 yılında Şirvan Nallıkaya kırsalında şehit olan Güvenlik Korucusu Hüseyin Zorlu’nun kıymetli eşi Medine Zorlu’nun vefatı nedeniyle Şehit Zorlu Ailesi’ne taziye ziyaretinde bulundu.  Kıymetli şehidimizin çocukları ve yakınlarıyla konutlarında bir araya gelerek acılarını paylaşan Vali Kızılkaya, şehit ailemize sabır ve başsağlığı dileklerini iletti.  Merhumeye Cenab-ı Allah’tan rahmet diliyoruz.  Mekânı cennet olsun 🤲  @tcicisleri  #BirizBeraberiz 🇹🇷 #Siirt;;0
https://www.instagram.com/p/DRR-sEbjPsZ/;Carousel;207;0;0;2025-11-20 17:03:16;https://scontent-fra5-2.cdninstagram.com/v/t51.82787-15/583745261_18073250900340029_9093944804063215550_n.jpg?stp=dst-jpg_e15_tt6&_nc_cat=107&ig_cache_key=Mzc3MDA2ODU2Mjg0MTc0MzY2OQ%3D%3D.3-ccb7-5&ccb=7-5&_nc_sid=58cdad&efg=eyJ2ZW5jb2RlX3RhZyI6InhwaWRzLjcyMHg5NjAuc2RyLkMzIn0%3D&_nc_ohc=eNAUu6mcvzoQ7kNvwHgF3Fq&_nc_oc=Admost9Kd5loqI13hvQx7fP0Xs8Vru0KdZbq7KTqNuuamIj6NYc3CZRVfe9FsdXAe29_5NgvmZCQjUv6_4PecRsH&_nc_ad=z-m&_nc_cid=0&_nc_zt=23&_nc_ht=scontent-fra5-2.cdninstagram.com&_nc_gid=bRy2TzeLBiMFiWovwNnZcg&oh=00_Afh_EEVtgI18SCkyuw-VrEashnJ-izd-ptXqWjYg_z3ZMw&oe=69311E5C;Valimiz Sayın @dr.kemalkizilkaya ‘Şehir ve Kültür Akademisi’nin konuğu oldu.📚   Vali Kızılkaya, kıymetli öğretmenlerimizle “Şehir ve İnsan” ile ‘’Şehir ve İnsan, Şehir ve Kültür ve Unutulmaya Yüz Tutmuş El Sanatları”  üzerine keyifli bir söyleşi gerçekleştirdi.🌟  Öğretmenler Gününü kutlayarak sözlerine başlayan Vali Kızılkaya: “Zengin tarihsel birikimi, doğal güzellikleri ve inanç turizmiyle çok zengin bir medeniyet dokusuna sahip #Siirt, bir kardeşlik şehridir. Doğa, inanç ve kültürün buluştuğu bu kadim kent, huzur ve güven ikliminde gerçekleştirilen yatırımlarla cazibe merkezi olma yolunda hızla ilerliyor.”  Vali Kızılkaya, “Şehrimizi geleceğe hazırlarken kültürel kimliğimizi yaşatmak önceliğimizdir. El sanatlarını desteklemek, ustalarımızı teşvik etmek ve gençlerimizi bu alana yönlendirmek temel hedeflerimizdendir. Çünkü kültürü güçlü olan toplumların geleceği de güçlüdür.” İfadelerini kullandı.  🇹🇷Türkiye yüzyılı hedefleri doğrultusunda Siirt’imizin doğal ve beşeri kaynaklarını değerlendirerek, Siirt’imizi hak ettiği geleceğe taşımak için Milletimizin duası ve desteği ile var gücümüzle çalışıyoruz! 💪✨  📍Tarım ve Ağaç Müzesi  @tcmeb @siirtmem   #SiirtEğitimŞehri 🎓 #SiirtÖğretmenAkademisi 🏫;;0
https://www.instagram.com/p/DRR14SwjHH4/;Reels;97;0;4806;2025-11-20 15:47:58;https://scontent-fra5-2.cdninstagram.com/v/t51.71878-15/584363004_2041799966577694_3397321789606340720_n.jpg?stp=dst-jpg_e15_tt6&_nc_cat=106&ig_cache_key=Mzc3MDAzMTMyNzk4MzQ2NDk1Mg%3D%3D.3-ccb7-5&ccb=7-5&_nc_sid=58cdad&efg=eyJ2ZW5jb2RlX3RhZyI6InhwaWRzLjY0MHgzNjAuc2RyLkMzIn0%3D&_nc_ohc=BBs1B1wc-W8Q7kNvwGoQRxK&_nc_oc=Adl18ZdfP6htKZGHQaEG0E-90j2VTAmSME8qjeW9nz0aFXhxW--FeYx191_Zo-CPfHbicws1r8HaBRECDoF2lIFM&_nc_ad=z-m&_nc_cid=0&_nc_zt=23&_nc_ht=scontent-fra5-2.cdninstagram.com&_nc_gid=bRy2TzeLBiMFiWovwNnZcg&oh=00_AfgPA-EXlchZilzFBLzoy7H86bvgmLlEzTOqM9VeLP3RYA&oe=693131DF;"#Siirt Valiliği İl #Jandarma Komutanlığımız, 20 Kasım Dünya Çocuk Hakları Günü kapsamında sorumluluk bölgesindeki okullarda öğrencilerimizle bir araya gelerek farkındalık etkinlikleri gerçekleştirmiştir. 🎈📚  Etkinliklerde çocuklarımıza; 👧👦 Çocuk hakları 🚸 Trafik kuralları ve güvenli geçiş 🛑 Trafik işaretlerinin anlamları 🐾 Hayvan ve doğa sevgisi konularında bilgilendirme yapılmış, çeşitli aktivitelerle keyifli bir gün geçirmeleri sağlanmıştır.  Geleceğimizin teminatı çocuklarımız için özveriyle görev yapan tüm Jandarma personelimize teşekkür ediyoruz. 🇹🇷  @tcicisleri @jandarma @dr.kemalkizilkaya  #DünyaÇocukHaklarıGünü";;0
https://www.instagram.com/p/DRROYKEDD99/;Reels;155;0;13388;2025-11-20 10:02:44;https://scontent-fra3-1.cdninstagram.com/v/t51.71878-15/583420871_1476370706774906_5881372516808244445_n.jpg?stp=dst-jpg_e15_tt6&_nc_cat=103&ig_cache_key=Mzc2OTg1NzU5NTgwOTc0MjcxNw%3D%3D.3-ccb7-5&ccb=7-5&_nc_sid=58cdad&efg=eyJ2ZW5jb2RlX3RhZyI6InhwaWRzLjY0MHg1MTIuc2RyLkMzIn0%3D&_nc_ohc=rNGCs1t0NroQ7kNvwGdfF8x&_nc_oc=AdnII7xfDAKqt32INIJcSYeNhtfSQj9HC0Ukhe2nQZshV442vogi-KX_DdAV3OidF92AfMHaYmchkBnDPYUettRF&_nc_ad=z-m&_nc_cid=0&_nc_zt=23&_nc_ht=scontent-fra3-1.cdninstagram.com&_nc_gid=bRy2TzeLBiMFiWovwNnZcg&oh=00_AfjyoxYIK5dRtzSI2IwLJkijxxvNWo6yxu8fMT9vaJqC2Q&oe=69311631;"#Siirt ‘te Trafik Güvenliğine Örnek Uygulama 🚨🐑  İlimiz genelinde küçükbaş hayvan hareketliliğinin mevsimsel olarak artması  ve muhtemel trafik kazalarını önlemek amacıyla;🚦⛔️  İl #Jandarma Komutanlığı trafik ekiplerimiz, il genelinde küçükbaş hayvanların küpelerine gece görünürlüğünü artıran reflektif bantlar taktı.🔦  @tcicisleri @jandarma @dr.kemalkizilkaya   #TrafikGüvenliği #TrtHaber 📺";;0
https://www.instagram.com/p/DRKW7VQjIOh/;Carousel;255;0;0;2025-11-17 18:01:08;https://scontent.cdninstagram.com/v/t51.82787-15/582978097_18072999332340029_624311393908598072_n.jpg?stp=dst-jpg_e35_tt6&_nc_cat=107&ig_cache_key=Mzc2NzkyNDg2MzY5NzQ2OTgxMw%3D%3D.3-ccb7-5&ccb=7-5&_nc_sid=58cdad&efg=eyJ2ZW5jb2RlX3RhZyI6InhwaWRzLjEwNjZ4NzExLnNkci5DMyJ9&_nc_ohc=-3E1FOpxCQQQ7kNvwHcsQiA&_nc_oc=Admj7dv4QWSweQXbhJLDrivgSp2CtTkYXcZYetqwBpMdH36kYImGaoP9RXAyEucVo5A&_nc_ad=z-m&_nc_cid=0&_nc_zt=23&_nc_ht=scontent.cdninstagram.com&_nc_gid=yviaVbm9OkY2_8KkpLZpiw&oh=00_Afi8HmGctxW4kqitG0v_V3Wnl-0p_N403kFiLNUcxeivrA&oe=693118E0;"Aile ve Sosyal Hizmetler Bakan Yardımcısı Sayın Leman Yenigün, Valimiz Sayın  @dr.kemalkizilkaya , Nurten Kızılkaya Hanımendi, Ak Parti #Siirt Milletvekilli Sayın Mervan Gül, 2⃣6⃣. Çocuk Forumu kapsamında #Tillo Tabiat Parkı’nda düzenlenen etkinliklere katıldı.  Gözaydınlığımız sevgili çocuklarımızın çeşitli aktivitelerle keyifli ve verimli zaman geçirdiği programda; müzik dinletisiyle güzel anlar paylaşıldı, kurulan stantlar ziyaret edildi ve uçurtma şenliği renkli görüntülere sahne oldu.  @tcailesosyal  #DijitalDünyadaÇocukHakları";;0
https://www.instagram.com/p/DRKNEtJDPMk/;Carousel;117;0;0;2025-11-17 16:35:02;https://scontent.cdninstagram.com/v/t51.82787-15/583790063_18072992525340029_7457829991691613273_n.jpg?stp=dst-jpg_e35_tt6&_nc_cat=111&ig_cache_key=Mzc2Nzg4MTUyNjY4MDQ5MTQ4NQ%3D%3D.3-ccb7-5&ccb=7-5&_nc_sid=58cdad&efg=eyJ2ZW5jb2RlX3RhZyI6InhwaWRzLjEwNjZ4NzExLnNkci5DMyJ9&_nc_ohc=vlVC2OXBixoQ7kNvwGV3IxD&_nc_oc=Adl4iM3rv_-uUpdEr6YLgN8rk2wpvNkR8C-MH2xRxW8Fz9ucstCI7TfJws9cKcBltt0&_nc_ad=z-m&_nc_cid=0&_nc_zt=23&_nc_ht=scontent.cdninstagram.com&_nc_gid=yviaVbm9OkY2_8KkpLZpiw&oh=00_AfhTinnM2OuXOAXUro4x8Rjv6GG_xBhFivBNOTGQbW8gMA&oe=6931271C;Güçlü Birey, Güçlü Aile, Güçlü Toplum❗️  Aile ve Sosyal Hizmetler Bakan Yardımcısı Sayın Leman Yenigün, Valimiz Sayın @dr.kemalkizilkaya , Ak Parti #Siirt Milletvekili Sayın Mervan Gül, İl Jandarma Komutanı Tuğgeneral Sayın Uğur Özmen, Ak Parti İl Başkanı Sayın Av. Bahri Caner Özturan ve 81 ilden Çocuk Hakları Komitesi üyesi çocuklarımızın katılımıyla “Dijital Dünyada Çocuk Hakları” temasıyla 2⃣6⃣. Ulusal Çocuk Forumu ilimizde gerçekleştirildi.📱🌐  🔗Valimiz Sayın Kızılkaya, forumu ilimizde ağırlamaktan duyduğu memnuniyeti ifade ederek, “Çocuklarımızın dijital ortamda kendilerini güvende hissetmeleri, haklarını bilmeleri ve teknolojiyi bilinçli kullanmaları hepimizin ortak sorumluluğudur. Forumda ortaya çıkan her fikir, çocuklarımız için daha güvenli, daha eşit ve daha güçlü bir dijital gelecek adına büyük önem taşımaktadır.”  Bu anlamlı buluşmaya katkı sunan Bakanlığımıza, UNICEF’e, öğretmenlerimize ve tüm paydaşlarımıza teşekkür ediyoruz.  Dijital dünyanın fırsatlarıyla güçlenen, risklerinden korunmuş bir nesil için çalışmaya devam edeceğiz.  @tcailesosyal  #DijitalDünyadaÇocukHakları #Siirt;;0
https://www.instagram.com/p/DRKKhcVjMaS/;Carousel;211;0;0;2025-11-17 16:12:45;https://scontent.cdninstagram.com/v/t51.82787-15/584380997_18072990713340029_6856595693983198988_n.jpg?stp=dst-jpg_e35_tt6&_nc_cat=102&ig_cache_key=Mzc2Nzg3MDMxMjc4MDk0NzE3Mg%3D%3D.3-ccb7-5&ccb=7-5&_nc_sid=58cdad&efg=eyJ2ZW5jb2RlX3RhZyI6InhwaWRzLjE0NDB4OTYwLnNkci5DMyJ9&_nc_ohc=aCRNlkwah_EQ7kNvwEiZmjn&_nc_oc=AdnGESFMui_96_RorEKL-lWyUPAo3CDRC2wzucHMPHQdGse0kV34NDd0DTun4ilrasA&_nc_ad=z-m&_nc_cid=0&_nc_zt=23&_nc_ht=scontent.cdninstagram.com&_nc_gid=yviaVbm9OkY2_8KkpLZpiw&oh=00_Afiy-pyDb9DU1iHqCMQImWWDnU9jb6m7OPOpu9E1V9QJAQ&oe=693123A0;"Bir dizi temas ve ziyaretler için ilimizi ziyaret eden Aile ve Sosyal Hizmetler Bakan Yardımcısı Sayın Leman Yenigün, Ak Parti Siirt Milletvekilli Sayın Mervan  Gül ile birlikete Valimiz Sayın @dr.kemalkizilkaya ’yı ziyaret etti.  Ziyarette, ilimizde yürütülen sosyal hizmet çalışmaları ile devam eden ve planlanan projeler ele alındı; Bakanlığımızın ilimizdeki faaliyetlerine dair görüş ve beklentiler değerlendirildi.  Nazik ziyaretleri için Sayın Bakan Yardımcımıza teşekkür ediyoruz.   Ziyarette, Vali Yardımcısı Rabia Naçar Çanakcıoğlu, Aile ve Sosyal Hizmetler İl Müdürü Sabri Didar da katıldı.  @tcailesosyal";;0
https://www.instagram.com/p/DRJgIeCDKql/;Carousel;126;0;0;2025-11-17 10:02:20;https://scontent.cdninstagram.com/v/t51.82787-15/581799738_18376440193149072_7857164548227241189_n.webp?_nc_cat=105&ig_cache_key=Mzc2NzY4Mzg3NDk3ODI3NTQ5Ng%3D%3D.3-ccb7-5&ccb=7-5&_nc_sid=58cdad&efg=eyJ2ZW5jb2RlX3RhZyI6InhwaWRzLjE0NDB4MTA4MC5zZHIuQzMifQ%3D%3D&_nc_ohc=yOOS-X9JsucQ7kNvwG26-kE&_nc_oc=Adl6cD1TCa6RGpCbq6bzg14GHcThhVEAofyTMFklDr6znKuB4GvUC4WsLFoESz37iiY&_nc_ad=z-m&_nc_cid=0&_nc_zt=23&_nc_ht=scontent.cdninstagram.com&_nc_gid=yviaVbm9OkY2_8KkpLZpiw&oh=00_Afj_QnGT-Z64603Ypl5sZVVkmyPwUMkAU34fqoQOIZwz8A&oe=693112C6;Zabıta Denetimleri Aralıksız Sürüyor❗ ️ #Siirt Belediyesi Zabıta ekipleri, 10-17 Kasım 2025 tarihleri arasında 330 iş yerini denetledi. 110 iş yerine uyarı, 10 iş yerine ise toplam 29.530 TL idari yaptırım uygulandı.  Vatandaşlardan gelen 65 şikâyetin tamamına anında müdahale edildi.  Denetimlerde, görüntü kirliliğine neden olan ve gelişi güzel bırakılan 1 tezgâh tahta çeşitli malzeme (flama, reklam panosu, saksı, araç lastiği) toplatılarak Ulaşım Müdürlüğü Makine İkmal deposunda muhafaza altına alınmıştır.  🚫 Kaldırım işgalleri, seyyar satıcılar ve hijyen kurallarına aykırı uygulamalara karşı denetimler kararlılıkla devam edecek.  📲 Şikâyet ve bildirimler için: Belediye WhatsApp: 0 535 016 05 44 Acil Çağrı Merkezi : 1️⃣1️⃣2️⃣ #DurmadanDuraksamadan🇹🇷;;0
https://www.instagram.com/p/DRHjUc9jNfw/;Reels;288;0;22452;2025-11-16 15:52:40;https://scontent.cdninstagram.com/v/t51.71878-15/582819090_833021246146948_6464367081737328690_n.jpg?stp=dst-jpg_e15_tt6&_nc_cat=103&ig_cache_key=Mzc2NzEzNDk1MDQzMzU0NDE3Ng%3D%3D.3-ccb7-5&ccb=7-5&_nc_sid=58cdad&efg=eyJ2ZW5jb2RlX3RhZyI6InhwaWRzLjY0MHgzNjIuc2RyLkMzIn0%3D&_nc_ohc=C9VH2hL8m1MQ7kNvwGlV8ce&_nc_oc=AdlwyhsXXx7gSx-V56t-Lupq1-KH8BVD7BldqBpj6yidRgNG3ARJKLwVW1tqpBGgHZI&_nc_ad=z-m&_nc_cid=0&_nc_zt=23&_nc_ht=scontent.cdninstagram.com&_nc_gid=yviaVbm9OkY2_8KkpLZpiw&oh=00_AfiFrtfJ3HgNpJlOPwqLWcQkE-VaIQ4uiqeFIlwv8o6juQ&oe=69311A5D;📍#Pervari / Geçittepe Mevkii   ❄️ 2100 rakımlı #Pervari Geçittepe Köy Grup Yolu’nda yoğun kar yağışı nedeniyle ulaşıma kapanan yolda mahsur kalan araçlar, İl Özel İdaresi ekiplerimizin hızlı müdahalesiyle kurtarıldı. 🌨️  📞 Herhangi bir acil durumda, hemen 1️⃣1️⃣2️⃣ Acil Çağrı Merkezini arayarak hızlı ve etkili yardım alabilirsiniz.🚨  7/24 sahadayız, güvenli ve kesintisiz ulaşım için çalışıyoruz! 🚜 👷  @tcicisleri @dr.kemalkizilkaya  #CanlaBaşla #DurmadanDuraksamadan🇹🇷;;0
https://www.instagram.com/p/DREwhYHjBLH/;Photo;61;0;0;2025-11-15 13:49:21;https://scontent.cdninstagram.com/v/t51.82787-15/582961323_18086517359296327_2876108533033699928_n.jpg?stp=dst-jpg_e35_tt6&_nc_cat=109&ig_cache_key=Mzc2NjM0ODU4ODI2MDI2NjY5NQ%3D%3D.3-ccb7-5&ccb=7-5&_nc_sid=58cdad&efg=eyJ2ZW5jb2RlX3RhZyI6InhwaWRzLjEyODB4MTcwNi5zZHIuQzMifQ%3D%3D&_nc_ohc=wXPvHdzE_DcQ7kNvwHxBhi0&_nc_oc=AdlRBpd7db5yZzzbMsx6UnCIyfnAA6wWTFFFLlI4EXP8Xrs0yPvO53Y4VYJnWPmuX9k&_nc_ad=z-m&_nc_cid=0&_nc_zt=23&_nc_ht=scontent.cdninstagram.com&_nc_gid=yviaVbm9OkY2_8KkpLZpiw&oh=00_AfhBm_C7tsHApcsDvW6h2MrhmC114Nqf_1djNDRmsfu1dA&oe=69311CCC;2026’ya Sağlıklı Bir Adım At!✨  Sigarayı bırakarak kendisi ve çevresi için daha sağlıklı bir hayata adım atmak isteyen tüm #siirt li hemşehrilerimizi bu kampanyaya katılmaya davet ediyorum. 🚭⬇️;;0
https://www.instagram.com/p/DRCufw_DFF3/;Reels;139;1;7689;2025-11-14 18:53:38;https://scontent.cdninstagram.com/v/t51.71878-15/581849401_849210937559450_4562978986663412650_n.jpg?stp=dst-jpg_e15_tt6&_nc_cat=108&ig_cache_key=Mzc2NTc3NjczMTQ3NTgyNTAxNQ%3D%3D.3-ccb7-5&ccb=7-5&_nc_sid=58cdad&efg=eyJ2ZW5jb2RlX3RhZyI6InhwaWRzLjY0MHgxMTM2LnNkci5DMyJ9&_nc_ohc=Dq1sXDClrksQ7kNvwFooacs&_nc_oc=AdmP0m7OFbzCztYwYgS2lfiw2NwDmegAxYrjswUiDf1RJZK7TQ0LqeqeBMgLihFaD7I&_nc_ad=z-m&_nc_cid=0&_nc_zt=23&_nc_ht=scontent.cdninstagram.com&_nc_gid=yviaVbm9OkY2_8KkpLZpiw&oh=00_Afi59NOITocv6LTPe2iZrDEXKfm2xSYBXp3Ff6GY-OnUNw&oe=69312B49;“Temiz Bir Kent ve Sağlıklı Bir Çevre” için başttığımız #TemizlikSeferberliği hız kesmeden devam ediyor. 💦🌪️🧹🚮  Halkımızın refahı ve esenliği için Cuma gününün ilk ışıkları ve bereketiyle okul çevreleri, cadde ve sokaklarda temizlik çalışmalarımız  sürüyor.🌿  Daha temiz bir #Siirt  için #CanlaBaşla çalışıyoruz.   📍Kooperatif Mahallesi  #BaşımGözümÜstüne #DurmadanDuraksamadan 🇹🇷;;0
https://www.instagram.com/p/DRALpOKDOjJ/;Carousel;210;0;0;2025-11-13 19:10:09;https://scontent.cdninstagram.com/v/t51.82787-15/581997851_18072653879340029_4759458685133261037_n.jpg?stp=dst-jpg_e35_tt6&_nc_cat=101&ig_cache_key=Mzc2NTA2MDQ5Mjc3MjI1Njc3MA%3D%3D.3-ccb7-5&ccb=7-5&_nc_sid=58cdad&efg=eyJ2ZW5jb2RlX3RhZyI6InhwaWRzLjE0NDB4OTYwLnNkci5DMyJ9&_nc_ohc=mIYMXAqC-i4Q7kNvwGNkZsn&_nc_oc=AdlXHnTFtTCYPrcIO6U2cIm1-1rp6YYT-J3UmGhnLN1JR7tPCtFjlXM0Ui8A5p9LXUo&_nc_ad=z-m&_nc_cid=0&_nc_zt=23&_nc_ht=scontent.cdninstagram.com&_nc_gid=yviaVbm9OkY2_8KkpLZpiw&oh=00_AfhntyRZJ87hbKhYZ3vKiGwht5Ww0zHoy4BQ8-5bhXT2VQ&oe=69311FCC;Dicle Kalkınma Ajansı Yönetim Kurulu Toplantısına  katılan Valimiz Sayın @dr.kemalkizilkaya , #Mardin Valimiz Sayın Tuncay Akkoyun’u  ziyaret etti.   @tcmardinvaliligi;;0
https://www.instagram.com/p/DQ89MVFDD1F/;Carousel;150;0;0;2025-11-12 13:06:09;https://scontent.cdninstagram.com/v/t51.82787-15/580745373_18072545255340029_5029406322662003428_n.jpg?stp=dst-jpg_e35_tt6&_nc_cat=111&ig_cache_key=Mzc2NDE1MjUxMDYzOTI1OTc0OA%3D%3D.3-ccb7-5&ccb=7-5&_nc_sid=58cdad&efg=eyJ2ZW5jb2RlX3RhZyI6InhwaWRzLjEwNjZ4NzExLnNkci5DMyJ9&_nc_ohc=gn6g_ZDDjUoQ7kNvwGPaKgM&_nc_oc=AdkjjzG1eeJZYni_F_WC7Xrk9HTINr2v8dwXe6yCXhS2iEpsSaSV1t_nl65VDTzvQYE&_nc_ad=z-m&_nc_cid=0&_nc_zt=23&_nc_ht=scontent.cdninstagram.com&_nc_gid=yviaVbm9OkY2_8KkpLZpiw&oh=00_Afhr0q-XYsMjMqCdvAfKYlLufXxzJdRVzJHTbsb7MlSHgw&oe=69311E27;"Valimiz Sayın @dr.kemalkizilkaya , Siirt Üniversitesi Arıcılık Araştırma ve Uygulama Merkezi (ARIMER) ile TÜBİTAK iş birliğinde düzenlenen “II. Ulusal Siirt Arıcılık ve Arı Sağlığı Çalıştayı”na katıldı.  Sözlerine, Azerbaycan’dan dönüş yolunda şehit olan kahraman Mehmetçiklerimize Allah’tan rahmet, ailelerine ve milletimize başsağlığı dileyerek başlayan Vali Kızılkaya, “Arıcılığı sadece bir üretim faaliyeti değil, Siirt’in geleceğine yapılan bir kalkınma yatırımı olarak görüyoruz.” dedi.🌱  📊 2024 TÜİK verilerine göre;  Siirt ilinin 227.097 kovanla Türkiye’de 🔟sırada, 3.048 ton bal üretimiyle de 5⃣. sırada olduğunu belirten Vali Kızılkaya,   “Hedefimiz; huzur ve güven ikliminde ilimizi daha ileriye taşımak, vatandaşlarımıza daha iyi yaşam kalitesi sunmak ve yaşam standartlarını yükseltmek. Daha güçlü, daha üretken ve bereketli bir #Siirt için birlikte #canlabaşla çalışmaya devam edeceğiz.”  #Arıcılık 🐝  #PervariBalı 🍯  #SiirtTarımKenti🌾";;0
https://www.instagram.com/p/DQ7iA71DHZv/;Photo;169;0;0;2025-11-11 23:49:25;https://scontent.cdninstagram.com/v/t51.82787-15/580130794_18072506768340029_7898954026779421895_n.jpg?stp=dst-jpg_e35_tt6&_nc_cat=101&ig_cache_key=Mzc2Mzc1MTUxMTQyMDMzNTcyNw%3D%3D.3-ccb7-5&ccb=7-5&_nc_sid=58cdad&efg=eyJ2ZW5jb2RlX3RhZyI6InhwaWRzLjE0NDB4OTU2LnNkci5DMyJ9&_nc_ohc=D6anWvZDLiQQ7kNvwHMQnD6&_nc_oc=Adnox-nP7NmQO5F4n-HUUyPoiCsF_oEwY_hXVEZ5oVAYMZYQaXn916EtHib2XLTFABc&_nc_ad=z-m&_nc_cid=0&_nc_zt=23&_nc_ht=scontent.cdninstagram.com&_nc_gid=yviaVbm9OkY2_8KkpLZpiw&oh=00_AfjsVT-9PNHkrFwEn_6nLkN6I1oS4qSVrctt7pjgH3zdug&oe=6931329D;"🇹🇷 Aziz Milletimizin Başı Sağ Olsun 🇹🇷  Azerbaycan’dan ülkemize dönüş yolunda, Millî Savunma Bakanlığımıza ait C-130 askeri kargo uçağının Gürcistan-Azerbaycan sınırında düşmesi sonucu şehit olan kahraman Mehmetçiklerimize Allah’tan rahmet; kederli ailelerine, yakınlarına ve aziz milletimize sabır ve başsağlığı diliyoruz.  Aziz şehitlerimizin ruhu şad, makamları âli olsun. 🤲";;0
https://www.instagram.com/p/DQ6593GDNP5/;Reels;294;3;19201;2025-11-11 18:02:19;https://scontent.cdninstagram.com/v/t51.71878-15/580543212_1611081559856497_1592845659945044053_n.jpg?stp=dst-jpg_e15_tt6&_nc_cat=109&ig_cache_key=Mzc2MzU3NTM3ODMxNzk4ODg1Nw%3D%3D.3-ccb7-5&ccb=7-5&_nc_sid=58cdad&efg=eyJ2ZW5jb2RlX3RhZyI6InhwaWRzLjY0MHgxMTM2LnNkci5DMyJ9&_nc_ohc=agO7XU5SLeUQ7kNvwFmpQAM&_nc_oc=Adl3YmagnWT2XclIke5-KUfoN07Vcr5DEmI0eDTgEp7wiWOrj7J2xNsvC8DCnDwT1kk&_nc_ad=z-m&_nc_cid=0&_nc_zt=23&_nc_ht=scontent.cdninstagram.com&_nc_gid=yviaVbm9OkY2_8KkpLZpiw&oh=00_AfiRknI28eFvgKlm_3nHJuhgFA8ncME8TJzCdm1M8Savew&oe=693102C8;🌱 Şahidimiz toprak, imzamız fidan, sevdamız yeşil vatan! 🇹🇷  “Her fidan, yarınlara bırakacağımız en kıymetli mirastır.” 🌿  ✨#siirt il genelinde 7️⃣5️⃣.0️⃣0️⃣0️⃣ fidanı toprakla buluşturuyoruz!🌲  #milliağaçlandırmagünü ’müz kutlu olsun!  📍 Siirt Üniversitesi Kezer Yerleşkesi  @iletisim @tc_tarim_ormancilik_bakanligi @tcicisleri  #türkiyeyüzyılı 🇹🇷 #yeşilvatanseferberliği 💚 #11kasımağaçlandırmagünü  #geleceğenefes;;0
https://www.instagram.com/p/DQ6h4pyDH5P/;Carousel;415;0;0;2025-11-11 14:29:03;https://scontent.cdninstagram.com/v/t51.82787-15/580736324_18072466835340029_8407519166029753767_n.jpg?stp=dst-jpg_e35_tt6&_nc_cat=107&ig_cache_key=Mzc2MzQ2OTQ0NDIzMzA3MTQzNQ%3D%3D.3-ccb7-5&ccb=7-5&_nc_sid=58cdad&efg=eyJ2ZW5jb2RlX3RhZyI6InhwaWRzLjEwNjZ4NzExLnNkci5DMyJ9&_nc_ohc=mg05fLDh1UUQ7kNvwEA10aT&_nc_oc=AdkeXEXwRPsELS0slcliOkTVdJRYBTTfD5AFMQskB2As5arIs7bbrnpgs4Qv3ExuwR0&_nc_ad=z-m&_nc_cid=0&_nc_zt=23&_nc_ht=scontent.cdninstagram.com&_nc_gid=yviaVbm9OkY2_8KkpLZpiw&oh=00_Afgt2trmaBVmBDx1XVRIxgehaptpETGT_vuUxGWRSLjpFg&oe=69310E7B;"🌱 Şahidimiz toprak, imzamız fidan, sevdamız yeşil vatan! 🇹🇷  #11KasımAğaçlandırmaGünü kapsamında; Valimiz ve Belediye Başkan V. Sayın @dr.kemalkizilkaya , eşi Nurten Kızılkaya Hanımefendi, il protokolü, kurum temsilcileri, sivil toplum kuruluşları, öğrencilerimiz ve vatandaşlarımızın katılımıyla,  🇹🇷 #YeşilVatanSeferberliği çerçevesinde, bu anlamlı günde 7 farklı noktada toplam 2⃣7⃣5⃣0⃣ fidan toprakla buluşturuldu. 🌲  #Siirt genelinde ise yıl sonuna kadar 7⃣5⃣.0⃣0⃣0⃣ fidanın toprakla buluşturulması hedefleniyor. 🌳  🌱 Her dikilen fidan, çocuklarımız için yeşeren bir umut, vatanımıza bırakılan en güzel mirastır.  📍 Siirt Üniversitesi Kezer Yerleşkesi  @iletisim @tarimgovtr  #YeşilVatanSeferberliği #TürkiyeYüzyılı 🇹🇷";;0
https://www.instagram.com/p/DQ6hduYDMi5/;Carousel;186;0;0;2025-11-11 14:25:22;https://scontent.cdninstagram.com/v/t51.82787-15/576533220_18375092962149072_3995528499479813248_n.webp?_nc_cat=104&ig_cache_key=Mzc2MzQ2NzYwNzg2NjExOTIxOQ%3D%3D.3-ccb7-5&ccb=7-5&_nc_sid=58cdad&efg=eyJ2ZW5jb2RlX3RhZyI6InhwaWRzLjE0NDB4OTYwLnNkci5DMyJ9&_nc_ohc=cO-HcdfBUtAQ7kNvwGCVf87&_nc_oc=AdlOUDomG0KMHO1sawU_Rn0br_5miH1kpOLzHp2_E0IHfz8i1ZtgJr7Tl0fsJ29gZ5xORkJGI-t3nYtXzuUhaP4U&_nc_ad=z-m&_nc_cid=0&_nc_zt=23&_nc_ht=scontent.cdninstagram.com&_nc_gid=M5Xvao5NFgyK_T80ym1NJw&oh=00_Afhq7avm8mZfApvB71Rn6-QoBdn-dbpgI_En3K8xOwGUhQ&oe=69311BEA;"🌱 Şahidimiz toprak, toprak, imzamız fidan, sevdamız yeşil vatan! 🇹🇷  #11KasımAğaçlandırmaGünü kapsamında; Valimiz ve Belediye Başkan V. Sayın Dr. Kemal Kızılkaya, eşi Nurten Kızılkaya Hanımefendi, il protokolü, kurum temsilcileri, sivil toplum kuruluşları, öğrencilerimiz ve vatandaşlarımızın katılımıyla,  🇹🇷 #YeşilVatanSeferberliği çerçevesinde, bu anlamlı günde 7 farklı noktada toplam 2⃣7⃣5⃣0⃣ fidan toprakla buluşturuldu. 🌲  #Siirt genelinde ise yıl sonuna kadar 7⃣5⃣.0⃣0⃣0⃣ fidanın toprakla buluşturulması hedefleniyor. 🌳  🌱 Her dikilen fidan, çocuklarımız için yeşeren bir umut, vatanımıza bırakılan en güzel mirastır.  📍 Siirt Üniversitesi Kezer Yerleşkesi   #YeşilVatanSeferberliği #TürkiyeYüzyılı 🇹🇷";;0
https://www.instagram.com/p/DQ32cysjEeA/;Reels;116;1;6719;2025-11-10 13:32:50;https://scontent.cdninstagram.com/v/t51.71878-15/580886163_1180064384051317_5214190980568396723_n.jpg?stp=dst-jpg_e15_tt6&_nc_cat=111&ig_cache_key=Mzc2MjcxNTQ4Njc4Mjc2OTAyNA%3D%3D.3-ccb7-5&ccb=7-5&_nc_sid=58cdad&efg=eyJ2ZW5jb2RlX3RhZyI6InhwaWRzLjY0MHgxMTM2LnNkci5DMyJ9&_nc_ohc=uF8nymIgYtAQ7kNvwFwbiHc&_nc_oc=Adl03ecF4mfU39YonJoYSaq7y6DONROaaHNAMfmUVZhFz0NWC8y1ugpnw1INCUrDs240FvcDTjQ4Yo5vG0eEFG7g&_nc_ad=z-m&_nc_cid=0&_nc_zt=23&_nc_ht=scontent.cdninstagram.com&_nc_gid=M5Xvao5NFgyK_T80ym1NJw&oh=00_Afi_Ad_XTc4hBfkpPxJjPNEXYtlNWYXtgyvmQ3v1Ef0UsQ&oe=69310B34;“Benim naçiz vücudum elbet bir gün toprak olacaktır, ancak Türkiye Cumhuriyeti ilelebet payidar kalacaktır.”🇹🇷  Cumhuriyetimizin banisi Gazi Mustafa Kemal #Atatürk’ ü ebediyete irtihalinin 87. yılında rahmet, minnet ve şükranla andık.  Milletimizin yüreğinde yaşayan Atatürk sevgisi, genç nesillerin gözlerinde bugün bir kez daha hayat buldu.  📍 İl Milli Eğitim Müdürlüğü Konferans Salonu  #10kasım193oo  #siirt 🇹🇷;;0
