PostLink;PostTürü;BeğeniSayısı;YorumSayısı;Görüntülenme Sayısı;Tarih;DisplayPhoto;Caption;Takipçi;TahminMi
https://www.instagram.com/p/DQo-C4hDCdg/;Carousel;209;0;0;2025-11-04 18:48:47;https://scontent.cdninstagram.com/v/t51.82787-15/573999515_18071880260340029_526156665119642744_n.jpg?stp=dst-jpg_e35_tt6&_nc_cat=106&ig_cache_key=Mzc1ODUyNjc1NzkwMjAwMTczMQ%3D%3D.3-ccb7-5&ccb=7-5&_nc_sid=58cdad&efg=eyJ2ZW5jb2RlX3RhZyI6InhwaWRzLjE0NDB4MTAwOC5zZHIuQzMifQ%3D%3D&_nc_ohc=FLbVyz2mpOYQ7kNvwHhfLb3&_nc_oc=Adlsv7Q0C_Xp_NhK2T0dsjWEjOE6-JKzGy7HIxnWfkJEzNhpADcTx7cK4RPgf2xYSHe2LEsqDlCvZVCrv8NtNvvZ&_nc_ad=z-m&_nc_cid=0&_nc_zt=23&_nc_ht=scontent.cdninstagram.com&_nc_gid=fGziME1AAlCM-oLwOfJp-Q&oh=00_AfgTa4UT5Muj9zG1N_XAg-JSSdoypnIl0lx8WULQgbK_mg&oe=69310BD0;"📍Taziye Ziyareti  Valimiz ve Belediye Başkan Vekili Sayın @dr.kemalkizilkaya ,  Halk ziyaretleri programı kapsamında;  Milli sporcumuz Evin Demirhan Yavuz’un kıymetli babası Şemsettin Demirhan’ın vefatı dolayısıyla, Demirhan ailesine ve yakınlarına taziye ziyaretinde bulunarak başsağlığı ve sabır dileklerini iletti.  Merhuma Allah’tan rahmet, diliyoruz. Mekânı cennet olsun🤲  #BirizBeraberiz #Siirt";;0
https://www.instagram.com/p/DQogajbjEmO/;Carousel;206;0;0;2025-11-04 14:29:52;https://scontent.cdninstagram.com/v/t51.82787-15/573066849_18071858537340029_2142884491614500776_n.jpg?stp=dst-jpg_e35_tt6&_nc_cat=109&ig_cache_key=Mzc1ODM5NjQ0Njg3NDU5NDEyMg%3D%3D.3-ccb7-5&ccb=7-5&_nc_sid=58cdad&efg=eyJ2ZW5jb2RlX3RhZyI6InhwaWRzLjEwNjd4NzEyLnNkci5DMyJ9&_nc_ohc=wiKMedivu48Q7kNvwFgipbr&_nc_oc=AdlvDmzgLooZ0AIrxuXfD_FvoWEV-mwaJclWABv9cfMcr8v4JhuiQFcNa2aFsdc9x-v5SMK6ZwXYpDzfnPprxexj&_nc_ad=z-m&_nc_cid=0&_nc_zt=23&_nc_ht=scontent.cdninstagram.com&_nc_gid=fGziME1AAlCM-oLwOfJp-Q&oh=00_AfiucMOKdAJLUHTHYItKdhu1lvj7k6oxZnlgFoPGwYgtfA&oe=6931215A;Bağımlılıkla Mücadelede Birlikteyiz❗️   Valimiz ve Belediye Başkan V. Sn. @dr.kemalkizilkaya ve eşi Nurten Kızılkaya Hanımefendi #Siirt Yeşilay Danışmanlık Merkezi’ni (YEDAM) ziyaret etti.  Ziyarette, bağımlılıkla mücadele kapsamında yürütülen çalışmalar hakkında Yeşilay yetkililerinden bilgi aldı.  Bağımlılıkla mücadelede kararlılık vurgusu yapan Vali Kızılkaya, Yeşilay’ın özellikle gençler başta olmak üzere toplumun tüm kesimlerinde farkındalık oluşturma, bireyleri bağımlılıktan koruma ve sağlıklı yaşam alışkanlıklarını teşvik etme yönündeki çalışmalarının büyük bir önem taşıdığını ifade etti. 🌿  Vali Kızılkaya, bağımlılıkla mücadelenin yalnızca kurumların değil, tüm toplumun ortak sorumluluğu olduğunu belirterek, bu alanda yürütülen her çalışmanın geleceğimiz için değerli bir yatırım olduğunu ifade etti.   👉 Bağımlılıklardan kurtulmak için ilk adımı at, 1⃣1⃣5⃣’i ara!   #YEDAM’ın uzmanları seni dinlemeye hazır. 📞  #Yeşilay #BağımlılıklaMücadele  @1920yesilay;;0
https://www.instagram.com/p/DQoXpFvDFHo/;Photo;62;0;0;2025-11-04 13:13:13;https://scontent.cdninstagram.com/v/t51.82787-15/573805067_18071853122340029_5599737690874431666_n.jpg?stp=dst-jpg_e35_tt6&_nc_cat=102&ig_cache_key=Mzc1ODM1Nzg2Nzc2NzAyNjE1Mg%3D%3D.3-ccb7-5&ccb=7-5&_nc_sid=58cdad&efg=eyJ2ZW5jb2RlX3RhZyI6InhwaWRzLjE0NDB4MTkyMC5zZHIuQzMifQ%3D%3D&_nc_ohc=Fh0KvGMmphIQ7kNvwGOKjLI&_nc_oc=AdksOnFtWult1tgD8gMjxT42gmQOhIV6r9yIk0EKytoq7C1AHIs-NfGBaKxNSHRKxVMbc-Sn87B7amknssFWZt-1&_nc_ad=z-m&_nc_cid=0&_nc_zt=23&_nc_ht=scontent.cdninstagram.com&_nc_gid=fGziME1AAlCM-oLwOfJp-Q&oh=00_Afi2pXp0K2Z-WHaR2PrySJFP9zWD5cNBB1q7NPny-mShtQ&oe=69312A15;"🌿💚 Haydi #Siirt ❗️  Hep birlikte #YeşilVatanSeferberliği’ne katılalım, ormanlarımızı büyütelim; vatana yeşil, yarınlara umut olalım. 🇹🇷  7’den 70’e birlikte kutlayacağımız 11 Kasım Millî Ağaçlandırma Gününde düzenlenecek fidan dikim törenine;  Tüm halkımız davetlidir.  Siz de gelecegenefes.gov.tr adresinden ister fidan sahiplenin, isterseniz bağışta bulunun. Mutlaka #YeşilVatanSeferberliği ’ne katılın.  🗓️ 11 Kasım 2025 🕤 11:11 📍 Siirt Üniversitesi Kezer Yerleşkesi   #GeleceğeNefes 💚 #TürkiyeYüzYılı🇹🇷  @dr.kemalkizilkaya";;0
https://www.instagram.com/p/DQn3WKmDE-f/;Reels;79;0;5227;2025-11-04 08:32:15;https://scontent.cdninstagram.com/v/t51.71878-15/572621218_1781752062492229_1648918667129847437_n.jpg?stp=dst-jpg_e15_tt6&_nc_cat=111&ig_cache_key=Mzc1ODIxNTgyOTgyNjMyNjQzMQ%3D%3D.3-ccb7-5&ccb=7-5&_nc_sid=58cdad&efg=eyJ2ZW5jb2RlX3RhZyI6InhwaWRzLjY0MHgzNjIuc2RyLkMzIn0%3D&_nc_ohc=g_6Kv_BSY4MQ7kNvwGbPbvi&_nc_oc=AdlRTsrOrBBlGfjfRaHHkpV7A9S-QPvi6EdaM4snCgNGBNzLLBTx1yT5JvGzmOigYJbEZtR0ecywAh-7KZcTOhX8&_nc_ad=z-m&_nc_cid=0&_nc_zt=23&_nc_ht=scontent.cdninstagram.com&_nc_gid=fGziME1AAlCM-oLwOfJp-Q&oh=00_AfjgCAXTzuCDp29EzRxJhRHeIX5ie2PxaHW9Ywz3bs3Nrw&oe=693128B8;🇹🇷 SİBER VATANDA DA HALKIMIZIN YANINDAYIZ! 💻  #Siirt Valiliği İl #Jandarma Komutanlığı, vatandaşlarımızın dijital dünyada güvenliği için yürüttüğü siber farkındalık eğitimlerine aralıksız devam ediyor.  📊 2025 yılının ilk on ayında 1️⃣0️⃣. 2️⃣2️⃣5️⃣ öğrenci ile vatandaşımıza eğitim verildi.  ⚖️ 32 siber dolandırıcılık olayı aydınlatıldı. 📉 Bir önceki yıla göre siber dolandırıcılık olaylarında %30 oranında azalma sağlandı.👏  Unutmayalım! Şüpheli durumlarla karşılaşırsanız 1️⃣1️⃣2️⃣’yi mutlaka arayın. Biz gereğini yapalım.❗️  #SİBERAY🌙    @tcicisleri @dr.kemalkizilkaya;;0
https://www.instagram.com/p/DQmC00KjOnY/;Reels;211;0;9089;2025-11-03 16:27:45;https://scontent.cdninstagram.com/v/t51.71878-15/573555200_859021156567518_2983486440901672541_n.jpg?stp=dst-jpg_e15_tt6&_nc_cat=110&ig_cache_key=Mzc1NzcwMzM2NDYwNDY1MTk5Mg%3D%3D.3-ccb7-5&ccb=7-5&_nc_sid=58cdad&efg=eyJ2ZW5jb2RlX3RhZyI6InhwaWRzLjY0MHgzNjAuc2RyLkMzIn0%3D&_nc_ohc=SlWaUGUt9K8Q7kNvwFr2O4Z&_nc_oc=AdkWhlNkfaq957OGtLyw34G07BBAWAEsiWCIPAIBxkZEikmrMopUkAYkQWKNqOaloNcR6w-XlBeWQ8v7RnERDfne&_nc_ad=z-m&_nc_cid=0&_nc_zt=23&_nc_ht=scontent.cdninstagram.com&_nc_gid=fGziME1AAlCM-oLwOfJp-Q&oh=00_Afigf24XDUoKzMnaqDgQ9u3z4R2duImRn9JcCDcl9ijs8Q&oe=69312DC6;Valimiz Sayın @dr.kemalkizilkaya , Ekim Ayı Asayiş ve Güvenlik Bilgilendirme ve Değerlendirme Toplantısı gerçekleştiriyor.   📍#Siirt Güvenlik ve Acil Durumlar Koordinasyon Merkezi (GAMER)  #SiirtinHuzuru 🇹🇷 #TürkiyeninHuzuru 🇹🇷  @tcicisleri;;0
https://www.instagram.com/p/DQlnglADGP1/;Carousel;166;0;0;2025-11-03 11:34:08;https://scontent.cdninstagram.com/v/t51.82787-15/573658530_18373554400149072_9050750705733967096_n.webp?_nc_cat=106&ig_cache_key=Mzc1NzU4MzIxODMwNTE0ODg0MA%3D%3D.3-ccb7-5&ccb=7-5&_nc_sid=58cdad&efg=eyJ2ZW5jb2RlX3RhZyI6InhwaWRzLjE0Mzl4MTM0Mi5zZHIuQzMifQ%3D%3D&_nc_ohc=QS7_Q3oIZzcQ7kNvwGn9muF&_nc_oc=Adn1aSg3KIfLfHFGbZ0YAQchyjgRT2AKt3fa2GlnoH0m_Ely3L7KwuQ_sCI_M-ApIwELd55NGj4SgbvC2l4Z-cSV&_nc_ad=z-m&_nc_cid=0&_nc_zt=23&_nc_ht=scontent.cdninstagram.com&_nc_gid=fGziME1AAlCM-oLwOfJp-Q&oh=00_AfgYGT5FcM8Ht2V28Fa2pxGqF9lUEXbTtp8mGKveaZqOpg&oe=69311102;Zabıta Denetimleri Aralıksız Sürüyor❗ ️ #Siirt Belediyesi Zabıta ekipleri, 27 Ekim -2 Kasım 2025 tarihleri arasında 340 iş yerini denetledi.  Daha önce uyarılmalarına rağmen kaldırım işgali yaptığı tespit edilen iki işletme,1 gün süreyle faaliyetten men edildi. 125 iş yerine uyarı, 15 iş yerine ise toplam 21.090 TL idari yaptırım uygulandı.  Vatandaşlardan gelen 75 şikâyetin tamamına anında müdahale edildi.  🚫 Kaldırım işgalleri, seyyar satıcılar ve hijyen kurallarına aykırı uygulamalara karşı denetimler kararlılıkla devam edecek.  📲 Şikâyet ve bildirimler için: Belediye WhatsApp: 0 535 016 05 44 Acil Çağrı Merkezi : 1️⃣1️⃣2️⃣  #CanlaBaşla #DurmadanDuraksamadan🇹🇷;;0
https://www.instagram.com/p/DQeuhB6DGwg/;Carousel;94;0;0;2025-10-31 19:20:41;https://scontent.cdninstagram.com/v/t51.82787-15/573927530_18071524388340029_7555328067651995334_n.jpg?stp=dst-jpg_e15_tt6&_nc_cat=111&ig_cache_key=Mzc1NTY0Mjk0NjcwNDkxNjgxOA%3D%3D.3-ccb7-5&ccb=7-5&_nc_sid=58cdad&efg=eyJ2ZW5jb2RlX3RhZyI6InhwaWRzLjcyMHg5NjAuc2RyLkMzIn0%3D&_nc_ohc=SYcNNJugs-EQ7kNvwEhlUYG&_nc_oc=AdkjRB6O7Jm9BYhT-66IeflA626WMjRkaNCOnPXRD_uIiqO-dbvAl--SX02RTmsv9fW5ATXNWMxl6r48taU8Y_RS&_nc_ad=z-m&_nc_cid=0&_nc_zt=23&_nc_ht=scontent.cdninstagram.com&_nc_gid=fGziME1AAlCM-oLwOfJp-Q&oh=00_Afjiip-bpbxnuQyFB6q8cDSlhXmijwFJ_a74PCZqXubCQg&oe=69311070;"#Siirt İl Afet Risk Azaltma Planı (İRAP) 2025 Yılı Genel Değerlendirme Toplantısı, Valimiz Sayın @dr.kemalkizilkaya başkanlığında; AFAD Yönetim Hizmetleri Genel Müdürü Cengiz Gevrek, kamu kurum ve kuruluşlarının temsilcileri ile İRAP İzleme ve Değerlendirme Komisyonu üyelerinin katılımıyla gerçekleştirildi.  Toplantıda, #İRAP kapsamında belirlenen 52 eylem planı ve afet risklerini azaltma çalışmaları değerlendirildi.  #AFAD İl Müdürlüğü’nün sunumuyla Siirt’in afet risklerini azaltmak amacıyla yürütülen eylem planları hakkında detaylı bilgi verildi.   Afet risklerini azaltmak, önlemek ve olası etkilerini en aza indirmek amacıyla kurumlar arası iş birliğinin önemine dikkat çeken Vali Kızılkaya, hazırlanan risk azaltma eylem planlarının sahada titizlikle uygulanması ve yakından takip edilmesi gerektiğini belirtti.  Afetlere karşı dirençli bir şehir inşa etmek için vatandaşların bilinçlenmesi ve farkındalık oluşturulmasının büyük önem taşıdığını sözlerine ekledi.  İlimizin afet riskini en aza indirmek için hep birlikte çalışmaya devam ediyoruz!   Toplantı görüş ve önerilerin sunulması ile sona erdi.  📍#SiirtValiliği Konferans Salonu  @tcicisleri @afadbaskanlik  #AfetYönetimi #AfetlereHazırlık";;0
https://www.instagram.com/p/DQefCn8jG6a/;Photo;115;0;0;2025-10-31 17:05:27;https://scontent-man2-1.cdninstagram.com/v/t51.82787-15/573702020_18071511401340029_9124056596816740061_n.jpg?stp=dst-jpg_e35_tt6&_nc_cat=102&ig_cache_key=Mzc1NTU3NTY1OTA0NjEzNzQ5OA%3D%3D.3-ccb7-5&ccb=7-5&_nc_sid=58cdad&efg=eyJ2ZW5jb2RlX3RhZyI6InhwaWRzLjE0NDB4OTYxLnNkci5DMyJ9&_nc_ohc=mYQLpOGMo4MQ7kNvwGOuR_9&_nc_oc=Adm6lb6c4_XCihak-QoLmBUz34zlpBIG8XBzFC1ZgWVYGJJQt58uaNZ5DHYnIDEgcdE&_nc_ad=z-m&_nc_cid=0&_nc_zt=23&_nc_ht=scontent-man2-1.cdninstagram.com&_nc_gid=fGdVOLMM7DwkLkwJuWnwcg&oh=00_AfjNF8OIo-2xMbMFJVanbJrSP99Ga8vaK1jixKil6M6CRA&oe=69311EE8;"Nesiller değişir, Hilal’e adanmış yürekler değişmez! 🌙  Valimiz Sayın @dr.kemalkizilkaya , #KızılayHaftası münasebetiyle;  Türk Kızılayı #Siirt Şube Başkanı Nihat Altunç, #Kızılay çalışanları ve gönüllülerden oluşan heyeti makamında kabul etti.🤝  Kızılay Haftası’nı tebrik eden Vali Kızılkaya, “Yardımseverliğin, merhametin ve dayanışmanın en güçlü sembollerinden biri olan Türk Kızılay’ımız; afetlerde, zor zamanlarda ve ihtiyaç anında milletimizin daima yanındadır. Bu vesileyle tüm Kızılay gönüllülerine ve çalışanlarına teşekkür ediyor, çalışmalarında başarılar diliyorum.”    #YarınaHilâlOl 🌙";;0
https://www.instagram.com/p/DQdk0NPDOIh/;Carousel;88;0;0;2025-10-31 08:36:41;https://scontent-man2-1.cdninstagram.com/v/t51.82787-15/573091366_18373239298149072_8136979917740884747_n.jpg?stp=dst-jpg_e15_tt6&_nc_cat=108&ig_cache_key=Mzc1NTMxOTQzMjI0NDQwODQwNg%3D%3D.3-ccb7-5&ccb=7-5&_nc_sid=58cdad&efg=eyJ2ZW5jb2RlX3RhZyI6InhwaWRzLjcyMHg5NjAuc2RyLkMzIn0%3D&_nc_ohc=GQy0M_Icc9wQ7kNvwHwQxnd&_nc_oc=Adljo3vyXeDg6VI_Rb2Wnt2j4cpzSD0V9q3J_7waml774HNVyVgR72e5FJ3UlqhFPK0&_nc_ad=z-m&_nc_cid=0&_nc_zt=23&_nc_ht=scontent-man2-1.cdninstagram.com&_nc_gid=fGdVOLMM7DwkLkwJuWnwcg&oh=00_Afisqzx6iF0UyQy5JgD9pHGUtyu0DhsbPqG7KBg9RH-A4Q&oe=69310367;“Temiz Bir Kent ve Sağlıklı Bir Çevre” için başttığımız #TemizlikSeferberliği hız kesmeden devam ediyor. 💦🌪️🧹🚮  Halkımızın refahı ve esenliği için Cuma gününün ilk ışıkları ve bereketiyle okul çevreleri, cadde ve sokaklarda temizlik çalışmalarımız  sürüyor.🌿  Daha temiz bir #Siirt  için #CanlaBaşla çalışıyoruz.   📍Afetevleri Mahallesi  #BaşımGözümÜstüne #DurmadanDuraksamadan 🇹🇷;;0
