PostLink;PostTürü;BeğeniSayısı;YorumSayısı;Görüntülenme Sayısı;Tarih;DisplayPhoto;Caption;Takipçi;TahminMi
https://www.instagram.com/p/DRHAhExjOyh/;Reels;298;11;20231;2025-11-16 10:49:18;https://scontent.cdninstagram.com/v/t51.71878-15/582672894_1828218775237100_3658248458722562902_n.jpg?stp=dst-jpg_e15_tt6&_nc_cat=111&ig_cache_key=Mzc2Njk4MTg4NjE4NzcyODAzMw%3D%3D.3-ccb7-5&ccb=7-5&_nc_sid=58cdad&efg=eyJ2ZW5jb2RlX3RhZyI6InhwaWRzLjY0MHgxMTM2LnNkci5DMyJ9&_nc_ohc=VP9YVy3i5UoQ7kNvwF1giUY&_nc_oc=AdkK_AXts1hSRer6jPoLBassI75kxN5IZyUglbdE4bmoUYAB43l2lLguMIYrFkffjo8&_nc_ad=z-m&_nc_cid=0&_nc_zt=23&_nc_ht=scontent.cdninstagram.com&_nc_gid=3RDzBuPJO22SmB7NL9mTTw&oh=00_Afgs4s_GprzL5_at8P28lk7zSBJIC5_FCFtuuQ6yvQy_Ow&oe=6931279C;Eruh’ta da yollarımız, vatandaşlarımızın gönül rızası, huzuru ve devletimize duası ile güzelleşiyor. 🤲🇹🇷  Erenkaya–Özlüpelit–Dağdöşü Grup Yolu, Kalender–Yeşilören Yolu, Yeşilören–Payamlı–Kılıçkaya–Milan Yolu, Milan–Kavaközü–Bağgöze–Çeltiksuyu Grup Yolu, Bağgöze Köy Yolu, Kaşıkyayla, Çimencik Köyü ve Çetinkol (Papire Sofi) güzergâhlarında toplam 29.350 metre Bitümlü Sıcak Karışım (BSK) asfalt yol yapımı ile yol çizgi ve şerit çalışmalarımızı tamamladık. #eruh ’umuza ve memleketimize hayırlı olsun. 👏  Yollarımız güzelleştikçe hemşerilerimizin yüzleri de gülmeye devam ediyor. 🧑‍🌾  #siirt genelinde 100 km’nin üzerinde tamamladığımız BSK asfalt yollarımızı, İl Özel İdaremize ait şantiyemizde kendi mühendislerimizin, teknik personelimizin ve işçilerimizin emeğiyle yapmış olmanın haklı gururunu yaşıyoruz. 🌟  Yatırımlarımız sayesinde ulaşım konforu ve güvenliği artarken, köylerimizin sosyal ve ekonomik hayatına da yeni bir ivme kazandırıyoruz. 📈  Bu yatırımların hayata geçirilmesinde bizlere her zaman destek veren Cumhurbaşkanımız Sayın Recep Tayyip Erdoğan’a, tüm bakanlarımıza, Milletvekilimiz Sayın @mervangul56 ’ya, ilçe kaymakamlarımıza, AK Parti İl Başkanımıza, İl Genel Meclisi başkan ve üyelerimize, İl Özel İdaresi Genel Sekreteri ve ekibine, muhtarlarımıza, desteklerini esirgemeyen tüm siyasi parti ve sivil toplum kuruluşlarına ve emeği geçen tüm mesai arkadaşlarıma şükranlarımı sunuyorum.  Yolumuz güzel 👍 Çizgimiz net 🇹🇷  @tcicisleri @iletisim  #canlabaşla #türkiyeyüzyılı #terörsüztürkiye #durmakyokyoladevam #durmadanduraksamadan 🇹🇷;5670.0;0
https://www.instagram.com/p/DRpFNBnDIz-/;Reels;88;1;3129;2025-11-29 16:23:51;https://scontent.cdninstagram.com/v/t51.71878-15/588938785_1475060696888714_3823595372659285304_n.jpg?stp=dst-jpg_e15_tt6&_nc_cat=108&ig_cache_key=Mzc3NjU3MjY0Nzg0MTUwMDQxNA%3D%3D.3-ccb7-5&ccb=7-5&_nc_sid=58cdad&efg=eyJ2ZW5jb2RlX3RhZyI6InhwaWRzLjY0MHgzNjIuc2RyLkMzIn0%3D&_nc_ohc=m5kzYfRo3-QQ7kNvwHxmVIp&_nc_oc=AdlW5aCX_dzAQN5TW2MzMhQHkry2YVXLaIQsc4pK3w4H827-9n0-rOGTq_jGftFG0sY&_nc_ad=z-m&_nc_cid=0&_nc_zt=23&_nc_ht=scontent.cdninstagram.com&_nc_gid=3RDzBuPJO22SmB7NL9mTTw&oh=00_AfimDyPf6cXHIAl7SAdsCQM_IYFhmdHN9SPrg_pFTpi4Qg&oe=6931162F;#siirt ’imizin #kanal7 ekranlarında canlı olarak tanıtılacağı programı hep birlikte izlemeye davet ediyorum. #siirtikeşfet 🇹🇷  📺 30 Kasım Pazar ⏰ 16:20;;0
https://www.instagram.com/p/DRpA-frjI7d/;Photo;117;0;0;2025-11-29 15:45:47;https://scontent.cdninstagram.com/v/t51.82787-15/589570885_18074063408340029_5240299928378552293_n.jpg?stp=dst-jpg_e35_tt6&_nc_cat=106&ig_cache_key=Mzc3NjU1NDA1NzE1MTA1NzYyOQ%3D%3D.3-ccb7-5&ccb=7-5&_nc_sid=58cdad&efg=eyJ2ZW5jb2RlX3RhZyI6InhwaWRzLjE0NDB4ODEwLnNkci5DMyJ9&_nc_ohc=4yyoobm_3QcQ7kNvwHvzu6c&_nc_oc=AdmSWKk2ltn8RjoLB0Hr3TBMcBN2D1Cv8iA-x77J7bloOODMvNuVWze89Bl7MSnzd0Q&_nc_ad=z-m&_nc_cid=0&_nc_zt=23&_nc_ht=scontent.cdninstagram.com&_nc_gid=3RDzBuPJO22SmB7NL9mTTw&oh=00_Afg-EL_z6BMzW_CA1ObcmBlRh-zCLUXGIE8DxfLVkBLmTw&oe=693106C4;"Milletimizin başı sağ olsun 🇹🇷  Görev başında geçirmiş oldukları trafik kazası sonucu Şehit olan #Manisa Bölge Trafik Denetleme Şube Müdürlüğü kadrosunda görevli Polis Memurları Hatice Ünal ve Ali Barut’a Allah’tan rahmet; ailelerine, Kahraman Emniyet Teşkilatımıza ve Milletimize başsağlığı diliyoruz.  Ruhları şâd, makamları âli  olsun 🤲  @dr.kemalkizilkaya";;0
https://www.instagram.com/p/DRl25xgjNzo/;Carousel;155;0;0;2025-11-28 10:20:02;https://scontent.cdninstagram.com/v/t51.82787-15/588151221_18377508490149072_7039200228310409537_n.webp?_nc_cat=105&ig_cache_key=Mzc3NTY2NTMyMjMyNjc5Mjk0Ng%3D%3D.3-ccb7-5&ccb=7-5&_nc_sid=58cdad&efg=eyJ2ZW5jb2RlX3RhZyI6InhwaWRzLjE0Mzd4ODExLnNkci5DMyJ9&_nc_ohc=9UcB0TvarggQ7kNvwHB6B5p&_nc_oc=AdmU2EhcOV7amHN5vFOtwO0IgdcSNYLq2wEiwMAc8Tzav0UknjTzQPnCX47kaPymgp4&_nc_ad=z-m&_nc_cid=0&_nc_zt=23&_nc_ht=scontent.cdninstagram.com&_nc_gid=3RDzBuPJO22SmB7NL9mTTw&oh=00_AfhBd3mBk5JTe_9UGjzmlzV3j5GGKKnwV8bddUyOpnKnxA&oe=693111F0;Siirt’imize Modern Sebze-Meyve Hali Kazandırılıyor!  Valimiz ve Belediye Başkan V. Sayın Dr. Kemal Kızılkaya, #Siirt Sebze ve Meyve Hali Komisyoncuları Dernek Başkanı Halit Aydar ve beraberindeki heyeti makamında kabul etti.  Görüşmede, mevcut sebze halinin artık ihtiyaca cevap veremediğini belirten Vali Kızılkaya, modern bir sebze halinin kurulmasının zorunlu bir ihtiyaç haline geldiğini ifade etti.   Vali Kızılkaya, imar ve yer tahsisi işlemlerinin tamamlandığını, proje ihalesine çıkıldığını ve sürecin yakından takip edildiğini, yeni sebze halinin şehir dışına taşınarak, Siirt–Eruh çevre yolu Gökçebağ beldesi kavşağında, şehirler arası otogarın karşısında bulunan 26.900 m² alan üzerine inşa edilmesi yönünde çalışmaların sürdüğünü ifade etti.  Vali Kızılkaya, 'Yeni Sebze-Meyve Hali Projesi'nin #Siirt ekonomisine ve esnafımıza önemli katkılar sağlayacağını belirterek, bu çalışmalarla kentin ticari altyapısını güçlendirmeyi hedeflediklerini sözlerine ekledi.  Dernek Başkanı Halit Aydar, #Siirt ’in yeni ve modern bir sebze haline kavuşması için projeye verilen destekten duydukları memnuniyeti dile getirerek, Sebze Hali esnafları adına Sayın Valimize teşekkür etti.  #CanlaBaşla #BaşımGözümÜstüne  #DurmadanDuraksamadan🇹🇷;;0
https://www.instagram.com/p/DRlyiFoDPYA/;Carousel;56;0;0;2025-11-28 09:41:51;https://scontent.cdninstagram.com/v/t51.82787-15/589247444_18377506300149072_6247599828203857599_n.jpg?stp=dst-jpg_e15_tt6&_nc_cat=108&ig_cache_key=Mzc3NTY0NTk3NTAwOTA3ODc0NQ%3D%3D.3-ccb7-5&ccb=7-5&_nc_sid=58cdad&efg=eyJ2ZW5jb2RlX3RhZyI6InhwaWRzLjQ4MHg2NDAuc2RyLkMzIn0%3D&_nc_ohc=Azl9etrP8I4Q7kNvwEL2NPB&_nc_oc=Adl4niXsrEDK5NSJsxr5iX6lD5Cn9VizSUH95VlAxVZ_pzMpG2eun_n_NcQ3ieo-R60&_nc_ad=z-m&_nc_cid=0&_nc_zt=23&_nc_ht=scontent.cdninstagram.com&_nc_gid=3RDzBuPJO22SmB7NL9mTTw&oh=00_Afj1QwnF2ah7YIYHA2sFGZ4DZjheTOaXEyWu6L_0HRRu5g&oe=69311A73;“Temiz Bir Kent ve Sağlıklı Bir Çevre” için başlattığımız #TemizlikSeferberliği kapsamında her hafta yaptığımız gibi bir mahallemizde #Cuma günün ilk ışıkları ve bereketiyle okul çevreleri, cadde ve sokaklarda yürüttüğümüz temizlik çalışmalarımız hız kesmeden devam ediyor.💦🌪️🧹  📍Çal Mahallesi   #Siirt  #CanlaBaşla  #BaşımGözümÜstüne  #DurmadanDuraksamadan 🇹🇷;;0
https://www.instagram.com/p/DRjoFecDP0m/;Photo;90;0;0;2025-11-27 13:32:05;https://scontent.cdninstagram.com/v/t51.82787-15/587549890_18073873121340029_8080447482336618384_n.jpg?stp=dst-jpg_e35_tt6&_nc_cat=101&ig_cache_key=Mzc3NTAzNzIxMDgwNzMwMzQ2Mg%3D%3D.3-ccb7-5&ccb=7-5&_nc_sid=58cdad&efg=eyJ2ZW5jb2RlX3RhZyI6InhwaWRzLjE0NDB4MTIwMC5zZHIuQzMifQ%3D%3D&_nc_ohc=liWLIPHFgcUQ7kNvwFM_bKy&_nc_oc=Adls52LLz0p7UpWa7vYaMmnlkWnUbiMdwwa_OYK79cVX8uTpUsZRHdA0nduR_t4vXEo&_nc_ad=z-m&_nc_cid=0&_nc_zt=23&_nc_ht=scontent.cdninstagram.com&_nc_gid=3RDzBuPJO22SmB7NL9mTTw&oh=00_Afi2C4mDIPBW-fEpFSSVgQ-gNjdfcOKrVo2mULYKZorucw&oe=693114F2;Valimiz Sayın @dr.kemalkizilkaya , Diyarbakır Basın İlan Kurumu Bölge Müdürü olarak atanan Murat Yürekli’yi makamında kabul etti.  Sayın Valimiz, müdürümüze yeni görev yerinde başarılar diledi.  📍#Siirt Valiliği;;0
https://www.instagram.com/p/DRfOqBejIiC/;Reels;234;1;9919;2025-11-25 20:34:38;https://scontent.cdninstagram.com/v/t51.71878-15/587554548_4004113236401310_1098830200821429586_n.jpg?stp=dst-jpg_e15_tt6&_nc_cat=103&ig_cache_key=Mzc3Mzc5OTQ3MzIxNTIxMTY1MA%3D%3D.3-ccb7-5&ccb=7-5&_nc_sid=58cdad&efg=eyJ2ZW5jb2RlX3RhZyI6InhwaWRzLjY0MHgxMTM2LnNkci5DMyJ9&_nc_ohc=RnkVR1R5G_0Q7kNvwGa5fKd&_nc_oc=Adk1450VdT4Bby4t9bHtAVogafWHCE9E3OzqWKmxLe-eWX3PXKrgmhC1oTGktCtKAVY&_nc_ad=z-m&_nc_cid=0&_nc_zt=23&_nc_ht=scontent.cdninstagram.com&_nc_gid=3RDzBuPJO22SmB7NL9mTTw&oh=00_Afhu96kuLj0T9HMLu1GPRbLTw5539v5YLi0-yalgq0aaMg&oe=69310323;🟧 Fark etmek, DUR demektir. #i̇şaretifarket   Kadınlarımızın güvenliği için devletimizin tüm imkânlarıyla yanındayız.  📱 Tüm vatandaşlarımızı, hayat kurtaran #KADES uygulamasını aktif şekilde kullanmaya davet ediyorum.  📲 KADES “Tek tuşla şiddetin karşısında, kadınların yanında.”  🔗 apps.apple.com/tr/app/kades/i…  🔗 play.google.com/store/apps/det…  @tcicisleri @tcailesosyal   #siirt  #şiddetesıfırtolerans #kadınaşiddetlemücadelegünü;;0
https://www.instagram.com/p/DRe-MZ5DJzb/;Carousel;304;0;0;2025-11-25 18:09:04;https://scontent.cdninstagram.com/v/t51.82787-15/587771283_18073714475340029_1463478805924528734_n.jpg?stp=dst-jpg_e35_tt6&_nc_cat=107&ig_cache_key=Mzc3MzcyNzA2MzQ2Mzk4OTEyMA%3D%3D.3-ccb7-5&ccb=7-5&_nc_sid=58cdad&efg=eyJ2ZW5jb2RlX3RhZyI6InhwaWRzLjE0NDB4OTYwLnNkci5DMyJ9&_nc_ohc=29Uv8qhfP78Q7kNvwEAuH9R&_nc_oc=AdnBbrn8MM8codyJ4Oa_R0fH6nC3hRgONT11YubAdANWQrxedGcol37HMvOxFF3dlxA&_nc_ad=z-m&_nc_cid=0&_nc_zt=23&_nc_ht=scontent.cdninstagram.com&_nc_gid=3RDzBuPJO22SmB7NL9mTTw&oh=00_AfhPsC7zKTNz62p9rRoVkwII9VLzTnuaSAo_ejJ8dmEJNQ&oe=69312926;Valimiz ve Belediye Başkan V. Sayın @Dr_KemalKzlkaya ve eşi Hanımefendi Nurten Kızılkaya, İl Müftülüğümüz ve Türkiye Diyanet Vakfı #Siirt Şubesi tarafından Gazze yararına açılan “Hayır Çarşısı”nı ziyaret ederek desteklerini iletti.  📍 Siirt’in Filistin’e olan güçlü dayanışması bir kez daha ortaya kondu.  Sayın Valimiz, duyarlılık gösteren tüm kurumlarımıza ve hayırsever hemşehrilerimize teşekkür ederek:  “Siirt halkının Filistin’e yönelik derin hassasiyeti ve yardımseverliğine bugün bir kez daha hep birlikte şahitlik ettik. Allah emeği geçen ve katkı sunan hemşehrilerimizden razı olsun.” ifadelerini kullandı.🇹🇷 🇵🇸;;0
https://www.instagram.com/p/DRe08rkjFvC/;Carousel;125;0;0;2025-11-25 16:48:17;https://scontent.cdninstagram.com/v/t51.82787-15/588436282_18073707197340029_199357365007735748_n.jpg?stp=dst-jpg_e35_tt6&_nc_cat=109&ig_cache_key=Mzc3MzY4NjM5NjUyNDIxNDQyMg%3D%3D.3-ccb7-5&ccb=7-5&_nc_sid=58cdad&efg=eyJ2ZW5jb2RlX3RhZyI6InhwaWRzLjE0NDB4OTYwLnNkci5DMyJ9&_nc_ohc=NLfTHM0OHHQQ7kNvwGFn86z&_nc_oc=AdngY_RstkSkgLEc-W1Ll3ziUnl3c6IbTMaiE3pxEVjVrN-zfUtAQJnLehtL0BqqHSo&_nc_ad=z-m&_nc_cid=0&_nc_zt=23&_nc_ht=scontent.cdninstagram.com&_nc_gid=3RDzBuPJO22SmB7NL9mTTw&oh=00_AfhBt2eVusrt54O18v2bTcctGoNsUp1NTEAmJaZ6HBfz1g&oe=69310576;"🟧Fark etmek, DUR demektir. #İşaretiFarket   Valimiz Sayın @dr.kemalkizilkaya ve eşi Hanımefendi Nurten Kızılkaya, ‘Kadına Yönelik Şiddete Karşı Uluslararası Mücadele Günü’ kapsamında #Siirt Aile ve Sosyal Hizmetler Müdürlüğü tarafından düzenlenen programa katıldı.  Kadına yönelik şiddetin her türlüsünü insanlığa ihanet olarak gördüklerini belirten Vali Kızılkaya konuşmasında; “Kadına yönelik şiddetin toplumun ortak yarası olduğunu, şiddetin hiçbir gerekçeyle kabul edilemeyeceğini ve devletin kadınların yanında olmaya kararlılıkla devam ettiğini belirtti. 🛑  Kadınlarımızın güvenliği, onuru ve güçlü yarınlara umutla bakması için çalışmaların aralıksız sürdürüldüğünü ifade eden Vali Kızılkaya, tüm vatandaşları #KADES başta olmak üzere güvenlik ve destek mekanizmalarını etkin şekilde kullanmaya davet etti. 📱  Etkinlikte, şiddete karşı farkındalık oluşturmak amacıyla hazırlanan oratoryo gösterimi ve “Portre” adlı tiyatro oyunu sahnelendi. 🎭   @tcicisleri  @tcailesosyal  #KADES #ŞiddeteSıfırTolerans #KadınaŞiddetleMücadeleGünü";;0
https://www.instagram.com/p/DRdxxY4CBWh/;Photo;62;0;0;2025-11-25 07:01:17;https://scontent.cdninstagram.com/v/t51.82787-15/583840630_18073669817340029_5498465324296759953_n.jpg?stp=dst-jpg_e35_tt6&_nc_cat=107&ig_cache_key=Mzc3MzM5MDk2MTA0OTYwNTUzNw%3D%3D.3-ccb7-5&ccb=7-5&_nc_sid=58cdad&efg=eyJ2ZW5jb2RlX3RhZyI6InhwaWRzLjY4MHg2ODAuc2RyLkMzIn0%3D&_nc_ohc=_2lypTL39nIQ7kNvwFdlYjw&_nc_oc=Adls96wvvWMB2UF9iFWgWhq0L5a1bwUxSLWiMsGYmFaz9xzkF2WzPOT01KqLTXhVAUQ&_nc_ad=z-m&_nc_cid=0&_nc_zt=23&_nc_ht=scontent.cdninstagram.com&_nc_gid=3RDzBuPJO22SmB7NL9mTTw&oh=00_AfimHkrB1avxvjhOJbMN7nBikcV1jA1YkAmjVd4F3MbI0Q&oe=69311A01;"❝Kadına şiddet insanlığa ihanettir.❞   25 Kasım Kadına Yönelik Şiddete Karşı Uluslararası Mücadele Günü’nde;  ❌ Şiddetin Karşısında 🌺 Kadınların Yanındayız. ✋ #KadınaElKalkamaz  📲 #KADES “Tek tuşla şiddetin karşısında kadınların yanında” ✅  🔗 https://apps.apple.com/tr/app/kades/id1360309770  🔗 https://play.google.com/store/apps/details?id=tr.gov.egm.kades  @tcicisleri @tcailesosyal @dr.kemalkizilkaya";;0
https://www.instagram.com/p/DRctzrRDLDX/;Reels;137;0;6225;2025-11-24 21:12:04;https://scontent.cdninstagram.com/v/t51.71878-15/587351797_3132392906930459_7883184308663004469_n.jpg?stp=dst-jpg_e15_tt6&_nc_cat=104&ig_cache_key=Mzc3MzA5MjA1MTA3Mjg4OTA0Nw%3D%3D.3-ccb7-5&ccb=7-5&_nc_sid=58cdad&efg=eyJ2ZW5jb2RlX3RhZyI6InhwaWRzLjY0MHgzNjAuc2RyLkMzIn0%3D&_nc_ohc=hqp0dfSO8BgQ7kNvwEqJuaI&_nc_oc=AdloVye3SiqcB2Z1P9gBAXuE0xr6YKtV18NnJ3zDCXNAa_7qtO-Y3mFQKJRsxzwkzec&_nc_ad=z-m&_nc_cid=0&_nc_zt=23&_nc_ht=scontent.cdninstagram.com&_nc_gid=3RDzBuPJO22SmB7NL9mTTw&oh=00_AfjtuCdO85aBMoxMycaKxqNq1FeN4knyt4ThSIcKX5GiEw&oe=69312C0C;"🇹🇷 24 Kasım Öğretmenler Günü Kutlu Olsun💐  #Siirt İl #Jandarma Komutanlığımız tarafından görevlendirilen ekiplerimiz, 24 Kasım Öğretmenler Günü kapsamında sorumluluk alanında il genelindeki tüm okulları ziyaret ederek öğretmenlerimizin bu anlamlı gününü tebrik etti.  📍 Bu kapsamda 297 okul jandarma ekiplerimiz tarafından ziyaret edildi.  Cumhuriyetimizin kurucusu, Başöğretmenimiz Gazi Mustafa Kemal Atatürk başta olmak üzere, görevi başındayken şehit olan ve ebediyete irtihal eden tüm öğretmenlerimizi rahmet, minnet ve şükranla yâd ediyor, ülkemizin dört bir yanında büyük bir özveriyle görev yapan tüm öğretmenlerimize sağlık, mutluluk ve başarılar diliyoruz.”  ❝Öğretmenler; yeni nesil sizin eseriniz olacaktır.❞ — Gazi Mustafa Kemal Atatürk 🇹🇷  @tcicisleri @jandarma @dr.kemalkizilkaya   #24Kasım #ÖğretmenlerGünü";;0
https://www.instagram.com/p/DRb3gctDDKO/;Carousel;142;0;0;2025-11-24 13:12:55;https://scontent-fra5-2.cdninstagram.com/v/t51.82787-15/588432790_18073600286340029_2396150724985174692_n.jpg?stp=dst-jpg_e35_tt6&_nc_cat=107&ig_cache_key=Mzc3Mjg1MzIxNzkyNDAwOTcyMw%3D%3D.3-ccb7-5&ccb=7-5&_nc_sid=58cdad&efg=eyJ2ZW5jb2RlX3RhZyI6InhwaWRzLjg0N3g1MjQuc2RyLkMzIn0%3D&_nc_ohc=FNg3Y3Pqw3kQ7kNvwFqefXe&_nc_oc=Adnhfqc0K0G_p4FnzbIFmGniJfr0yUZLwq013erCRHhegNQSV1rfpjJre98IVIlFH0yCA8dvmPl4hJShxDf_9KgR&_nc_ad=z-m&_nc_cid=0&_nc_zt=23&_nc_ht=scontent-fra5-2.cdninstagram.com&_nc_gid=bRy2TzeLBiMFiWovwNnZcg&oh=00_AfjNuFCxmX83F2lgm97gGP4eA2t_zIwkJJbHdfR4NT5fIw&oe=693118D1;🇹🇷 Sevgi, emek ve özveriyle yarınlarımızı inşa eden kıymetli öğretmenlerimize minnettarız! ✨  Valimiz Sayın @dr.kemalkizilkaya , eşi Hanımefendi Nurten Kızılkaya, il protokolü, öğretmenler, öğrenciler ve vatandaşlarımızın katılımıyla 24 Kasım Öğretmenler Günü programı gerçekleştirildi.  Programda hitap eden Vali Kızılkaya,�”Öğretmenlik sadece bir meslek değil, medeniyetimizin değerlerini geleceğe taşıyan bir sevda yolculuğudur. Eğitime yapılan her yatırım milletimizin geleceğine yapılan en değerli yatırımdır. Öğretmenlerimizin yanında olmaya devam edeceğiz.” ifadelerini kullandı. 🌹📚  📖 Şiirler, 🏆 ödüller, 🕺halk dansları ve 🎶 müzik dinletisiyle renklenen program, emekliye ayrılan öğretmenlere ‘Hizmet Şeref Belgeleri’nin Sayın Valimiz tarafından takdim edilmesiyle sona erdi.  📚 Her öğrencinin yüreğine dokunan, ülkemizin dört bir yanında fedakârca görev yapan tüm öğretmenlerimize gönülden teşekkür ediyor, #TürkiyeYüzyılı’nın mimarları olarak başarılar diliyoruz.  🇹🇷 24 Kasım Öğretmenler Günü Kutlu Olsun 👏  #ÖğretmenlerGeleceğimizdir 💐;;0
https://www.instagram.com/p/DRZUtQWDFmH/;Reels;1045;6;50169;2025-11-23 13:34:48;https://scontent-fra3-1.cdninstagram.com/v/t51.71878-15/587222262_1356670049289027_6950735125815528813_n.jpg?stp=dst-jpg_e15_tt6&_nc_cat=108&ig_cache_key=Mzc3MjEzNzIzMzc1NTk1MzU0Mw%3D%3D.3-ccb7-5&ccb=7-5&_nc_sid=58cdad&efg=eyJ2ZW5jb2RlX3RhZyI6InhwaWRzLjY0MHgzNjAuc2RyLkMzIn0%3D&_nc_ohc=bsCj50NHRW0Q7kNvwFQltc3&_nc_oc=Adl1l_RiOBmHq2V9W8ya0pG3InqlPQAfGcv8cIa3I10VqGlpnYCzjZb_2MX9gsfGG7iEToiDCfbII3OlRyjNC-3b&_nc_ad=z-m&_nc_cid=0&_nc_zt=23&_nc_ht=scontent-fra3-1.cdninstagram.com&_nc_gid=bRy2TzeLBiMFiWovwNnZcg&oh=00_AfhiRihaVJ7X58zWunHWrDLpw-enqPdzIpVLyrv4XlEiOg&oe=693105C6;#siirt ’imizin #trt1 ekranlarında canlı olarak tanıtılacağı programı hep birlikte izlemeye davet ediyorum. #siirtikeşfet 🇹🇷  📺 25 Kasım Salı ⏰ 10:30  #alişanlahayatagülümse;;0
https://www.instagram.com/p/DRZS1gSDE65/;Carousel;369;0;0;2025-11-23 13:14:00;https://scontent-fra3-1.cdninstagram.com/v/t51.82787-15/587732265_18073506797340029_1194525659656711470_n.jpg?stp=dst-jpg_e35_tt6&_nc_cat=105&ig_cache_key=Mzc3MjEyODk5NDIzMDMyOTEyMg%3D%3D.3-ccb7-5&ccb=7-5&_nc_sid=58cdad&efg=eyJ2ZW5jb2RlX3RhZyI6InhwaWRzLjEwNjd4NzEyLnNkci5DMyJ9&_nc_ohc=jEEU82u8jHIQ7kNvwGhpwjh&_nc_oc=Adl6bImZbNbbkCAYO1JJXI0U_3KCkN3XEQZHkPveAdh8IW9hJBXXvb8Y6jCiBvmHg8uCSRWp_c9gcYHfBJT_fs3i&_nc_ad=z-m&_nc_cid=0&_nc_zt=23&_nc_ht=scontent-fra3-1.cdninstagram.com&_nc_gid=bRy2TzeLBiMFiWovwNnZcg&oh=00_AfhqfRRZ0Om1cm_zltELv7TjxnfPxhCcLQ3WI76HtC8p0A&oe=69311434;"💫24 Kasım Öğretmenler Günü’ Münasebetiyle Kıymetli Öğretmenlerimizle Bir Araya Geldik! 🌹  Valimiz Sayın @dr.kemalkizilkaya ve eşi Hanımefendi Nurten Kızılkaya, #Siirt Öğretmenevi’nde düzenlenen etkinlikte öğretmenlerimizle bir araya geldi.   Öğretmenlerimize karanfil takdim ederek günlerini kutlayan Vali Kızılkaya, öğretmenlik mesleğinin kutsallığına ve toplumun geleceğini inşa etmedeki önemine dikkat çekti.   🎙️”Sizler; sevgi, emek ve özveri ile evlatlarımızın geleceğini şekillendiren, onların hayatlarına ışık tutan, yaşam yolculuklarında birer kurtarıcı, birer rehbersiniz.  Eğitime verilen her emeğin milletimizin geleceğine yapılmış en değerli yatırım olduğu bilinciyle, öğretmenlerimizin yanında olmaya devam edeceğiz”  📚 Eğitim için hep birlikte daha güzel yarınlara❗️  📍Siirt Öğretmenevi  #ÖğretmenlerGünüKutluOlsun 💐";;0
https://www.instagram.com/p/DRU--fpjMIQ/;Reels;132;2;9452;2025-11-21 21:04:57;https://scontent-fra5-2.cdninstagram.com/v/t51.71878-15/584312581_4143738959270008_367112332344254814_n.jpg?stp=dst-jpg_e15_tt6&_nc_cat=107&ig_cache_key=Mzc3MDkxNTc2MTQ5MDI4MDk3Ng%3D%3D.3-ccb7-5&ccb=7-5&_nc_sid=58cdad&efg=eyJ2ZW5jb2RlX3RhZyI6InhwaWRzLjY0MHgxMTM2LnNkci5DMyJ9&_nc_ohc=eHew0nqcGu0Q7kNvwH-rpJf&_nc_oc=AdlzPnUnZed2Ijsc-s42Ot11OaYZIcnQKldI4Q59Sm-tSLjd-BIgsxyWn1JdggR4WtuxHQ4k6KAXpKeAix-61IqH&_nc_ad=z-m&_nc_cid=0&_nc_zt=23&_nc_ht=scontent-fra5-2.cdninstagram.com&_nc_gid=bRy2TzeLBiMFiWovwNnZcg&oh=00_AfjhatUP9t6sDBsouGgJNnCErb8ryK0Y5lTdcHX-CViaSw&oe=693120EA;"🇹🇷 Tarım kenti #siirt , üretim gücüyle her geçen gün büyüyor, güçleniyor.  @tarimgovtr Bakanlığımız ve Valiliğimizin destekleriyle 2025 yılı Kırsal Kalkınma Yatırımları Programı kapsamında;  📌 114 proje desteklendi. 📌 268 milyon TL yatırım yapıldı. 📌 61’i kadın olmak üzere 118 kişiye istihdam sağlandı.  Arıcılıktan modern sulamaya, yenilenebilir enerjiden kovan desteğine kadar üreticilerimizin yanında olduk. IPARD ve Valiliğimiz projeleriyle bu yıl 18 bin kovanı daha üreticilerimize teslim ettik.  Siirt’te üreticimizin gelişimi, sağladığımız desteklerin ve modern ekipmanların etkisiyle açıkça görüldü.   Eskiden yaylada barınmak için çadır sıkıntısı yaşayan gezginci arıcılarımız, bugün güneş enerjisi destekli karavanlar, üretim makineleri ve termo kovanlarla çalışıyor.⛺️🚐  👨‍🌾 Son iki yılda verilen destekler ve çiftçimizin gayreti sayesinde Siirt, bal üretiminde Türkiye’de 8’inci sıradan 5’inci sıraya yükseldi.📈  Devletimizin üretime ve istihdama yönelik destekleri artarak devam edecek.  🐝 Arı gibi çalışkan, bal gibi bereketli üreticilerimize teşekkür ediyor; helal, hayırlı ve bereketli kazançlar diliyorum. 🤲  @iletisim @tcicisleri  #canlabaşla  #türkiyeyüzyılı  #siirttarımşehri  #terörsüztürkiye  #durmadanduraksamadan";;0
https://www.instagram.com/p/DRUg784jLxM/;Carousel;188;0;0;2025-11-21 16:41:01;https://scontent-fra3-1.cdninstagram.com/v/t51.82787-15/584404005_18073339661340029_1911138237197308170_n.jpg?stp=dst-jpg_e35_tt6&_nc_cat=105&ig_cache_key=Mzc3MDc4MzYzMzE4ODM0MzYzOA%3D%3D.3-ccb7-5&ccb=7-5&_nc_sid=58cdad&efg=eyJ2ZW5jb2RlX3RhZyI6InhwaWRzLjEwNjZ4NzExLnNkci5DMyJ9&_nc_ohc=nbqrCJdKx2kQ7kNvwEU35e9&_nc_oc=AdntxeINmJPwp4MQ2ihnqCmpp9rnobkvN9UF8-MP8JWO4E-OikkLFkL1XwWScYmLgOXtFFDuIiPTtRACMZFCRfAf&_nc_ad=z-m&_nc_cid=0&_nc_zt=23&_nc_ht=scontent-fra3-1.cdninstagram.com&_nc_gid=bRy2TzeLBiMFiWovwNnZcg&oh=00_AfgXKS4QxthwUpaugIhEGV6ZgaXnqXj-aLsp9BhHat2TcQ&oe=693131C8;"Devletimiz, Her Daim Üreticilerimizin ve Çiftçilerimizin Yanında 🇹🇷  Valimiz Sayın @dr.kemalkizilkaya , AK Parti #Siirt İl Başkanı Sn. Av. Bahri Caner Özturan,  kurum müdürlerimiz ile arı ve bal üreticilerimizin katılımıyla; Kırsal Kalkınma Yatırımlarının Desteklenmesi Programı kapsamında arıcılık malzemeleri, ekipman ve hibe destekleri törenle üreticilerimize teslim edildi. 🐝🍯  Törende hitap eden Vali Kızılkaya: “Siirt’imizin kalkınma lokomotifi tarım, hayvancılık ve turizmdir. Tarım ve hayvancılığın geliştirilmesi için Tarım Bakanlığımızın himayelerinde yürüttüğümüz projelerle üreticilerimizi desteklemeye devam ediyoruz” dedi.  Vali Kızılkaya, 2025 yılı Kırsal Kalkınma Yatırımları Programı kapsamında; ✅1⃣1⃣4⃣ projenin desteklendiğini, ✅2⃣6⃣8⃣ milyon TL yatırım gerçekleştirildiğini, ✅61’i kadın olmak üzere 1⃣1⃣8⃣ kişiye istihdam sağlandığını ifade etti.  Arıcılık ekipmanlarından modern sulama projelerine, yenilenebilir enerji yatırımlarından kovan desteklerine kadar geniş bir yelpazede üreticilere katkı sunulduğunu belirten Vali Kızılkaya, ayrıca IPARD ve Valiliğimiz projeleriyle 18 binden fazla arı kovanının üreticilerimize teslim edildiğini söyledi.  Siirt’in bereketine bereket katan tüm üreticilerimize teşekkür ediyor, hayırlı ve bereketli bir sezon diliyoruz.  @tarimgovtr  #SiirtTarımŞehri";;0
https://www.instagram.com/p/DRUX9YWDI0X/;Carousel;165;0;0;2025-11-21 15:22:34;https://scontent-fra3-2.cdninstagram.com/v/t51.82787-15/583437109_18073333754340029_1501168579482322380_n.jpg?stp=dst-jpg_e35_tt6&_nc_cat=104&ig_cache_key=Mzc3MDc0NDE1MTA3MjMxNDQxMA%3D%3D.3-ccb7-5&ccb=7-5&_nc_sid=58cdad&efg=eyJ2ZW5jb2RlX3RhZyI6InhwaWRzLjE0NDB4OTYwLnNkci5DMyJ9&_nc_ohc=ffJ2lq-Zi2cQ7kNvwGm2fMO&_nc_oc=AdkPjv_s-1lNfKTx5M_mr_b_vrKV0RxEFbEJvNyo3mSYXJiKV8YtmOhOucTF-rSjdmA4nEMy-o7jC56W8VtBJVQf&_nc_ad=z-m&_nc_cid=0&_nc_zt=23&_nc_ht=scontent-fra3-2.cdninstagram.com&_nc_gid=bRy2TzeLBiMFiWovwNnZcg&oh=00_AfjULmfFkS1iMVfvAnQsVbccmzlLIQVZgFzN5eajX2OeRA&oe=69311553;Valimiz ve Belediye Başkan V. Sayın @dr.kemalkizilkaya , Cuma namazı sonrası Cumhuriyet Caddesi’nde esnaf ve vatandaşlarımızla bir araya geldi.  Hemşehrilerimizin hal hatırını soran, talep ve önerilerini dinleyen Vali Kızılkaya, Cuma bereketinin şehrimize huzur, birlik ve kolaylıklar getirmesini diledi.  Esnafımıza bereketli kazançlar temennisinde bulunan Vali Kızılkaya, “Birlik, beraberlik ve kardeşlik mesajları vererek, her zaman  vatandaşımızın yanındayız.”   #BirizBeraberiz 🇹🇷 #Siirt;;0
https://www.instagram.com/p/DRToySYjBah/;Carousel;80;0;0;2025-11-21 08:30:21;https://scontent-fra3-1.cdninstagram.com/v/t51.82787-15/583866089_18376809286149072_6506076710603725965_n.jpg?stp=dst-jpg_e15_tt6&_nc_cat=108&ig_cache_key=Mzc3MDUzNjQ2MDUxMzIxNDg1NA%3D%3D.3-ccb7-5&ccb=7-5&_nc_sid=58cdad&efg=eyJ2ZW5jb2RlX3RhZyI6InhwaWRzLjcyMHg5NjAuc2RyLkMzIn0%3D&_nc_ohc=83frq_ySGL4Q7kNvwEQhiKW&_nc_oc=AdmMoVNlScUyWhS4HUq7fBVIbdvOEg8ze-I4H_tatkL6Btg28DBx-NqJW3HpKfuwxiPDdmHSTJuRzoK9XE-mq_zF&_nc_ad=z-m&_nc_cid=0&_nc_zt=23&_nc_ht=scontent-fra3-1.cdninstagram.com&_nc_gid=bRy2TzeLBiMFiWovwNnZcg&oh=00_Afjr-hBWjYdzlaO8-tM50M1mrNSI05DPMTGHE9_HJ7Uv5Q&oe=69310F2E;“Temiz Bir Kent ve Sağlıklı Bir Çevre” için başlattığımız #TemizlikSeferberliği kapsamında her hafta yaptığımız gibi bir mahallemizde #Cuma günün ilk ışıkları ve bereketiyle okul çevreleri, cadde ve sokaklarda yürüttüğümüz temizlik çalışmalarımız hız kesmeden devam ediyor.💦🌪️🧹  📍Dumlupınar Mahallesi   #Siirt  #CanlaBaşla  #BaşımGözümÜstüne  #DurmadanDuraksamadan 🇹🇷;;0
