PostLink;PostTürü;BeğeniSayısı;YorumSayısı;Görüntülenme Sayısı;Tarih;DisplayPhoto;Caption;Takipçi;TahminMi
https://www.instagram.com/p/DRpV6PcjdGJ/;Reels;84;2;6201;2025-11-29 18:51:48;https://scontent-muc2-1.cdninstagram.com/v/t51.71878-15/587783441_859442693194516_7879246483778398408_n.jpg?stp=dst-jpg_e15_tt6&_nc_cat=100&ig_cache_key=Mzc3NjY0NjEyMzgxODQzOTA0OQ%3D%3D.3-ccb7-5&ccb=7-5&_nc_sid=58cdad&efg=eyJ2ZW5jb2RlX3RhZyI6InhwaWRzLjY0MHgxMTM2LnNkci5DMyJ9&_nc_ohc=RFKmyM8Al60Q7kNvwFBK3iB&_nc_oc=AdmLaMvYcMMr4Gy5pcSOhQzV-5-Nq6NqJKXYAkA5p--19Trm_NTJkZQqaE_syMsa8qc&_nc_ad=z-m&_nc_cid=0&_nc_zt=23&_nc_ht=scontent-muc2-1.cdninstagram.com&_nc_gid=lOJCjJK-D4zOb9-2eSP_TA&oh=00_AfjvLvN33-cQlVk9pHU9hzGN9A8CBrCRHuy7OogrYbVeGQ&oe=69311966;Özvatan’da huzurlu ve konforlu bir yol deneyimi için önemli bir adım daha attık. 🚧  Küpeli Mahallesi’nde 5 bin 300 ton sıcak asfalt kullanarak 5 kilometrelik yolu baştan sona yeniledik. Hemşehrilerimizin daha güvenli, daha rahat ve daha modern bir ulaşım altyapısına kavuşması için çalışmalarımız aralıksız sürüyor.  Biz de her zaman olduğu gibi gösterdiği uyumlu ve özverili çalışmalar için Halit Başkan’a teşekkür ediyor, yapılan çalışmnın Özvatan’a hayırlı olmasını diliyoruz. 🙏;65351.0;0
https://www.instagram.com/p/DRpGNGkDUXB/;Photo;194;3;0;2025-11-29 16:31:28;https://scontent-muc2-1.cdninstagram.com/v/t51.82787-15/589535078_18549834241001303_2890590242216451439_n.jpg?stp=dst-jpg_e35_tt6&_nc_cat=101&ig_cache_key=Mzc3NjU3NzA1MTIwNjQzNjI4OQ%3D%3D.3-ccb7-5&ccb=7-5&_nc_sid=58cdad&efg=eyJ2ZW5jb2RlX3RhZyI6InhwaWRzLjE0NDB4MTc5Ni5zZHIuQzMifQ%3D%3D&_nc_ohc=Gv-nzPfCl6AQ7kNvwFSGiaq&_nc_oc=AdlWf5jAj-ZV2lXlVndUotPl4fb7KoKomPY1c5NEoLN4WXRX2jBRzD6prnr7giphDuA&_nc_ad=z-m&_nc_cid=0&_nc_zt=23&_nc_ht=scontent-muc2-1.cdninstagram.com&_nc_gid=lOJCjJK-D4zOb9-2eSP_TA&oh=00_Afg-8ZYqbrA_5P4B9PhmIsyE-DFyfBijM5qXFMMWzbjjkA&oe=69312653;Karadeniz’de muhteşem bir galibiyet👏👏 Tebrikler çocuklar👍  Bizim için çok önemli bir üç puandı. Hepinizi alınlarınızdan öpüyorum.💛❤️;;0
https://www.instagram.com/p/DRoh2utDbQO/;Photo;107;0;0;2025-11-29 11:13:51;https://scontent-muc2-1.cdninstagram.com/v/t51.82787-15/590957755_18549799930001303_7926250856646403665_n.jpg?stp=dst-jpg_e35_tt6&_nc_cat=109&ig_cache_key=Mzc3NjQxNzE4NDA4NDc2Nzc1OA%3D%3D.3-ccb7-5&ccb=7-5&_nc_sid=58cdad&efg=eyJ2ZW5jb2RlX3RhZyI6InhwaWRzLjE0NDB4MTkyMC5zZHIuQzMifQ%3D%3D&_nc_ohc=gmbUbBtltKgQ7kNvwEFOKV9&_nc_oc=Adl5haG5MH6F5u-VMnIOxDpB9ch2n_euJv3K3z5V5S36owtcDaMQoThkYYGgZH0XcUc&_nc_ad=z-m&_nc_cid=0&_nc_zt=23&_nc_ht=scontent-muc2-1.cdninstagram.com&_nc_gid=lOJCjJK-D4zOb9-2eSP_TA&oh=00_AfhwYKJkR9YKvnRiXKGE5sVuYe_WZcozPwuRCcHZr0YrNg&oe=69310E21;Deplasmanda Çaykur Rizespor ile oynayacak olan Kayserispor’umuza başarılar diliyorum.💛❤️  Her ne kadar tribünde yanlarında olamasak da yüreğimiz onlarla birlikte..❤️;;0
https://www.instagram.com/p/DRohCMJjcbZ/;Reels;241;15;14548;2025-11-29 11:07:05;https://scontent-muc2-1.cdninstagram.com/v/t51.71878-15/587571379_1163279715894027_7321805376300907488_n.jpg?stp=dst-jpg_e15_tt6&_nc_cat=109&ig_cache_key=Mzc3NjQxMzU3MzU2OTE2OTExMw%3D%3D.3-ccb7-5&ccb=7-5&_nc_sid=58cdad&efg=eyJ2ZW5jb2RlX3RhZyI6InhwaWRzLjY0MHgzNjAuc2RyLkMzIn0%3D&_nc_ohc=CERqxI92K2kQ7kNvwFbJcvs&_nc_oc=AdluT2SaatA-p5TBIN6fXZCAykkNWd7CjoWqRiBFoEeywNYB0aBkDVl69bc-_uHbdNQ&_nc_ad=z-m&_nc_cid=0&_nc_zt=23&_nc_ht=scontent-muc2-1.cdninstagram.com&_nc_gid=lOJCjJK-D4zOb9-2eSP_TA&oh=00_Afhvq7JfWJeGZ2xns_dOCotwoAoV-kocc0ZjV3ir_PxWkA&oe=69310841;Kayseri’de toplu taşımada dijital dönüşümü başlattık. 🚍  GTFS entegrasyonu sayesinde vatandaşlarımız artık Google Maps üzerinden otobüs rotalarını anlık görebilecek, aktarmaları kolayca planlayabilecek ve seyahat sürelerini önceden öğrenebilecek.   Teknolojiyi vatandaşımızın günlük yaşamına entegre ederek, Kayseri’yi akıllı şehirler arasında öncü hâle getiriyoruz.   #HerŞeyKayseriİçin;;0
https://www.instagram.com/p/DRnHW3TjduB/;Reels;238;9;8735;2025-11-28 22:04:22;https://scontent-muc2-1.cdninstagram.com/v/t51.71878-15/588712828_2614575378943020_2030779834550711792_n.jpg?stp=dst-jpg_e15_tt6&_nc_cat=104&ig_cache_key=Mzc3NjAxOTE3MDExMTM4MDM1Mw%3D%3D.3-ccb7-5&ccb=7-5&_nc_sid=58cdad&efg=eyJ2ZW5jb2RlX3RhZyI6InhwaWRzLjY0MHgxMTM2LnNkci5DMyJ9&_nc_ohc=1_a_Rv8ANjIQ7kNvwFWa7GL&_nc_oc=Adk_Aov2eN69FIgiNQBPWo5Gyt_abg4JSEWAbWup5FsFGH-MiD7iy5yo2PRRuht9DGA&_nc_ad=z-m&_nc_cid=0&_nc_zt=23&_nc_ht=scontent-muc2-1.cdninstagram.com&_nc_gid=lOJCjJK-D4zOb9-2eSP_TA&oh=00_AfhU0itX-SFLEoanqS7MsQ9isZ_L-WQ8DTlb2guKjyRJJQ&oe=693130DA;Tüm çabamız daha mutlu bir Kayseri için.. ❤️   📍AK Parti Sosyal Politikalar Başkanlığı İç Anadolu Bölge Toplantısı, Kayseri;;0
https://www.instagram.com/p/DRnA5ARDY1V/;Carousel;205;4;0;2025-11-28 21:06:33;https://scontent-muc2-1.cdninstagram.com/v/t51.82787-15/588358953_18549718411001303_3340580752978862012_n.jpg?stp=dst-jpg_e35_tt6&_nc_cat=100&ig_cache_key=Mzc3NTk5MDcxODcyMTI0MTQyOQ%3D%3D.3-ccb7-5&ccb=7-5&_nc_sid=58cdad&efg=eyJ2ZW5jb2RlX3RhZyI6InhwaWRzLjE0NDB4OTYwLnNkci5DMyJ9&_nc_ohc=BeuNqxn9pY8Q7kNvwFbt0o5&_nc_oc=AdlvRwbzGB1InS2Tis2_3UDcccfPTcusPADlbQY8kDlTZdtY0by3q_yo-CcxeU3rizc&_nc_ad=z-m&_nc_cid=0&_nc_zt=23&_nc_ht=scontent-muc2-1.cdninstagram.com&_nc_gid=lOJCjJK-D4zOb9-2eSP_TA&oh=00_AfhcARTMYecIBgHzWY59dJ-wBRQt2DB1jdTO4fYvH8vL5A&oe=6930FD12;"AK Parti Genel Başkan Yardımcımız Sayın Fatma Betül Sayan Kaya’nın teşrifleriyle; Genel Merkez Gençlik Kolları MKYK Üyesi Sayın Yunus Emre Müküs, AK Parti İl Başkanımız Sayın Hüseyin Okandan ve Gençlik Kolları Başkanımız Sayın Hayri Danacı ile birlikte Recep Tayyip Erdoğan Millet Bahçesi’nde bulunan İl Halk Kütüphanesi’nde gençlerimizle bir araya geldik.  Şehrimizin ve ülkemizin gündemine dair tecrübe paylaşımında bulunduğumuz bu anlamlı buluşmada, gençlerimizin merak ettiği soruları samimiyetle yanıtlayarak karşılıklı istişarelerde bulunduk. Gençlerimizin vizyonu, enerjisi ve heyecanı bizlere umut veriyor. İyi ki varsınız gençler ❤️";;0
https://www.instagram.com/p/DRmS4UdjTuq/;Reels;526;12;33106;2025-11-28 14:31:43;https://scontent-muc2-1.cdninstagram.com/v/t51.71878-15/591159598_1399875585066200_7152009502522734309_n.jpg?stp=dst-jpg_e15_tt6&_nc_cat=104&ig_cache_key=Mzc3NTc4ODM3MjY5NTI2ODI2Ng%3D%3D.3-ccb7-5&ccb=7-5&_nc_sid=58cdad&efg=eyJ2ZW5jb2RlX3RhZyI6InhwaWRzLjY0MHgzNjAuc2RyLkMzIn0%3D&_nc_ohc=HAjigDNP3v0Q7kNvwE2r_Wl&_nc_oc=AdkHrvHagaE2bhRy98rZpKYuoKFlMhIrD8VqbPrf5tFvt_bXD4ih-lWRgZSqzginsYA&_nc_ad=z-m&_nc_cid=0&_nc_zt=23&_nc_ht=scontent-muc2-1.cdninstagram.com&_nc_gid=lOJCjJK-D4zOb9-2eSP_TA&oh=00_Afj0emWXwnG-S8_OhIFop8f5upKHK1VmL3X8o6YbA34J7w&oe=69312757;Yerköy–Kayseri YHT Projemizde çalışmalar güzel bir şekilde ilerliyor, her aşamasını yakından takip ediyoruz. 🚄  İnşallah tamamlandığında Ankara–Kayseri arası 1 saat 45 dakikaya düşecek ve hemşehrilerimize çok büyük bir konfor sağlayacak.  Bu değerli yatırım için Cumhurbaşkanımız Sayın Recep Tayyip Erdoğan ile Ulaştırma ve Altyapı Bakanımız Abdulkadir Uraloğlu’na teşekkür ediyorum.  #HerŞeyKayseriİçin;;0
https://www.instagram.com/p/DRmPsx6DQaZ/;Carousel;426;9;0;2025-11-28 13:56:43;https://scontent-muc2-1.cdninstagram.com/v/t51.82787-15/588985661_18549663301001303_1183005719264217626_n.jpg?stp=dst-jpg_e35_tt6&_nc_cat=102&ig_cache_key=Mzc3NTc3NDM3MjQxMDUwNzg5NQ%3D%3D.3-ccb7-5&ccb=7-5&_nc_sid=58cdad&efg=eyJ2ZW5jb2RlX3RhZyI6InhwaWRzLjE0NDB4OTYwLnNkci5DMyJ9&_nc_ohc=Y_RQP_rvOvIQ7kNvwGE58gN&_nc_oc=AdmAyl99CaWLdVMH2131RqSjml2cotyVx6Tc4Y5VQsThK1NdeP9F05gMzTcw-wiVUao&_nc_ad=z-m&_nc_cid=0&_nc_zt=23&_nc_ht=scontent-muc2-1.cdninstagram.com&_nc_gid=lOJCjJK-D4zOb9-2eSP_TA&oh=00_Afia4aY5oAYXERRDaSBuG-ZTDnfKMdj6OwjJSVJl6VsROQ&oe=69310DB9;Hunat Camii’nde kıldığımız Cuma namazının ardından hemşehrilerimizle ve esnaflarımızla bir araya gelerek hasbihal ettik. Hal hatır sorduk, gönül gönüle sohbet ederek hemşehrilerimizi dinledik.;;0
https://www.instagram.com/p/DRmK6YhDSvB/;Carousel;178;4;0;2025-11-28 13:14:53;https://scontent-muc2-1.cdninstagram.com/v/t51.82787-15/588163761_18549658783001303_9001739392770031633_n.jpg?stp=dst-jpg_e35_tt6&_nc_cat=101&ig_cache_key=Mzc3NTc1MzMyMTc0Mzk5OTc1OQ%3D%3D.3-ccb7-5&ccb=7-5&_nc_sid=58cdad&efg=eyJ2ZW5jb2RlX3RhZyI6InhwaWRzLjE0NDB4OTYwLnNkci5DMyJ9&_nc_ohc=JsYn9aAOy84Q7kNvwGOvNGB&_nc_oc=Adm8HLNuG10XeOQhvb73hnfRfKltyLd_yEMJpa9I2xRAkzJuQTYaFQdKP-ZWRNrUSSk&_nc_ad=z-m&_nc_cid=0&_nc_zt=23&_nc_ht=scontent-muc2-1.cdninstagram.com&_nc_gid=lOJCjJK-D4zOb9-2eSP_TA&oh=00_Afi-LzjXvyi5q1Wbw92jkUwbqK6fPdydHZJE8TJqqN_Azg&oe=69312786;"AK Parti Sosyal Politikalar Başkanlığımızın düzenlediği İç Anadolu Bölge Toplantısı’nı kadim şehrimiz Kayseri’de ev sahibi olarak gerçekleştirmenin mutluluğunu yaşıyoruz.  İç Anadolu teşkilatlarımızın Sosyal Politikalar Başkanlarıyla bir araya geldiğimiz bu önemli toplantıda, AK Parti’mizin sosyal politika alanındaki hizmetlerini vatandaşlarımıza daha etkin şekilde ulaştırmak adına yapılması gereken çalışmaları kapsamlı bir şekilde ele aldık. Oldukça verimli geçen toplantımız, istişare ve ortak aklın en güzel örneklerinden biri olmuştur.  Toplantımıza teşrif eden; AK Parti Genel Başkan Yardımcımız Sayın Fatma Betül Sayan Kaya’ya, İçişleri Bakan Yardımcımız Sayın Mehmet Aktaş’a, Milli Eğitim Bakan Yardımcımız Sayın Celile Eren Ökten’e, Gençlik ve Spor Bakan Yardımcımız Sayın Halil Yunus Ersöz’e, Çalışma ve Sosyal Güvenlik Bakan Yardımcımız Sayın Lütfihak Alpkan’a, AK Parti MKYK Üyesi ve Kayseri Milletvekilimiz Sayın Dursun Ataş’a, AK Parti Kayseri Milletvekilimiz Sayın Bayar Özsoy’a, AK Parti İl Başkanımız Sayın Hüseyin Okandan’a, kıymetli milletvekillerimize ve tüm değerli katılımcılarımıza teşekkür ediyor, katkılarından dolayı şükranlarımızı sunuyoruz.  Birlik ve beraberlik içerisinde, sosyal politikalar alanında daha güçlü adımlar atmaya, milletimizin yanında olmaya kararlılıkla devam edeceğiz.";;0
https://www.instagram.com/p/DRjtSh8DZAE/;Carousel;424;7;0;2025-11-27 14:17:34;https://scontent-muc2-1.cdninstagram.com/v/t51.82787-15/589133538_18549514309001303_858185285567189438_n.jpg?stp=dst-jpg_e35_tt6&_nc_cat=101&ig_cache_key=Mzc3NTA2MDA4OTY3MDI4MDc5OA%3D%3D.3-ccb7-5&ccb=7-5&_nc_sid=58cdad&efg=eyJ2ZW5jb2RlX3RhZyI6InhwaWRzLjEwNjV4NzEwLnNkci5DMyJ9&_nc_ohc=UZpu13kruSQQ7kNvwFt9vdw&_nc_oc=AdkpvyiFSL6ixEJDQyPGFcIkd-m4EW0l0zzpNMM0KZGZhxZap_uTX5iqa79QpuUpewQ&_nc_ad=z-m&_nc_cid=0&_nc_zt=23&_nc_ht=scontent-muc2-1.cdninstagram.com&_nc_gid=lOJCjJK-D4zOb9-2eSP_TA&oh=00_Afjj_CmEAQDtxnnQD8VzCldFPKh41HuRR_bLuEjsBldyaw&oe=6931056A;"Dün, okulda boğazına kaçan bir atıştırmalık nedeniyle henüz çok küçük yaşta aramızdan ayrılan KAYTUR personelimiz Volkan Polat’ın kıymetli oğlu Ahmet Emiralp için taziye ziyaretinde bulunduk.  Bu elim hadise hepimizi derinden üzmüştür. Rabbim evladımıza rahmet eylesin, mesai arkadaşımıza ve ailesine sabır, metanet ve güç versin. Acıları büyük, sınavları zor; ancak bilinsin ki Büyükşehir Ailesi olarak her daim yanlarında olacağız.";;0
https://www.instagram.com/p/DRhulQ-jVVw/;Reels;311;5;12507;2025-11-26 19:51:05;https://scontent-muc2-1.cdninstagram.com/v/t51.71878-15/588400287_2099461934159992_6536069001843082975_n.jpg?stp=dst-jpg_e15_tt6&_nc_cat=108&ig_cache_key=Mzc3NDUwMjgzMzcwMjY1NTM0NA%3D%3D.3-ccb7-5&ccb=7-5&_nc_sid=58cdad&efg=eyJ2ZW5jb2RlX3RhZyI6InhwaWRzLjY0MHgxMTM2LnNkci5DMyJ9&_nc_ohc=-E3io5TRR4sQ7kNvwH6tTrc&_nc_oc=Adn2UjRxoZ4hm8jja9neW02lmhqNuI5awgPstcbgIMADgJkHJx6lDnupQ5CYl6kh2L0&_nc_ad=z-m&_nc_cid=0&_nc_zt=23&_nc_ht=scontent-muc2-1.cdninstagram.com&_nc_gid=lOJCjJK-D4zOb9-2eSP_TA&oh=00_Afhoaj5ObnNOZntxmVKObud_D7VhXfGLT5JBur4b7Mew4A&oe=69311D48;Kadim Şehrimizi aydınlatmak bizim işimiz. Ekonomik ömrünü tamamlayan ve fazla elektrik tüketimine sebep olan sodyum buharlı aydınlatma armatürlerini Enerji Bakanlığımızın talimatları uyarınca LED li yol armatürleri ile yeniliyoruz. Bu sayede ülkemiz ekonomisine katkı sağlarken enerji tüketimini ve dolayısıyla  karbon salınımı azaltıyor çevremizi de koruyoruz.  Şehrimize ve tüketicilerimize hayırlı olsun... tedaskurumsal @tcenerji @kayseribsb;;0
https://www.instagram.com/p/DRhH9F5DdzO/;Carousel;642;52;0;2025-11-26 14:12:50;https://scontent.cdninstagram.com/v/t51.82787-15/588808768_18549362227001303_7125564611473419017_n.jpg?stp=dst-jpg_e35_tt6&_nc_cat=104&ig_cache_key=Mzc3NDMzMjkzNzY1NjE4NDYyNA%3D%3D.3-ccb7-5&ccb=7-5&_nc_sid=58cdad&efg=eyJ2ZW5jb2RlX3RhZyI6InhwaWRzLjE0NDB4OTYwLnNkci5DMyJ9&_nc_ohc=2Ykx-rqRWB8Q7kNvwGij_fC&_nc_oc=Adlf_uYEiNEkU5hs0Zy2ZbtbtKuJKq1bEGgZImVHFiU9pcHPV5nrDxnEJ9OGERuWdmU&_nc_ad=z-m&_nc_cid=0&_nc_zt=23&_nc_ht=scontent.cdninstagram.com&_nc_gid=1iRu4vRzV0nM25AhWusVCQ&oh=00_AfgPWAW2bK7RwqI70yY2_VeXSegPy3yNMGG8l2hbFkwjCg&oe=69310B1C;"Ailemizin büyüğü, koca çınarımız, bugünlere gelmemde büyük emeği olan öğretmenim, değerli ağabeyim Ramazan Büyükkılıç ile kıymetli hemşehrilerimiz Emine Turgut, Hanife Taşkın, Hanife Oğur, Üzeyir Akbulut ve Nuri Seviçin’i Orgeneral Hulusi Akar Camii’nde kıldığımız cenaze namazlarının ardından dualarla ebedi istirahatgâhlarına uğurladık. Rabbim mekânlarını cennet eylesin.  Ramazan ağabeyim; sakinliği, tevazusu ve kimseyi incitmeyen gönlüyle herkesin kalbinde yer edinmişti. Hayatı boyunca iyiliği, kardeşliği ve gönül yapmayı kendine vazife bildi. Güzel izler bırakarak aramızdan ayrıldı.  Başımız sağ olsun.";;0
https://www.instagram.com/p/DReQoHpDSlL/;Photo;1639;328;0;2025-11-25 11:30:54;https://scontent.cdninstagram.com/v/t51.82787-15/587669096_18549191521001303_3390619230637321565_n.jpg?stp=dst-jpg_e35_tt6&_nc_cat=107&ig_cache_key=Mzc3MzUyNjY2MzUxMTIyMjYwMw%3D%3D.3-ccb7-5&ccb=7-5&_nc_sid=58cdad&efg=eyJ2ZW5jb2RlX3RhZyI6InhwaWRzLjE0NDB4OTU5LnNkci5DMyJ9&_nc_ohc=tvgq6M0IJwQQ7kNvwFEaDQD&_nc_oc=AdmZbyP2qCr8cZ99A9EFns_JR_nBNGZN7N6cCQVMudEDOcSN4ZhV-xoAHBRJvA4Ld1E&_nc_ad=z-m&_nc_cid=0&_nc_zt=23&_nc_ht=scontent.cdninstagram.com&_nc_gid=1iRu4vRzV0nM25AhWusVCQ&oh=00_AfjRIaP69SvkU-jKD4n0EhKlAfFav6lvQG2HuH7t88MxPw&oe=69311956;"İnnâ lillâhi ve innâ ileyhi raciun…  Ailemizin çınarı, yetişmeme vesile olan, öğretmenim, kıymetli ağabeyim Ramazan Büyükkılıç’ın Hakk’ın rahmetine kavuştuğunu derin bir üzüntüyle paylaşıyorum.  Ramazan ağabeyim; gönül yapmayı, iyiliği çoğaltmayı hayatının merkezine koymuş, arkasında dualarla anılacak güzel izler bırakmış bir hayırseverdi. Bizlere her daim duruşu, merhameti ve çalışkanlığıyla örnek oldu.  Acımız büyük… Rabbim mekânını cennet, makamını âli eylesin. Başımız sağ olsun.  Cenazemiz, 26 Kasım Çarşamba günü öğle namazına müteakip Hulusi Akar Camii’nden kaldırılacaktır.";;0
https://www.instagram.com/p/DRcLMBtDcFP/;Reels;532;8;36778;2025-11-24 16:08:52;https://scontent.cdninstagram.com/v/t51.82787-15/588490539_18549066313001303_3274092608867333889_n.jpg?stp=dst-jpg_e15_tt6&_nc_cat=111&ig_cache_key=Mzc3MjkzOTc5MjgwNDU5Mzk5OTE4NTQ5MDY2MzEwMDAxMzAz.3-ccb7-5&ccb=7-5&_nc_sid=58cdad&efg=eyJ2ZW5jb2RlX3RhZyI6InhwaWRzLjcyMHgxMjgwLnNkci5DMyJ9&_nc_ohc=fteFnOyDJuAQ7kNvwGyZTiN&_nc_oc=AdlP1pmNLDMtqeYo90b2HcHhxveaMi-HgvkcF-DBN9dskmdZxTYGwELPkXAJVzRUTO4&_nc_ad=z-m&_nc_cid=0&_nc_zt=23&_nc_ht=scontent.cdninstagram.com&_nc_gid=1iRu4vRzV0nM25AhWusVCQ&oh=00_Afjdl8mFlFPKzQ8tYYdd2dHVRSX5lM4FPvAJTWLs0KEIrw&oe=69310B7C;Geleceği ilmek ilmek dokuyan tüm öğretmenlerimize saygı ve sevgilerimle… ❤️;;0
https://www.instagram.com/p/DRcK2R_jbJN/;Photo;215;3;0;2025-11-24 16:01:55;https://scontent.cdninstagram.com/v/t51.82787-15/587776512_18549064720001303_8326254550240774256_n.jpg?stp=dst-jpg_e35_tt6&_nc_cat=111&ig_cache_key=Mzc3MjkzODI5ODQ2NjM0OTY0NQ%3D%3D.3-ccb7-5&ccb=7-5&_nc_sid=58cdad&efg=eyJ2ZW5jb2RlX3RhZyI6InhwaWRzLjE0NDB4OTU5LnNkci5DMyJ9&_nc_ohc=05snMSPwb48Q7kNvwHqd4Iz&_nc_oc=Adnw7ejpT72iiPpfIQIoFUPBG-kQ1TCRSwSeBcKOmj4teAowCxkhqCokQGFGzbA5pFc&_nc_ad=z-m&_nc_cid=0&_nc_zt=23&_nc_ht=scontent.cdninstagram.com&_nc_gid=1iRu4vRzV0nM25AhWusVCQ&oh=00_AfgsbarENFQa3yi8MADLYhwbzFQjHvVr0_OW0l-LXudADw&oe=693106C4;Milli Eğitim Bakan Yardımcımız, değerli hemşehrimiz Sayın Nazif Yılmaz belediyemizi ziyaret etti. Nazik ziyaretleri için Sayın Bakan Yardımcımıza teşekkürlerimi sunuyorum.;;0
https://www.instagram.com/p/DRcDda1jb0p/;Carousel;201;2;0;2025-11-24 14:57:22;https://scontent.cdninstagram.com/v/t51.82787-15/587690603_18549056815001303_9196720553082709830_n.jpg?stp=dst-jpg_e35_tt6&_nc_cat=107&ig_cache_key=Mzc3MjkwNTc5Mjk3MTA2OTg2NA%3D%3D.3-ccb7-5&ccb=7-5&_nc_sid=58cdad&efg=eyJ2ZW5jb2RlX3RhZyI6InhwaWRzLjEwNjZ4NzEwLnNkci5DMyJ9&_nc_ohc=iHPeAgJtKgwQ7kNvwE0bhPz&_nc_oc=AdmKT4pJAOBWc-du8EOG1eSKGnK0C9tnDnHfEu28le2cG1FOBxmztElPb2NSp1oSVvA&_nc_ad=z-m&_nc_cid=0&_nc_zt=23&_nc_ht=scontent.cdninstagram.com&_nc_gid=1iRu4vRzV0nM25AhWusVCQ&oh=00_AfhpP6m8ntrLBkmcd_SuXGuYxBVWfconsGGlS0qoK_tf2Q&oe=69310738;Kayseri Valimiz Sayın Gökmen Çiçek ve Milli Eğitim Bakan Yardımcımız, kıymetli hemşehrimiz Sayın Nazif Yılmaz’ın katılımlarıyla düzenlediğimiz Öğretmenler Günü programında AK Parti İl Başkanımız Sayın Hüseyin Okandan ve şehir protokolümüzle birlikte geleceğimizi ilmek ilmek dokuyan, bilgisiyle yolumuzu aydınlatan, sabrıyla nesiller yetiştiren fedakar öğretmenlerimizle bir araya gelmenin mutluluğunu yaşadık.  Müreffeh yarınlarımızın teminatı olan evlatlarımızı sevgiyle, emekle ve özveriyle hayata hazırlayan tüm öğretmenlerimize şükranlarımızı sunuyorum. İyi ki varsınız, iyi ki bu kutsal mesleğin neferlerisiniz.❤️;;0
https://www.instagram.com/p/DRZu7chjZvB/;Reels;417;18;22201;2025-11-23 17:25:17;https://scontent.cdninstagram.com/v/t51.71878-15/585032676_767369696309178_4492558634294013396_n.jpg?stp=dst-jpg_e15_tt6&_nc_cat=105&ig_cache_key=Mzc3MjI1MjU1ODExNTgzODkxMw%3D%3D.3-ccb7-5&ccb=7-5&_nc_sid=58cdad&efg=eyJ2ZW5jb2RlX3RhZyI6InhwaWRzLjY0MHgxMTM2LnNkci5DMyJ9&_nc_ohc=cnq2hAWNtSgQ7kNvwHYK7qv&_nc_oc=AdkvcBTITFWSBdX5tBgBIDzD9eKsTzLUR7P1orLNBw6Zc8Io8kb8gIMG9GxAPJfKCcQ&_nc_ad=z-m&_nc_cid=0&_nc_zt=23&_nc_ht=scontent.cdninstagram.com&_nc_gid=1iRu4vRzV0nM25AhWusVCQ&oh=00_AfgxcC3sb6IPcv0hxzCk4SgxrRVDT5KcGkI0waWHuXuawg&oe=69310350;Onlar sadece birer öğretmen değil…  Bir şehrin geleceğini ilmek ilmek dokuyan, her öğrencisinin hayatına iz bırakan gönül mimarları…   Yüreğiyle öğreten, emeğiyle büyüten, varlığıyla güç veren tüm öğretmenlerimizin 24 Kasım Öğretmenler Günü kutlu olsun. ❤️;;0
https://www.instagram.com/p/DRZiJL0CDUL/;Reels;1252;29;141865;2025-11-23 15:30:06;https://scontent.cdninstagram.com/v/t51.71878-15/587405156_856335400546197_2764563684826811877_n.jpg?stp=dst-jpg_e15_tt6&_nc_cat=103&ig_cache_key=Mzc3MjE5NjMyNzY0MDI4MjM3OQ%3D%3D.3-ccb7-5&ccb=7-5&_nc_sid=58cdad&efg=eyJ2ZW5jb2RlX3RhZyI6InhwaWRzLjY0MHgxMTM2LnNkci5DMyJ9&_nc_ohc=wcZFatZ8jaIQ7kNvwHTm-Zd&_nc_oc=AdkCoYug5RUkvWVVdOzsQ1vaI7Q78qRAZJ2Ivlo-edczoB2VBwDO6LuW6FoRwM5-h6w&_nc_ad=z-m&_nc_cid=0&_nc_zt=23&_nc_ht=scontent.cdninstagram.com&_nc_gid=1iRu4vRzV0nM25AhWusVCQ&oh=00_Afjl_zb6-jBCzUI8JZ1RneXPI_gFdXU2LUqFJ8eelM8LrQ&oe=6931263C;🚧 Osman Kavuncu Bulvarı’ndaki katlı kavşak çalışmaları hızlı şekilde ilerlemektedir.  🛠️ Bu çalışmalar kapsamında raylı sistem güzergâhındaki bölüm tamamlanana kadar, Osman Kavuncu – Yeni Sanayi DSİ istasyonları arasında otobüslerle aktarma yapılacaktır.  🚍➡️🚈 Organize Sanayi veya Şehir Hastanesi yönüne gidecek yolcularımız: 	•	Osman Kavuncu İstasyonu’nda inerek ücretsiz aktarma otobüslerini kullanabilir. 	•	DSİ İstasyonu’ndan ise raylı sistem araçlarıyla yolculuklarına devam edebilirler.  🚈➡️🚍 Düvenönü ve Cumhuriyet Meydanı istikametine gidecek yolcularımız: 	•	DSİ İstasyonu’nda inerek ücretsiz aktarma otobüslerini kullanabilir. 	•	Osman Kavuncu İstasyonu’ndan raylı sistem araçlarıyla yolculuklarına devam edebilirler.  📍 Lütfen istasyonlarda ve aktarma noktalarında yapılan yönlendirmeleri takip ediniz.  🙏 Anlayışınız için teşekkür eder, 🚋 İyi yolculuklar dileriz.;;0
https://www.instagram.com/p/DRZCeE3DY4x/;Reels;314;16;21580;2025-11-23 10:51:40;https://scontent.cdninstagram.com/v/t51.71878-15/587287082_2062193787930755_5628609833907139531_n.jpg?stp=dst-jpg_e15_tt6&_nc_cat=101&ig_cache_key=Mzc3MjA1NzAyNTc5NTQyNzg4OQ%3D%3D.3-ccb7-5&ccb=7-5&_nc_sid=58cdad&efg=eyJ2ZW5jb2RlX3RhZyI6InhwaWRzLjY0MHgxMTM2LnNkci5DMyJ9&_nc_ohc=cyWcokdmbfEQ7kNvwHRtoCj&_nc_oc=Adm2t3UnmHVvFmVioTAE7x0ORR-3cve5xBl09dNIP2U9LLVOK-JBijYpihtpHoVJDTM&_nc_ad=z-m&_nc_cid=0&_nc_zt=23&_nc_ht=scontent.cdninstagram.com&_nc_gid=1iRu4vRzV0nM25AhWusVCQ&oh=00_AfhQuLH9f4lOCaoCLEnRT3ZM6RsLKg9XXxFjMaw2BoyyFw&oe=6930FB5A;Suriçi Camikebir Kentsel Dönüşüm Projemizde ilk etap için resmî süreci başlattık. Tarihi kent merkezimizi yeniden ayağa kaldıracak bu önemli proje için tüm hazırlıklarımızı tamamladık.   Bu süreçte kimseyi mağdur etmeden, her aşamada hemşehrilerimizi bilgilendiriyoruz. Ayrıca projemizin KentFest 2025’te “En İyi Tarihi Alan Dönüşümü” ödülünü alması, doğru yolda olduğumuzun en güzel göstergesi çok şükür.   Güçlü bir şekilde ilerliyoruz. Kayseri’mizin kalbini birlikte güzelleştireceğiz. 💛  #HerŞeyKayseriİçin;;0
https://www.instagram.com/p/DRY2LMbCG16/;Photo;85;1;0;2025-11-23 09:03:33;https://scontent.cdninstagram.com/v/t51.82787-15/586677877_18548855506001303_1708782081869417638_n.jpg?stp=dst-jpg_e35_tt6&_nc_cat=109&ig_cache_key=Mzc3MjAwMjk1MTY4NzA3MzE0Ng%3D%3D.3-ccb7-5&ccb=7-5&_nc_sid=58cdad&efg=eyJ2ZW5jb2RlX3RhZyI6InhwaWRzLjE0NDB4MTkyMC5zZHIuQzMifQ%3D%3D&_nc_ohc=5TPPkqVerRYQ7kNvwH-hzGL&_nc_oc=AdmBmGTJz-oYmdG-saeoSyr4Ij8CXsFTPlxCo9Y9FIiRvpLTra7Rp2OC8TV-QYlXDcU&_nc_ad=z-m&_nc_cid=0&_nc_zt=23&_nc_ht=scontent.cdninstagram.com&_nc_gid=1iRu4vRzV0nM25AhWusVCQ&oh=00_Afhqy3g38iB7yPSzixoTP2dNtVNpRa-Xxem9efz00ntM2Q&oe=6931096C;Bugün saat 16.00’da Kadir Has Spor Salonu’nda Melikgazi Kayseri Basketbol’umuz, Nesibe Aydın Gençlik ve Spor Kulübü ile önemli bir mücadeleye çıkıyor. 🏀  Tüm hemşehrilerimizi takımımıza destek olmaya, salonun coşkusunu birlikte büyütmeye davet ediyorum. ❤️💛;;0
https://www.instagram.com/p/DRXYpLyjfL1/;Reels;232;9;19459;2025-11-22 19:27:41;https://scontent.cdninstagram.com/v/t51.71878-15/587271448_694641883703756_7346764396864848364_n.jpg?stp=dst-jpg_e15_tt6&_nc_cat=110&ig_cache_key=Mzc3MTU5MTU5NjIyMDIxNjA1Mw%3D%3D.3-ccb7-5&ccb=7-5&_nc_sid=58cdad&efg=eyJ2ZW5jb2RlX3RhZyI6InhwaWRzLjY0MHgxMTM2LnNkci5DMyJ9&_nc_ohc=DSujg0gHA60Q7kNvwH7e6J2&_nc_oc=AdkrFVKHZodgTvPIfB7J-lAjoaXJl949Vh2RzyCvyNFV6C3hYdGeqZpoqHqhGvs-4QI&_nc_ad=z-m&_nc_cid=0&_nc_zt=23&_nc_ht=scontent.cdninstagram.com&_nc_gid=1iRu4vRzV0nM25AhWusVCQ&oh=00_AfisiAQLbbjxF-DPTKSaCw5eyYTcwE7lfe2z5B2FwmkAnw&oe=6931228A;KAYMEK’imizin kıymetli öğretmenleri ve 25 özel öğrencimiz, Sevgi Evleri’nde yaşayan çocuklarımız için ilmek ilmek atkılar ördüler. Her birinin gözlerindeki heyecan, kalplerindeki merhamet..   İşte bizim için asıl değer bu.   Emeği geçen tüm yavrularımızın alınlarından öpüyor, öğretmenlerimize ve tüm ekip arkadaşlarımıza gönülden teşekkür ediyorum.  Biz büyük bir aileyiz. ❤️  📍Besime Özderici Engelsiz Yaşam Merkezi;;0
https://www.instagram.com/p/DRXLoEMjYia/;Photo;164;0;0;2025-11-22 17:32:31;https://scontent.cdninstagram.com/v/t51.82787-15/587799290_18548739658001303_8902279383566218989_n.jpg?stp=dst-jpg_e35_tt6&_nc_cat=102&ig_cache_key=Mzc3MTUzNDM0NDc0MjM0MDc2Mg%3D%3D.3-ccb7-5&ccb=7-5&_nc_sid=58cdad&efg=eyJ2ZW5jb2RlX3RhZyI6InhwaWRzLjE0NDB4OTYwLnNkci5DMyJ9&_nc_ohc=Mb02xrx9N9MQ7kNvwH1ykML&_nc_oc=AdkN1_Qfcg0hE9iyoHLcM1dJvR1KwREfJRFv4MibnP2JvtwAuFuGOFOrPE0-JMgD-EI&_nc_ad=z-m&_nc_cid=0&_nc_zt=23&_nc_ht=scontent.cdninstagram.com&_nc_gid=1iRu4vRzV0nM25AhWusVCQ&oh=00_AfgxAIs7C_NquxHMertdIC29-SkjTUCqw7_8-ApsETjXTQ&oe=69312980;Kayseri Forum AVM’de kapılarını açan İlvi Mağazası’nın açılışına katıldık. Şehrimize değer katacak her yeni girişimde olduğu gibi, bu güzel başlangıçta da hemşehrilerimizle birlikte olmaktan büyük memnuniyet duydum.   Hayırlı, bereketli ve bol kazançlı olsun.;;0
https://www.instagram.com/p/DRXLdsqjQIA/;Carousel;275;1;0;2025-11-22 17:31:06;https://scontent.cdninstagram.com/v/t51.82787-15/587946392_18548739454001303_8069252750890834126_n.jpg?stp=dst-jpg_e35_tt6&_nc_cat=105&ig_cache_key=Mzc3MTUzMzYyNDMwMzQ4ODMzOQ%3D%3D.3-ccb7-5&ccb=7-5&_nc_sid=58cdad&efg=eyJ2ZW5jb2RlX3RhZyI6InhwaWRzLjcyMHg1NDAuc2RyLkMzIn0%3D&_nc_ohc=9thK0q71xO4Q7kNvwGMjKLC&_nc_oc=AdmPPg2aGXb3RV9TP4iKqqOdSk7ikPGeSNDKja3pLI8DCL3Oik3v-CAzNnU-MPsk3hY&_nc_ad=z-m&_nc_cid=0&_nc_zt=23&_nc_ht=scontent.cdninstagram.com&_nc_gid=1iRu4vRzV0nM25AhWusVCQ&oh=00_AfgjTPb92clU0zIy_rTz0KxbfPtlex4YK5l4BhRde6KtFg&oe=69311810;Talas Kiçiköy Mahallemizde hizmet verecek olan Cemil Baba Pide Fırını’nın açılışını gerçekleştirdik. Bol kazanç diliyorum. Hayırlı, uğurlu olsun.;;0
