PostLink;PostTürü;BeğeniSayısı;YorumSayısı;Görüntülenme Sayısı;Tarih;DisplayPhoto;Caption;Takipçi;TahminMi
https://www.instagram.com/p/DRB7o8XjfiZ/;Carousel;1030;8;0;2025-11-14 11:28:46;https://scontent-atl3-1.cdninstagram.com/v/t51.82787-15/583663425_18547456924001303_3512429431138065825_n.jpg?stp=dst-jpg_e35_tt6&_nc_cat=100&ig_cache_key=Mzc2NTU1MzA1MDkyOTY2NDQ0Nw%3D%3D.3-ccb7-5&ccb=7-5&_nc_sid=58cdad&efg=eyJ2ZW5jb2RlX3RhZyI6InhwaWRzLjE0NDB4OTYwLnNkci5DMyJ9&_nc_ohc=Clx2adllPgEQ7kNvwG7IUdX&_nc_oc=AdnT_4cLwjyFiXtQNQ07DmnL0H0sRx3-VkhzniQ4neC25I8dA5lr4G4VrjSPqoxTeE1e2KWetk2h05Zuo0-9usPq&_nc_ad=z-m&_nc_cid=0&_nc_zt=23&_nc_ht=scontent-atl3-1.cdninstagram.com&_nc_gid=nYPetRf0Qc859OCKkWF1vA&oh=00_Afihl_20N_M1m9FWpFwiwtJvs9pGASSM5ghUC1IjLfPCoA&oe=6930FA58;Gürcistan’da yaşanan elim kazada şehadete eren Hava Pilot Binbaşı Nihat İlgen ve Hava Uçak Bakım Astsubay Başçavuş Burak Özkan’ın naaşlarını havaalanında karşılayarak, şehidimiz Burak Özkan’ı memleketi Niğde’ye uğurladık.  Kahramanlarımızdan Nihat İlgen’in cenaze namazı, Cuma namazını müteakip Kalemkırdı Camii’nde kılınacak olup, şehidimizi dualarla ebediyete tevdi edeceğiz.;;0
https://www.instagram.com/p/DRB3BWRjb_L/;Photo;126;0;0;2025-11-14 10:48:25;https://scontent-atl3-1.cdninstagram.com/v/t51.82787-15/581733249_18547453597001303_2073620439174316368_n.jpg?stp=dst-jpg_e35_tt6&_nc_cat=106&ig_cache_key=Mzc2NTUzMjc0ODY1Mjg1NTI0Mw%3D%3D.3-ccb7-5&ccb=7-5&_nc_sid=58cdad&efg=eyJ2ZW5jb2RlX3RhZyI6InhwaWRzLjE0NDB4MTkyMC5zZHIuQzMifQ%3D%3D&_nc_ohc=MbKgdhoxVgQQ7kNvwEMchi7&_nc_oc=AdkLiTY1vNlVGhmh5iGdLU_BKfsbbu9pGwgs9modywJEWJX0dGKHx2hqAaoEISa7U-4DqDngrSqGYWJK_xTSpef2&_nc_ad=z-m&_nc_cid=0&_nc_zt=23&_nc_ht=scontent-atl3-1.cdninstagram.com&_nc_gid=nYPetRf0Qc859OCKkWF1vA&oh=00_Afhki-Ff6cg_1yJomjXQVm8QMopLkQB0-rUtcUVu7GnySA&oe=6930FCF3;14 Kasım 1944 Ahıska Türkleri Sürgünü’nde vatanlarından koparılan, büyük acılar yaşayan kardeşlerimizin hatırası milletimizin hafızasında yaşıyor.   Bu zulmü unutmadık, unutturmayacağız. Ruhları şad olsun.;;0
https://www.instagram.com/p/DQ9KtMiDYZ6/;Carousel;1228;12;0;2025-11-12 15:04:13;https://scontent-atl3-3.cdninstagram.com/v/t51.82787-15/580577933_18546591898001303_6293918570442553249_n.jpg?stp=dst-jpg_e35_tt6&_nc_cat=111&ig_cache_key=Mzc2NDIxMTk0MjAzOTU4NTEwNg%3D%3D.3-ccb7-5&ccb=7-5&_nc_sid=58cdad&efg=eyJ2ZW5jb2RlX3RhZyI6InhwaWRzLjg2M3g0NjUuc2RyLkMzIn0%3D&_nc_ohc=8o0QrRBHhVMQ7kNvwHwzxCS&_nc_oc=AdmVj9kig3K8CEnmAY1FrmmisaEwWZs8Z2WmZTRAr8cjR4pCopfX-nvCVR7I3BQl7sS-nMz8jtGI0h6RbxH0n6tI&_nc_ad=z-m&_nc_cid=0&_nc_zt=23&_nc_ht=scontent-atl3-3.cdninstagram.com&_nc_gid=nYPetRf0Qc859OCKkWF1vA&oh=00_AfgZcjf63HUUeiBj84EJGYA0A1zJk75-taQ-FzDOc47xnQ&oe=69310EA9;📍Ankara   175. AK Parti Genişletilmiş İl Başkanları Toplantısı’nda Cumhurbaşkanımız Sayın Recep Tayyip Erdoğan’ın hitaplarını dinliyoruz.;;0
https://www.instagram.com/p/DQ9FTvkjVek/;Carousel;481;5;0;2025-11-12 14:17:04;https://scontent-atl3-3.cdninstagram.com/v/t51.82787-15/581103025_18546587197001303_1538437295234278763_n.jpg?stp=dst-jpg_e35_tt6&_nc_cat=109&ig_cache_key=Mzc2NDE4ODIwMzQwMzA0MTYzOA%3D%3D.3-ccb7-5&ccb=7-5&_nc_sid=58cdad&efg=eyJ2ZW5jb2RlX3RhZyI6InhwaWRzLjE0NDB4OTYxLnNkci5DMyJ9&_nc_ohc=QN3WwzTwcpgQ7kNvwFxwbxS&_nc_oc=Adm4ZCkNsEipcNQ8o8DMOb2UQ6tn30VBL44oDLFd351-9QQPq3-k56-uSJX8n0vf2xROI7Z0pZfl86I-gfwFmkkS&_nc_ad=z-m&_nc_cid=0&_nc_zt=23&_nc_ht=scontent-atl3-3.cdninstagram.com&_nc_gid=nYPetRf0Qc859OCKkWF1vA&oh=00_AfgX13sSJq8wm8HgQw7lpPjA2sDV39FGcln1qDDq9K6heA&oe=69312721;📍Ankara   Çevre, Şehircilik ve İklim Değişikliği Bakanımız Sayın Murat Kurum’u, bürokratlarımızla birlikte ziyaret ettik. Bakanlığımızın çalışma alanına giren konular ve şehrimizde yürüttüğümüz çevre, kentsel dönüşüm, altyapı ve iklim dostu projelerle ilgili kapsamlı ve verimli bir görüşme gerçekleştirdik.  Kayseri’nin gelişimi ve sürdürülebilir geleceği adına yürüttüğümüz çalışmalarımıza verdikleri destek, ilgi ve katkılarından dolayı Sayın Bakanımıza şükranlarımı sunuyorum.;;0
https://www.instagram.com/p/DQ81IrEDc0p/;Carousel;244;3;0;2025-11-12 11:55:44;https://scontent-atl3-3.cdninstagram.com/v/t51.82787-15/580996149_18546526930001303_6122101189593935358_n.jpg?stp=dst-jpg_e35_tt6&_nc_cat=107&ig_cache_key=Mzc2NDExNzA3MDcxNjcwMDk4NA%3D%3D.3-ccb7-5&ccb=7-5&_nc_sid=58cdad&efg=eyJ2ZW5jb2RlX3RhZyI6InhwaWRzLjQ1OXgzNDQuc2RyLkMzIn0%3D&_nc_ohc=8GYjuZ_Vq5EQ7kNvwHp-sgl&_nc_oc=AdnsohyWFv2Wxt_4WlSiTp1LWbPG6i86Z44jpBMkBZzNQNDQ-Yedk4s39AvC3L8rlBFRGjKKjqydP0WGYvsKL_bJ&_nc_ad=z-m&_nc_cid=0&_nc_zt=23&_nc_ht=scontent-atl3-3.cdninstagram.com&_nc_gid=nYPetRf0Qc859OCKkWF1vA&oh=00_AfgsDaLDDq6VVgoKBU7p6sDCKuPonis7CWY1BpmfIw3mpg&oe=69310CD6;Şehitlerimizin ruhları şâd, mekanları cennet, makamları ali olsun.  Aziz milletimizin başı sağ olsun. 🇹🇷;;0
https://www.instagram.com/p/DQ8yCUkDZxf/;Photo;133;0;0;2025-11-12 11:28:39;https://scontent-atl3-2.cdninstagram.com/v/t51.82787-15/581001467_18546510595001303_1205478092976912764_n.jpg?stp=dst-jpg_e35_tt6&_nc_cat=102&ig_cache_key=Mzc2NDEwMzQ1MDQxOTEwODk1OQ%3D%3D.3-ccb7-5&ccb=7-5&_nc_sid=58cdad&efg=eyJ2ZW5jb2RlX3RhZyI6InhwaWRzLjE0NDB4MTkyMC5zZHIuQzMifQ%3D%3D&_nc_ohc=Lir0qugyTlUQ7kNvwEIHCmS&_nc_oc=Adk3eMDhQd6J40S95277UHmqGJyhOTL9lfwFDgd4M2NiqE7arXvSOeru0XHUqQu9ZqxRruANTrnKD6ixT7m0ErTj&_nc_ad=z-m&_nc_cid=0&_nc_zt=23&_nc_ht=scontent-atl3-2.cdninstagram.com&_nc_gid=nYPetRf0Qc859OCKkWF1vA&oh=00_AfgJOBbveSCSxfP9I7gDY0-9457pIOHPPV-a9lf3oWHOxA&oe=693116AC;Düzce Depremi’nin yıl dönümünde yaşamını yitiren kardeşlerimizi rahmetle anıyorum.   Allah aziz milletimizi, güzel ülkemizi her türlü afetten korusun.;;0
https://www.instagram.com/p/DQ6245Tjcem/;Photo;1866;20;0;2025-11-11 17:32:35;https://scontent-atl3-2.cdninstagram.com/v/t51.82787-15/579890002_18546181636001303_2278855400591409779_n.jpg?stp=dst-jpg_e35_tt6&_nc_cat=104&ig_cache_key=Mzc2MzU2MTg0Mjk1NTExMDMxMA%3D%3D.3-ccb7-5&ccb=7-5&_nc_sid=58cdad&efg=eyJ2ZW5jb2RlX3RhZyI6InhwaWRzLjE0NDB4MTg3MS5zZHIuQzMifQ%3D%3D&_nc_ohc=2buCygRrFN0Q7kNvwGXmf0P&_nc_oc=AdktWZbpS1UUwkI7bh_PAnWqxSHDj7U1Alo5CCer7Qo0G4jgIYCsweV_NnUYcduIdV5hu8ALJQZX5LtVREbEuvd0&_nc_ad=z-m&_nc_cid=0&_nc_zt=23&_nc_ht=scontent-atl3-2.cdninstagram.com&_nc_gid=nYPetRf0Qc859OCKkWF1vA&oh=00_Afh1rdt-HKmDx1tVR9LfUmuUuyjfDcWN789FuCTdHSq5Tg&oe=6931224F;Cumhurbaşkanımız Sayın Recep Tayyip Erdoğan’ın liderliğinde şehrimiz için hizmet yolunda aşkla ve şevkle çalışmaya devam ediyoruz.  Her daim bizlere ilham veren vizyonları ve güçlü liderlikleriyle yolumuzu aydınlatan ve tüm Kayserililere selamlarını ileten Sayın Cumhurbaşkanımıza şükranlarımı sunuyorum.;;0
https://www.instagram.com/p/DQ61hPWjYEv/;Carousel;201;2;0;2025-11-11 17:20:37;https://scontent-atl3-2.cdninstagram.com/v/t51.82787-15/579685953_18546179623001303_1528562473366670981_n.jpg?stp=dst-jpg_e35_tt6&_nc_cat=105&ig_cache_key=Mzc2MzU1NTgxNDA1NDE0MzMwMA%3D%3D.3-ccb7-5&ccb=7-5&_nc_sid=58cdad&efg=eyJ2ZW5jb2RlX3RhZyI6InhwaWRzLjE0MDF4OTU5LnNkci5DMyJ9&_nc_ohc=6aPfU-F9UcoQ7kNvwErYZbi&_nc_oc=Adlx3QjZdpWOoSenitdKunkCtpNu4qBIJRd4Eh0zNQ6q4Nzh17Yp8wp_hZN7-OECy2p_1CGeumv_ZmofkNrBcAtP&_nc_ad=z-m&_nc_cid=0&_nc_zt=23&_nc_ht=scontent-atl3-2.cdninstagram.com&_nc_gid=nYPetRf0Qc859OCKkWF1vA&oh=00_AfiyTrbr5Vk4Ai1XwQwWdRsSsM37_oDpQbJTiTzgVcEzjA&oe=6931241C;Cumhurbaşkanımız ve AK Parti Genel Başkanımız Sayın Recep Tayyip Erdoğan’ın liderliğinde, şehirlerimizi medeniyetimizin izleriyle geleceğe taşıyacak adımlar atmaya devam ediyoruz.  “Medeniyetimizde Şehir ve Mekân” temalı Şehircilik Zirvesi ve Kentkırım Sergisine katılarak, Cumhurbaşkanımız Sayın Recep Tayyip Erdoğan’ın koyduğu vizyonla çevre ve şehircilik politikalarımızı geliştirerek şehirlerimizi geleceğe hazırlayacak projelerimizi bu zirveden elde ettiğimiz tecrübeler ışığında hayata geçireceğiz.  AK Partimizin hizmet belediyeciliği anlayışıyla şehirlerimizi modern yarınlara taşımaya devam edeceğiz.;;0
https://www.instagram.com/p/DQ6yozxjcX9/;Photo;141;2;0;2025-11-11 16:55:26;https://scontent-atl3-3.cdninstagram.com/v/t51.82787-15/579705388_18546176209001303_7043207075982638426_n.jpg?stp=dst-jpg_e35_tt6&_nc_cat=108&ig_cache_key=Mzc2MzU0MzE0NTMxODMwMzIyOQ%3D%3D.3-ccb7-5&ccb=7-5&_nc_sid=58cdad&efg=eyJ2ZW5jb2RlX3RhZyI6InhwaWRzLjExNzF4NjEzLnNkci5DMyJ9&_nc_ohc=5g8U6G1AJOcQ7kNvwGFoVjN&_nc_oc=Adm4srYTP20qO6RTGOOQrWAWs2QcyZCiWiLSUVIJB8apEH5zBf_ENeWDVttPW9L5tpg0mpYsmPQLOn1P9wYpsTUM&_nc_ad=z-m&_nc_cid=0&_nc_zt=23&_nc_ht=scontent-atl3-3.cdninstagram.com&_nc_gid=nYPetRf0Qc859OCKkWF1vA&oh=00_AfjEorGx4wZfA99220vm5scvTls_juFfEKeOwJz5zuRvvw&oe=6930FE03;Azerbaycan’dan ülkemize gelmekte olan Milli Savunma Bakanlığımıza ait C130 askeri kargo uçağımızın Gürcistan-Azerbaycan sınırında düştüğü haberini büyük bir üzüntüyle öğrendik.   Yaşanan kazada şehadete eren askerlerimize Allah’tan rahmet diliyorum. Milletimizin başı sağ olsun. 🇹🇷🇹🇷;;0
https://www.instagram.com/p/DQ6aV9WjRY9/;Carousel;402;14;0;2025-11-11 13:23:08;https://scontent-atl3-2.cdninstagram.com/v/t51.82787-15/581209697_18546151669001303_5605609878081583210_n.jpg?stp=dst-jpg_e35_tt6&_nc_cat=105&ig_cache_key=Mzc2MzQzNjI4MTY4MzM2NjIwMw%3D%3D.3-ccb7-5&ccb=7-5&_nc_sid=58cdad&efg=eyJ2ZW5jb2RlX3RhZyI6InhwaWRzLjE0NDB4MTA5My5zZHIuQzMifQ%3D%3D&_nc_ohc=73uWDaS1LfwQ7kNvwEmM1xv&_nc_oc=AdnI3hGjk-_2gYxtozIa1CC-GxkHq7OAX0jnaetJux2ez1avmppX5BFc4aRzA3IwxB_0uaQf1iuRt1rpr5fOn4gc&_nc_ad=z-m&_nc_cid=0&_nc_zt=23&_nc_ht=scontent-atl3-2.cdninstagram.com&_nc_gid=nYPetRf0Qc859OCKkWF1vA&oh=00_AfiWgZpzwOAEQIRfK7X34dK0ZeYYl65xeXlA_nXEmcqFsw&oe=69311986;“Yeşil Vatan” sadece bir slogandan ibaret değil. Adeta topyekün bir kurtuluş mücadelesidir. Bu amaçla  Cumhurbaşkanımız Sayın Recep Tayyip Erdoğan’ın himayesinde gerçekleştirilen Milli Ağaçlandırma Günü’nde bir seferberlik emri gibi Türkiye’nin dört bir yanını yemyeşil yapmak için büyük bir mücadelenin içerisindeyiz.   Kayserimizde de her yıl yüzbinlerce ağacı toprakla buluşturuyoruz. Bugün de muhteşem doğasıyla Bayramhacı Mahallemizde Kızılırmak’ın suyunu yeşille buluşturduk.  Yeşili korumak ve yetiştirmek vatanı korumak kadar önemli. Lütfen geleceğimiz için yeşilimize sahip çıkalım ve doğayı koruyalım. 💚🌲;;0
https://www.instagram.com/p/DQ6PAJujfoe/;Photo;315;27;0;2025-11-11 11:44:03;https://scontent-muc2-1.cdninstagram.com/v/t51.82787-15/579837595_18546126814001303_4625132659924309577_n.jpg?stp=dst-jpg_e35_tt6&_nc_cat=101&ig_cache_key=Mzc2MzM4NjQxOTc2Mzg3MDIzOA%3D%3D.3-ccb7-5&ccb=7-5&_nc_sid=58cdad&efg=eyJ2ZW5jb2RlX3RhZyI6InhwaWRzLjE0NDB4MTkyMC5zZHIuQzMifQ%3D%3D&_nc_ohc=rs7Jges6W-sQ7kNvwF1mC-t&_nc_oc=AdmEKWqCuIM-Fxw4cZqFyn0vR_MxjawZZBTSl9RUqMvF4m5E8tH6qTJ5hpUC1w7TPI9s3bRMdr6w_h1orZcTJA8G&_nc_ad=z-m&_nc_cid=0&_nc_zt=23&_nc_ht=scontent-muc2-1.cdninstagram.com&_nc_gid=t5BF__W_yaMMGONeXQeC5w&oh=00_Afh-e9qrA95iZfHGaZdPAwyIYUpSHH5pypR8evc6-c5o8w&oe=69310A80;"Kayseri’mizin gözbebeği Erciyes Kayak Merkezi, dünyaca ünlü dergilerden Snow Magazine tarafından “Dünyanın En İyi 25 Kayak Merkezi” arasında gösterildi. 🌍❄️  Bu başarı, tesadüf değil; vizyon, emek ve planlı bir çalışmanın sonucu.  Kayseri Büyükşehir Belediyesi olarak yıllar önce hayalini kurduğumuz Erciyes Master Planı, bugün uluslararası arenada karşılığını buldu.  Erciyes artık sadece Türkiye’nin değil, dünyanın sayılı kayak merkezlerinden biri.⛷️ Bu gurur Kayseri’mizin, bu başarı hepimizin. 💙  #HerŞeyKayseriİçin";;0
https://www.instagram.com/p/DQ56J4GjECB/;Reels;164;6;14535;2025-11-11 08:42:58;https://scontent-muc2-1.cdninstagram.com/v/t51.71878-15/580577896_1559352825059277_9165371571355233660_n.jpg?stp=dst-jpg_e15_tt6&_nc_cat=103&ig_cache_key=Mzc2MzI5NDcyOTA1NzA5MTcxMw%3D%3D.3-ccb7-5&ccb=7-5&_nc_sid=58cdad&efg=eyJ2ZW5jb2RlX3RhZyI6InhwaWRzLjY0MHgxMTM2LnNkci5DMyJ9&_nc_ohc=T2jlHJhLBLkQ7kNvwHbLvBf&_nc_oc=Admyfmv5e5qGwsf6JzRk_-V_5BvdkaoQuC9pNDm6ZDMIiRL9mdWOeSpMssFlLgzwP0wX0LOevtCWWoEaFhMoUTpj&_nc_ad=z-m&_nc_cid=0&_nc_zt=23&_nc_ht=scontent-muc2-1.cdninstagram.com&_nc_gid=t5BF__W_yaMMGONeXQeC5w&oh=00_Afj31M6cyOefC9lOXiuo60flhF6sE3i9ruN-yjlwrfaeqg&oe=693118F9;Şahidimiz toprak, imzamız fidan, sevdamız vatan 🇹🇷☘️  Cumhurbaşkanımız Sayın Recep Tayyip Erdoğan’ın himayelerinde başlatılan “Geleceğe Nefes ve Yeşil Vatan Seferberliği” ile ülkemizin dört bir yanında ağaçlar dikiyor, yeşilin mirasını gelecek nesillere taşıyoruz. Ne yapıyorsak güzel ülkemiz için, güzel Kayseri’miz için.   11 Kasım Milli Ağaçlandırma Günümüz kutlu olsun. 💚  #GeleceğeNefes #YeşilVatanSeferberliği #HerŞeyKayseriİçin;;0
https://www.instagram.com/p/DQ4fyzPDfjS/;Reels;257;8;17227;2025-11-10 19:36:24;https://scontent-muc2-1.cdninstagram.com/v/t51.71878-15/580994434_1196714345761285_3837555652237692850_n.jpg?stp=dst-jpg_e15_tt6&_nc_cat=107&ig_cache_key=Mzc2Mjg5NzMxOTA5NzEzNzM2Mg%3D%3D.3-ccb7-5&ccb=7-5&_nc_sid=58cdad&efg=eyJ2ZW5jb2RlX3RhZyI6InhwaWRzLjY0MHgzNjAuc2RyLkMzIn0%3D&_nc_ohc=4zFo89t2XToQ7kNvwEMpG3Q&_nc_oc=AdmzSQ8Ql_9jzk-lqjmSWpwORZ1tcUnY5c7DWGSdGR9Ds5UY8r3bAKQsSYCP6APtMTJh3Kp1-NF9CfbYt_6_y_7n&_nc_ad=z-m&_nc_cid=0&_nc_zt=23&_nc_ht=scontent-muc2-1.cdninstagram.com&_nc_gid=t5BF__W_yaMMGONeXQeC5w&oh=00_AfjJcFVVgFVQZbCEy1QwQdZj5g6CKna8deQeYwii7cq84w&oe=6930FAA6;KASKİ’mizin gayretli ve özverili çalışmaları sayesinde, içme suyu kalitesinde Türkiye’nin önde gelen illerinden biri olmanın gururunu yaşıyoruz.  30 Büyükşehir Belediyesi arasında   💧 Meskende en uygun fiyatla su hizmeti sunan 4️⃣.  💧 İş yerinde ise 3️⃣. belediye olarak, hemşehrilerimize kaliteli suyu en ekonomik şekilde ulaştırıyoruz.   Ayrıca KASKİ’miz aracılığıyla ilçelerimize yönelik yatırımlarımızı da aralıksız sürdürüyoruz.  Yaptığımız tüm çalışmaların yanı sıra suyun önemini tüm hemşehrilerime tekrardan hatırlatmak istiyor ve israftan kaçınalım diyorum. ‼️;;0
https://www.instagram.com/p/DQ4bcIeCGDQ/;Reels;1228;19;102444;2025-11-10 19:12:12;https://scontent-muc2-1.cdninstagram.com/v/t51.71878-15/580045472_2177143716105719_2920269132525788721_n.jpg?stp=dst-jpg_e15_tt6&_nc_cat=101&ig_cache_key=Mzc2Mjg3ODE2OTE2Mjk5Nzk2OA%3D%3D.3-ccb7-5&ccb=7-5&_nc_sid=58cdad&efg=eyJ2ZW5jb2RlX3RhZyI6InhwaWRzLjY0MHgxMTM2LnNkci5DMyJ9&_nc_ohc=61sLh22zQmUQ7kNvwH711jM&_nc_oc=AdlXX2j6SmKRZCwNAMGM--FG6ziOBNBsd5onDA22tajxhPdudYB99047fjjXhqUg0izg0pIyDidtWSR60N59jexN&_nc_ad=z-m&_nc_cid=0&_nc_zt=23&_nc_ht=scontent-muc2-1.cdninstagram.com&_nc_gid=t5BF__W_yaMMGONeXQeC5w&oh=00_Afhhn0NXMSrBgyfjVaH43uEz_T7SfRP0bY-osG9VEvxcMw&oe=693106BC;⚽ Cumhuriyet Meydanı’nda Sürpriz Gol Zamanı!  Hiç beklemediğin bir anda karşına biz çıkabiliriz! 😄 Top bir anda önünde, kalabalık arkanda, herkes seni izliyor… O an tek bir şey söylüyoruz: “Görelim bakalım, nasıl bir vuruş geliyor!” 🎯  Kayseri Cumhuriyet Meydanı’nda yaptığımız sürpriz etkinlikle hem şaşırttık hem de yüzlere kocaman bir gülümseme kondurduk. Kimisi profesyonel gibiydi, kimisi topu görünce kaçtı ama herkes çok eğlendi! ⚽💥  Sporun enerjisi her yerde, her an karşınıza çıkabilir! 😉 Peki, bir sonraki durağımız neresi olsun? Yorumlara yazın, belki bir sonraki sürpriz sizin mahallenizde olur! 🙌  #yazseninlegüzel;;0
https://www.instagram.com/p/DQ4XCUhDS4o/;Reels;340;12;22057;2025-11-10 18:16:56;https://scontent-muc2-1.cdninstagram.com/v/t51.71878-15/580118687_1878805192844601_4170921488180424553_n.jpg?stp=dst-jpg_e15_tt6&_nc_cat=111&ig_cache_key=Mzc2Mjg1ODgwMzIwNjEwNjY2NA%3D%3D.3-ccb7-5&ccb=7-5&_nc_sid=58cdad&efg=eyJ2ZW5jb2RlX3RhZyI6InhwaWRzLjY0MHgzNTQuc2RyLkMzIn0%3D&_nc_ohc=A6TCScEvHV0Q7kNvwHoxksq&_nc_oc=AdlH6sBkv87Oe_f84VZmHVKS9x8nEQIy9vTiLMS_cyn1u2YqRZ8KNHSBwfH_eOYrr373O4RZWCbVgVeoSRuc10qw&_nc_ad=z-m&_nc_cid=0&_nc_zt=23&_nc_ht=scontent-muc2-1.cdninstagram.com&_nc_gid=t5BF__W_yaMMGONeXQeC5w&oh=00_AfiPW6K7xM8MSJRTyQ_kMlt_MZvJFczBLi614JvnkjV-8w&oe=69311B01;Kayseri Büyükşehir Belediyesi İtfaiye Dalış Ekibimiz, 10 Kasım Atatürk’ü Anma Günü vesilesiyle Yamula Barajı Kuşçu Marina bölgesinde anlamlı bir dalış gerçekleştirdi.  Gazi Mustafa Kemal Atatürk’ü aramızdan ayrılışının 87. yıldönümünde bir kez daha saygı ve rahmetle yad ediyoruz. Ruhun şad olsun.;;0
https://www.instagram.com/p/DQ4MqLgDbCU/;Carousel;312;9;0;2025-11-10 16:45:05;https://scontent-muc2-1.cdninstagram.com/v/t51.82787-15/580506352_18545836168001303_296214441672591675_n.jpg?stp=dst-jpg_e35_tt6&_nc_cat=102&ig_cache_key=Mzc2MjgxMzE1NDc1MDIxOTY1Nw%3D%3D.3-ccb7-5&ccb=7-5&_nc_sid=58cdad&efg=eyJ2ZW5jb2RlX3RhZyI6InhwaWRzLjEwNjZ4NzEwLnNkci5DMyJ9&_nc_ohc=IBERLgZkyo0Q7kNvwEXzK0M&_nc_oc=AdlDTHxvNbj-ZbK0ef3mpaddyRiix7JYRYYmW8xBG1LTaCCFwV8RSIoVo7t9VZNhPXPXtsPmWNdQYOg0xS120SJN&_nc_ad=z-m&_nc_cid=0&_nc_zt=23&_nc_ht=scontent-muc2-1.cdninstagram.com&_nc_gid=t5BF__W_yaMMGONeXQeC5w&oh=00_AfjDz6D67Ow9b6UYtBqpyxbHfCUZOgV_vi6OdVSLqteZHg&oe=69311940;Büyükşehir Belediyesi Kasım Ayı Olağan Meclis Toplantımızı gerçekleştirerek 96 maddeyi karara bağladık. Aldığımız kararların kadim şehrimiz Kayseri’ye ve bu şehrin güzel insanlarına hayırlı olmasını diliyorum.;;0
https://www.instagram.com/p/DQ34P-5jT3l/;Carousel;184;0;0;2025-11-10 13:46:45;https://scontent-muc2-1.cdninstagram.com/v/t51.82787-15/576094983_18545811862001303_1976997062346523697_n.jpg?stp=dst-jpg_e35_tt6&_nc_cat=104&ig_cache_key=Mzc2MjcyMzM5NTM1Mjc2ODY2NQ%3D%3D.3-ccb7-5&ccb=7-5&_nc_sid=58cdad&efg=eyJ2ZW5jb2RlX3RhZyI6InhwaWRzLjE0NDB4OTYwLnNkci5DMyJ9&_nc_ohc=ptsBYRCMqkMQ7kNvwH9g6gp&_nc_oc=AdnybhAz-bAaipUjd5dpDJT_bae7Pm6Vqo0qPc1QJIkNAKFsyZFMz3b6hpAOXIEIV_73t_zS2WolVcsS6LySlXe0&_nc_ad=z-m&_nc_cid=0&_nc_zt=23&_nc_ht=scontent-muc2-1.cdninstagram.com&_nc_gid=t5BF__W_yaMMGONeXQeC5w&oh=00_Afhc5LklksWm6p1r22zsIfvbVtKGamIdjUDWs1ff1yGh5g&oe=69311523;Valimiz Sayın Gökmen Çiçek, Melikgazi Belediye Başkanımız Mustafa Palancıoğlu ve Kocasinan Belediye Başkanımız Ahmet Çolakbayrakdar ile birlikte Gürkan Büro Mobilyaları Yönetim Kurulu Başkanı ve hayırsever iş insanı Mehmet İlgü’yü ziyaret ettik. Misafirperverliği için kendisine teşekkür ediyorum.;;0
https://www.instagram.com/p/DQ30O30jRS-/;Carousel;304;9;0;2025-11-10 13:11:39;https://scontent-muc2-1.cdninstagram.com/v/t51.82787-15/576344190_18545806630001303_4022438295013870636_n.jpg?stp=dst-jpg_e35_tt6&_nc_cat=110&ig_cache_key=Mzc2MjcwNTcyNTA2ODc4NjA5OA%3D%3D.3-ccb7-5&ccb=7-5&_nc_sid=58cdad&efg=eyJ2ZW5jb2RlX3RhZyI6InhwaWRzLjE0NDB4OTYwLnNkci5DMyJ9&_nc_ohc=rEd_mR7MZukQ7kNvwHkqpQW&_nc_oc=AdkafGdu4GqOm8EhS75BbkpMdNSD-Is1xBx1GBNiAFgj6Z3lND-JXPDuhNXoWpXSaLQKeci0FyxwuuAgtH4Bf6K8&_nc_ad=z-m&_nc_cid=0&_nc_zt=23&_nc_ht=scontent-muc2-1.cdninstagram.com&_nc_gid=t5BF__W_yaMMGONeXQeC5w&oh=00_AfhqpRiL3hUoXxyeOWyOic2iX-o2cHFSkbJzmExAzO0pUw&oe=6931142A;Millet Caddesi’ndeki esnaflarımızı Valimiz Sayın Gökmen Çiçek ile birlikte selamlayarak hayırlı işler temennisinde bulunduk.;;0
https://www.instagram.com/p/DQ3ygHSjTkG/;Carousel;201;0;0;2025-11-10 12:56:31;https://scontent-muc2-1.cdninstagram.com/v/t51.82787-15/576078965_18545805046001303_4286301648464267634_n.jpg?stp=dst-jpg_e35_tt6&_nc_cat=101&ig_cache_key=Mzc2MjY5ODExNTMxNzg1Njk1OQ%3D%3D.3-ccb7-5&ccb=7-5&_nc_sid=58cdad&efg=eyJ2ZW5jb2RlX3RhZyI6InhwaWRzLjEyMDB4OTAwLnNkci5DMyJ9&_nc_ohc=RFOpeHY_tTQQ7kNvwGIw54N&_nc_oc=AdnsTY9Y6yDsKD9HQVqH3r5AtxTv8pcFOecpcSgJ118UI31vztiy3DFqhktp8mPx9eTn-_30_QgYNd4qcLzipUOe&_nc_ad=z-m&_nc_cid=0&_nc_zt=23&_nc_ht=scontent-muc2-1.cdninstagram.com&_nc_gid=t5BF__W_yaMMGONeXQeC5w&oh=00_Afimt1yXn33EPu2snLr6TAfmFIn5WC7OlNyMzZEZsL9UzQ&oe=6930FC85;Valimiz Sayın Gökmen Çiçek ile birlikte Kayseri Esnaf ve Sanatkarlar Kefalet Kooperatifi Başkanı Mustafa Alan’ı ziyaret ettik. Misafirperverliği için Mustafa Başkanımıza teşekkür ediyorum.;;0
https://www.instagram.com/p/DQ3r4YqjaxU/;Carousel;289;8;0;2025-11-10 11:58:40;https://scontent-muc2-1.cdninstagram.com/v/t51.82787-15/580354690_18545799922001303_5847780009642275261_n.jpg?stp=dst-jpg_e35_tt6&_nc_cat=104&ig_cache_key=Mzc2MjY2ODk5NTA5NTY4Njc0NQ%3D%3D.3-ccb7-5&ccb=7-5&_nc_sid=58cdad&efg=eyJ2ZW5jb2RlX3RhZyI6InhwaWRzLjE0NDB4OTYwLnNkci5DMyJ9&_nc_ohc=UbWCX17WtdUQ7kNvwHvEJ33&_nc_oc=AdnwC1G6vCu3QyqleE6JJwdZavk6aTk5GDmEL2q9PWwJAdvm4RL6jE7NnROmT9x2AzxZUIEVVezkXvqf9ivxLgpB&_nc_ad=z-m&_nc_cid=0&_nc_zt=23&_nc_ht=scontent-muc2-1.cdninstagram.com&_nc_gid=t5BF__W_yaMMGONeXQeC5w&oh=00_AfjgiRqoIfBm5lzgLSgVVp-wnPh20j-8xB6EH4F-ySvzNA&oe=69312309;Valimiz Sayın Gökmen Çiçek ile birlikte Makina Mühendisleri Odası’nı ziyaret ederek Oda Başkanımız Süleyman Varol ile bir araya geldik. Misafirperverlikleri için Oda Başkanımız Süleyman Varol’a teşekkür ediyorum.;;0
https://www.instagram.com/p/DQ3qaIdDQ7X/;Carousel;149;0;0;2025-11-10 11:45:48;https://scontent-muc2-1.cdninstagram.com/v/t51.82787-15/579885150_18545798947001303_3505641806517956809_n.jpg?stp=dst-jpg_e35_tt6&_nc_cat=101&ig_cache_key=Mzc2MjY2MjUyMTQwNTUwNTg1OA%3D%3D.3-ccb7-5&ccb=7-5&_nc_sid=58cdad&efg=eyJ2ZW5jb2RlX3RhZyI6InhwaWRzLjE0NDB4OTYwLnNkci5DMyJ9&_nc_ohc=yo7VZXG1FwEQ7kNvwFGzJU_&_nc_oc=AdmNYRuiMvsoX_zA9sJxMgwbGjqEmH1-pjB3GfRSX5BGXmEIoFuPDFkVnSDBIlFJInY7S98swSjvtUE3_FYOlKd7&_nc_ad=z-m&_nc_cid=0&_nc_zt=23&_nc_ht=scontent-muc2-1.cdninstagram.com&_nc_gid=t5BF__W_yaMMGONeXQeC5w&oh=00_Afj3LoadOwuwFTQv5H2tYdov350_LIFbgFIScpBUMIKRJQ&oe=69310C23;10 Kasım Atatürk’ü Anma Günü’nde Valimiz Sayın Gökmen Çiçek ile birlikte Atatürk Evi Müzesi’ni ziyaret ettik.;;0
https://www.instagram.com/p/DQ3maj0jV-B/;Carousel;244;0;0;2025-11-10 11:10:54;https://scontent-muc2-1.cdninstagram.com/v/t51.82787-15/580607554_18545796019001303_8139523553715625690_n.jpg?stp=dst-jpg_e35_tt6&_nc_cat=104&ig_cache_key=Mzc2MjY0NDk1Mzk2NTg5Mzk2NQ%3D%3D.3-ccb7-5&ccb=7-5&_nc_sid=58cdad&efg=eyJ2ZW5jb2RlX3RhZyI6InhwaWRzLjE0NDB4OTYwLnNkci5DMyJ9&_nc_ohc=9azu5J5sE_UQ7kNvwELMsrt&_nc_oc=AdlfKbwF7SuAXXtGYonq2xpWRHXEoaorB1FvdbiN7HnlvQFDnCo8AHvnj-kvftB-O7h7SQptE_F2m6_dV0KSogea&_nc_ad=z-m&_nc_cid=0&_nc_zt=23&_nc_ht=scontent-muc2-1.cdninstagram.com&_nc_gid=t5BF__W_yaMMGONeXQeC5w&oh=00_AfjT8bNEMrL9kkrOikOiRVvoCXhIleVQeBFS-MvKK8we8Q&oe=693114FE;10 Kasım Atatürk’ü Anma programı kapsamında Gültepe Kültür Merkezi’nde hemşehrilerimizle bir araya gelerek Cumhuriyetimizin Kurucusu Gazi Mustafa Kemal Atatürk’ü saygı ve rahmetle andık.;;0
https://www.instagram.com/p/DQ3bXqRjQvc/;Carousel;399;0;0;2025-11-10 09:34:23;https://scontent-fra3-1.cdninstagram.com/v/t51.82787-15/579837568_18545766718001303_1164830513830668268_n.jpg?stp=dst-jpg_e35_tt6&_nc_cat=105&ig_cache_key=Mzc2MjU5NjM3NTE5MzAwMzczMQ%3D%3D.3-ccb7-5&ccb=7-5&_nc_sid=58cdad&efg=eyJ2ZW5jb2RlX3RhZyI6InhwaWRzLjE0NDB4OTYwLnNkci5DMyJ9&_nc_ohc=NZv67L4Q7swQ7kNvwFp69yj&_nc_oc=AdnRgUZUOqLyNT_yxKbl4LfF_HkNxig3dAphV0FXPKf9ouqJGMnhcbaZCoCKS5QP7hVnwj8NLs4KX2F1PuNFdwnw&_nc_ad=z-m&_nc_cid=0&_nc_zt=23&_nc_ht=scontent-fra3-1.cdninstagram.com&_nc_gid=VTCEUf2ANK4lfy9E9Nn3UQ&oh=00_AfgpM56dxQHUCQm6KCBgXnlcnltC0os5o_0Bi3w9GW5qWQ&oe=69311F77;Cumhuriyetimizin kurucusu Gazi Mustafa Kemal Atatürk’ü, aramızdan ayrılışının 87. yılında Cumhuriyet Meydanı’nda düzenlenen törende saygı ve rahmetle yâd ettik.;;0
https://www.instagram.com/p/DQ2Zu4ZDQqX/;Photo;284;6;0;2025-11-10 00:00:51;https://scontent-fra3-2.cdninstagram.com/v/t51.82787-15/581052608_18545663011001303_8188479768060256249_n.jpg?stp=dst-jpg_e35_tt6&_nc_cat=104&ig_cache_key=Mzc2MjMwNzcxMTUyMzE2Mjc3NQ%3D%3D.3-ccb7-5&ccb=7-5&_nc_sid=58cdad&efg=eyJ2ZW5jb2RlX3RhZyI6InhwaWRzLjE0NDB4MTkyMC5zZHIuQzMifQ%3D%3D&_nc_ohc=s7tV-R2TBg4Q7kNvwG-FDsz&_nc_oc=AdmRw8IelQaNDznc_jIBrdgfj8Mmt_xTyH-vvV7s8Bd4JvncWDm6nN_8AWzjhxkT14Hg2vI73gNQI_uxj2gnnHWk&_nc_ad=z-m&_nc_cid=0&_nc_zt=23&_nc_ht=scontent-fra3-2.cdninstagram.com&_nc_gid=VTCEUf2ANK4lfy9E9Nn3UQ&oh=00_Afg3tOZkLtc_la38NP9vNjrciRWFli8vfeCBg2hCLGxcEQ&oe=69311C6C;Cumhuriyetimizin kurucusu Gazi Mustafa Kemal Atatürk’ü, ebediyete intikalinin 87. yıl dönümünde rahmetle ve saygıyla anıyorum.  #10Kasım;;0
https://www.instagram.com/p/DQ17qEWDUDX/;Reels;142;0;17171;2025-11-09 19:39:23;https://scontent-fra3-1.cdninstagram.com/v/t51.71878-15/581110739_811591328369368_1208138599172942271_n.jpg?stp=dst-jpg_e15_tt6&_nc_cat=103&ig_cache_key=Mzc2MjE3NTQzOTM2NTAzMDEwMw%3D%3D.3-ccb7-5&ccb=7-5&_nc_sid=58cdad&efg=eyJ2ZW5jb2RlX3RhZyI6InhwaWRzLjY0MHgxMTM2LnNkci5DMyJ9&_nc_ohc=Byd_wgBYk18Q7kNvwFFFabB&_nc_oc=AdkNEhIUbRS1htdi13D5O-dVsb1mykTP_nx2eM8fZfbX2fDGB0kSgN6ewx_5_zUaNLqLd78ho8E3r6T0MU30QqHg&_nc_ad=z-m&_nc_cid=0&_nc_zt=23&_nc_ht=scontent-fra3-1.cdninstagram.com&_nc_gid=VTCEUf2ANK4lfy9E9Nn3UQ&oh=00_AfiDSQADihKKxzqGo1lhNlB2vANOF2K9uz7LDkFlXDqQNQ&oe=6931296B;Alsancak Mahallesi’nde kentsel dönüşüm çalışmalarımızı hızlandırdık. 🏡✨   400 milyon TL’lik yatırımımızla modern, güvenli ve konforlu yaşam alanları inşa ediyoruz. Şu anda 130 dairelik iki blok tamamlanıyor, toplamda 16 blokluk dönüşümü halkımızla buluşturacağız.  Emeği geçen herkese teşekkür ediyor, çalışmaların hayırlı olmasını diliyorum. ❤️  #HerŞeyKayseriİçin;;0
