PostLink;PostTürü;BeğeniSayısı;YorumSayısı;Görüntülenme Sayısı;Tarih;DisplayPhoto;Caption;Takipçi;TahminMi
https://www.instagram.com/p/DQuJOVADHBr/;Carousel;378;0;0;2025-11-06 19:02:40;https://scontent-lhr8-2.cdninstagram.com/v/t51.82787-15/573328482_18377866099145826_8604612614768754167_n.jpg?stp=dst-jpg_e35_tt6&_nc_cat=101&ig_cache_key=Mzc1OTk4MzI5ODUyNjA5OTY2Ng%3D%3D.3-ccb7-5&ccb=7-5&_nc_sid=58cdad&efg=eyJ2ZW5jb2RlX3RhZyI6InhwaWRzLjE0NDB4OTYwLnNkci5DMyJ9&_nc_ohc=_dKdZmTNBzwQ7kNvwH7eRwq&_nc_oc=Adn_qg-JCM9bY9n8PsT2s7XSHbbgH6ZOr36aoEcrnB9GkzPMY4VmF1RO-0sV0J-VZHA&_nc_ad=z-m&_nc_cid=0&_nc_zt=23&_nc_ht=scontent-lhr8-2.cdninstagram.com&_nc_gid=wFabxXmv2slFAJr5RaIU6Q&oh=00_AfjmCsGtWt6IFJDgCRNb46wVacFv-5J4Qx3hiFKZAl-ipg&oe=69310C02;Valimiz Sn. Ozan Balcı, Türkiye İran sınırı Saray İlçesindeki Kapıköy Gümrük Kapısında incelemelerde bulunarak yetkililerden çalışmalar hakkında bilgi aldı.  @valiozanbalci75;;0
https://www.instagram.com/p/DQuC1zejO_e/;Carousel;418;1;0;2025-11-06 18:06:53;https://scontent-lhr6-1.cdninstagram.com/v/t51.82787-15/573882460_18377860750145826_2895163120294849840_n.jpg?stp=dst-jpg_e35_tt6&_nc_cat=110&ig_cache_key=Mzc1OTk1NTIyNzMwNzY5MDMyMw%3D%3D.3-ccb7-5&ccb=7-5&_nc_sid=58cdad&efg=eyJ2ZW5jb2RlX3RhZyI6InhwaWRzLjE0NDB4OTYxLnNkci5DMyJ9&_nc_ohc=DnZTILYLcI0Q7kNvwEXHVHm&_nc_oc=AdklcIXx_ZvH95XY_3FC1u2NUoDCXEYbDx6jo4EnWAe72kWg0JOwm1B8MGwzSXgjHBM&_nc_ad=z-m&_nc_cid=0&_nc_zt=23&_nc_ht=scontent-lhr6-1.cdninstagram.com&_nc_gid=wFabxXmv2slFAJr5RaIU6Q&oh=00_Afg33vPJT04yX74cjj3dPfQAwOQyq59rBIIp5oudCsVG0w&oe=693128FD;Vanspor Tesislerimiz Hızla Tamamlanıyor  Valimiz Sn. Ozan Balcı, Vanspor için yeni yaptırılan tesislerin inşaatında incelemelerde bulunarak çalışmalar hakkında bilgi aldı.  Vanspor’a desteklerinin tam olduğunu belirten ve 1. Ligde başarılar dileyen Valimiz,   ”Vansporumuza hibrit sahalar, FİFA standartlarında çim sahalar ve sosyal tesisler yapıyoruz. Bu sahalarımız ve sosyal tesislerimiz bitince Vansporumuzun alt yapısına büyük katkı sağlamış olacağız.  Her zaman bütün olanaklarımızla sporun ve sporcunun yanındayız” dedi  @valiozanbalci75;;0
https://www.instagram.com/p/DQt6DlfDPF-/;Carousel;341;0;0;2025-11-06 16:50:08;https://scontent-lhr8-1.cdninstagram.com/v/t51.82787-15/573455866_18377835022145826_2511988651848273514_n.jpg?stp=dst-jpg_e35_tt6&_nc_cat=107&ig_cache_key=Mzc1OTkxNjU4OTY4OTYyNDk2Mw%3D%3D.3-ccb7-5&ccb=7-5&_nc_sid=58cdad&efg=eyJ2ZW5jb2RlX3RhZyI6InhwaWRzLjE0NDB4OTYwLnNkci5DMyJ9&_nc_ohc=79REgZ71Hz8Q7kNvwG73GWt&_nc_oc=Adlkxg3EcEs2NdKjqxPZDbFsXn72rPWtkpZLMfO7x7s0aKd4opXeyyRbMhEPNpub69M&_nc_ad=z-m&_nc_cid=0&_nc_zt=23&_nc_ht=scontent-lhr8-1.cdninstagram.com&_nc_gid=wFabxXmv2slFAJr5RaIU6Q&oh=00_AfiGHoGTgWmJqzuoP14nf2fjMPWjeUC6_V2L65SPhNrB7g&oe=69312ED8;Çevre Yolundaki Çalışmalar Hızla Devam Ediyor   Valimiz Sn. Ozan Balcı, yapımı hızla devam eden Van Çevre Yolundaki çalışmaları inceleyerek çalışanlara kolaylıklar diledi.  @valiozanbalci75;;0
https://www.instagram.com/p/DQtzSVmjLhY/;Carousel;392;1;0;2025-11-06 15:50:58;https://scontent-mia3-1.cdninstagram.com/v/t51.82787-15/575297976_18377829688145826_6927310129541358126_n.jpg?stp=dst-jpg_e35_tt6&_nc_cat=111&ig_cache_key=Mzc1OTg4NjgxNDM2NzQ3MzU1NQ%3D%3D.3-ccb7-5&ccb=7-5&_nc_sid=58cdad&efg=eyJ2ZW5jb2RlX3RhZyI6InhwaWRzLjE0NDB4OTYxLnNkci5DMyJ9&_nc_ohc=jaDQ-7b4srMQ7kNvwFn50pp&_nc_oc=AdkaYYSB3VRgDcZExVZiLTNG4nZI_f5vV3L0SnHHcfdOz8a7TDPgx7jGgV_fonE7vjdt8E32kmCR_qnNBgqdbikh&_nc_ad=z-m&_nc_cid=1087&_nc_zt=23&_nc_ht=scontent-mia3-1.cdninstagram.com&_nc_gid=ZAsndHyp9m3SZYb4n_jDwg&oh=00_AfgBjIs6bS9bNP9CKZVeJOsb9wbOJdIZ_dnA6sqXjrJ6ug&oe=693134F5;Kapıköy Gümrük Kapısında Yeni Sosyal Tesisler Yapılıyor   Valimiz Sn. Ozan Balcı, Saray İlçemizde Kapıköy Gümrük Kapısı yanında yapımı devam eden alışveriş merkezi ve sosyal tesislerin inşaat alanında incelemelerde bulundu.   Yüklenici firma yetkililerinden bilgi alan Valimiz, “Bize İran’dan çok sayıda misafir geliyor. Şimdi Kapıköy Gümrük Kapısının dışında bulunan alanda çalışma yapılıyor. Hem ülkemize gelen, hem de yurtdışına bu kapıdan çıkan hemşerilerimize hizmet sağlayacak sosyal donatılar, dinlenme alanları, rekreasyon alanlarını TOBB ile birlikte yapıyoruz. Bittiğinde de hemşehrilerimize, gelen misafirlerimize, vatandaşlarımıza daha güzel daha konforlu hizmet sunumu sağlanacak. Bize bu yatırımlarda destek verenlere çok teşekkür ediyorum. dedi.  @valiozanbalci75;;0
https://www.instagram.com/p/DQtjwUlDDn_/;Carousel;311;1;0;2025-11-06 13:35:15;https://scontent-mia3-1.cdninstagram.com/v/t51.82787-15/576023591_18377800783145826_6179535140302583686_n.jpg?stp=dst-jpg_e35_tt6&_nc_cat=106&ig_cache_key=Mzc1OTgxODUwODkzNTY3MTAzOQ%3D%3D.3-ccb7-5&ccb=7-5&_nc_sid=58cdad&efg=eyJ2ZW5jb2RlX3RhZyI6InhwaWRzLjE0NDB4OTU5LnNkci5DMyJ9&_nc_ohc=Gvl5IsJ9tdwQ7kNvwHOzo7k&_nc_oc=AdkzcCO0zTeUB_b6yNEREvEK-DrPPqpY6Zwhvlq3pRiDuu5RLNMKS6lrGkkcuD0GPD5TRZWqujoov7uAKpkWeE04&_nc_ad=z-m&_nc_cid=1087&_nc_zt=23&_nc_ht=scontent-mia3-1.cdninstagram.com&_nc_gid=ZAsndHyp9m3SZYb4n_jDwg&oh=00_AfiOb9_lIfNB9DDCgeY2SJuXNqQcCB3k9Fk2YHUOcwYARw&oe=69311479;Özalp Hükümet Konağı Hızla Tamamlanıyor   Valimiz Sn. Ozan Balcı, Özalp İlçesi programı kapsamında yapımı devam eden Özalp Hükümet Konağının inşaatında incelemelerde bulundu.   Valimiz, “Hızla devam bu hükümet konaklarımız kamu hizmetlerinin vatandaşlarımıza daha etkin ve iyi şartlarda sunulması için çok önemlidir. İnşallah Özalp hükümet konağını en kısa zamanda bitirip hizmete açacağız.   Ayrıca Bahçesaray ilçesi hükümet konağımız yeni yapıldı. Başkale, İpekyolu ve Tuşba ilçelerimizin hükümet konakları yeni yapıldı ve hizmete açıldı. Valilik binamız hızla tamamlanıyor.   Bu hükümet konaklarının yapımında bize destek olan İçişleri Bakanımız Sayın Ali Yerlikaya başta olmak üzere emeği geçenlere çok teşekkür ediyorum. Hayırlı uğurlu olsun ” dedi.  @valiozanbalci75;;0
https://www.instagram.com/p/DQtg1CqDNCe/;Carousel;492;0;0;2025-11-06 13:09:41;https://scontent-mia3-3.cdninstagram.com/v/t51.82787-15/573352858_18377798806145826_4226055062843533172_n.jpg?stp=dst-jpg_e35_tt6&_nc_cat=110&ig_cache_key=Mzc1OTgwNTYzNjc5Mjg0NDA3OQ%3D%3D.3-ccb7-5&ccb=7-5&_nc_sid=58cdad&efg=eyJ2ZW5jb2RlX3RhZyI6InhwaWRzLjE0NDB4OTg3LnNkci5DMyJ9&_nc_ohc=X45oJ0_WjZMQ7kNvwEc3m0V&_nc_oc=Adl9apLxOKix5oQcfZQ_3QyNWWfocpTyj0avVPlnb9Ugo5DtlGJ7bgysnBKpNE8sBsbTvkUYafv7DOyp-aD01gAD&_nc_ad=z-m&_nc_cid=1087&_nc_zt=23&_nc_ht=scontent-mia3-3.cdninstagram.com&_nc_gid=ZAsndHyp9m3SZYb4n_jDwg&oh=00_AfjXcDsbCrUMVT8z5DzwyTEe40yS5qfeZGaAnrSUw7EJ2A&oe=69310CA7;Özalp İlçemizde Kütüphane ve Gençlik Merkezini Ziyaret Ettik  Valimiz Sn. Ozan Balcı, Özalp İlçesinde tamamlanarak hizmete açılan Halk Kütüphanesi ve Gençlik Merkezini ziyaret etti.   İlçe Kaymakamı Sn. Rahmi Bulut ve ilçe protokolü tarafından karşılanan Valimiz, ilk olarak gençlik merkezini gezdi.   Daha sonra ilçe kütüphanesinde incelemelerde bulunan Valimiz, kütüphanede etüt yapan öğrencilerle hasbihal ederek başarılar diledi.  Valimiz, “13 ilçemize Kültür ve Turizm Bakanlığımız ile Kütüphaneler Yayımlar Genel Müdürlüğü destekleri ve yerel imkanlarımızla bebek çocuk kütüphanesi yaptık. Çocuklarımızın gençlerimizin hizmetine açtık. Başta Kültür ve Turizm Bakanımız, Kütüphaneler Yayımlar Genel Müdürümüze ve emeği geçenlere teşekkür ediyorum” dedi.  @valiozanbalci75;;0
https://www.instagram.com/p/DQsa8_fDI34/;Reels;382;0;20774;2025-11-06 03:00:36;https://scontent-mia3-2.cdninstagram.com/v/t51.71878-15/573415688_1529202708531684_240960095042988727_n.jpg?stp=dst-jpg_e15_tt6&_nc_cat=107&ig_cache_key=Mzc1OTQ5ODMyOTQ5MjA2NTc4NA%3D%3D.3-ccb7-5&ccb=7-5&_nc_sid=58cdad&efg=eyJ2ZW5jb2RlX3RhZyI6InhwaWRzLjY0MHgxMTM2LnNkci5DMyJ9&_nc_ohc=A_KQ8HBExSMQ7kNvwGoistD&_nc_oc=AdnsDYoGUEQv_IvJA1SEybeN59djG6Bo4SZAnjzadSUeaUA5FLlLSTbSIIIzHA6N_Tgy_5SDdk7PWzN580QE5G0i&_nc_ad=z-m&_nc_cid=1087&_nc_zt=23&_nc_ht=scontent-mia3-2.cdninstagram.com&_nc_gid=ZAsndHyp9m3SZYb4n_jDwg&oh=00_AfgukbRwCjLMFyGPKSvFtJqahyTQjfqlY6FYN5RI_ZhWCA&oe=69312E5C;Bilim Merkezimiz Hızla Tamamlanıyor.  @valiozanbalci75;;0
https://www.instagram.com/p/DQsaBRdjLMJ/;Reels;739;16;30596;2025-11-06 02:52:07;https://scontent-mia3-3.cdninstagram.com/v/t51.71878-15/573129644_2026715984749914_6987098626570236850_n.jpg?stp=dst-jpg_e15_tt6&_nc_cat=108&ig_cache_key=Mzc1OTQ5NDIyNTYyNTY1ODEyMQ%3D%3D.3-ccb7-5&ccb=7-5&_nc_sid=58cdad&efg=eyJ2ZW5jb2RlX3RhZyI6InhwaWRzLjY0MHgxMTM2LnNkci5DMyJ9&_nc_ohc=-XJVddiZnFMQ7kNvwGN6y5h&_nc_oc=AdnnPTJyT9-YXG0BA1PCA9FNTZ_pQhQuzNRzmbaxH6yCXZ8Q-F-fMp9ozWIbw1-5HHxko675kv0_Cr_KHMzAnq57&_nc_ad=z-m&_nc_cid=1087&_nc_zt=23&_nc_ht=scontent-mia3-3.cdninstagram.com&_nc_gid=ZAsndHyp9m3SZYb4n_jDwg&oh=00_Afg8O8QMbvo3DbmEWpic5nN2AxbPLZ4p33iIiX4LSi95sQ&oe=69310ADB;Eski Van Şehri Surlarını Yapıyoruz.  @valiozanbalci75;;0
https://www.instagram.com/p/DQsZEygjMje/;Reels;326;0;31076;2025-11-06 02:44:12;https://scontent-mia3-3.cdninstagram.com/v/t51.71878-15/572897652_1343968127258845_5721037848853795435_n.jpg?stp=dst-jpg_e15_tt6&_nc_cat=109&ig_cache_key=Mzc1OTQ5MDA2OTIyMTM5NDY1NA%3D%3D.3-ccb7-5&ccb=7-5&_nc_sid=58cdad&efg=eyJ2ZW5jb2RlX3RhZyI6InhwaWRzLjY0MHgxMTM2LnNkci5DMyJ9&_nc_ohc=9MaYhSz3ZWIQ7kNvwEoFy6L&_nc_oc=AdkEXhtITZr_qEOts88o-QGhMjNPx4tN9pGnp4Jc3Sj7VUHMNR4BaEOtddb6gfy1uVF339Zt9WeBtjq5YsbfOhHQ&_nc_ad=z-m&_nc_cid=1087&_nc_zt=23&_nc_ht=scontent-mia3-3.cdninstagram.com&_nc_gid=ZAsndHyp9m3SZYb4n_jDwg&oh=00_Afh18902CRT-56PCqPoaDevdKemd8WTOauINLy0eu8vAyg&oe=69310ACD;Tarihi Ulu Camii’miz Hızla Yükseliyor.  @valiozanbalci75;;0
https://www.instagram.com/p/DQsYZJ8DGpl/;Reels;895;12;45192;2025-11-06 02:37:16;https://scontent-mia3-3.cdninstagram.com/v/t51.71878-15/574233282_1742981066396420_4380349564292746123_n.jpg?stp=dst-jpg_e15_tt6&_nc_cat=110&ig_cache_key=Mzc1OTQ4NzA3MDcyMTgyOTQ3Nw%3D%3D.3-ccb7-5&ccb=7-5&_nc_sid=58cdad&efg=eyJ2ZW5jb2RlX3RhZyI6InhwaWRzLjY0MHgxMTM2LnNkci5DMyJ9&_nc_ohc=a1ZxHYeXicsQ7kNvwHmD5Ls&_nc_oc=Adn9jn98eOGf63ggY3TV0rrwwWZLORgKYJSuUBeWonfaog9V6bcq3j4VeEtFRAuIm8BQiamNUyw5eyacpQLOXzye&_nc_ad=z-m&_nc_cid=1087&_nc_zt=23&_nc_ht=scontent-mia3-3.cdninstagram.com&_nc_gid=ZAsndHyp9m3SZYb4n_jDwg&oh=00_Afj0feSEzl0sYCU5kxV-A0LrMzUUYmnwi0qT50K9IT01mg&oe=69313523;Horhor Bölgesinin Çevre Düzenlemesi Ve Yürüyüş Yollarını Yapıyoruz.  @valiozanbalci75;;0
https://www.instagram.com/p/DQsXc_GjPQ2/;Reels;456;10;25241;2025-11-06 02:30:16;https://scontent-mia3-3.cdninstagram.com/v/t51.71878-15/572922284_1341004164371419_6538917624251095682_n.jpg?stp=dst-jpg_e15_tt6&_nc_cat=110&ig_cache_key=Mzc1OTQ4MjkzNTkxODI2MTMwMg%3D%3D.3-ccb7-5&ccb=7-5&_nc_sid=58cdad&efg=eyJ2ZW5jb2RlX3RhZyI6InhwaWRzLjY0MHgxMTM2LnNkci5DMyJ9&_nc_ohc=D1xC9IS8iCoQ7kNvwFaAIsI&_nc_oc=Adld_UHNQjzKnpg6q6KZd39fcM0GntiyMDlNpgY0CiRvje2h_ZhDXG5SrlvFZA21dJtUHvVQ4cHy0M6x_aZtDIpb&_nc_ad=z-m&_nc_cid=1087&_nc_zt=23&_nc_ht=scontent-mia3-3.cdninstagram.com&_nc_gid=ZAsndHyp9m3SZYb4n_jDwg&oh=00_AfgteQo2l1YJuanskGNfaYP4-iEhyuSFu-nvtYDQGUWhzg&oe=69312D5D;Kitap Van Projemiz Başarıyla Devam Ediyor.  @valiozanbalci75;;0
https://www.instagram.com/p/DQsWOFQDKqQ/;Reels;386;3;22212;2025-11-06 02:18:22;https://scontent-mia3-2.cdninstagram.com/v/t51.71878-15/573800629_1913485355896490_6156992586267749252_n.jpg?stp=dst-jpg_e15_tt6&_nc_cat=103&ig_cache_key=Mzc1OTQ3NzUxMzY4MTQxNDgwMA%3D%3D.3-ccb7-5&ccb=7-5&_nc_sid=58cdad&efg=eyJ2ZW5jb2RlX3RhZyI6InhwaWRzLjY0MHgxMTM2LnNkci5DMiJ9&_nc_ohc=OwbZDo1K3Z8Q7kNvwFXjSoV&_nc_oc=AdmBN3jfW8tujV07mMZjCujth7TdX_5UImZgZ3kQBW8Mybe_t1gSl5oi_KnJFpGvca-TPpISLggYR_nOG5560Z0S&_nc_ad=z-m&_nc_cid=1087&_nc_zt=23&_nc_ht=scontent-mia3-2.cdninstagram.com&_nc_gid=ZAsndHyp9m3SZYb4n_jDwg&oh=00_Afj4ilL_vQDNlSVpprGddgSdj1bQEH4Ml_jNh4ZrByEzwg&oe=69312570;Yatılı Kız Hafızlık ve Kur’an Kursumuz Hızla Yükseliyor.  @valiozanbalci75;;0
https://www.instagram.com/p/DQsVNk_DL-_/;Reels;331;2;16861;2025-11-06 02:09:58;https://scontent-mia5-1.cdninstagram.com/v/t51.71878-15/574242615_3313989608753808_305922897666970193_n.jpg?stp=dst-jpg_e15_tt6&_nc_cat=104&ig_cache_key=Mzc1OTQ3MzA4MDk4OTk1ODA3OQ%3D%3D.3-ccb7-5&ccb=7-5&_nc_sid=58cdad&efg=eyJ2ZW5jb2RlX3RhZyI6InhwaWRzLjY0MHgxMTM2LnNkci5DMyJ9&_nc_ohc=S5zOu0-U2h0Q7kNvwEffOhC&_nc_oc=AdkuSpw7mjRuajFWaPQhkVg1SKi0lJo7gZR2De7MgEAfy5Dq9Sz469hI1hb84xpUGIOg5TMZNC8r-cgrE01YMyBH&_nc_ad=z-m&_nc_cid=1087&_nc_zt=23&_nc_ht=scontent-mia5-1.cdninstagram.com&_nc_gid=ZAsndHyp9m3SZYb4n_jDwg&oh=00_Afib8YIwpOtNBLT9VYuBUOq7m_n-NxgxpQDzc6IpaAOxKw&oe=69312C6D;Türkiye Yüzyılı Eğitim Kampüsü Hızla Tamamlanıyor.  @valiozanbalci75;;0
https://www.instagram.com/p/DQsTl73DB6L/;Reels;509;8;40200;2025-11-06 01:55:39;https://scontent-mia5-1.cdninstagram.com/v/t51.71878-15/573176490_853032503921163_9143842345756657151_n.jpg?stp=dst-jpg_e15_tt6&_nc_cat=104&ig_cache_key=Mzc1OTQ2NTk1ODcyNjE4MDQ5MQ%3D%3D.3-ccb7-5&ccb=7-5&_nc_sid=58cdad&efg=eyJ2ZW5jb2RlX3RhZyI6InhwaWRzLjY0MHgxMTM2LnNkci5DMyJ9&_nc_ohc=R2lhFpP6dxAQ7kNvwGjbo7n&_nc_oc=AdnbyOOorCAS9gDuUAau3Dg9XqbcZnOsnUe38z7FjstTDxpAL4z9pLiJan_WKd68OAiVOeMmaEPHm0JYqzRsKtUq&_nc_ad=z-m&_nc_cid=1087&_nc_zt=23&_nc_ht=scontent-mia5-1.cdninstagram.com&_nc_gid=ZAsndHyp9m3SZYb4n_jDwg&oh=00_Afjn7sLp6AedVUCgN5RdaKBKFJA--IYuHJyUgi-_wPHc0g&oe=69313518;Millet Bahçemiz Van’ımıza Nefes Aldıracak.  @valiozanbalci75;;0
https://www.instagram.com/p/DQsSnVTDDrx/;Reels;1519;15;103210;2025-11-06 01:46:56;https://scontent-mia5-2.cdninstagram.com/v/t51.71878-15/575617096_841756174935824_4507100731905171634_n.jpg?stp=dst-jpg_e15_tt6&_nc_cat=100&ig_cache_key=Mzc1OTQ2MTY1NjcxMjQ2MTA0MQ%3D%3D.3-ccb7-5&ccb=7-5&_nc_sid=58cdad&efg=eyJ2ZW5jb2RlX3RhZyI6InhwaWRzLjY0MHgxMTM2LnNkci5DMyJ9&_nc_ohc=eGRfJz9jDq4Q7kNvwGPUpsP&_nc_oc=Adl_B22r0nIM_Q3GnOc--frVDiz9Ers7rMRggdHwSzTlvlcfZKuXNpQSbACVP_KXUIXIUEL03ypivHpcZJ4pqv12&_nc_ad=z-m&_nc_cid=1087&_nc_zt=23&_nc_ht=scontent-mia5-2.cdninstagram.com&_nc_gid=ZAsndHyp9m3SZYb4n_jDwg&oh=00_Afix_ZC68T308wKCtKX-32WmPJKu7XYb7iZdDkstqdmkwQ&oe=69312830;Van Ferit Melen Havalimanı Çalışmaları Sona Geldi.  @valiozanbalci75;;0
https://www.instagram.com/p/DQsRw8kDI_t/;Reels;1003;12;71161;2025-11-06 01:39:58;https://scontent-dub4-1.cdninstagram.com/v/t51.71878-15/575628602_1327067588747760_4446384028565464298_n.jpg?stp=dst-jpg_e15_tt6&_nc_cat=103&ig_cache_key=Mzc1OTQ1NzkxOTMwMjQwNjEyNQ%3D%3D.3-ccb7-5&ccb=7-5&_nc_sid=58cdad&efg=eyJ2ZW5jb2RlX3RhZyI6InhwaWRzLjY0MHgxMTM2LnNkci5DMyJ9&_nc_ohc=m24HgjhX2lcQ7kNvwED1ujl&_nc_oc=AdluPfspQujXU_MQVw11_EMlpNV8d_uBihV-UQGv6jZ3JO_QcvbwlQIJwu9Z6oTZo9UmG_iUhVPIKuUlsid8nUU-&_nc_ad=z-m&_nc_cid=0&_nc_zt=23&_nc_ht=scontent-dub4-1.cdninstagram.com&_nc_gid=QQwwevBGAoUk2uro9pydjw&oh=00_AfhfEzoBcGBlBdkJiJ3CENzy6JGSwHa-kHtB-H5rcJBEzg&oe=693129A0;Refakatçi Misafirhanemiz Hızla Tamamlanıyor.  @valiozanbalci75;;0
https://www.instagram.com/p/DQsQn55jMUg/;Reels;326;3;18311;2025-11-06 01:30:03;https://scontent-dub4-1.cdninstagram.com/v/t51.71878-15/572132526_1339680134278502_5852983233674825341_n.jpg?stp=dst-jpg_e15_tt6&_nc_cat=104&ig_cache_key=Mzc1OTQ1Mjg5OTkyMDEwMjY4OA%3D%3D.3-ccb7-5&ccb=7-5&_nc_sid=58cdad&efg=eyJ2ZW5jb2RlX3RhZyI6InhwaWRzLjY0MHgxMTM2LnNkci5DMyJ9&_nc_ohc=cjJUm5ZxWIMQ7kNvwHTfMe0&_nc_oc=AdnfHa0_m_Cbf0O4KYRAA2_St2uwNl6MrXiAE-j0R1AroNhkPKm-QYl7EuswgX5x3RC5oa0d86zA5psrAHWNj95y&_nc_ad=z-m&_nc_cid=0&_nc_zt=23&_nc_ht=scontent-dub4-1.cdninstagram.com&_nc_gid=QQwwevBGAoUk2uro9pydjw&oh=00_Afg4aHuzCIBPN59BG0PB3mxpQM8IyCstrdfa36q_rjCbyg&oe=69311C2A;Özel Eğitim Okulumuzu Ziyaret Ettik.  @valiozanbalci75;;0
https://www.instagram.com/p/DQsPnTkjP6X/;Reels;945;9;46433;2025-11-06 01:22:16;https://scontent-dub4-1.cdninstagram.com/v/t51.71878-15/573619867_837351098990335_8219989179129482215_n.jpg?stp=dst-jpg_e15_tt6&_nc_cat=111&ig_cache_key=Mzc1OTQ0ODQ2MDcxOTA5NTQ0Nw%3D%3D.3-ccb7-5&ccb=7-5&_nc_sid=58cdad&efg=eyJ2ZW5jb2RlX3RhZyI6InhwaWRzLjY0MHgxMTM2LnNkci5DMyJ9&_nc_ohc=ALiqvxCC8JsQ7kNvwFhcAIa&_nc_oc=AdkJ6Bly2sxwSgQAVeZ37KdxqCXNkVI0hdncAduSrHS9cjBZ2P7Mp6UTIkpb-NkV2dKnlP8V7NjWx6m4vHVotGiF&_nc_ad=z-m&_nc_cid=0&_nc_zt=23&_nc_ht=scontent-dub4-1.cdninstagram.com&_nc_gid=QQwwevBGAoUk2uro9pydjw&oh=00_AfjZ6L9VKaA2eE2mhOirnwx7xrBElgP0tdWzV7vKylAPHg&oe=6931346E;Koyun Projemiz Devam Ediyor.  @valiozanbalci75;;0
https://www.instagram.com/p/DQsN66ZDDfh/;Reels;393;4;19733;2025-11-06 01:07:02;https://scontent-dub4-1.cdninstagram.com/v/t51.71878-15/573106993_2004219827032947_8777451481267542095_n.jpg?stp=dst-jpg_e15_tt6&_nc_cat=103&ig_cache_key=Mzc1OTQ0MTAxMTk3OTA3MzUwNQ%3D%3D.3-ccb7-5&ccb=7-5&_nc_sid=58cdad&efg=eyJ2ZW5jb2RlX3RhZyI6InhwaWRzLjY0MHgxMTM2LnNkci5DMyJ9&_nc_ohc=eq2vCiMQTtEQ7kNvwGT5QOX&_nc_oc=AdkDjpf2IdSIqcVm9Ceow6-aXnZCu68iJVJu-jRQI_B-ZHn3cMzbkElCHx7lKFoDkBzzxMdBxc6icHUGgYyUqFdv&_nc_ad=z-m&_nc_cid=0&_nc_zt=23&_nc_ht=scontent-dub4-1.cdninstagram.com&_nc_gid=QQwwevBGAoUk2uro9pydjw&oh=00_AfgB62n3fViegWkVYbYBweBoZB3d8X_s95moOnXZgmq3DA&oe=69310E9E;Gevaş Selçuklu Mezarlığı Restorasyonumuz Devam Ediyor.  @valiozanbalci75;;0
https://www.instagram.com/p/DQsMajgDK68/;Reels;487;5;22557;2025-11-06 00:53:43;https://scontent-dub4-1.cdninstagram.com/v/t51.71878-15/572722042_701801782969201_6518562919117923316_n.jpg?stp=dst-jpg_e15_tt6&_nc_cat=107&ig_cache_key=Mzc1OTQzNDM5MDMzMDcxNTgzNg%3D%3D.3-ccb7-5&ccb=7-5&_nc_sid=58cdad&efg=eyJ2ZW5jb2RlX3RhZyI6InhwaWRzLjY0MHgxMTM2LnNkci5DMyJ9&_nc_ohc=LmuYjBo9SicQ7kNvwFzF8bP&_nc_oc=Adlnidd0yrDWF5FESUP2musz2gqS4B1TzOwayqSH_71gdq95m7f-a9-oPF0hXHN9L5gdmWFafJu_sFqo7kl5CXVs&_nc_ad=z-m&_nc_cid=0&_nc_zt=23&_nc_ht=scontent-dub4-1.cdninstagram.com&_nc_gid=QQwwevBGAoUk2uro9pydjw&oh=00_AfhNBnEMi42hru8DrQz701ny4XpMvUt9xFAAD0WTPT-Efg&oe=69311DD7;İzzeddin Şir Camii Restorasyonunda Sona Yaklaştık.  @valiozanbalci75;;0
https://www.instagram.com/p/DQrxZT-DJFk/;Carousel;296;0;0;2025-11-05 20:55:58;https://scontent-dub4-1.cdninstagram.com/v/t51.82787-15/573466301_18377576527145826_8109853034441837097_n.jpg?stp=dst-jpg_e35_tt6&_nc_cat=103&ig_cache_key=Mzc1OTMxNTU1MjM2MDUyMzg1Mg%3D%3D.3-ccb7-5&ccb=7-5&_nc_sid=58cdad&efg=eyJ2ZW5jb2RlX3RhZyI6InhwaWRzLjE0NDB4OTYyLnNkci5DMyJ9&_nc_ohc=HVu9OmvkQoEQ7kNvwFXsZXS&_nc_oc=AdlumlZJcH-CJiyLKwas2A9x7zklDH9DxwXRAzqO7uGLnWaqy5a145hyld8bLEoW7w41dDHC74uwGw4jNpZcDReZ&_nc_ad=z-m&_nc_cid=0&_nc_zt=23&_nc_ht=scontent-dub4-1.cdninstagram.com&_nc_gid=QQwwevBGAoUk2uro9pydjw&oh=00_AfiAKcY8qGND75buAFe-E-yrUIrvudCwGLPKK1lgc2p_oA&oe=69310FF4;Valimiz Sn. Ozan Balcı, Edremit ilçesindeki eski Vali evinin düzenlenerek dönüştürüldüğü Özel Eğitim Uygulama Okulunu ziyaret ederek özel gereksinimli öğrencilerle bir araya geldi.  @valiozanbalci75;;0
https://www.instagram.com/p/DQrw8sBjM02/;Carousel;254;0;0;2025-11-05 20:52:04;https://scontent-dub4-1.cdninstagram.com/v/t51.82787-15/574226821_18377576191145826_5770861186998139858_n.jpg?stp=dst-jpg_e35_tt6&_nc_cat=108&ig_cache_key=Mzc1OTMxMzU4MDE1NjgxMjYzNQ%3D%3D.3-ccb7-5&ccb=7-5&_nc_sid=58cdad&efg=eyJ2ZW5jb2RlX3RhZyI6InhwaWRzLjE0NDB4OTYxLnNkci5DMyJ9&_nc_ohc=NBwDKZJUvDcQ7kNvwEiBLlA&_nc_oc=Adkboclgv93M__lPJW91ss3vCjpV44qPTj0mYK3VtxX3ujsMcxn5J-ix5JJF8FmIh5HOG9DNLo6aDfo56D7rhZNw&_nc_ad=z-m&_nc_cid=0&_nc_zt=23&_nc_ht=scontent-dub4-1.cdninstagram.com&_nc_gid=QQwwevBGAoUk2uro9pydjw&oh=00_AfiZrPO8TU4IqEx2ADOcQRIXwt5V3vT6gXhHWPCvgz2-LQ&oe=6931135F;Bilim Merkezi ve Kent Müzemiz Hızla Tamamlanıyor   Valimiz Sn. Ozan Balcı, sahil yolunda yapımına başlanan Bilim Merkezi ve Kent Müzesi inşaatında incelemelerde bulunarak çalışmalar hakkında yetkililerden bilgi aldı.  @valiozanbalci75;;0
https://www.instagram.com/p/DQrwtH-jCmD/;Carousel;247;0;0;2025-11-05 20:49:56;https://scontent-dub4-1.cdninstagram.com/v/t51.82787-15/573619229_18377575942145826_6661602574754198404_n.jpg?stp=dst-jpg_e35_tt6&_nc_cat=106&ig_cache_key=Mzc1OTMxMjUxNTQzMjc3MTg1MQ%3D%3D.3-ccb7-5&ccb=7-5&_nc_sid=58cdad&efg=eyJ2ZW5jb2RlX3RhZyI6InhwaWRzLjE0NDB4OTYxLnNkci5DMyJ9&_nc_ohc=N0cXPBgKvyUQ7kNvwGiOLwz&_nc_oc=AdnOxTnualOz5aLjRzdHCW4T9tIKdODn0mBbu6UsI--_Mbuu4MyDcQVZKO2P2vxpk1yz2lXKnE8LIsIJP5gpl2Bc&_nc_ad=z-m&_nc_cid=0&_nc_zt=23&_nc_ht=scontent-dub4-1.cdninstagram.com&_nc_gid=QQwwevBGAoUk2uro9pydjw&oh=00_AfhrFzBUM6YI_v7iQ-njAfbWkGh-_u4QCQFushX5KsRRSg&oe=69312DD6;750 Yıllık Tarihi Ulu Caminin Restorasyonu Hızla Devam Ediyor   Valimiz Sn. Ozan Balcı, eski Van Şehrinde bulunan 800 yıllık tarihi Ulu Cami’de yapılan restorasyon çalışmalarını inceleyerek, yüklenici firma yetkilisinden bilgi aldı.  @valiozanbalci75;;0
https://www.instagram.com/p/DQrwbrsjOvx/;Photo;280;2;0;2025-11-05 20:47:33;https://scontent-dub4-1.cdninstagram.com/v/t51.82787-15/574016531_18377575801145826_3966055318401159027_n.jpg?stp=dst-jpg_e35_tt6&_nc_cat=107&ig_cache_key=Mzc1OTMxMTMyMjU0NzU0NzEyMQ%3D%3D.3-ccb7-5&ccb=7-5&_nc_sid=58cdad&efg=eyJ2ZW5jb2RlX3RhZyI6InhwaWRzLjE0NDB4MTA3OS5zZHIuQzMifQ%3D%3D&_nc_ohc=o8BIl85msvgQ7kNvwGUwQsi&_nc_oc=Adn6GwGUE-kWANm6RwdUNPpNVcd35Dog9TrQJVp6qb74QEr9UYuakNhjIOsw6x6X9jYtckMJkNsK2hI-wkJf4rhO&_nc_ad=z-m&_nc_cid=0&_nc_zt=23&_nc_ht=scontent-dub4-1.cdninstagram.com&_nc_gid=QQwwevBGAoUk2uro9pydjw&oh=00_AfijNwotv7lf7_FAEqRN3yCDrevi8YIaOoS5l7G73oEL0A&oe=69310ACD;Valimiz Sn. Ozan Balcı, programları sırasında karşılaştığı çocuklarla sohbet ederek kitap hediye etti.  @valiozanbalci75;;0
https://www.instagram.com/p/DQrwSgwjNA0/;Photo;507;0;0;2025-11-05 20:46:18;https://scontent-dub4-1.cdninstagram.com/v/t51.82787-15/573713117_18377575672145826_425452681486650719_n.jpg?stp=dst-jpegr_e35_tt6&_nc_cat=103&ig_cache_key=Mzc1OTMxMDY5MjMyODE5ODE5Ng%3D%3D.3-ccb7-5&ccb=7-5&_nc_sid=58cdad&efg=eyJ2ZW5jb2RlX3RhZyI6InhwaWRzLjE0NDB4MTA4MC5oZHIuQzMifQ%3D%3D&_nc_ohc=enUyB7745w4Q7kNvwGzLf1M&_nc_oc=AdlJX9DQeOEqvr0jFFQHF5svZbnQXh4ayR8uojJcCv4D-heqPEKIzZFgTNH9f2MvPxgubnmRTvQ6aCOyF_qzDKO-&_nc_ad=z-m&_nc_cid=0&_nc_zt=23&se=-1&_nc_ht=scontent-dub4-1.cdninstagram.com&_nc_gid=QQwwevBGAoUk2uro9pydjw&oh=00_AfjUwwROnzTKkN6wcLt-1xfokgq_gCwZue7I73lTxWREYA&oe=6931070A;PTT Aracılığıyla 340 Bin Kitap Çocukların Evlerine Kadar Ulaştırıldı  Valimiz Sn. Ozan Balcı, Kitap Van Koordinasyon merkezini ziyaret ederek yapılan çalışmalar hakkında Koordinatör Sn. Gökhan Arslan’dan bilgi aldı.  Valimiz, projenin başarılı bir şekilde devam ettiğini, proje kapsamında şu ana kadar 175 bin öğrenciye 340 bin kitabın PTT aracılığıyla evlerine kadar ulaştırıldığını belirterek emeği geçenlere teşekkür etti.  @valiozanbalci75;;0
https://www.instagram.com/p/DQrwHcdDFtq/;Photo;263;0;0;2025-11-05 20:44:47;https://scontent-dub4-1.cdninstagram.com/v/t51.82787-15/576015020_18377575588145826_1652516642081355404_n.jpg?stp=dst-jpg_e35_tt6&_nc_cat=108&ig_cache_key=Mzc1OTMwOTkzMTc5MTgwMTE5NA%3D%3D.3-ccb7-5&ccb=7-5&_nc_sid=58cdad&efg=eyJ2ZW5jb2RlX3RhZyI6InhwaWRzLjE0NDB4OTYyLnNkci5DMyJ9&_nc_ohc=-WnPZX2KnO0Q7kNvwEaoiu0&_nc_oc=AdmbRiWEt_U3nFOvSXWWTKURb3spic4GWuFQzvNaWS7Al9CVi-t1hjZbCnzMaebHG9sHkgAsBUwCXU2HCjFnjCBJ&_nc_ad=z-m&_nc_cid=0&_nc_zt=23&_nc_ht=scontent-dub4-1.cdninstagram.com&_nc_gid=QQwwevBGAoUk2uro9pydjw&oh=00_AfhQpZPaUEjfBdT890FqT17GWhxVcV3x5ghEJEUZgsuyjg&oe=69311D48;Valimiz Sn. Ozan Balcı, Hatuniye Caddesi üzerinde yapımı devam eden kız hafızlık ve Kur’an kursu inşaatında incelemelerde bulunarak çalışmalar hakkında bilgi aldı.  @valiozanbalci75;;0
https://www.instagram.com/p/DQrv6GoDPZm/;Carousel;304;2;0;2025-11-05 20:42:58;https://scontent-dub4-1.cdninstagram.com/v/t51.82787-15/574028930_18377575402145826_7949474105388844871_n.jpg?stp=dst-jpg_e35_tt6&_nc_cat=105&ig_cache_key=Mzc1OTMwOTAwNTExOTA4MTI0Mg%3D%3D.3-ccb7-5&ccb=7-5&_nc_sid=58cdad&efg=eyJ2ZW5jb2RlX3RhZyI6InhwaWRzLjE0NDB4OTYyLnNkci5DMyJ9&_nc_ohc=ahDBNelptnwQ7kNvwHkfUbR&_nc_oc=AdkdCILomn3qsXSAVEAmqDXhRgIIl9p7HCDseFz2Ahi2I5_nADRGHijw6E0DwnHresv3nBfK4pvlCIi_dIR_MLNl&_nc_ad=z-m&_nc_cid=0&_nc_zt=23&_nc_ht=scontent-dub4-1.cdninstagram.com&_nc_gid=QQwwevBGAoUk2uro9pydjw&oh=00_AfizX20XVCSiWEIeEqnXnzCSVs7k6_3UCwWa1Kz_eOqWSw&oe=69313598;Türkiye Yüzyılı Eğitim Kampüsü Hızla Yükseliyor   Valimiz Sn. Ozan Balcı, eski YİKOB alanında yapımına başlanan Türkiye Yüzyılı Eğitim Kampüsünde incelemelerde bulundu.  @valiozanbalci75;;0
https://www.instagram.com/p/DQrmRK5DBRD/;Carousel;406;2;0;2025-11-05 19:18:44;https://scontent-fra5-2.cdninstagram.com/v/t51.82787-15/573859841_18377546620145826_226420292012741372_n.jpg?stp=dst-jpg_e35_tt6&_nc_cat=107&ig_cache_key=Mzc1OTI2NjYxMzM3MjQ0OTk3Nw%3D%3D.3-ccb7-5&ccb=7-5&_nc_sid=58cdad&efg=eyJ2ZW5jb2RlX3RhZyI6InhwaWRzLjE0NDB4OTYyLnNkci5DMyJ9&_nc_ohc=Jml4pUa1ECUQ7kNvwGGhAQZ&_nc_oc=AdmnC6p7l7xu2b_TsLVwzVvb6CrOO7feONufB9fu1MMSKyIOkcDmKQ7okeBkqQz_Q7jceaiMG5yeMOyw4o3OKVlv&_nc_ad=z-m&_nc_cid=0&_nc_zt=23&_nc_ht=scontent-fra5-2.cdninstagram.com&_nc_gid=53o2ze2IwB4JhbodBtPLfA&oh=00_AfgablKhIL-rIxWtzcD3_zWLCzGMa70hs6f7bqgv1vW5RA&oe=6931051C;Valimiz Yeni Millet Bahçesinde İncelemelerde Bulundu  Valimiz Sn. Ozan Balcı, eski DSİ yerleşkesinde yapımı devam eden Millet Bahçesinde incelemelerde bulundu.  Valimiz, 144 dönüm arazi üzerine yapılan millet bahçesinin, kente büyük değer katacağını belirterek,   “Vatandaşlarımızın rahat edeceği,  nefes alacağı, sosyal donatılarıyla, çocuk oyun alanlarıyla, rekreasyon alanlarıyla beraber millet bahçesi yapıyoruz. Yürüyüş yollarıyla, açık ve kapalı spor alanlarıyla çocuklarımızın, gençlerimizin, kadınlarımızın, yaşlılarımızın yararlanacağı şehrin tam kalbinde bir yer.   Emeği geçen herkese çok teşekkür ediyorum” dedi.  @valiozanbalci75;;0
