PostLink;PostTürü;BeğeniSayısı;YorumSayısı;Görüntülenme Sayısı;Tarih;DisplayPhoto;Caption;Takipçi;TahminMi
https://www.instagram.com/p/DQwlPJejGnE/;Photo;406;0;0;2025-11-07 17:45:55;https://scontent-mia5-1.cdninstagram.com/v/t51.82787-15/574458987_17948808618046885_4859795652898044303_n.jpg?stp=dst-jpg_e35_tt6&_nc_cat=102&ig_cache_key=Mzc2MDY2OTQ1NzU0MzYyMTA2MA%3D%3D.3-ccb7-5&ccb=7-5&_nc_sid=58cdad&efg=eyJ2ZW5jb2RlX3RhZyI6InhwaWRzLjE0NDB4MTEwOC5zZHIuQzMifQ%3D%3D&_nc_ohc=wM3wEu9Jy-AQ7kNvwF2fQZM&_nc_oc=AdmCvRpOGjUazk7bE2nUol_0TmfN79VMAKBLrYT2FBDp8QKVce1G0GAxuTOKYuC-Xoxe2bzTX9-UqMKJPPzK_Fkz&_nc_ad=z-m&_nc_cid=0&_nc_zt=23&_nc_ht=scontent-mia5-1.cdninstagram.com&_nc_gid=VQBSdZYlymMqsZkl2sHVbQ&oh=00_AfiMyyClxsrQdlr_h-DmJl4Yo2BpEN8w3YT9PnWKFglQNw&oe=69310643;AK Parti Mardin İl Başkanı Sayın Mehmet Uncu ve İl Başkan Yardımcısı Sayın Bülent Gözü, Valimiz Sayın Tuncay Akkoyun’a ziyarette bulundu.  @iletisim  @tcicisleri;;0
https://www.instagram.com/p/DQwbRVPDP7g/;Carousel;550;0;0;2025-11-07 16:18:51;https://scontent-mia3-2.cdninstagram.com/v/t51.82787-15/573591720_17948800578046885_8911783275370384766_n.jpg?stp=dst-jpg_e35_tt6&_nc_cat=107&ig_cache_key=Mzc2MDYyNTYxOTg4NjE3Mzc4Nw%3D%3D.3-ccb7-5&ccb=7-5&_nc_sid=58cdad&efg=eyJ2ZW5jb2RlX3RhZyI6InhwaWRzLjEyMDB4OTAwLnNkci5DMyJ9&_nc_ohc=qDKrIwhR0e4Q7kNvwH36GCT&_nc_oc=Adkvw8Nmq85G9JwUDwyWBnNWibhInKdDjDIAHG_50_8SzrgezYT6LsbEL5beTW3nc_ECDeaR2gpltLopfaCCgd0l&_nc_ad=z-m&_nc_cid=0&_nc_zt=23&_nc_ht=scontent-mia3-2.cdninstagram.com&_nc_gid=VQBSdZYlymMqsZkl2sHVbQ&oh=00_AfiWr0BIeW90wsT00v-p3yuD3xNXaAHagNUlhDOjWLTZEQ&oe=69312999;Valimiz Sayın Tuncay Akkoyun, Pınarbaşı Camiinde Cuma namazı sonrası hemşehrilerimizle bir araya gelerek hasbihal etti.  @iletisim  @tcicisleri;;0
https://www.instagram.com/p/DQumfM0DPF7/;Carousel;224;0;0;2025-11-06 23:18:22;https://scontent-mia3-2.cdninstagram.com/v/t51.82787-15/574747450_17948703012046885_6111596132716977703_n.jpg?stp=dst-jpg_e35_tt6&_nc_cat=105&ig_cache_key=Mzc2MDExMjAwMDE5OTA0ODYwNw%3D%3D.3-ccb7-5&ccb=7-5&_nc_sid=58cdad&efg=eyJ2ZW5jb2RlX3RhZyI6InhwaWRzLjEwNjV4NzEwLnNkci5DMyJ9&_nc_ohc=qFqu9oTEkBkQ7kNvwHhyrn6&_nc_oc=AdlAbQQJy7szhZ3yrfLCvKdG-VJVUKpl3bl-KqUzY5aNZDLuC2U8a2yqXR8WfT8T3DXpShquKL0u-XDaMk2iO25e&_nc_ad=z-m&_nc_cid=0&_nc_zt=23&_nc_ht=scontent-mia3-2.cdninstagram.com&_nc_gid=VQBSdZYlymMqsZkl2sHVbQ&oh=00_AfguW2OExrWvMYCmjPeZVWGmg4N32QuKOkvLkD94rQBUow&oe=69311444;"📍Derik/ 75 Yataklı Devlet Hastanesi İnşaatı  Valimiz Sayın Tuncay Akkoyun; Derik Kaymakamı Yunus Emre Bayraklı, Vali Yardımcısı İbrahim Engin Şenay, İl Jandarma Komutanı Tuğgeneral Tahsin Saruhan ve beraberindekilerle, ▶️ Derik İlçemizde inşaatı devam eden 75 Yataklı Devlet Hastanesi İnşaatı çalışmalarında incelemelerde bulundu.  Sayın Valimiz, çalışmalar hakkında İl Sağlık Müdürü Uzm. Dr. Saffet Yavuz’dan bilgiler aldı.  @iletisim  @tcicisleri";;0
https://www.instagram.com/p/DQub49lDA5S/;Carousel;347;0;0;2025-11-06 21:45:46;https://scontent-nrt6-1.cdninstagram.com/v/t51.82787-15/574563650_17948696727046885_3911599872113454085_n.jpg?stp=dst-jpg_e35_tt6&_nc_cat=100&ig_cache_key=Mzc2MDA2NTM4ODYzMDI4ODUyNw%3D%3D.3-ccb7-5&ccb=7-5&_nc_sid=58cdad&efg=eyJ2ZW5jb2RlX3RhZyI6InhwaWRzLjEwNjd4NzEyLnNkci5DMyJ9&_nc_ohc=a5ViFYsMFrgQ7kNvwGBXHCq&_nc_oc=AdnN46azhV9zAc4tB_udiMgp83QUaBJoHU4Zgvq4v0l34hF7rsj07KUsIbC9Bhn_qZk&_nc_ad=z-m&_nc_cid=0&_nc_zt=23&_nc_ht=scontent-nrt6-1.cdninstagram.com&_nc_gid=pBI8ej2NuAoh7KE3yJX4iw&oh=00_Afjqk_MPrHLAFeGiLUlCVXvs-5i0Ku3PiQq4zav4z1E3EA&oe=6930FE0F;"📌 Derik/ Zeytin İşleme, Sıkma ve Sabun Üretim Atölyesi  Valimiz Sayın Tuncay Akkoyun; Derik Kaymakamı Yunus Emre Bayraklı, Vali Yardımcısı İbrahim Engin Şenay, İl Jandarma Komutanı Tuğgeneral Tahsin Saruhan ve beraberindekilerle Derik Mesleki ve Teknik Anadolu Lisesini ziyaret ettiler.  Sayın Valimiz, Derik Kaymakamlığı tarafından DİKA ve Mardin Büyükşehir Belediyesi’nin destekleriyle hayata geçirilen “Derik Zeytin Sıkma, İşleme ve Sabun Üretim Tesisi”nde incelemelerde bulunarak tesisin üretim kapasitesi, işleyiş süreci ve şehrimizin ekonomisine sağlayacağı katkılar hakkında görevlilerden bilgi aldı.  Sayın Valimiz, tesise bugüne kadar her türlü desteği verdiklerini belirterek, projenin bölge ekonomisine önemli katkı sağladığını ve desteklerinin artarak devam edeceğini vurguladı.  @iletisim  @tcicisleri";;0
https://www.instagram.com/p/DQuKdYwDAk0/;Carousel;656;0;0;2025-11-06 19:13:27;https://scontent-nrt1-2.cdninstagram.com/v/t51.82787-15/573889654_17948683800046885_5966150413047327533_n.jpg?stp=dst-jpg_e35_tt6&_nc_cat=104&ig_cache_key=Mzc1OTk4ODcyOTYzODA5MDkyMA%3D%3D.3-ccb7-5&ccb=7-5&_nc_sid=58cdad&efg=eyJ2ZW5jb2RlX3RhZyI6InhwaWRzLjE0NDB4OTYwLnNkci5DMyJ9&_nc_ohc=qsQMJgO-upgQ7kNvwEKk4KJ&_nc_oc=Adl6vOho1Cj-bKhXW05KUQy5WA9Auip0LspqYhNbD0dZyTTodm7SpDCi1YFMu54-Uug&_nc_ad=z-m&_nc_cid=0&_nc_zt=23&_nc_ht=scontent-nrt1-2.cdninstagram.com&_nc_gid=pBI8ej2NuAoh7KE3yJX4iw&oh=00_AfjD6M1XmByA9v_3F6BqlmBOiY0SNH7UUqZU6bhyjqdDBw&oe=69312270;"📍Derik/ Zeytin Hasadı  Valimiz Sayın Tuncay Akkoyun; Derik Kaymakamı Yunus Emre Bayraklı, Vali Yardımcısı İbrahim Engin Şenay, İl Jandarma Komutanı Tuğgeneral Tahsin Saruhan ve beraberindekilerle, coğrafi işaretli ürünlerimiz arasında yer alan Derik zeytini hasadına katıldı.  Sayın Valimiz, hemşehrilerimizle birlikte zeytin hasadına katılarak çiftçimiz Mucizat Ekinci’ye ait zeytin tarlasında zeytin topladı, ardından vatandaşlarımızla birlikte yeşil zeytin kırdı.  Hasat sırasında çiftçilerimizle sohbet eden Sayın Valimiz, Derik zeytininin yetiştirilme süreci, zeytinin işlenmesi ve zeytinyağı üretim aşamaları hakkında bilgiler aldı.  Valimiz Sayın Tuncay Akkoyun, zeytin üreticilerilerimize bereketli bir hasat dönemi geçirmeleri temennilerinde bulundu.  @iletisim  @tcicisleri";;0
https://www.instagram.com/p/DQt6LKXDLE2/;Carousel;429;0;0;2025-11-06 16:51:10;https://scontent-nrt1-1.cdninstagram.com/v/t51.82787-15/573828136_17948654739046885_2769193334059532937_n.jpg?stp=dst-jpg_e35_tt6&_nc_cat=106&ig_cache_key=Mzc1OTkxNzEwOTM2Mzg4NjAyNw%3D%3D.3-ccb7-5&ccb=7-5&_nc_sid=58cdad&efg=eyJ2ZW5jb2RlX3RhZyI6InhwaWRzLjE0NDB4OTYwLnNkci5DMyJ9&_nc_ohc=M4rAw4EAQNsQ7kNvwHWtmqH&_nc_oc=AdmnUmOSK-H-u4YwTwspUv-xXw2AyHB4U5RMCk1VnEYjHqj-Nz9JMtv-3D_WQejyROQ&_nc_ad=z-m&_nc_cid=0&_nc_zt=23&_nc_ht=scontent-nrt1-1.cdninstagram.com&_nc_gid=pBI8ej2NuAoh7KE3yJX4iw&oh=00_Afgp28j7bVr7dLtrDcBEKDWuTcUZPEh00aOYZ5RBOAppOA&oe=6931108D;"📌Derik/Mahalle Muhtarlarımız ile İstişare Toplantısı  Valimiz Sayın Tuncay Akkoyun; Derik Kaymakamı Yunus Emre Bayraklı, Vali Yardımcısı İbrahim Engin Şenay, İl Jandarma Komutanı Tuğgeneral Tahsin Saruhan, Mardin Büyükşehir Belediyesi Genel Sekreter Vekili Ahmet Seydaoğulları, MARSU Genel Müdürü Murat Erçin, Daire Başkanları ve Derik İlçemiz Mahalle Muhtarlarının katılımıyla “Mahalle Muhtarlarımız ile İstişare Toplantısı” gerçekleştirildi.  Büyükşehir Belediyesi Daire Başkanları, Derik İlçemizde gerçekleştirilen hizmetlere ilişkin sunumlarını muhtarlarla paylaştı.  Toplantıda muhtarlarımız söz alarak mahalleleri ile ilgili talep ve önerileri dile getirdiler. Muhtarlarımızı tek tek dinleyen Sayın Valimiz, dile getirilen konuların çözümü için ilgili kurum ve kuruluşlar ile daire başkanlarına talimat verdi.  @iletisim  @tcicisleri";;0
https://www.instagram.com/p/DQtUgzwDH9k/;Photo;344;0;0;2025-11-06 11:22:04;https://scontent-nrt1-1.cdninstagram.com/v/t51.82787-15/573957938_17948631564046885_4314638441182358273_n.jpg?stp=dst-jpg_e35_tt6&_nc_cat=109&ig_cache_key=Mzc1OTc1MTQ3OTQ0NDY2ODI2MA%3D%3D.3-ccb7-5&ccb=7-5&_nc_sid=58cdad&efg=eyJ2ZW5jb2RlX3RhZyI6InhwaWRzLjE0NDB4OTYwLnNkci5DMyJ9&_nc_ohc=vKmP4G0iX4oQ7kNvwEozsdt&_nc_oc=AdlDP6spsvguT06acII78WBeW_PlgXfEbIuKIaiXuYldLkx2dAbxhUXMoSYXGJ7nN6c&_nc_ad=z-m&_nc_cid=0&_nc_zt=23&_nc_ht=scontent-nrt1-1.cdninstagram.com&_nc_gid=pBI8ej2NuAoh7KE3yJX4iw&oh=00_Afg58dYtilveQYvkW7KpMfJtIuYQkNGeQAhkhRq7WhpvFQ&oe=69312FA6;Ardahan Valisi Sayın Hayrettin Çiçek, Valimiz Sayın Tuncay Akkoyun’a ziyarette bulundu.  @iletisim  @tcicisleri  @ardahanvaliligi;;0
https://www.instagram.com/p/DQrqMenjOJk/;Carousel;206;0;0;2025-11-05 19:53:03;https://scontent-nrt1-2.cdninstagram.com/v/t51.82787-15/573095838_17948575113046885_5627226656310390671_n.jpg?stp=dst-jpg_e35_tt6&_nc_cat=107&ig_cache_key=Mzc1OTI4Mzg4NDUwMTI5MTQzMw%3D%3D.3-ccb7-5&ccb=7-5&_nc_sid=58cdad&efg=eyJ2ZW5jb2RlX3RhZyI6InhwaWRzLjE0NDB4MTA4MC5zZHIuQzMifQ%3D%3D&_nc_ohc=YlXL4clnVXsQ7kNvwFLdSGZ&_nc_oc=AdleASyu0AUSIFt53IDy3LzF76KkZyNYIrq0aB4WVzSjG9KH-0EV64GFDBMgIpqcA_c&_nc_ad=z-m&_nc_cid=0&_nc_zt=23&_nc_ht=scontent-nrt1-2.cdninstagram.com&_nc_gid=pBI8ej2NuAoh7KE3yJX4iw&oh=00_AfglOiAFVa3oLUzw_gjx7M9TtVgMvsUEYgbo2yj4o-C-Wg&oe=69311F3A;"Valimiz Sayın Tuncay Akkoyun; Yeşilli Kaymakamı Mehmet Sadık Kılıç, İl Jandarma Komutanı Tuğgeneral Tahsin Saruhan, Yeşilli Belediye Başkan Hayrettin Demir ve beraberindekilerle, Yeşilli İlçemizde vefat eden Şükriye Tanış’ın taziyesine katılarak ailesine başsağlığı dileklerinde bulundu.  @iletisim  @tcicisleri";;0
https://www.instagram.com/p/DQrZWkrDP9n/;Carousel;333;0;0;2025-11-05 17:25:53;https://scontent-nrt1-1.cdninstagram.com/v/t51.82787-15/573898933_17948561454046885_3903068663933013616_n.jpg?stp=dst-jpg_e35_tt6&_nc_cat=108&ig_cache_key=Mzc1OTIwOTgwNjUxNTk4ODk2NQ%3D%3D.3-ccb7-5&ccb=7-5&_nc_sid=58cdad&efg=eyJ2ZW5jb2RlX3RhZyI6InhwaWRzLjE0NDB4OTYwLnNkci5DMyJ9&_nc_ohc=Ml2wq6nLj2cQ7kNvwG7WUXY&_nc_oc=AdnpiT_7vSIMIvWWWtT8NvSBNs5jb6t-hOjkyvSuFvZS2BSgdMRoYsOwNPPI14nkLHo&_nc_ad=z-m&_nc_cid=0&_nc_zt=23&_nc_ht=scontent-nrt1-1.cdninstagram.com&_nc_gid=pBI8ej2NuAoh7KE3yJX4iw&oh=00_Afjsk6UBXhkqDsPjruV0OJWLzSfcCxW9ry0NcI5Z2PPLUw&oe=693118A3;"📌Savur/Şehit Öğretmelerimizi Anma Programı   Valimiz Sayın Tuncay Akkoyun; Savur İlçemizde Şehit Öğretmenlerimiz Ali Yıldız, Mehmet Zeki Ödük, Mehmet Çatalkaya ve Erol Ercan’ın şehadetlerinin seneyidevriyesinde düzenlenen anma programına katıldı.  Saygı duruşunda bulunma ve İstiklal Marşı’nın okunmasının ardından Kur’an-ı Kerim tilaveti okundu. Aziz Şehitlerimizin özgeçmişlerinin okunmasından sonra Şehit Öğretmenlerimiz için dua edildi.  Programa ayrıca; Savur Kaymakamı Enes Emircan Buyuran, İl Jandarma Komutanı Tuğgeneral Tahsin Saruhan, Savur Belediye Başkanı Engin Uğur Hamidi, Vali Yardımcısı Hasan Kurt, İl Emniyet Müdür Yardımcısı Mustafa Keklik, Aziz Şehitlerimizin Aileleri, Kahraman Gazilerimiz, Kamu Kurumları Amirleri, Öğrenciler, Öğretmenler ve Vatandaşlarımız katıldı.  @iletisim  @tcicisleri";;0
https://www.instagram.com/p/DQq3SqRDHkV/;Reels;115;0;9295;2025-11-05 12:29:19;https://scontent-nrt1-1.cdninstagram.com/v/t51.71878-15/573836421_846762728041847_5766948791933664371_n.jpg?stp=dst-jpg_e15_tt6&_nc_cat=109&ig_cache_key=Mzc1OTA2MDAxMzg4NTk3ODkwMQ%3D%3D.3-ccb7-5&ccb=7-5&_nc_sid=58cdad&efg=eyJ2ZW5jb2RlX3RhZyI6InhwaWRzLjY0MHgzNjAuc2RyLkMzIn0%3D&_nc_ohc=_WTDeH5VmmYQ7kNvwHsDSbd&_nc_oc=AdkZ9cZ9zyHxOfQvmDUbwNgamWICTYPJGK-wizs4bR6-MGtHLu-fG1Jt7I79X5PHP_E&_nc_ad=z-m&_nc_cid=0&_nc_zt=23&_nc_ht=scontent-nrt1-1.cdninstagram.com&_nc_gid=pBI8ej2NuAoh7KE3yJX4iw&oh=00_AfiOxbyB4tbjyM2L8uHhCVNOSCLWZJNrT05f9GypCs5eHA&oe=69312502;#CanlıYayın📡🎥  Valimiz Sayın Tuncay Akkoyun, Ekim Ayı Asayiş ve Güvenlik Basın Bilgilendirme Toplantısı gerçekleştirdi.  #TürkiyeninHuzuru🇹🇷 #MardininHuzuru🇹🇷  📍 Mardin Valiliği;;0
https://www.instagram.com/p/DQpWly_DAV0/;Carousel;305;0;0;2025-11-04 22:23:16;https://scontent-nrt1-2.cdninstagram.com/v/t51.82787-15/572651409_17948486880046885_620878659343077988_n.jpg?stp=dst-jpg_e35_tt6&_nc_cat=102&ig_cache_key=Mzc1ODYzNDcxMjM2NjMyMzQxMA%3D%3D.3-ccb7-5&ccb=7-5&_nc_sid=58cdad&efg=eyJ2ZW5jb2RlX3RhZyI6InhwaWRzLjE0NDB4MTA4MC5zZHIuQzMifQ%3D%3D&_nc_ohc=E_aonQyTMwwQ7kNvwGQwyKC&_nc_oc=AdmAwQTdRP-3Mi2qEy9WJWvmDSfdHqeoXpljWV6Atxda9tbaHaQouhWU0SZz4FR33Rk&_nc_ad=z-m&_nc_cid=0&_nc_zt=23&_nc_ht=scontent-nrt1-2.cdninstagram.com&_nc_gid=pBI8ej2NuAoh7KE3yJX4iw&oh=00_Afj-5t4ZTxW3Xunu88pvFrQzxGEKcyHz1tOtlgOOa6c9rQ&oe=69312ACE;"Valimiz Sayın Tuncay Akkoyun; Nusaybin Kaymakamı Evren Çakır, İl Emniyet Müdürü Recep Tecimer ve beraberindekilerle, Nusaybin İlçemizde vefat eden Seyit Mustafa Çelik’in taziyesine katılarak ailesine başsağlığı dileklerinde bulundu.  @iletisim  @tcicisleri";;0
https://www.instagram.com/p/DQpHh3_DEKG/;Carousel;375;0;0;2025-11-04 20:11:39;https://scontent-nrt1-2.cdninstagram.com/v/t51.82787-15/572957757_17948477295046885_7859996304646590868_n.jpg?stp=dst-jpg_e35_tt6&_nc_cat=101&ig_cache_key=Mzc1ODU2ODQ2OTE0Nzk5NzU1MA%3D%3D.3-ccb7-5&ccb=7-5&_nc_sid=58cdad&efg=eyJ2ZW5jb2RlX3RhZyI6InhwaWRzLjE0NDB4OTYwLnNkci5DMyJ9&_nc_ohc=fWbmaig1qCUQ7kNvwHF60yB&_nc_oc=AdmvH3SC08uxyHen99Ns7AwqfgP-Lc2MWBGvjLqB1_2ScQOlZ27XqdVagmBrQwrjpfQ&_nc_ad=z-m&_nc_cid=0&_nc_zt=23&_nc_ht=scontent-nrt1-2.cdninstagram.com&_nc_gid=pBI8ej2NuAoh7KE3yJX4iw&oh=00_AfgogbKVSgkaMwR-vgh2RF9VUYE4NrNIwls66NUOL1bHOg&oe=69310572;"📌 Mardin Behcet Hattapoğlu Kur’an Eğitim Merkezi  Valimiz Sayın Tuncay Akkoyun; Vali Yardımcısı İbrahim Engin Şenay, İl Müftüsü Dr. Enver Türkmen ve beraberindekilerle, Mardin Behcet Hattapoğlu Kur’an Eğitim Merkezi’ni ziyaret etti.  Sayın Valimiz, Kur’an Eğitim Merkezi’nde Hafızlık eğitimi gören öğrencilerle bir araya geldi.  @iletisim  @tcicisleri";;0
https://www.instagram.com/p/DQoysYvjB8r/;Carousel;358;0;0;2025-11-04 17:09:35;https://scontent-nrt1-2.cdninstagram.com/v/t51.82787-15/573052961_17948462685046885_840763866796082865_n.jpg?stp=dst-jpg_e35_tt6&_nc_cat=105&ig_cache_key=Mzc1ODQ3NjgzNDkyMTgyNzkyMg%3D%3D.3-ccb7-5&ccb=7-5&_nc_sid=58cdad&efg=eyJ2ZW5jb2RlX3RhZyI6InhwaWRzLjEwNjd4NzEyLnNkci5DMyJ9&_nc_ohc=puut-47Li7YQ7kNvwEmBI5J&_nc_oc=AdmS49qDirGsn_l1v0ZaMK3huhMiNXA2mcltbYGLWtWOF2tuOdAt_JtgC7As1EkFeWA&_nc_ad=z-m&_nc_cid=0&_nc_zt=23&_nc_ht=scontent-nrt1-2.cdninstagram.com&_nc_gid=pBI8ej2NuAoh7KE3yJX4iw&oh=00_AfhSICWiLpW---AhCOsjv9Xi86A_wja0-uX5Yn-0PGIX2g&oe=69312D4F;"Valimiz Sayın Tuncay Akkoyun Başkanlığında; Vali Yardımcısı İbrahim Engin Şenay, DSİ 10. Bölge Müdürü Zafer Akın, MARSU Genel Müdürü Murat Erçin, DSİ Bölge Müdür Yardımcısı Ahmet Sezer, DSİ 102. Şube Müdürü Faruk Aslan ile İçme Suyu Şube Müdürü Mehmet Erdağ’ın katılımıyla “Midyat İçme Suyu Projesi” Toplantısı gerçekleştirildi.  @iletisim  @tcicisleri";;0
https://www.instagram.com/p/DQmc8KvDJ49/;Photo;232;0;0;2025-11-03 19:21:01;https://scontent-nrt1-1.cdninstagram.com/v/t51.82787-15/574186883_17948379672046885_6091616279974547701_n.jpg?stp=dst-jpg_e35_tt6&_nc_cat=108&ig_cache_key=Mzc1NzgxODIxOTA4NDk0NzAwNQ%3D%3D.3-ccb7-5&ccb=7-5&_nc_sid=58cdad&efg=eyJ2ZW5jb2RlX3RhZyI6InhwaWRzLjE0NDB4OTYxLnNkci5DMyJ9&_nc_ohc=a4jl5K0zuC4Q7kNvwEPcfC8&_nc_oc=AdnmSdNTF-3yfrhIe1pSy4IKMHWKLnlY4dDOabRDAzLabWVgNmTpQU1DlLlykWJLpr4&_nc_ad=z-m&_nc_cid=0&_nc_zt=23&_nc_ht=scontent-nrt1-1.cdninstagram.com&_nc_gid=pBI8ej2NuAoh7KE3yJX4iw&oh=00_AfgVhoZbzXZioPNS-cJNTrUk166zw-W0NsBUdjTUBFGFFw&oe=69310134;"Valimiz Sayın Tuncay Akkoyun; ▶️ Ressam İsmet Yedikardeş, Mardinliler Vakfı Başkanı Av. Remzi Yedikardeş ile İş İnsanı Fevzi Yedikardeş’i Valilik Makamında ağırladı.  @iletisim  @tcicisleri";;0
https://www.instagram.com/p/DQmLpXdDHlc/;Photo;285;0;0;2025-11-03 16:49:54;https://scontent-nrt6-1.cdninstagram.com/v/t51.82787-15/573067923_17948365206046885_4036574986793101225_n.jpg?stp=dst-jpg_e35_tt6&_nc_cat=100&ig_cache_key=Mzc1Nzc0MjE2MDI4MDg0NDYzNg%3D%3D.3-ccb7-5&ccb=7-5&_nc_sid=58cdad&efg=eyJ2ZW5jb2RlX3RhZyI6InhwaWRzLjE0NDB4OTYwLnNkci5DMyJ9&_nc_ohc=pE5qnSQnuIQQ7kNvwGE64K3&_nc_oc=Admk-uTqO6Qq__F-4TRiV6zUuqOy_9aWoqLESQjGkO29PsMSp4WuAI7NUOcWC0UIDSE&_nc_ad=z-m&_nc_cid=0&_nc_zt=23&_nc_ht=scontent-nrt6-1.cdninstagram.com&_nc_gid=pBI8ej2NuAoh7KE3yJX4iw&oh=00_AfjdaDDJ6jQVcc1Bs07ValwWOAsgbuhSValXudIk57vPlg&oe=69311224;Vakıflar Genel Müdürü Sayın Sinan Aksu, Genel Müdür Yardımcıları Sayın Erkan Ömeroğlu ve Sayın Hayrullah Çelebi, Azınlık Cemaat Temsilcileri Meclis üyesi Sayın Can Ustabaşı, Bölge Müdürü Sayın Hakan Demir ile Vali Yardımcısı Sayın Hasan Kurt, Valimiz Sayın Tuncay Akkoyun’a ziyarette bulundular.  @iletisim  @tcicisleri;;0
https://www.instagram.com/p/DQmGd94jNxT/;Photo;212;0;0;2025-11-03 16:04:40;https://scontent-phx1-1.cdninstagram.com/v/t51.82787-15/573387640_17948361159046885_8958792817584421078_n.jpg?stp=dst-jpg_e35_tt6&_nc_cat=108&ig_cache_key=Mzc1NzcxOTM4NjY3ODE1NjM3MQ%3D%3D.3-ccb7-5&ccb=7-5&_nc_sid=58cdad&efg=eyJ2ZW5jb2RlX3RhZyI6InhwaWRzLjE0NDB4OTYxLnNkci5DMyJ9&_nc_ohc=DnSxyDaOVToQ7kNvwHUAzf1&_nc_oc=AdkaNpCSh0pJ69ybqr0eCDTIcudyLM3OEL4gfgm7UgRqrlybTW909jAPu9GfNuVB5tI&_nc_ad=z-m&_nc_cid=0&_nc_zt=23&_nc_ht=scontent-phx1-1.cdninstagram.com&_nc_gid=9viruuswbx_H0viF0kzKoA&oh=00_AfjiXOczFVMT2Ks9HDcPngKylibDXbEPzI5Vg74OmKqA7A&oe=69311E8F;"Valimiz Sayın Tuncay Akkoyun; Kızılay Mardin Şube Başkanı Abdulmelik Şahin, Başkan Yardımcısı Mehmet Ali Duyan, Kadın Kolları Başkanı Özlem Artukoğlu, Yönetim Kurulu Üyeleri İsa Aydoğan, Mehmet Bakır Deniz ve Mustafa Demir’i Valilik Makamında ağırladı.  @iletisim  @tcicisleri";;0
https://www.instagram.com/p/DQj_2eGDKtI/;Carousel;307;0;0;2025-11-02 20:28:21;https://scontent-phx1-1.cdninstagram.com/v/t51.82787-15/573422597_17948290092046885_4224967823679665110_n.jpg?stp=dst-jpg_e35_tt6&_nc_cat=104&ig_cache_key=Mzc1NzEyNzMyOTA2ODY3NDMwOQ%3D%3D.3-ccb7-5&ccb=7-5&_nc_sid=58cdad&efg=eyJ2ZW5jb2RlX3RhZyI6InhwaWRzLjE0NDB4MTA4MC5zZHIuQzMifQ%3D%3D&_nc_ohc=llKC4ofZBVkQ7kNvwGTuTLI&_nc_oc=AdkLEm32dEcG9A53CjoT5QOeCHGPjUujP3QTMINB_BaNResc1Kl7viLehGR8JQwQJz8&_nc_ad=z-m&_nc_cid=0&_nc_zt=23&_nc_ht=scontent-phx1-1.cdninstagram.com&_nc_gid=9viruuswbx_H0viF0kzKoA&oh=00_AfjsnDOk2aw9j4NbnzrmPZ6qrYyLk-CEu6uuQt5fi5Bjcg&oe=69311A92;"📌Midyat/Sayın Valimiz, 15 Temmuz Şehidimizin Vefat Eden Babasının Taziyesine Katıldı  Valimiz Sayın Tuncay Akkoyun; Midyat Kaymakamı Mehmet Kaya, İl Jandarma Komutanı Tuğgeneral Tahsin Saruhan, İl Emniyet Müdürü Recep Tecimer ve beraberindekiler, ▶️ 15 Temmuz Şehidimiz Kahraman Özel Harekat Polisimiz Velid Bektaş’ın vefat eden babası Abdülkadir Bektaş’ın taziyesine katılarak ailesine başsağlığı dileklerinde bulundu.  @iletisim  @tcicisleri";;0
https://www.instagram.com/p/DQjxsuGDEXx/;Carousel;315;0;0;2025-11-02 18:24:42;https://scontent-phx1-1.cdninstagram.com/v/t51.82787-15/573806008_17948277882046885_7818137035260221367_n.jpg?stp=dst-jpg_e35_tt6&_nc_cat=109&ig_cache_key=Mzc1NzA2NTA4NDU5MDY3OTU5MQ%3D%3D.3-ccb7-5&ccb=7-5&_nc_sid=58cdad&efg=eyJ2ZW5jb2RlX3RhZyI6InhwaWRzLjEyMDB4OTAwLnNkci5DMyJ9&_nc_ohc=lYNMgAp-ex4Q7kNvwF_rrzN&_nc_oc=AdltV21RAsDpR5GsqcM9PGK_DpCYWpr80lBn0RopgVR_-NidmAFbJ8pY_K-m1r9tWrg&_nc_ad=z-m&_nc_cid=0&_nc_zt=23&_nc_ht=scontent-phx1-1.cdninstagram.com&_nc_gid=9viruuswbx_H0viF0kzKoA&oh=00_AfgDhE5iEDCLIDUjR0jADqkZtRI-53lROEXq5FgTStWABA&oe=69311CA6;"Valimiz Sayın Tuncay Akkoyun; İl Jandarma Komutanı Tuğgeneral Tahsin Saruhan, İl Emniyet Müdürü Recep Tecimer ve beraberindekilerle, vefat eden Müzeyyen Başboğa’nın taziyesine katılarak ailesine başsağlığı dileklerinde bulundu.  @iletisim  @tcicisleri";;0
https://www.instagram.com/p/DQfCHxCjDGh/;Carousel;403;0;0;2025-10-31 22:12:00;https://scontent-phx1-1.cdninstagram.com/v/t51.82787-15/572217974_17948073714046885_4149724780887049533_n.jpg?stp=dst-jpg_e35_tt6&_nc_cat=102&ig_cache_key=Mzc1NTcyOTkzNjQzNTcwNjMxOQ%3D%3D.3-ccb7-5&ccb=7-5&_nc_sid=58cdad&efg=eyJ2ZW5jb2RlX3RhZyI6InhwaWRzLjE0NDB4OTYwLnNkci5DMyJ9&_nc_ohc=qjIaNHC2IlYQ7kNvwE8c62l&_nc_oc=AdmEgE0qvS096YVpytg7uOtCTiKIc1XaXZvJzXF43bln9rdeNrpNELUnfqhQT2jYcYo&_nc_ad=z-m&_nc_cid=0&_nc_zt=23&_nc_ht=scontent-phx1-1.cdninstagram.com&_nc_gid=9viruuswbx_H0viF0kzKoA&oh=00_Afh9n6p3O6E9ZEaErjbAx3KGAnJM1V0rydVVLKCfcAv0jg&oe=693132A2;"Valimiz Sayın Tuncay Akkoyun; Vali Yardımcısı İbrahim Engin Şenay ve İl Müftüsü Dr. Enver Türkmen ile birlikte Mardin Müftülüğü tarafından 15 Temmuz Demokrasi ve Şehitler Parkında kurulan “Hayır Çarşı”nı ziyaret etti.  @iletisim  @tcicisleri";;0
https://www.instagram.com/p/DQepqSGjAsf/;Carousel;242;0;0;2025-10-31 18:38:15;https://scontent-phx1-1.cdninstagram.com/v/t51.82787-15/573334004_18270597307304771_3855157561285008126_n.jpg?stp=dst-jpg_e35_tt6&_nc_cat=110&ig_cache_key=Mzc1NTYyMjM1ODMxNzgxODQyMw%3D%3D.3-ccb7-5&ccb=7-5&_nc_sid=58cdad&efg=eyJ2ZW5jb2RlX3RhZyI6InhwaWRzLjE0NDB4OTYwLnNkci5DMyJ9&_nc_ohc=jv9Xlx0icTQQ7kNvwH831n0&_nc_oc=Adk_zpuuaZq1HENv9Tbjc1XgtsvuYGM8gS1inVvlQfeXAvswAvSi3EIDWrlV79lwHs0&_nc_ad=z-m&_nc_cid=0&_nc_zt=23&_nc_ht=scontent-phx1-1.cdninstagram.com&_nc_gid=9viruuswbx_H0viF0kzKoA&oh=00_AfhK-hDxIKzcPh0XJmBhUBl9t-EyhIfTHjPX2O8Yrd9U0w&oe=69311BE8;"Valimiz/Büyükşehir Belediye Başkan Vekilimiz Sayın Tuncay Akkoyun Başkanlığında; Genel Sekreterimiz Kemalettin Sakin, MARSU Genel Müdürümüz Murat Erçin, Genel Sekreter Yardımcılarımız ve Daire Başkanlarımızın katılımıyla Mardin Büyükşehir Belediyesinde düzenlenen toplantıda, Mardin’imizin 10 ilçesinde planlanan ve devam eden yatırımlar, İlçelerimizin kamu hizmetleri ihtiyaçlarının tespiti ve projelerin koordinasyonu ile ilgili yapılacak çalışmalar değerlendirildi.  Sayın Valimiz/Büyükşehir Belediye Başkan Vekilimiz, Daire Başkanlarımızın hizmetlerini anlatan sunumları tek tek dinleyerek çalışmaları hakkında bilgi aldı.";;0
https://www.instagram.com/p/DQeXBzHjNPt/;Carousel;446;0;0;2025-10-31 15:55:26;https://scontent-phx1-1.cdninstagram.com/v/t51.82787-15/573052960_17948037621046885_5472496056115694747_n.jpg?stp=dst-jpg_e35_tt6&_nc_cat=110&ig_cache_key=Mzc1NTU0MDQwODcxNDM5OTU5OQ%3D%3D.3-ccb7-5&ccb=7-5&_nc_sid=58cdad&efg=eyJ2ZW5jb2RlX3RhZyI6InhwaWRzLjE0NDB4MTA3OS5zZHIuQzMifQ%3D%3D&_nc_ohc=yVmJFPKsP_oQ7kNvwHtjZey&_nc_oc=AdkgfFaBTYLvpGQRQkR__3p68PzGs_de1Amcg3wIG3EEiN7X5unWDwj3CviWfopUYlI&_nc_ad=z-m&_nc_cid=0&_nc_zt=23&_nc_ht=scontent-phx1-1.cdninstagram.com&_nc_gid=9viruuswbx_H0viF0kzKoA&oh=00_Afgg1Q_jJbrNH8Qdap7AUcBgc9NCaz5f4g9mytLYWYVkJw&oe=6931259C;Valimiz Sayın Tuncay Akkoyun, Artuklu Kaymakamı Muhammet Öztabak, İl Jandarma Komutanı Tuğgeneral Tahsin Saruhan ve İl Emniyet Müdürü Recep Tecimer, Kabala Hacı İsmail Kaya Camiinde Cuma namazı sonrası hemşehrilerimiz ve Kur’an Kursu öğrencileri ile bir araya geldiler.  @iletisim  @tcicisleri;;0
https://www.instagram.com/p/DQeLqmijP5d/;Carousel;272;0;0;2025-10-31 14:16:09;https://scontent-phx1-1.cdninstagram.com/v/t51.82787-15/574221622_17948029545046885_4423139545795079234_n.jpg?stp=dst-jpg_e35_tt6&_nc_cat=106&ig_cache_key=Mzc1NTQ5MDQ0MDQ5NDQ4NTEyMw%3D%3D.3-ccb7-5&ccb=7-5&_nc_sid=58cdad&efg=eyJ2ZW5jb2RlX3RhZyI6InhwaWRzLjE0NDB4MTA4MC5zZHIuQzMifQ%3D%3D&_nc_ohc=pF5yzS-sN1wQ7kNvwFZ5al8&_nc_oc=AdlhIURS8SG7ETLg7DHri47LSSlgwmCu42qhyRI7Uk_d_ndYHmgYCghiP_miPpvQWhY&_nc_ad=z-m&_nc_cid=0&_nc_zt=23&_nc_ht=scontent-phx1-1.cdninstagram.com&_nc_gid=9viruuswbx_H0viF0kzKoA&oh=00_AfgQwTpNQAkbogd2-ja9wW6rw42AyYHs5YkLpE5cMnNmAA&oe=69312127;"Valimiz Sayın Tuncay Akkoyun; Artuklu Kaymakamı Muhammet Öztabak, İl Jandarma Komutanı Tuğgeneral Tahsin Saruhan, İl Emniyet Müdürü Recep Tecimer ve beraberindekilerle, vefat eden Seyithan Bozkuş’un taziyesine katılarak ailesine başsağlığı dileklerinde bulundu.  @iletisim  @tcicisleri";;0
https://www.instagram.com/p/DQdxy1GDByo/;Photo;247;0;0;2025-10-31 10:30:05;https://scontent-phx1-1.cdninstagram.com/v/t51.82787-15/573328415_17948013132046885_1969829976267818535_n.jpg?stp=dst-jpg_e35_tt6&_nc_cat=103&ig_cache_key=Mzc1NTM3NjY2MTU1OTUxNjMyOA%3D%3D.3-ccb7-5&ccb=7-5&_nc_sid=58cdad&efg=eyJ2ZW5jb2RlX3RhZyI6InhwaWRzLjE0NDB4OTYwLnNkci5DMyJ9&_nc_ohc=zXYYZPMedHIQ7kNvwGUVR6e&_nc_oc=AdloiGFx6xzxIbnSKC3QtiXA6zw0UFMA9bNZ6q6P7GJMzEU5C7JGryf-CM37i9OJrEk&_nc_ad=z-m&_nc_cid=0&_nc_zt=23&_nc_ht=scontent-phx1-1.cdninstagram.com&_nc_gid=9viruuswbx_H0viF0kzKoA&oh=00_Afjvatqo0aip4GgUxdg9pijRww0T0mGmENbNmZ-Bb-G3zA&oe=693107B0;PTT Genel Müdür Yardımcısı Fatih Tezcan, PTT Uluslararası Operasyonel Daire Başkanı Yasemin Çına Yavuz, PTT Uluslararası Operasyonel Daire Başkan Yardımcısı Serkan Akşahin ile Mardin PTT Başmüdürü Abdulhakim Yenigün, Valimiz Sayın Tuncay Akkoyun’a ziyarette bulundu.  @iletisim  @tcicisleri;;0
